title,subhead,URL,premium,image URL,byline,article type
 French government admits 'failure' and blames judicial system over death of 11-year-old girl  ,"The government does not intend to be the only one bearing responsibility for the death of Lyhanna, a girl who had been missing for a week before her body was found on a farm.",https://www.lemonde.fr/en/france/article/2026/06/06/french-government-admits-failure-and-blames-judicial-system-over-death-of-11-year-old-girl_6754212_7.html,Subscribers only,,,
'No one was prepared for what was about to happen': Gaza flotilla activist speaks about violence she suffered in Israel,,https://www.lemonde.fr/en/france/article/2026/06/07/no-one-was-prepared-for-what-was-about-to-happen-gaza-flotilla-activist-speaks-about-violence-she-suffered-in-israel_6754213_7.html,Subscribers only,,,
Russian player Andreeva wins French Open,,https://www.lemonde.fr/en/sports/article/2026/06/06/russia-s-andreeva-wins-first-grand-slam-title-at-french-open_6754206_9.html,,,,
French telecom giants reach deal to acquire struggling rival SFR,"The companies – Bouygues Telecom, Orange and Free owner Iliad – said SFR parent Altice had accepted their offer of €20.35 billion for the struggling mobile operator. The deal could reshape the French telecoms landscape by reducing the number of main operators from four to three.",https://www.lemonde.fr/en/economy/article/2026/06/07/french-telecom-giants-reach-deal-to-acquire-struggling-rival-sfr_6754216_19.html,,,,
Mélenchon hopes Saint-Denis rally will turn into show of strength,"Radical-left leader Jean-Luc Mélenchon will hold his first major campaign meeting on Sunday, in the northern Paris suburb of Saint-Denis. He hopes the event's success will pressure some on the left to rally behind his candidacy.",https://www.lemonde.fr/en/politics/article/2026/06/06/2027-french-presidential-election-melenchon-hopes-saint-denis-rally-will-turn-into-show-of-strength_6754211_5.html,Subscribers only,,,
"With 'De Gaulle: Tilting Iron,' Simon Abkarian boldly steps into the General's shoes","The first part of a two-part film directed by Antonin Baudry, this movie encompasses every possible register: war, action, love, politics, humor, lyricism and grandeur.",https://www.lemonde.fr/en/culture/article/2026/06/07/with-de-gaulle-tilting-iron-simon-abkarian-boldly-steps-into-the-general-s-shoes_6754215_30.html,Subscribers only,,,
Sagrada Familia organist to lead landmark Mass as Pope Leo XIV visits Spain,The pontiff is expected in Barcelona on June 10 for the inauguration of the monumental main tower of the basilica envisioned by Antoni Gaudí. Chief organist Juan de la Rubia is in charge of the musical repertoire for the ceremony.,https://www.lemonde.fr/en/m-le-mag/article/2026/06/07/sagrada-familia-organist-to-lead-landmark-mass-as-pope-leo-xiv-visits-spain_6754214_117.html,Subscribers only,, Guillaume Delacroix,Profile
Pope Leo XIV praises Spain's 'commitment to peace and solidarity',,https://www.lemonde.fr/en/international/article/2026/06/06/pope-leo-xiv-praises-spain-s-commitment-to-peace-and-solidarity_6754209_4.html,,,,
"Bernadette Chirac, the wife of ex-president Jacques Chirac, has died",,https://www.lemonde.fr/en/obituaries/article/2026/06/06/bernadette-chirac-the-wife-of-ex-president-jacques-chirac-has-died_6754201_15.html,Subscribers only,,,
"On D-Day anniversary, Hegseth urges Europe to counter present-day 'invasion' of beaches",,https://www.lemonde.fr/en/france/article/2026/06/06/on-d-day-anniversary-hegseth-urges-europe-to-counter-present-day-invasion-of-beaches_6754207_7.html,,,,
Illegal rave in France tests local ban and new government bill,,https://www.lemonde.fr/en/france/article/2026/06/06/illegal-rave-in-france-tests-local-ban-and-new-government-bill_6754208_7.html,,,,
Israel's government steps up attacks on judiciary: 'A race to eliminate democratic institutions has begun',,https://www.lemonde.fr/en/international/article/2026/06/05/israel-s-government-steps-up-attacks-on-judiciary-a-race-to-eliminate-democratic-institutions-has-begun_6754187_4.html,Subscribers only,,,
"Bernadette Chirac, a liberated voice: 'I'm like my snakeskin bag: I bite'",,https://www.lemonde.fr/en/obituaries/article/2026/06/06/death-of-bernadette-chirac-a-liberated-voice-i-m-like-my-snakeskin-bag-i-bite_6754205_15.html,,,,
Albania's 'Flamingo Revolution' rises up against the Trump family and Prime Minister Edi Rama,,https://www.lemonde.fr/en/international/article/2026/06/06/albania-s-flamingo-revolution-rises-up-against-the-trump-family-and-prime-minister-edi-rama_6754195_4.html,Subscribers only,,,
Mali's ruling junta sentences a French agent to 20 years in prison,,https://www.lemonde.fr/en/international/article/2026/06/06/mali-s-ruling-junta-sentences-a-dgse-agent-to-20-years-in-prison_6754192_4.html,Subscribers only,,,
"Pope Leo XIV quotes Gandalf, highlighting Tolkien's close ties with Catholicism",,https://www.lemonde.fr/en/pixels/article/2026/06/06/pope-leo-xiv-quotes-gandalf-highlighting-tolkien-s-close-ties-with-catholicism_6754210_13.html,Subscribers only,,,
Ever-extreme Eric Zemmour prepares second bid for French president,,https://www.lemonde.fr/en/politics/article/2026/06/05/ever-extreme-eric-zemmour-prepares-second-bid-for-french-president_6754163_5.html,Subscribers only,,,
Did Rafael Jodar really push that ball girl? That's beside the point,,https://www.lemonde.fr/en/sports/article/2026/06/06/did-rafael-jodar-really-push-that-ball-girl-that-s-beside-the-point_6754197_9.html,Subscribers only,,,
"As Israeli bombs target Lebanon, Tyre residents call for the ancient city to be declared an 'open city' and demilitarized",,https://www.lemonde.fr/en/international/article/2026/06/06/as-israeli-bombs-target-lebanon-tyre-residents-call-for-the-ancient-city-to-be-declared-an-open-city-and-demilitarized_6754194_4.html,Subscribers only,,,
"Over three decades, China's promise became a trap for European industry","'How China is Devouring Europe' (1/4). In just a few decades, China has gone from being the world's factory to a major technological rival for Europeans, who had hoped to profit on China's vast domestic market but underestimated its capacity for innovation.",https://www.lemonde.fr/en/economy/article/2026/06/06/over-three-decades-china-s-promise-became-a-trap-for-european-industry_6754199_19.html,Subscribers only,," Bastien Bonnefous,  Isabelle Chaperon and  Sophie Fay",Series
Zelensky's letter to Putin is actually addressed to Russia's elites who are tired of the war in Ukraine,"Behind the offer of an outstretched hand, the Ukrainian president's letter to the Russian leader seeks to exploit Moscow's vulnerabilities and the Russian people's exhaustion after four years of high-intensity war.",https://www.lemonde.fr/en/international/article/2026/06/06/by-writing-to-putin-zelensky-addresses-the-russian-elites-who-are-weary-of-the-war-in-ukraine_6754198_4.html,Subscribers only,," Benjamin Quénelle,  Claire Gatinois and  Thomas d’Istria",In Depth
HSBC charged for helping former Lebanese central bank head embezzle hundreds of millions,The Swiss subsidiary of HSBC is suspected of having helped former Lebanese central bank chief Riad Salameh embezzle more than $300 million from the country's central bank. The charges mark a significant development in the French judicial investigation.,https://www.lemonde.fr/en/les-decodeurs/article/2026/06/04/hsbc-charged-for-helping-former-lebanese-central-bank-head-embezzle-hundreds-of-millions_6754142_8.html,Subscribers only,, Guillaume Daudin,Investigation
Outsourcing migrant deportations is incompatible with Europe's values,,https://www.lemonde.fr/en/opinion/article/2026/06/06/outsourcing-migrant-deportations-is-incompatible-with-europe-s-values_6754202_23.html,,,,Editorial
"Patrick Artus: 'Wars are economically irrational. Yet, the risk of new conflicts remains high'",,https://www.lemonde.fr/en/opinion/article/2026/05/30/patrick-artus-wars-are-economically-irrational-yet-the-risk-of-new-conflicts-remains-high_6753973_23.html,Subscribe,,,Column
'Charles III's timely reminder of democratic order and Leo XIV's necessary warning on the dangers of AI',,https://www.lemonde.fr/en/opinion/article/2026/06/06/charles-iii-s-timely-reminder-of-democratic-order-and-leo-xiv-s-necessary-warning-on-the-dangers-of-ai_6754200_23.html,Subscribe,,,Column
