title,premium,image URL,subhead,URL,byline,article type
"'The Gaza agreement is fragile, but the Americans are on top of it': Words of hope from an Israeli peace broker", Subscribers only ,,,,,
"Filip Turek, the Czech Trumpist 'Motorist' who flirts with Nazi symbols", Subscribers only ,,,,,
Five scenarios for the future,,,,,,
Fragile ceasefire resumes in Gaza after day of violence, Subscribers only ,,,,,
"After Charlie Kirk's murder, Europe's far right swears allegiance to Trump's politics", Subscribers only ,,,,,
Sanctions against Russia spark rift between US and Europe over China, Subscribers only ,,,,,
France's political instability puts Franco-German alliance to the test,,,,,,
France faces prospect of paying higher borrowing costs than Italy, Subscribers only ,,,,,
Spectacular Louvre heist highlights security flaws at world's largest museum, Subscribers only ,,,,,
Louvre heist captivates global news media,,,,,,
Louvre heist: Photos of the stolen jewels,,,,,,
Four men charged in alleged plot to attack a Russian dissident in southern France, Subscribers only ,,,,,
Afghanistan: Relentless repression continues over four years into Taliban's rule,,,,,,
Watch: Hundreds of thousands march in France against budget cuts,,,,,,
Emmys 2025: 'Adolescence' star Owen Cooper becomes youngest winner for best supporting actor,,,,,,
"From 'influence peddling' to 'corruption,' what is French Culture Minister Rachida Dati accused of?",,,,,,
'Nicolas Sarkozy's supporters have undermined the foundations of political and judicial life', Subscribers only ,,,,,
'Abandoning the corporate sustainability due diligence directive would be a historic mistake for Europe', Subscribers only ,,,,,
"'By calling those who oppose his policies antisemitic, Netanyahu only stokes the scourge'", Subscribers only ,,,,,
Five scenarios for the future of Israel and Palestine, Subscribers only ,,,,,
The wild Albanian island where the Trumps want to build a luxury hotel, Subscribers only ,,,,,
"France's last military pigeons, custodians of a fading tradition", Subscribers only ,,,,,
"Rabbi, drag queen and gay: Amichai Lau-Lavie, a Jewish trailblazer", Subscribers only ,,,,,
Matthieu Blazy: 'Just because Karl was a legend does not mean that everyone who designs for Chanel has to be one too', Subscribers only ,,,,,
"Jean-François Piège, guardian of Paris's bistro heritage", Subscribers only ,,,,,
Five places in and near Paris to savor choux à la crème, Subscribers only ,,,,,
"Berthe Weill at the Musée de l'Orangerie, the treasures of an eclectic gallerist", Subscribers only ,,,,,
Five fun ways to discover Paris and its surroundings with your family, Subscribers only ,,,,,
 The Louvre's history of burglaries  ,Subscribers only,,"Several paintings have been stolen from the celebrated Parisian museum, including the Mona Lisa. Over the course of its history, it has steadily improved its security.",https://www.lemonde.fr/en/culture/article/2025/10/20/the-louvre-s-history-of-burglaries_6746608_30.html,,
Spectacular Louvre heist highlights security flaws at world's largest museum,Subscribers only,https://img.lemde.fr/2025/10/19/0/0/5500/3666/398/265/75/0/6ee718c_ftp-import-images-1-hvmzei1vx1tx-2025-10-19t161952z-400991512-rc22fhasyuw0-rtrmadp-3-france-crime-louvre.JPG,,https://www.lemonde.fr/en/france/article/2025/10/20/spectacular-louvre-heist-highlights-security-flaws-at-world-s-largest-museum_6746591_7.html,,
Amazon's cloud services hit by global outage,,https://img.lemde.fr/2025/10/20/0/139/4659/3106/398/265/75/0/d49e678_ftp-import-images-1-06fivak7x0dx-2025-10-20t081820z-1637449743-rc2j7hatv9us-rtrmadp-3-amazon-outages-aws.JPG,,https://www.lemonde.fr/en/international/article/2025/10/20/amazon-s-cloud-services-hit-by-global-outage_6746597_4.html,,
Israel receives remains of Gaza hostage as ceasefire tensions continue,,https://img.lemde.fr/2025/10/13/1/0/5997/3998/398/265/75/0/e3e85ee_ftp-import-images-1-bnq6w9jmiw8t-60afb60637b64b3c89fca1598a106c24-1-2bb8c4154e784119b18546483310c67f.jpg,"As Hamas hands over the body of one Israeli captive under a US-brokered ceasefire, violence persists in Gaza, with four Palestinians killed by Israeli fire amid ongoing disputes over the truce.",https://www.lemonde.fr/en/international/article/2025/10/20/israel-receives-remains-of-gaza-hostage-as-ceasefire-tensions-continue_6746616_4.html,,
"Filip Turek, the Czech Trumpist 'Motorist' who flirts with Nazi symbols",Subscribers only,https://img.lemde.fr/2025/10/15/0/0/7287/4858/398/265/75/0/e9ad31b_upload-1-rps3fdojw5xs-ap25286569515626.jpg,"'The new faces of the far right' (2/5) The honorary president of the Motorist Party, which won nearly 7% of the vote in the legislative elections, is seeking the position of foreign minister in Andrej Babis's government.",https://www.lemonde.fr/en/international/article/2025/10/20/filip-turek-the-czech-trumpist-motorist-who-flirts-with-nazi-symbols_6746613_4.html,,
Louvre heist: Who were the royals the stolen jewels belonged to?,,https://img.lemde.fr/2025/10/20/0/0/4000/2666/398/265/75/0/c26edb5_upload-1-9dtsex9iwa24-000-hkg7385603-1.jpg,"Eight extremely valuable items were stolen on Sunday morning from the Apollo Gallery in the world's largest museum. Most of them belonged to Marie-Amélie of Bourbon-Siciles, Hortense de Beauharnais and Eugénie de Montijo.",https://www.lemonde.fr/en/culture/article/2025/10/20/louvre-heist-who-were-the-royals-to-whom-the-priceless-stolen-jewels-belonged_6746612_30.html,,
"'The Gaza agreement is fragile, but the Americans are on top of it': Words of hope from an Israeli peace broker",Subscribers only,https://img.lemde.fr/2025/10/20/1250/0/3000/2000/664/442/75/0/e5358dc_upload-1-grf47pwfnyrl-lgeai-gershon-baskin-3.jpg,"Researcher and activist Gershon Baskin, who has been involved in ceasefire efforts in Gaza, rejects the Netanyahu government's claim that Hamas is reluctant to return the bodies of hostages who died in the enclave. He also argues that demilitarization is not out of reach.",https://www.lemonde.fr/en/international/article/2025/10/20/the-gaza-agreement-is-fragile-but-the-americans-are-on-top-of-it-words-of-hope-from-an-israeli-peacemaker_6746614_4.html, Luc Bronner,Conversation
Madagascar president names civilian prime minister after military takeover,,https://img.lemde.fr/2025/10/17/0/0/8640/5760/198/132/95/0/c4e0448_ftp-import-images-1-0mrngtr7nnyg-3a856a696d734a778ce87eb7e85f0876-1-fb379abaff1d416bb1c1a5920409635b.jpg,,https://www.lemonde.fr/en/international/article/2025/10/20/madagascar-president-names-civilian-prime-minister-after-military-takeover_6746617_4.html,,
EU agrees to stop importing Russian gas by end of 2027,,https://img.lemde.fr/2025/10/19/0/84/5926/3951/198/132/95/0/2027e5f_ftp-import-images-1-47imnfhthdfp-2025-10-19t105524z-805141308-rc2pz2a3ybfl-rtrmadp-3-ukraine-crisis-russia-gas-drones.JPG,,https://www.lemonde.fr/en/energies/article/2025/10/20/eu-agrees-to-stop-importing-russian-gas-by-end-2027_6746600_98.html,,
Fragile ceasefire resumes in Gaza after day of violence,Subscribers only,https://img.lemde.fr/2025/10/19/0/3/5493/3662/198/132/95/0/2dd9c38_ftp-import-images-1-cz7mzkgvt4kx-2025-10-19t155423z-1035832442-rc23fhanfqe3-rtrmadp-3-israel-palestinians-gaza.JPG,,https://www.lemonde.fr/en/international/article/2025/10/20/fragile-ceasefire-resumes-in-gaza-after-day-of-violence_6746596_4.html,,
Macron hosted Sarkozy four days before start of incarceration,,https://img.lemde.fr/2025/10/20/767/0/1544/1029/198/132/95/0/eae4dc0_ftp-import-images-1-mjiehxuevsdx-2025-10-20t094705z-1152538425-rc2lfhaje2ix-rtrmadp-3-france-politics-sarkozy.JPG,,https://www.lemonde.fr/en/politics/article/2025/10/20/macron-hosted-sarkozy-four-days-before-start-of-incarceration_6746606_5.html,,
BNP Paribas shares plumet after verdict on liability in Sudan atrocities,,,,https://www.lemonde.fr/en/global-issues/article/2025/10/20/bnp-paribas-shares-plumet-after-us-verdict-on-complicity-of-sudan-atrocities_6746610_199.html,,
"Kering sells beauty branch to L'Oréal, refocusing on fashion",Subscribers only,,,https://www.lemonde.fr/en/economy/article/2025/10/20/kering-sells-beauty-branch-to-l-oreal-refocusing-on-fashion_6746598_19.html,,
Trump administration seeks to turn government  shutdown against Democrats,Subscribers only,,,https://www.lemonde.fr/en/international/article/2025/10/19/the-trump-administration-seeks-to-turn-the-government-shutdown-against-the-democrats_6746581_4.html,,
"Zaho de Sagazan: 'Without others, without friendship, you can't achieve much'",Subscribers only,,,https://www.lemonde.fr/en/culture/article/2025/10/19/zaho-de-sagazan-without-others-without-friendship-you-can-t-achieve-much_6746582_30.html,,
"Cargo plane skids off Hong Kong runway, killing two",,,,https://www.lemonde.fr/en/international/article/2025/10/20/hong-kong-airport-sees-two-people-killed-in-cargo-plane-landing-accident_6746599_4.html,,
Mongolia's president blocks parliament's bid to oust prime minister,,,,https://www.lemonde.fr/en/international/article/2025/10/20/mongolia-s-president-blocks-parliament-s-bid-to-oust-prime-minister_6746603_4.html,,
Japan approves over-the-counter 'morning after' pill,,,,https://www.lemonde.fr/en/japan/article/2025/10/20/japan-approves-over-the-counter-morning-after-pill_6746595_230.html,,
Dembélé back in PSG squad for Champions League clash with Leverkusen,,,,https://www.lemonde.fr/en/sports/article/2025/10/20/dembele-back-in-psg-squad-for-champions-league-clash-with-leverkusen_6746615_9.html,,
Joyful and massive 'No Kings' protests against Trump reveal a sense of powerlessness,Subscribers only,https://img.lemde.fr/2025/10/18/0/0/3900/2600/664/442/75/0/963b88f_ftp-import-images-1-og1hwvulovaw-5202805-01-06.jpg,"Seven million people, according to organizers, marched on Saturday in 2,600 demonstrations across the United States to protest against the excesses of the Republican president.",https://www.lemonde.fr/en/international/article/2025/10/19/joyful-and-massive-no-kings-protests-against-trump-reveal-a-sense-of-powerlessness_6746569_4.html, Arnaud Leparmentier and  Nicolas Chapuis,Feature
Five scenarios for the future of Israel and Palestine,Subscribers only,https://img.lemde.fr/2025/10/15/0/0/4173/2782/664/442/75/0/08b14bd_upload-1-ycftlfjwotfo-000-76vh8xn.jpg,"The recognition of the State of Palestine by 11 more countries has revived the debate over what form it could take. From pragmatic to utopian, here are the main ideas that have emerged since the creation of Israel.",https://www.lemonde.fr/en/opinion/article/2025/10/19/five-scenarios-for-the-future-of-israel-and-palestine_6746567_23.html, Christophe Ayad,In Depth
'Nicolas Sarkozy's supporters have undermined the foundations of political and judicial life',Subscribers only,https://img.lemde.fr/2025/10/09/992/0/3335/2223/664/442/75/0/af06997_upload-1-fn7cc2nckibl-philippe-conte.jpg,"Philippe Conte, professor emeritus of criminal law at Panthéon-Assas University, says the judges who convicted the former French president of criminal conspiracy merely enforced the laws written by those now denouncing them.",https://www.lemonde.fr/en/opinion/article/2025/10/20/nicolas-sarkozy-s-supporters-have-undermined-the-foundations-of-political-and-judicial-life_6746589_23.html, Anne Chemin,Interview
Trump's exasperating inconsistency over the war in Ukraine,,,,https://www.lemonde.fr/en/opinion/article/2025/10/18/trump-s-exasperating-inconsistency-over-the-war-in-ukraine_6746556_23.html,,Editorial
'Abandoning the corporate sustainability due diligence directive would be a historic mistake for Europe',Subscribe,,,https://www.lemonde.fr/en/opinion/article/2025/10/20/abandoning-the-corporate-sustainability-due-diligence-directive-would-be-a-historic-mistake-for-europe_6746593_23.html,,Op-Ed
"'By calling those who oppose his policies antisemitic, Netanyahu only stokes the scourge'",Subscribe,https://img.lemde.fr/2025/02/13/0/0/0/0/100/100/60/0/e49d71b_sirius-fs-upload-1-hfccvvna5map-1739442970267-capture-da-a-cran-2025-02-13-113500.png,,https://www.lemonde.fr/en/opinion/article/2025/10/20/by-labeling-his-critics-as-anti-semitic-netanyahu-only-fuels-the-problem_6746587_23.html,,Column
