title,premium,image URL,subhead,URL,byline,article type
Masses of displaced persons return to northern Gaza amid a landscape of ruins, Subscribers only ,,,,,
"Faced with looming gasoline shortage, California's governor backs off oil companies", Subscribers only ,,,,,
Peruvian lawmakers oust president over failure to resolve security crisis, Subscribers only ,,,,,
Trump obtains indictment of attorney general who prosecuted him, Subscribers only ,,,,,
Sanctions against Russia spark rift between US and Europe over China, Subscribers only ,,,,,
France's political instability puts Franco-German alliance to the test,,,,,,
France faces prospect of paying higher borrowing costs than Italy, Subscribers only ,,,,,
French man arrested in Slovenia for crimes committed in Croatia during 1991 war, Subscribers only ,,,,,
Pelicot rape case closes with forgettable appeal trial, Subscribers only ,,,,,
"Robert Badinter's secret face-to-face with the guillotine, in four unseen pictures", Subscribers only ,,,,,
First residents move into Paris 2024 Athletes' Village, Subscribers only ,,,,,
"At Cédric Jubillar's trial, mother's guilt turns into damning testimony", Subscribers only ,,,,,
Afghanistan: Relentless repression continues over four years into Taliban's rule,,,,,,
Watch: Hundreds of thousands march in France against budget cuts,,,,,,
Emmys 2025: 'Adolescence' star Owen Cooper becomes youngest winner for best supporting actor,,,,,,
"From 'influence peddling' to 'corruption,' what is French Culture Minister Rachida Dati accused of?",,,,,,
"'In the United States, Congress no longer exists as a counterbalance'", Subscribers only ,,,,,
Cancer: France must know why it has higher exposure rates,,,,,,
Israel's strikes on Qatar may have jump-started Gaza peace plan, Subscribers only ,,,,,
Paris's remarkable fashion week masks the luxury industry's headlong rush, Subscribers only ,,,,,
Matthieu Blazy: 'Just because Karl was a legend does not mean that everyone who designs for Chanel has to be one too', Subscribers only ,,,,,
Sweden's new list of 'cultural values' sparks controversy, Subscribers only ,,,,,
The making of the Agnès b. cardigan, Subscribers only ,,,,,
The West Bank village of Palestine's forgotten Americans, Subscribers only ,,,,,
Five fun ways to discover Paris and its surroundings with your family, Subscribers only ,,,,,
Emma Reyes's still lifes relive in two Paris exhibitions, Subscribers only ,,,,,
Tradition done right: Five Paris restaurants reimagining the classics, Subscribers only ,,,,,
Paris Design Week: A 15th edition marked by abundance, Subscribers only ,,,,,
 Macron keeps Lecornu on as prime minister despite political parties' hostility  ,Subscribers only,,"The reappointment of Sébastien Lecornu to form a 'government of mission' that would be 'disconnected from presidential ambitions' has reignited criticism of the president, who has been accused of staying in denial, not only by the opposition parties but now by his own camp, too.",https://www.lemonde.fr/en/politics/article/2025/10/11/macron-keeps-lecornu-on-as-prime-minister-despite-political-parties-hostility_6746323_5.html,,
US government shutdown begins to undermine the country's economy,Subscribers only,https://img.lemde.fr/2025/10/09/0/0/5122/3415/398/265/75/0/9a7620a_ftp-import-images-1-7fe1xkr76bsf-b5e984d893fd49b0a8077b3aec8d083c-0-de865c243fde43dbb551df603d35795c.jpg,,https://www.lemonde.fr/en/economy/article/2025/10/11/us-government-shutdown-begins-to-undermine-the-country-s-economy_6746330_19.html,,
Israel's strikes on Qatar may have jump-started Gaza peace plan,Subscribers only,https://img.lemde.fr/2025/10/09/0/0/3199/2133/398/265/75/0/af62f02_upload-1-bj5cd9c2cemw-000-73wk4zq.jpg,,https://www.lemonde.fr/en/opinion/article/2025/10/11/israel-s-strikes-on-qatar-may-have-jump-started-gaza-peace-plan_6746327_23.html,,
Paris's remarkable fashion week masks the luxury industry's headlong rush,Subscribers only,https://img.lemde.fr/2025/10/06/0/0/5224/3483/398/265/75/0/2058c4d_ftp-import-images-1-hi5lcuifqvlo-5100319-01-06.jpg,"By reigniting the dream machine, the so-called 'fashion week of the century' has signaled the rise of a new generation of designers − but without revealing anything about the intentions of the leaders of luxury conglomerates.",https://www.lemonde.fr/en/opinion/article/2025/10/11/paris-s-remarkable-fashion-week-masks-the-luxury-industry-s-headlong-rush_6746320_23.html,,
Madagascar soldiers join youth-led demonstrations,,https://img.lemde.fr/2025/10/11/0/0/4000/2666/398/265/75/0/2f018db_ftp-import-images-1-mqpumqgw061d-5138030-01-06.jpg,Fresh protests in Antananarivo drew large crowds in one of the biggest gatherings since a protest movement erupted on the Indian Ocean island on September 25. Some soldiers joined after announcing they would refuse any orders to shoot demonstrators.,https://www.lemonde.fr/en/international/article/2025/10/11/madagascar-soldiers-join-youth-led-demonstrations_6746331_4.html,,
"RSF attack kills 60 in Sudan's El-Fasher, says activists",,https://img.lemde.fr/2025/10/08/0/179/3642/2428/398/265/75/0/babb5df_ftp-import-images-1-x21bspfmw7ug-2025-10-08t131847z-1271458750-rc217haekokr-rtrmadp-3-sudan-politics-fashir.JPG,"The resistance committee for El-Fasher, the North Darfur state capital, said the paramilitary Rapid Support Forces hit the Dar al-Arqam displacement center on the grounds of a university.",https://www.lemonde.fr/en/international/article/2025/10/11/rsf-attack-kills-60-in-sudan-s-el-fasher-says-activists_6746329_4.html,,
Masses of displaced persons return to northern Gaza amid a landscape of ruins,Subscribers only,https://img.lemde.fr/2025/10/10/9/0/5500/3666/664/442/75/0/f2f5135_ftp-import-images-1-n8vlybzhgcc7-2025-10-10t130047z-1366895486-rc2z8ha99qc1-rtrmadp-3-israel-palestinians-gaza.JPG,"Nearly 200,000 Palestinians had returned to the Gaza Strip's north by Friday evening, according to the territory's civil defense service.",https://www.lemonde.fr/en/international/article/2025/10/11/northern-gaza-sees-mass-return-of-displaced-people-amid-ruined-landscape_6746324_4.html, Laure Stephan,News
Portland activists use humor to counter Trump's apocalyptic portrayal of the city,Subscribers only,https://img.lemde.fr/2025/10/08/1/0/7361/4907/198/132/95/0/9d45fe5_upload-1-iup89ngd8qhc-705698.jpg,,https://www.lemonde.fr/en/international/article/2025/10/10/in-portland-activists-use-humor-to-counter-donald-trump-s-apocalyptic-portrayal-of-the-city_6746281_4.html,,
"Trump announces new 100% tariff on China, threatens to scrap Xi talks",,https://img.lemde.fr/2025/06/05/0/0/3419/2279/198/132/95/0/34e2fac_ftp-import-images-1-5rsa7cwqroqf-2025-06-05t135347z-2005869237-rc2qzaafkmlu-rtrmadp-3-china-usa-xi-trump.JPG,,https://www.lemonde.fr/en/international/article/2025/10/11/trump-announces-new-100-china-tariff-threatens-to-scrap-xi-talks_6746317_4.html,,
"Multiple dead, 19 missing after blast at Tennessee explosives plant",,https://img.lemde.fr/2025/10/10/0/0/3999/2666/198/132/95/0/45e6ec2_ftp-import-images-1-319lt1c5tp3n-2025-10-10t184846z-1417062782-rc269ha7p8wy-rtrmadp-3-usa-trump-memphis.JPG,,https://www.lemonde.fr/en/international/article/2025/10/10/multiple-dead-19-missing-after-blast-at-tennessee-explosives-plant_6746316_4.html,,
Melania Trump says talks with Putin have secured the return of Ukrainian children abducted by Russia,,https://img.lemde.fr/2025/10/10/0/0/5413/3608/198/132/95/0/e07f641_ftp-import-images-1-1rznl1q9nxpp-2025-10-10t160912z-1952772345-rc239ha25p3f-rtrmadp-3-ukraine-crisis-trump-children.JPG,,https://www.lemonde.fr/en/international/article/2025/10/10/melania-trump-says-talks-with-putin-have-secured-the-return-of-ukrainian-children-abducted-by-russia_6746315_4.html,,
Nobel Peace Prize winner Machado dedicates award to Trump,,,,https://www.lemonde.fr/en/international/article/2025/10/10/nobel-peace-prize-winner-machado-dedicates-award-to-trump_6746311_4.html,,
Peruvian lawmakers oust president over failure to resolve security crisis,Subscribers only,,,https://www.lemonde.fr/en/international/article/2025/10/10/peruvian-lawmakers-oust-president-over-failure-to-resolve-security-crisis_6746305_4.html,,
Le Pen opens door to 'governing agreement' with mainstream right,Subscribers only,,,https://www.lemonde.fr/en/politics/article/2025/10/10/le-pen-opens-door-to-governing-agreement-with-mainstream-right_6746308_5.html,,
Britain shouldn't gloat about France's crisis,,,,https://www.lemonde.fr/en/economy/article/2025/10/10/britain-shouldn-t-gloat-about-france-s-crisis_6746306_19.html,,
'Official data falls far short of illustrating the poverty' in Morocco,Subscribers only,,,https://www.lemonde.fr/en/le-monde-africa/article/2025/10/10/official-data-falls-far-short-of-illustrating-the-precarious-situation-in-morocco_6746309_124.html,,
Pelicot rape case closes with forgettable appeal trial,Subscribers only,,,https://www.lemonde.fr/en/france/article/2025/10/10/pelicot-rape-case-closes-with-a-forgettable-appeal-trial_6746300_7.html,,
Trump obtains indictment of attorney general who prosecuted him,Subscribers only,,,https://www.lemonde.fr/en/international/article/2025/10/10/trump-obtains-indictement-of-attorney-general-who-prosecuted-him_6746303_4.html,,
"Faced with looming gasoline shortage, California's governor backs off oil companies",Subscribers only,,,https://www.lemonde.fr/en/international/article/2025/10/11/faced-with-a-looming-gasoline-shortage-california-s-governor-backs-off-oil-companies_6746319_4.html,,
"From Bob Dylan to Taylor Swift, the resurrection of Ophelia",Subscribers only,https://img.lemde.fr/2025/10/06/0/0/3778/2518/664/442/75/0/53110ae_ftp-import-images-1-zdr5zzsk2hyd-255e2aa8d2054de6a9e1937b927fcf03-0-ea6953ca38324ffea3e1b9b6bbf3043f.jpg,"More and more female singers are reinterpreting the Shakespearean figure, drawing on her imagery but rejecting the tragic outcome of her fate.",https://www.lemonde.fr/en/opinion/article/2025/10/10/from-bob-dylan-to-taylor-swift-the-resurrection-of-the-ophelia-myth_6746285_23.html, Aureliano Tonet,News analysis
'One Battle After Another' stirs political passion in the US,Subscribers only,https://img.lemde.fr/2025/10/09/0/360/1911/1274/664/442/75/0/77e379a_upload-1-2uwcj0hbumzp-capture-da-ei-cran-2025-10-09-ai-3-27-20a-pm.png,"Lauded as a 'rallying cry' by some and denounced as 'glorifying terrorism' by others, the film has been dissected in starkly opposing terms, writes Le Monde's Thomas Sotinel in his column.",https://www.lemonde.fr/en/culture/article/2025/10/10/one-battle-after-another-stirs-political-passion-in-the-us_6746313_30.html, Thomas Sotinel,Column
Matthieu Blazy: 'Just because Karl was a legend does not mean that everyone who designs for Chanel has to be one too',Subscribers only,https://img.lemde.fr/2025/10/07/1047/0/2953/1968/664/442/75/0/478d01d_upload-1-judlpxmqg4ht-20250915-s8a6409-a4.JPG,"The anticipation was overwhelming. But on Monday, the first show by Chanel's new artistic director under the glass roof of the Grand Palais lived up to all expectations. With his impeccable CV and strong personality, the 41-year-old designer has written the first page of a new chapter for the fashion house. His mission? To usher it into a new era without losing its soul.",https://www.lemonde.fr/en/m-le-mag/article/2025/10/08/chanel-s-new-face-matthieu-blazy-just-because-karl-was-a-legend-does-not-mean-that-everyone-who-designs-for-chanel-has-to-be-one-too_6746228_117.html, Caroline Rousseau,Profile
Cancer: France must know why it has higher exposure rates,,,,https://www.lemonde.fr/en/opinion/article/2025/10/11/cancer-france-must-know-why-it-faces-higher-exposure-rates_6746328_23.html,,Editorial
"'In the United States, Congress no longer exists as a counterbalance'",Subscribe,,,https://www.lemonde.fr/en/opinion/article/2025/10/11/in-the-united-states-congress-no-longer-exists-as-a-counterbalance_6746322_23.html,,Op-Ed
Pension reform discontent catches up with Macron,,,,https://www.lemonde.fr/en/opinion/article/2025/10/09/pension-reform-discontent-catches-up-with-macron_6746269_23.html,,Editorial
