title,premium,image URL,subhead,URL,byline,article type
The endless purges of Xi Jinping's China, Subscribers only ,,,,,
Trump openly grants pardons to business allies and political supporters, Subscribers only ,,,,,
The success of Roma TikTokers in Greece hides dramatic living conditions, Subscribers only ,,,,,
Trump decides not to deploy National Guard in San Francisco, Subscribers only ,,,,,
"After Charlie Kirk's murder, Europe's far right swears allegiance to Trump's politics", Subscribers only ,,,,,
Sanctions against Russia spark rift between US and Europe over China, Subscribers only ,,,,,
France's political instability puts Franco-German alliance to the test,,,,,,
France faces prospect of paying higher borrowing costs than Italy, Subscribers only ,,,,,
Woman who murdered 12-year-old girl in Paris sentenced to life without parole,,,,,,
"Emilie König, IS jihadist and propagandist, will go before French criminal court", Subscribers only ,,,,,
Cédric Jubillar trial: What led to the 30-year prison sentence for the murder of his wife, Subscribers only ,,,,,
France's Assemblée Nationale backs bill adding consent to rape law, Subscribers only ,,,,,
Afghanistan: Relentless repression continues over four years into Taliban's rule,,,,,,
Watch: Hundreds of thousands march in France against budget cuts,,,,,,
Emmys 2025: 'Adolescence' star Owen Cooper becomes youngest winner for best supporting actor,,,,,,
"From 'influence peddling' to 'corruption,' what is French Culture Minister Rachida Dati accused of?",,,,,,
"'The Louvre's stolen jewels, valuable only for their gemstones, are above all outdated and cumbersome'", Subscribers only ,,,,,
Malian junta is powerless against jihadist threat,,,,,,
"'Contrary to the claims of the far-right populists, people are convinced of the reality of climate change'", Subscribers only ,,,,,
'The Thiaroye massacre in Senegal in 1944 marked the reestablishment of colonial order', Subscribers only ,,,,,
Brigitte Macron's never-ending fake news nightmare, Subscribers only ,,,,,
A new Israeli-Palestinian restaurant promotes peace through food in Paris, Subscribers only ,,,,,
The wild Albanian island where the Trumps want to build a luxury hotel, Subscribers only ,,,,,
"France's last military pigeons, custodians of a fading tradition", Subscribers only ,,,,,
Twelve artistic happenings to catch outside Art Basel Paris, Subscribers only ,,,,,
A new Israeli-Palestinian restaurant promotes peace through food in Paris, Subscribers only ,,,,,
"'The spirit of the new Fondation Cartier is not that of a cathedral where one must always do more, always bigger'", Subscribers only ,,,,,
"Jean-François Piège, guardian of Paris's bistro heritage", Subscribers only ,,,,,
 Alassane Ouattara tightens control in Côte d'Ivoire as he seeks fourth term  ,Subscribers only,,"The two main opposition leaders are barred from Saturday's presidential vote, as a 44,000-strong security operation is deployed nationwide.",https://www.lemonde.fr/en/le-monde-africa/article/2025/10/25/alassane-ouattara-tightens-control-in-cote-d-ivoire-as-he-seeks-fourth-term_6746768_124.html,,
Brigitte Macron's never-ending fake news nightmare,Subscribers only,https://img.lemde.fr/2025/10/22/212/0/1571/1047/398/265/75/0/dbe52f8_upload-1-zlomphzpzsmh-2018-10-17t000000z-1559596828-rc1d2ea1d230-rtrmadp-3-france-jap.jpeg,,https://www.lemonde.fr/en/m-le-mag/article/2025/10/25/brigitte-macron-s-never-ending-fake-news-nightmare_6746763_117.html,,
"Emilie König, IS jihadist and propagandist, will go before French criminal court",Subscribers only,https://img.lemde.fr/2025/10/24/12/0/4842/3228/398/265/75/0/06751a0_upload-1-n6qok7r9qoy6-000-96x643.jpg,,https://www.lemonde.fr/en/france/article/2025/10/25/emilie-konig-is-jihadist-and-propagandist-will-go-before-french-criminal-court_6746771_7.html,,
Louvre heist turns into a flashpoint in Paris municipal elections,Subscribers only,https://img.lemde.fr/2025/10/21/0/1/5782/3855/398/265/75/0/70b664d_ftp-import-images-1-mokqcnyvuci2-2025-10-21t131448z-675605938-rc2dgha2mb14-rtrmadp-3-france-politics.JPG,Culture minister and Paris mayoral candidate Rachida Dati has come under fire from the Parisian left after the burglary.,https://www.lemonde.fr/en/politics/article/2025/10/25/louvre-heist-turns-into-a-flashpoint-in-paris-municipal-elections_6746770_5.html,,
Canada becomes embroiled in new conflict with Donald Trump,Subscribers only,https://img.lemde.fr/2025/10/24/0/22/2955/1970/398/265/75/0/19f423d_ftp-import-images-1-9m4dfhlqa7ue-e100c35880cc43f0a861e24566360d0f-0-5a2a0a2d08ec4222838bb2c82ed97217.jpg,"Offendend by a Canadian advertisement featuring a 1987 speech by Ronald Reagan criticizing tariffs, the American president broke off trade talks with Ottawa.",https://www.lemonde.fr/en/economy/article/2025/10/25/canada-becomes-embroiled-in-new-conflict-with-donald-trump_6746767_19.html,,
Moody's keeps France's credit rating but places it on negative outlook,Subscribers only,https://img.lemde.fr/2025/10/15/0/0/5899/3933/398/265/75/0/1c71424_upload-1-ogzxnww1hfmn-jmug251014006.jpg,"While maintaining its 'AA3' rating on Friday, the US ratings agency warned about France's 'political fragmentation' much more than its economic fundamentals.",https://www.lemonde.fr/en/economy/article/2025/10/25/moody-s-keeps-france-s-credit-rating-but-places-it-on-negative-outlook_6746760_19.html,,
The Fondation Cartier unveils its new landmark in central Paris,Subscribers only,https://img.lemde.fr/2025/10/21/0/0/1200/800/664/442/75/0/d8026b8_ftp-import-images-1-9rcwqnkoupls-402098-3442806.jpg,"The Fondation Cartier for Contemporary Art has moved to Place du Palais-Royal in Paris. Like its previous location on Boulevard Raspail, the new building was designed by architect Jean Nouvel, conceived as an innovative, flexible space that can be configured in countless ways.",https://www.lemonde.fr/en/culture/article/2025/10/25/the-fondation-cartier-unveils-its-new-landmark-in-central-paris_6746758_30.html, Emmanuelle Lequeux,News
Thailand's former queen Sirikit has died at 93,,https://img.lemde.fr/2025/10/24/80/0/2486/1657/198/132/95/0/ed11231_ftp-import-images-1-dv05t5vnsi1e-7bbc8d4fe2c04b308f03aa534f5a5954-0-1a0e9c88c87c4c6d90d6f6e8c1e6493a.jpg,,https://www.lemonde.fr/en/obituaries/article/2025/10/25/thailand-s-former-queen-sirikit-has-died-at-93_6746766_15.html,,
Rubio seeks quick deployment of international force to police ceasefire in Gaza,,https://img.lemde.fr/2025/10/24/0/0/5773/3849/198/132/95/0/e52ba57_ftp-import-images-1-0r5xzq9komik-8598ca70c77a472998e12990ab0dfa97-0-a354b73d896748618ae337e7fe0cd809.jpg,,https://www.lemonde.fr/en/international/article/2025/10/25/rubio-seeks-quick-deployment-of-international-force-to-police-ceasefire-in-gaza_6746759_4.html,,
Catherine Connolly is the favorite to succeed Michael Higgins as president in Irish election,,https://img.lemde.fr/2025/10/22/0/0/6000/4000/198/132/95/0/950ee43_ftp-import-images-1-qcgf0ox3uv0l-2025-10-22t103553z-802563694-rc2zsgaxqvbc-rtrmadp-3-ireland-election.JPG,,https://www.lemonde.fr/en/international/article/2025/10/25/catherine-connolly-is-the-favorite-to-succeed-michael-higgins-as-president-in-irish-election_6746765_4.html,,
"First loves: '20 years later, our bodies recognize each other, it's crazy'",Subscribers only,https://img.lemde.fr/2025/09/11/420/0/1440/960/198/132/95/0/aa3726a_upload-1-rcjggvxrxd5j-amours-jeunesse.jpg,,https://www.lemonde.fr/en/intimacy/article/2025/10/25/first-loves-20-years-later-our-bodies-recognize-each-other-it-s-crazy_6746762_310.html,,
US sends aircraft carrier to Latin America as military campaign escalates against alleged drug trafficking,,,,https://www.lemonde.fr/en/international/article/2025/10/24/us-imposes-sanctions-on-colombia-s-president_6746755_4.html,,
'The Thiaroye massacre in Senegal in 1944 marked the reestablishment of colonial order',Subscribers only,,,https://www.lemonde.fr/en/opinion/article/2025/10/25/the-thiaroye-massacre-in-senegal-in-1944-marked-the-reestablishment-of-colonial-order_6746761_23.html,,
"'Contrary to the claims of the far-right populists, people are convinced of the reality of climate change'",Subscribers only,,,https://www.lemonde.fr/en/opinion/article/2025/10/25/contrary-to-the-claims-of-the-far-right-populists-people-are-convinced-of-the-reality-of-climate-change_6746764_23.html,,
"After nine months of Trump's presidency, US inflation returns but does not derail economic policy",Subscribers only,,,https://www.lemonde.fr/en/economy/article/2025/10/25/after-nine-months-of-trump-s-presidency-us-inflation-returns-but-does-not-derail-economic-policy_6746757_19.html,,
"In emotional speech, NYC mayoral candidate Mamdani defends Muslim identity against 'racist and baseless' attacks",,,,https://www.lemonde.fr/en/international/article/2025/10/24/in-emotional-speech-nyc-mayoral-candidate-zohran-mamdani-defends-muslim-identity-against-racist-and-baseless-attacks_6746756_4.html,,
The endless purges of Xi Jinping's China,Subscribers only,,,https://www.lemonde.fr/en/international/article/2025/10/24/the-endless-purges-of-xi-jinping-s-china_6746754_4.html,,
New partnership hopes to strengthen the European aerospace sector and block Elon Musk's Starlink,Subscribers only,,,https://www.lemonde.fr/en/economy/article/2025/10/24/a-new-partnership-hopes-to-strengthen-the-european-aerospace-sector-and-block-elon-musk-s-starlink_6746723_19.html,,
Attorney General Letitia James pleads not guilty to bank fraud charges pursued by Trump,,,,https://www.lemonde.fr/en/international/article/2025/10/24/attorney-general-letitia-james-pleads-not-guilty-to-bank-fraud-charges-pursued-by-trump_6746752_4.html,,
"'The Louvre's stolen jewels, valuable only for their gemstones, are above all outdated and cumbersome'",Subscribers only,https://img.lemde.fr/2025/10/22/0/0/3923/2615/664/442/75/0/c83b47b_ftp-import-images-1-v3uvn3m8fu9q-2025-10-22t113325z-1959701680-rc2xghawv6ic-rtrmadp-3-france-crime-louvre.JPG,"Reactions to the Louvre heist ignore the complex equation museums face: offering generous public access while securing cumbersome objects better suited for a bank vault, explains Le Monde columnist Michel Guerrin.",https://www.lemonde.fr/en/opinion/article/2025/10/24/the-louvre-s-stolen-jewels-valuable-only-for-their-gemstones-are-above-all-outdated-and-cumbersome_6746751_23.html, Michel Guerrin,Column
Sarkozy imprisonment: Protection of ex-president by armed officers angers prison guards,Subscribers only,https://img.lemde.fr/2025/10/21/667/0/5000/3333/664/442/75/0/6b7ed64_upload-1-qbucqbqb7ui3-kzihnioglu-pol-sarko-sante-21102025-hd-22.JPG,"On Wednesday, interior minister Laurent Nuñez defended the measure, citing Nicolas Sarkozy's 'status' and 'threats against him.' Prison guard unions decried it as 'security madness' and 'unprecedented humiliation.'",https://www.lemonde.fr/en/france/article/2025/10/23/sarkozy-imprisonment-armed-officers-guarding-the-ex-president-spark-shock-and-outrage_6746706_7.html," Antoine Albertini,  Grégoire Biseau and  Soren Seelow",In Depth
A former mining city in northern China has become a budget tourist destination,Subscribers only,https://img.lemde.fr/2025/10/22/0/0/6694/4462/664/442/75/0/11b10b4_upload-1-mhmsiskhzpuo-gettyimages-2176095999.jpg,"Driven by the reconstruction of its downtown area and the redevelopment of disused mining sites, China's northern city of Datong, located 350 kilometers west of Beijing, has been experiencing a boost in tourism.",https://www.lemonde.fr/en/economy/article/2025/10/24/a-former-mining-city-in-northern-china-has-become-a-budget-tourist-destination_6746726_19.html, Jordan Pouille,Feature
Malian junta is powerless against jihadist threat,,,,https://www.lemonde.fr/en/opinion/article/2025/10/25/malian-junta-is-powerless-against-jihadist-threat_6746769_23.html,,Editorial
'France has lost all budgetary credibility',Subscribe,,,https://www.lemonde.fr/en/opinion/article/2025/10/21/france-has-lost-all-budgetary-credibility_6746627_23.html,,Column
France's democratic crisis is showing increasingly alarming symptoms,,,,https://www.lemonde.fr/en/opinion/article/2025/10/21/france-s-democratic-crisis-is-showing-increasingly-alarming-symptons_6746626_23.html,,Editorial
