title,premium,image URL,subhead,URL,byline,article type
"« Sans intervention, ma commune va devenir un centre de vacances » : dans le Morbihan, un maire tente en vain de favoriser l’habitat à l’année", Article réservé aux abonnés ,,,,,
Nucléaire : « Les ogres des données sont partis à la chasse aux électrons », Article réservé aux abonnés ,,,,,
"Patrick Artus : « Aux Etats-Unis, les attaques sur le système de recherche publique et les universités compromettent les perspectives de croissance  »", Article réservé aux abonnés ,,,,,
"« Pour réglementer les cryptomonnaies, les Etats-Unis devraient s’inspirer de la voie européenne »", Article réservé aux abonnés ,,,,,
Iran : l’impact des frappes israéliennes sur l’environnement,,,,,,
Attaque d’Israël contre l’Iran : les images analysées par « Le Monde » montrent les sites stratégiques touchés,,,,,,
Les images des attaques iraniennes contre Israël dans la nuit du 14 au 15 juin,,,,,,
Ukraine : ce que l’on sait de l’attaque de drones inédite lancée contre des bases russes,,,,,,
Médecins accusés de violences sexuelles : clarifier les responsabilités,,,,,,
"Loïs Boisson, le rôle modèle qui manquait au sport féminin en France ?", Article réservé aux abonnés ,,,,,
"Les idées d’extrême droite, un poison lent dans l’Union européenne", Article réservé aux abonnés ,,,,,
« L’émergence d’un Iran normalisé est la seule voie possible pour les citoyens iraniens victimes du régime », Article réservé aux abonnés ,,,,,
"« “Les Dents de la mer”, sorti il y a cinquante ans, ébauche le blockbuster moderne et marque l’histoire de l’industrie du cinéma »", Article réservé aux abonnés ,,,,,
"« Les Lois et les Nombres », de Romain Graziani : la chronique « histoire » de Roger-Pol Droit", Article réservé aux abonnés ,,,,,
"« Jack Lang, le beau rôle », sur France 5 : ministre, maire, député, directeur… huit décennies d’une existence dense, commentées par l’intéressé", Article réservé aux abonnés ,,,,,
"Ludovico Einaudi, le pianiste italien devenu star de la « musique de fond »", Article réservé aux abonnés ,,,,,
"Sophie Toporkoff, des défilés de mode à l’art exigeant du vitrail", Article réservé aux abonnés ,,,,,
"Le parasol à franges, de nouveau dans le vent",,,,,,
Cinq lieux culturels à faire avec son enfant de moins de 2 ans à Paris, Article réservé aux abonnés ,,,,,
Un apéro avec Pierre Garnier : « Le temps qui passe m’a toujours fait flipper », Article réservé aux abonnés ,,,,,
"         Live  Article se déroulant en direct   Au moins 657 personnes tuées en Iran par les frappes israéliennes depuis le 13 juin, selon une ONG iranienne exilée aux Etats-Unis  ", Article réservé aux abonnés ,,"Selon l’organisation HRANA, au moins 263 civils, dont plus d’une vingtaine d’enfants, 164 militaires et 230 autres personnes ont été tués en Iran depuis le début de l’offensive israélienne.",https://www.lemonde.fr/international/live/2025/06/21/en-direct-israel-iran-au-moins-657-personnes-ont-ete-tuees-par-les-frappes-israeliennes-depuis-le-13-juin-selon-une-ong-iranienne-exilee-aux-etats-unis-l-etat-hebreu-affirme-qu-il-poursuivra-ses-attaques-tant-que-persistera-la-menace-nucleair_6614739_3210.html,,
"Marine Rosset, socialiste et homosexuelle, nommée à la tête des Scouts et guides de France : le malaise d’une partie de la communauté catholique",Article réservé aux abonnés,https://img.lemde.fr/2025/06/20/224/0/5227/3484/398/265/75/0/7d85915_upload-1-hn44ikk101di-sipa-01210400-000003.jpg,,https://www.lemonde.fr/societe/article/2025/06/20/scouts-et-guides-de-france-remous-apres-l-election-de-marine-rosset-socialiste-et-homosexuelle_6614855_3224.html,,
"Mahmoud Khalil, leader des manifestations propalestiniennes à l’université Columbia arrêté par l’administration Trump, a été libéré",,https://img.lemde.fr/2025/06/21/0/0/9504/6336/398/265/75/0/1eb81fe_ftp-import-images-1-3edahliuxnhl-9f150ddbc5624742b27023c9845f7c18-0-12673e24432d43fe85c086fc3cf9f42d.jpg,,https://www.lemonde.fr/international/article/2025/06/21/mahmoud-khalil-leader-des-manifestations-propalestiniennes-a-l-universite-columbia-arrete-par-l-administration-trump-va-etre-libere_6614868_3210.html,,
"Au Royaume-Uni, la Chambre des communes adopte une loi sur l’aide à mourir",Article réservé aux abonnés,https://img.lemde.fr/2025/06/20/0/0/3499/2333/398/265/75/0/dd0e2d1_upload-1-xljbtbwfws5o-439102.jpg,"Le texte propose de ne légaliser la mesure que dans le cas de personnes majeures, atteintes d’une maladie en phase terminale avec une espérance de vie de six mois ou moins. Les patients doivent être pleinement conscients et capables de s’administrer la dose létale eux-mêmes.",https://www.lemonde.fr/international/article/2025/06/20/au-royaume-uni-la-chambre-des-communes-adopte-une-loi-sur-l-aide-a-mourir_6614858_3210.html,,
"Pic de chaleur prévu samedi, 16 départements restent en vigilance orange",,https://img.lemde.fr/2025/06/20/0/0/4842/3228/398/265/75/0/0b5cf82_ftp-import-images-1-effiwstiku9z-2025-06-20t152615z-2044570294-rc2c6fan6kcm-rtrmadp-3-france-weather-heat-wave.JPG,Plusieurs villes ouvrent exceptionnellement leurs parcs la nuit pour offrir un peu de fraîcheur aux habitants.,https://www.lemonde.fr/planete/article/2025/06/21/canicule-la-vague-de-chaleur-a-son-zenith-ce-samedi-16-departements-restent-en-vigilance-orange_6615006_3244.html,,
Tesla va construire sa plus grande usine de stockage d’électricité en Chine,,https://img.lemde.fr/2022/11/19/0/0/3500/2333/398/265/75/0/8d191f7_fw1-tesla-recall-1119-11.jpg,"Cette installation doit « permettre d’ajuster les ressources du réseau électrique et de résoudre efficacement les pressions liées à la fourniture d’électricité en milieu urbain », annonce le groupe américain.",https://www.lemonde.fr/economie/article/2025/06/21/tesla-va-construire-sa-plus-grande-usine-de-stockage-d-electricite-en-chine_6614869_3234.html,,
"Sikou Niakate, auteur et documentariste : « Je dois être “un Noir exceptionnel”. C’est une charge politique immense »",Article réservé aux abonnés,https://img.lemde.fr/2025/06/20/89/0/709/472/664/442/75/0/9b3250b_upload-1-xc4opssu4hmt-sikou-lemonde-2.jpeg,"L’auteur de « Dans le noir, je crie » et du podcast « Jour noir » s’interroge sans cesse sur la perception de sa couleur de peau dans l’espace public. Et défend une masculinité sensible, poussant les hommes à exprimer leurs émotions librement.",https://www.lemonde.fr/intimites/article/2025/06/21/sikou-niakate-auteur-et-documentariste-je-dois-etre-un-noir-exceptionnel-c-est-une-charge-politique-immense_6615040_6190330.html, Clara Georges,Entretien
"En direct, guerre en Ukraine : les dernières informations",,https://img.lemde.fr/2025/06/13/51/0/5146/3430/198/132/95/0/a68d9bc_ftp-import-images-1-sqjyvzltm0xw-2025-06-13t154528z-1850607589-rc2n1fap6rca-rtrmadp-3-ukraine-crisis-sumy.JPG,,https://www.lemonde.fr/international/live/2025/06/21/en-direct-guerre-en-ukraine-les-dernieres-informations_6613242_3210.html,,
"Harvard va pouvoir accueillir de nouveaux étudiants étrangers, confirme une juge fédérale",,https://img.lemde.fr/2025/06/05/0/0/4146/2764/198/132/95/0/36f3085_ftp-import-images-1-ocdna4layujz-5103089-01-06.jpg,,https://www.lemonde.fr/international/article/2025/06/21/harvard-va-pouvoir-accueillir-de-nouveaux-etudiants-etrangers-confirme-une-juge-federale_6614870_3210.html,,
"Dans la bande de Gaza, 43 nouvelles personnes tuées par l’armée israélienne, dont 26 qui attendaient de l’aide humanitaire, selon la défense civile",,https://img.lemde.fr/2025/06/20/0/0/5470/3646/198/132/95/0/2f28bfd_upload-1-wpcwbp8rkgym-000-634f8g2.jpg,,https://www.lemonde.fr/international/article/2025/06/20/gaza-43-nouvelles-personnes-tuees-par-l-armee-israelienne-dont-26-attendaient-de-l-aide-pres-du-corridor-de-netzarim-selon-la-defense-civile-de-l-enclave_6614832_3210.html,,
"Les replays du week-end : mystère sous-marin, secret algérien, relations toxiques…",Article réservé aux abonnés,https://img.lemde.fr/2025/06/20/0/77/870/580/198/132/95/0/5cdebc8_upload-1-hde6zntd8gte-dcw7domwdadqu3husqzkx1mymoc0qi1aoeivku5o1je8p8wkdbo8a92nqkjac71yusllss-9yjeufbdzisoqzji47hqyxszkdrp71nvka6k18ibc8mkz6n78ga-bzep1o5o5a9cn.jpg,,https://www.lemonde.fr/culture/article/2025/06/21/les-replays-du-week-end-mystere-sous-marin-secret-algerien-relations-toxiques_6614973_3246.html,,
"Ludovico Einaudi, le pianiste italien devenu star de la « musique de fond »",Article réservé aux abonnés,,,https://www.lemonde.fr/culture/article/2025/06/20/ludovico-einaudi-le-pianiste-italien-devenu-star-de-la-musique-de-fond_6614863_3246.html,,
"J. D. Vance, le vice-président des Etats-Unis, affirme que la garde nationale et les marines sont « toujours nécessaires » à Los Angeles",,,,https://www.lemonde.fr/international/article/2025/06/21/j-d-vance-le-vice-president-des-etats-unis-affirme-que-la-garde-nationale-et-les-marines-sont-toujours-necessaires-a-los-angeles_6614906_3210.html,,
Athlétisme : Azeddine Habz s’empare du record de France du 1 500 m lors du meeting de Paris,,,,https://www.lemonde.fr/sport/article/2025/06/21/athletisme-azeddine-habz-s-empare-du-record-de-france-du-1-500-m-lors-du-meeting-de-paris_6614872_3242.html,,
Stade toulousain-Aviron bayonnais : le résumé de la qualification des Toulousains pour la finale du Top 14,,,,https://www.lemonde.fr/sport/article/2025/06/20/stade-toulousain-aviron-bayonnais-le-resume-de-la-qualification-des-toulousains-pour-la-finale-du-top-14_6614866_3242.html,,
"Marine Le Pen défend Caroline Parmentier, vice-présidente du groupe RN à l’Assemblée, critiquée pour des écrits racistes, haineux et antiavortement",Article réservé aux abonnés,,,https://www.lemonde.fr/politique/article/2025/06/20/marine-le-pen-defend-caroline-parmentier-l-une-de-ses-proches-epinglee-pour-des-ecrits-racistes_6614821_823448.html,,
"Philippe Diallo, ce nouveau patron du football français que personne n’avait vu venir",Article réservé aux abonnés,,,https://www.lemonde.fr/sport/article/2025/06/20/philippe-diallo-ce-nouveau-patron-du-football-francais-que-personne-n-avait-vu-venir_6614738_3242.html,,Enquête
"Le narcotrafiquant Abdelkader Bouguettaia, extradé de Dubaï, a été mis en examen et incarcéré en France",,,,https://www.lemonde.fr/societe/article/2025/06/20/le-narcotrafiquant-abdelkader-bouguettaia-extrade-de-dubai-a-ete-mis-en-examen-et-incarcere-en-france_6614849_3224.html,,
"La dérive de Martial Lanoir, chanteur raté tombé dans le complotisme, jugé pour meurtre à Paris",Article réservé aux abonnés,,,https://www.lemonde.fr/societe/article/2025/06/20/a-la-cour-d-assises-de-paris-la-derive-de-martial-lanoir-chanteur-rate-devenu-meurtrier_6614862_3224.html,,
Un apéro avec Pierre Garnier : « Le temps qui passe m’a toujours fait flipper »,Article réservé aux abonnés,https://img.lemde.fr/2025/06/13/62/0/3307/2204/664/442/75/0/869adc7_upload-1-cngkgcgszlwo-01-iorgis-matyassy-pierre-garnier-hd-03.jpg,"Chaque semaine, « L’Epoque » paie son coup. Le gagnant de la 11ᵉ saison de la « Star Academy » s’est arrêté quelques heures dans la capitale, en plein cœur de sa tournée, avant d’y revenir le 22 juin, pour un concert au Zénith de Paris.",https://www.lemonde.fr/m-perso/article/2025/06/20/un-apero-avec-pierre-garnier-le-temps-qui-passe-m-a-toujours-fait-flipper_6614844_4497916.html, Sandra Favier,Rencontre
Les enfants sacrifiés de la secte bouddhiste de Robert Spatz,Article réservé aux abonnés,https://img.lemde.fr/2025/06/20/80/0/1125/750/664/442/75/0/93554e4_upload-1-sqq9okxmo7vd-fcdbcfa-ftp-import-images-1-qujgnp54qnzf-386101-3425791.jpg,"Les enfants des disciples de « lama Kunzang », fondateur d’une secte bouddhiste tibétaine, ont grandi dans un domaine isolé  dans les Alpes-de-Haute-Provence. Plusieurs d’entre eux racontent y avoir subi brimades, violences et viols. Malgré les plaintes déposées et une condamnation, l’accusé vit des jours tranquilles en Espagne.",https://www.lemonde.fr/m-le-mag/article/2025/06/20/les-enfants-sacrifies-de-la-secte-de-robert-spatz-j-ai-recu-des-gifles-des-coups-de-pied-j-ai-ete-enferme-prive-de-nourriture-plusieurs-jours-d-affilee_6614732_4500055.html, Elodie Emery,Récit
Les expositions à ne pas rater cet été dans toute la France,Article réservé aux abonnés,https://img.lemde.fr/2025/06/10/595/0/2132/1421/664/442/75/0/e1aa569_sirius-fs-upload-1-tybqpgokm9up-1749558165970-10890.jpg,"Dubuffet, Hokusai, Bretécher, Giacometti, Avedon… Cet été, les musées, les fondations et les centres d’art rivalisent de propositions pour attirer les vacanciers, qui se voient offrir l’opportunité de belles découvertes. ",https://www.lemonde.fr/culture/article/2025/06/20/les-expositions-a-ne-pas-rater-cet-ete-dubuffet-hokusai-bretecher-giacometti_6614727_3246.html,,Sélection
Médecins accusés de violences sexuelles : clarifier les responsabilités,,,,https://www.lemonde.fr/idees/article/2025/06/20/medecins-accuses-de-violences-sexuelles-clarifier-les-responsabilites_6614789_3232.html,,Éditorial
« Guerre préventive et changement de régime sont rarement couronnés de succès »,S’abonner,https://img.lemde.fr/2017/09/22/0/0/0/0/100/100/60/0/cd62c21_403.jpg,,https://www.lemonde.fr/idees/article/2025/06/18/iran-israel-guerre-preventive-et-changement-de-regime-sont-rarement-couronnes-de-succes_6614125_3232.html,,Chronique
"Loïs Boisson, le rôle modèle qui manquait au sport féminin en France ?",S’abonner,,,https://www.lemonde.fr/sciences/article/2025/06/20/lois-boisson-la-locomotive-qui-manquait-a-la-pratique-du-sport-feminin_6614813_1650684.html,,Les faits
