title,premium,image URL,subhead,URL,byline,article type
"Mouvement Bloquons tout : trains, aéroports, raffineries… A quels blocages s’attendre le 10 septembre ?", Article réservé aux abonnés ,,,,,
Google échappe au démantèlement aux Etats-Unis, Article réservé aux abonnés ,,,,,
"« Voilà que le gouvernement allemand laisse MediaForEurope, contrôlé par la famille Berlusconi, s’emparer du deuxième diffuseur privé du pays »", Article réservé aux abonnés ,,,,,
"« Pour éviter que la France ne s’appauvrisse, il faut associer rééquilibrage budgétaire et investissements d’avenir »", Article réservé aux abonnés ,,,,,
Z Event : comment est financé le plus grand stream caritatif de France, Article réservé aux abonnés ,,,,,
Pourquoi la Russie utilise tellement de drones iraniens Shahed pour attaquer l’Ukraine, Article réservé aux abonnés ,,,,,
La machine anti-immigration de Donald Trump s’active au cœur de New York, Article réservé aux abonnés ,,,,,
Hiroshima : comment s’est déroulé le bombardement atomique le plus dévastateur de l’histoire, Article réservé aux abonnés ,,,,,
Guerre en Ukraine : le travail de Sisyphe des Européens face à Donald Trump,,,,,,
"« La France de 2025 n’est pas le Portugal de 2011, passé sous les fourches Caudines du FMI »", Article réservé aux abonnés ,,,,,
"« Après huit ans de marginalisation, les socialistes vivent “leur” moment, sans être assurés pour autant d’en sortir indemnes »", Article réservé aux abonnés ,,,,,
"Sandro Gozi, eurodéputé : « Nous devons montrer aux citoyens que nous pouvons nous opposer au pouvoir démesuré des Big Tech »", Article réservé aux abonnés ,,,,,
"A la Mostra de Venise, le documentaire dame le pion à la fiction", Article réservé aux abonnés ,,,,,
"« Droites nationalistes et homosexualités en France », de Mickaël Studnicki : de la difficulté d’être un gay d’extrême droite", Article réservé aux abonnés ,,,,,
"Avec « Highest 2 Lowest », Spike Lee dresse le portrait d’un notable afro-américain du XXIᵉ siècle", Article réservé aux abonnés ,,,,,
Les spectacles à réserver en septembre 2025, Article réservé aux abonnés ,,,,,
"« Les heures de cours sans fin, les récrés, la cantine, l’étude, les embrouilles, les devoirs, la fatigue ; mais pourquoi, sérieux, est-ce qu’il faut arriver si tôt en cours ? »", Article réservé aux abonnés ,,,,,
"Les clubs œnologiques, acteurs discrets de la culture du vin", Article réservé aux abonnés ,,,,,
Le management brutal sanctionné au sein du groupe Ducasse, Article réservé aux abonnés ,,,,,
"« Il a un côté Tom Sawyer pour sa proximité avec la nature » : Bill François, le naturaliste qui murmurait à l’oreille des silures", Article réservé aux abonnés ,,,,,
         Live  Article se déroulant en direct   Israël intensifie ses bombardements sur la ville de Gaza et affirme avoir détruit un immeuble utilisé par le Hamas  , Article réservé aux abonnés ,,"« Nous avons ouvert le cadenas des portes de l’enfer dans la ville de Gaza », a déclaré le ministre de la défense israélien, Israel Katz. Depuis l’aube, au moins 18 personnes, dont sept enfants, ont été tuées dans la ville par les frappes israéliennes.",https://www.lemonde.fr/international/live/2025/09/05/en-direct-gaza-israel-intensifie-ses-bombardements-sur-la-ville-de-gaza_6638986_3210.html,,
« Le vieillissement de la population est ce qui risque de faire exploser notre système »,Article réservé aux abonnés,https://img.lemde.fr/2025/09/04/0/0/2047/1365/398/265/75/0/4279eca_upload-1-xg9oyk4imke0-breton-2048x1365.jpg,,https://www.lemonde.fr/societe/article/2025/09/05/le-vieillissement-de-la-population-est-ce-qui-risque-de-faire-exploser-notre-systeme_6639070_3224.html,,
"Mouvement Bloquons tout : trains, aéroports, raffineries… A quels blocages s’attendre le 10 septembre ?",Article réservé aux abonnés,https://img.lemde.fr/2025/09/04/0/0/2362/1574/398/265/75/0/e91163a_upload-1-d3ojvwyf0t25-blocage.jpg,,https://www.lemonde.fr/economie/article/2025/09/05/mouvement-du-10-septembre-cheminots-raffineurs-eboueurs-repondent-en-ordre-disperse-a-l-appel-citoyen-a-tout-bloquer_6638990_3234.html,,
Attaques contre la vaccination aux Etats-Unis : Robert F. Kennedy Jr sème la confusion,Article réservé aux abonnés,https://img.lemde.fr/2025/09/05/0/0/5914/3942/398/265/75/0/1b3d49c_upload-1-tdfgphqafgpq-112359.jpg,"Après des licenciements massifs dans les principales agences américaines, le ministre de la santé a pris, cet été, plusieurs décisions menaçant l’écosystème vaccinal du pays, libérant la parole antivax.",https://www.lemonde.fr/planete/article/2025/09/05/les-attaques-de-robert-f-kennedy-jr-contre-la-vaccination-aux-etats-unis-se-multiplient-semant-la-confusion_6638980_3244.html,,
La Chine va imposer jusqu’à 60 % de droits de douane provisoires sur le porc en provenance de l’Union européenne,,https://img.lemde.fr/2025/09/05/0/0/6000/4000/398/265/75/0/c707e4b_upload-1-lzs7h2j474vm-000-47ma6kd.jpg,"L’interprofession du porc en France a déploré une « très mauvaise nouvelle », sachant que la Chine est son premier client à l’export.",https://www.lemonde.fr/economie/article/2025/09/05/la-chine-va-imposer-jusqu-a-60-de-droits-de-douane-provisoires-sur-le-porc-en-provenance-de-l-union-europeenne_6639093_3234.html,,
"La trajectoire éclair de Jean Pormanove, streameur pris dans le piège d’une popularité exploitée",Article réservé aux abonnés,https://img.lemde.fr/2025/09/04/0/0/2463/1642/398/265/75/0/6b430e3_upload-1-gzj1jeao0jz1-bestimage-00719444-000004.jpg,"Mort en direct sur la plateforme Kick, lundi 18 août, l’homme de 46 ans avait fait ses débuts en streamant le jeu vidéo « Fortnite », avant de devenir progressivement la « star » d’un spectacle humiliant.",https://www.lemonde.fr/pixels/article/2025/09/05/la-trajectoire-eclair-de-jean-pormanove-streameur-pris-dans-le-piege-mortel-d-une-popularite-exploitee_6639069_4408996.html,,
"Un ex-policier condamné à vingt-deux ans de prison pour le meurtre de sa compagne : « Je voulais qu’elle arrête de dire ces choses qui me détruisent, j’ai mis mes mains autour de son cou »",Article réservé aux abonnés,https://img.lemde.fr/2025/09/04/95/0/2144/1429/664/442/75/0/f632e8f_upload-1-lnae1vaj8yj6-severin-millet-proces-bonnefoy.jpg,"La cour d’assises de Paris a condamné, vendredi, au terme de trois jours d’audience, Arnaud Bonnefoy pour le féminicide d’Amanda Glain, en 2022.",https://www.lemonde.fr/societe/article/2025/09/05/un-ex-policier-condamne-a-vingt-deux-ans-de-prison-pour-le-meurtre-de-sa-compagne-je-voulais-qu-elle-arrete-de-dire-ces-choses-qui-me-detruisent-j-ai-mis-mes-mains-autour-de-son-cou_6639104_3224.html, Pascale Robert-Diard,Récit
"Emmanuel Macron reçoit Gérard Larcher à l’Elysée, à trois jours du vote de confiance",,https://img.lemde.fr/2024/07/11/0/0/1023/682/198/132/95/0/da7c738_1720680907310-000-329u38z-1.jpg,,https://www.lemonde.fr/politique/article/2025/09/05/emmanuel-macron-recoit-gerard-larcher-a-l-elysee-a-trois-jours-du-vote-de-confiance_6639075_823448.html,,
"Pour l’après-Bayrou, Marine Le Pen tangue entre dissolution et négociations",Article réservé aux abonnés,https://img.lemde.fr/2025/09/02/0/0/5899/3933/198/132/95/0/f86eecf_upload-1-3imqp7vjyqzm-jmug250902049.jpg,,https://www.lemonde.fr/politique/article/2025/09/05/dissolution-ineligibilite-marine-le-pen-entre-coups-de-boutoir-et-coups-de-menton_6638977_823448.html,,
"Famille royale britannique : mort à 92 ans de la duchesse de Kent, figure de Wimbledon et passionnée de musique",,https://img.lemde.fr/2025/09/05/0/0/3643/2428/198/132/95/0/6b38cc1_ftp-import-images-1-0lrfqmdhjnew-5801387-01-06.jpg,,https://www.lemonde.fr/disparitions/article/2025/09/05/famille-royale-britannique-mort-a-92-ans-de-la-duchesse-de-kent-figure-de-wimbledon-et-passionnee-de-musique_6639103_3382.html,,
La discrète disparition des Cachou Lajaunie,Article réservé aux abonnés,https://img.lemde.fr/2025/09/05/1/0/4300/2866/198/132/95/0/de8ee6a_upload-1-n1zwao1adhin-maxnewsworldfour742351.jpg,,https://www.lemonde.fr/economie/article/2025/09/05/la-discrete-disparition-des-cachou-lajaunie_6639101_3234.html,,
Vladimir Poutine garantit « la sécurité à 100 % » aux dirigeants ukrainiens en cas de rencontre à Moscou,,,,https://www.lemonde.fr/international/live/2025/09/05/en-direct-guerre-en-ukraine-dans-l-hypothese-d-une-rencontre-en-russie-vladimir-poutine-promet-aux-dirigeants-ukrainiens-une-securite-a-100_6637567_3210.html,,
Le management brutal sanctionné au sein du groupe Ducasse,Article réservé aux abonnés,,,https://www.lemonde.fr/emploi/article/2025/09/05/management-brutal-sanctionne-au-sein-du-groupe-ducasse_6639071_1698637.html,,
"Les clubs œnologiques, acteurs discrets de la culture du vin",Article réservé aux abonnés,,,https://www.lemonde.fr/le-monde-passe-a-table/article/2025/09/05/les-clubs-nologiques-acteurs-discrets-de-la-culture-du-vin_6639096_6082232.html,,Enquête
"Soudan : une « myriade » de crimes contre l’humanité commis par les paramilitaires, selon une mission de l’ONU",,,,https://www.lemonde.fr/afrique/article/2025/09/05/soudan-une-myriade-de-crimes-contre-l-humanite-commis-par-les-paramilitaires-selon-une-mission-de-l-onu_6639091_3212.html,,
Accident du funiculaire à Lisbonne : une Française est morte ; des premiers éléments sur l’accident attendus vendredi,,,,https://www.lemonde.fr/international/article/2025/09/05/accident-du-funiculaire-a-lisbonne-une-francaise-est-morte-annonce-jean-noel-barrot_6639032_3210.html,,
"Le Z Event, marathon caritatif des streameurs au modèle économique difficile à reproduire",Article réservé aux abonnés,,,https://www.lemonde.fr/pixels/article/2025/09/05/le-z-event-marathon-caritatif-des-streameurs-au-modele-economique-difficile-a-reproduire_6639088_4408996.html,,
"Une élève a obtenu le bac à 9 ans, un record selon le ministère de l’éducation",,,,https://www.lemonde.fr/bac-lycee/article/2025/09/05/une-eleve-a-obtenu-le-bac-a-9-ans-un-record-selon-le-ministere-de-l-education_6639097_4401499.html,,
"L’Europe lance Jupiter, son supercalculateur destiné à rattraper son retard dans l’IA",,,,https://www.lemonde.fr/economie/article/2025/09/05/l-europe-lance-jupiter-son-supercalculateur-destine-a-rattraper-son-retard-dans-l-ia_6639102_3234.html,,
Budget 2026 : l’imposition des très riches revient au cœur du débat politique,Article réservé aux abonnés,https://img.lemde.fr/2025/09/04/1194/0/3933/2622/664/442/75/0/6b38fc2_upload-1-d7uzojf6jcpd-jmug250904021.jpg,"La gauche tient plus que tout à instaurer la taxe Zucman. La droite n’en veut pas, mais admet qu’il y a un problème d’équité fiscale en France. Taxer les grandes fortunes redevient un sujet-clé pour le budget 2026.",https://www.lemonde.fr/politique/article/2025/09/05/budget-2026-l-imposition-des-tres-riches-revient-au-c-ur-du-debat-politique_6638982_823448.html, Denis Cosnard,Décryptage
"Au procès de l’ex-policier de la brigade de protection des mineurs accusé de viols, les larmes du collègue qui l’a démasqué",Article réservé aux abonnés,https://img.lemde.fr/2025/04/10/0/0/3000/2000/664/442/75/0/b96eb89_sirius-fs-upload-1-xbh6jmsgmu5e-1744297402352-frame-9.jpg,"Devant la cour criminelle des Bouches-du-Rhône, où un fonctionnaire est jugé pour des viols commis sur deux enfants des rues de Manille et la détention de milliers d’images pédopornographiques, le lanceur d’alerte a raconté mardi comment il s’est retrouvé « seul contre tous ».",https://www.lemonde.fr/societe/article/2025/09/03/au-proces-de-l-ex-policier-de-la-brigade-de-protection-des-mineurs-accuse-de-viols-les-larmes-du-collegue-qui-l-a-demasque_6638726_3224.html, Luc Leroux,Récit
Lutte contre le narcotrafic : la frappe américaine contre un bateau qui ne constituait pas un danger suscite une vague de réprobation,Article réservé aux abonnés,https://img.lemde.fr/2025/09/03/0/293/3165/2110/664/442/75/0/4665e31_ftp-import-images-1-ckq0atd6di6e-2025-09-03t061231z-1601255917-rc20kgauix96-rtrmadp-3-usa-trump-venezuela-pentagon.JPG,"La destruction – décidée et mise en scène par l’administration Trump – d’un bateau parti du Venezuela et transportant 11 personnes questionne la légitimité de l’opération. L’embarcation était chargée de drogue, selon les autorités américaines.",https://www.lemonde.fr/international/article/2025/09/05/la-lutte-antiterroriste-etendue-au-narcotrafic-par-l-administration-trump-controversee_6638995_3210.html, Piotr Smolar,Décryptage
Guerre en Ukraine : le travail de Sisyphe des Européens face à Donald Trump,,,,https://www.lemonde.fr/idees/article/2025/09/05/guerre-en-ukraine-le-travail-de-sisyphe-des-europeens-face-a-donald-trump_6639044_3232.html,,Éditorial
« Le combat de Trump contre le militantisme de l’art s’inscrit dans un débat féroce déjà à l’œuvre dans les musées du monde entier »,S’abonner,https://img.lemde.fr/2017/09/22/0/0/0/0/100/100/60/0/ae2f702_132.jpg,,https://www.lemonde.fr/idees/article/2025/09/05/le-combat-de-trump-contre-le-militantisme-de-l-art-s-inscrit-dans-un-debat-feroce-deja-a-l-uvre-dans-les-musees-du-monde-entier_6638985_3232.html,,Chronique
"« La France de 2025 n’est pas le Portugal de 2011, passé sous les fourches Caudines du FMI »",S’abonner,https://img.lemde.fr/2024/12/16/0/0/0/0/100/100/60/0/074862f_1734339160632-pascal-riche.jpg,,https://www.lemonde.fr/idees/article/2025/09/04/la-france-de-2025-n-est-pas-le-portugal-de-2011-passe-sous-les-fourches-caudines-du-fmi_6638846_3232.html,,Chronique
