title,image URL,premium,subhead,URL,byline,article type
La Poste suspend l’envoi de colis vers les Etats-Unis,,,,,,
Les nombreuses analogies entre les Etats-Unis de Trump et ceux des « barons voleurs » de 1890,, Article réservé aux abonnés ,,,,
"Quand la cave privée enterrée sous la voie publique s’effondre, qui est responsable ?",, Article réservé aux abonnés ,,,,
L’appel de 23 économistes à Israël pour « un arrêt immédiat de toute politique qui intensifie la famine généralisée à Gaza »,, Article réservé aux abonnés ,,,,
Pourquoi la Russie utilise tellement de drones iraniens Shahed pour attaquer l’Ukraine,, Article réservé aux abonnés ,,,,
Pourquoi tout le monde s’arrache l’Arctique ? Comprendre en trois minutes,,,,,,
La machine anti-immigration de Donald Trump s’active au cœur de New York,, Article réservé aux abonnés ,,,,
Hiroshima : comment s’est déroulé le bombardement atomique le plus dévastateur de l’histoire,, Article réservé aux abonnés ,,,,
Sud global : Trump fait le jeu de la Chine,,,,,,
"Pierre Dardot et Christian Laval, trente ans de pensée en commun",, Article réservé aux abonnés ,,,,
"Face à Donald Trump, « les anciens présidents américains ne veulent pas risquer de compromettre la fonction en parlant de façon irréfléchie »",, Article réservé aux abonnés ,,,,
"Face à Vladimir Poutine, il faut « retourner le facteur temps à l’avantage de l’Ukraine »",, Article réservé aux abonnés ,,,,
"Tahar Rahim, dans « Alpha », de Julia Ducournau : « J’avais besoin de ressentir un manque, comme les usagers de drogue »",, Article réservé aux abonnés ,,,,
"Catherine Girard, la fille de l’assassin",, Article réservé aux abonnés ,,,,
"Les replays du week-end : « Titan », « Grasse », « Jack Lang » et « Liza Minnelli »",, Article réservé aux abonnés ,,,,
"Prêt de la tapisserie de Bayeux au British Museum : l’œuvre n’est pas « intransportable », selon le chargé de mission de l’Elysée",,,,,,
"A Paris, la guinguette Plat/Form fait chavirer avec ses belles salades",, Article réservé aux abonnés ,,,,
"La fleur de rudbeckia, une fille du soleil",,,,,,
"Les nouveaux bureaux d’Acne Studios à Paris, un laboratoire de mode et d’art",, Article réservé aux abonnés ,,,,
Les tribus des pieds : ce que les claquettes-chaussettes disent de nous,, Article réservé aux abonnés ,,,,
 L’état de famine reconnu à Gaza : un revers diplomatique et judiciaire pour les autorités israéliennes  ,,Article réservé aux abonnés,"Si les réactions diplomatiques ont été peu nombreuses, la reconnaissance de la famine peut venir alimenter les procédures ouvertes devant la justice internationale pour « crime contre l’humanité » contre Benyamin Nétanyahou et Yoav Gallant, et pour « génocide » contre l’Etat d’Israël.",https://www.lemonde.fr/international/article/2025/08/23/l-etat-de-famine-reconnu-a-gaza-un-revers-diplomatique-et-judiciaire-pour-les-autorites-israeliennes_6633976_3210.html,,
"Après une attaque de Matteo Salvini, Paris convoque l’ambassadrice italienne",https://img.lemde.fr/2022/03/10/114/0/4244/2829/398/265/75/0/245220f_1646873544355-145477.jpg,Article réservé aux abonnés,,https://www.lemonde.fr/international/article/2025/08/23/apres-une-attaque-de-matteo-salvini-paris-convoque-l-ambassadrice-italienne_6633876_3210.html,,
Intelligence artificielle : les économistes s’inquiètent d’un risque de bulle financière,https://img.lemde.fr/2025/07/26/0/0/4999/3333/398/265/75/0/5c67251_ftp-import-images-1-o7e8qtvn51ka-2025-07-26t024135z-795872368-rc2gx1aqamo6-rtrmadp-3-china-ai-expo.JPG,Article réservé aux abonnés,,https://www.lemonde.fr/economie/article/2025/08/23/intelligence-artificielle-les-economistes-s-inquietent-d-un-risque-de-bulle-financiere_6634010_3234.html,,
"Dans l’Ukraine occupée, des enfants en appellent au Kremlin : « Tonton Poutine, donnez-nous l’accès à l’eau ! »",https://img.lemde.fr/2025/08/22/0/7/4983/3322/398/265/75/0/be55e08_ftp-import-images-1-eijeeoy5lgul-2025-08-22t141116z-1091884078-rc2rbgad42ux-rtrmadp-3-ukraine-crisis-donetsk.JPG,Article réservé aux abonnés,"A Donetsk et dans une partie du Donbass occupé par la Russie depuis 2014, les habitants souffrent d’une pénurie menaçant de dégénérer en catastrophe humanitaire.",https://www.lemonde.fr/international/article/2025/08/23/dans-l-ukraine-occupee-des-enfants-en-appellent-au-kremlin-tonton-poutine-donnez-nous-l-acces-a-l-eau_6633699_3210.html,,
"A Radio France, les syndicats appellent à une grève illimitée à partir de lundi",https://img.lemde.fr/2025/08/23/1/0/7488/4992/398/265/75/0/a03dced_upload-1-2chi28hhbrfp-000-666m28g.jpg,,"Les syndicats rejettent plusieurs réformes voulues par la patronne du groupe, Sibyle Veil. Parmi elles, l’arrêt de la radio Le Mouv’ sur la FM, des changements éditoriaux au sein du réseau des radios locales publiques et l’arrêt d’émissions d’investigation et de reportage.",https://www.lemonde.fr/actualite-medias/article/2025/08/23/a-radio-france-les-syndicats-appellent-a-une-greve-illimitee-a-partir-de-lundi_6633977_3236.html,,
Les jeux que l’on a préférés à Gamescom 2025 (et qui ne sont pas « Hollow Knight »),https://img.lemde.fr/2025/08/22/137/133/1415/943/398/265/75/0/291de91_upload-1-pylsqnl8cklr-ss-b4c140dc61db50a5a5e736c9be17f5d774765826-1920x1080.jpg,Article réservé aux abonnés,"« Kirby Air Riders », « Routine », « Lego Batman »… « Le Monde » a sélectionné huit titres découverts ou essayés lors du salon du jeu vidéo de Cologne en Allemagne.",https://www.lemonde.fr/pixels/article/2025/08/23/les-jeux-que-l-on-a-preferes-a-gamescom-2025-et-qui-ne-sont-pas-hollow-knight_6634047_4408996.html,,
Petites manies de nuit : « Je plonge et enroule mon corps nu dans mes draps »,https://img.lemde.fr/2025/08/13/0/6/2469/1646/664/442/75/0/8c0e977_upload-1-wmbc4bq6klwv-lemonde-seriesommeil-rituels-juleslebarazer-def.jpg,Article réservé aux abonnés,"« Comment dormez-vous ? » (6/6). Avec un doudou, en tenue d’Eve, le pied qui dépasse du lit, dans l’obscurité… A partir de 200 témoignages, voici une liste non exhaustive de nos rituels du sommeil, chacun inventant son théâtre nocturne.",https://www.lemonde.fr/series-d-ete/article/2025/08/23/petites-manies-de-nuit-je-plonge-et-enroule-mon-corps-nu-dans-mes-draps_6633698_3451060.html, Charlotte Herzog,Témoignages
Le chef du renseignement militaire américain limogé après un rapport sur les frappes en Iran,https://img.lemde.fr/2025/08/22/0/0/8104/5403/198/132/95/0/8fa4d06_ftp-import-images-1-vjflhmeuqfqc-5691850-01-06.jpg,,,https://www.lemonde.fr/international/article/2025/08/23/jeffrey-kruse-le-chef-du-renseignement-militaire-americain-limoge-apres-un-rapport-sur-les-frappes-en-iran_6633560_3210.html,,
"En Bosnie, un référendum sera organisé le 25 octobre sur la condamnation de Milorad Dodik, chef des Serbes",https://img.lemde.fr/2025/08/06/1/0/6000/4000/198/132/95/0/167884a_ftp-import-images-1-2w9ylbsqwhzz-2025-08-06t111427z-233637000-rc2t1da352tk-rtrmadp-3-bosnia-dodik-mandate.JPG,,,https://www.lemonde.fr/international/article/2025/08/23/en-bosnie-un-referendum-sera-organise-le-25-octobre-sur-la-condamnation-de-milorad-dodik-chef-des-serbes_6634046_3210.html,,
Le Texas adopte une nouvelle carte électorale favorable aux républicains et voulue par Donald Trump,https://img.lemde.fr/2025/08/22/0/0/8640/5760/198/132/95/0/794030c_ftp-import-images-1-musecac2agdg-1597160e8f25461e914ae7f25cc345cf-0-a985fa2cce074e0e8c45eb5e42780f93.jpg,,,https://www.lemonde.fr/international/article/2025/08/23/le-texas-adopte-une-nouvelle-carte-electorale-favorable-aux-republicains-et-voulue-par-donald-trump_6633807_3210.html,,
"Tahar Rahim, dans « Alpha », de Julia Ducournau : « J’avais besoin de ressentir un manque, comme les usagers de drogue »",https://img.lemde.fr/2025/08/18/0/1423/2574/1716/198/132/95/0/08ae73f_upload-1-sjumlffbjl87-alpha-photo-5-mandarin-compagnie-kallouche-cinema-frakas-productions-france-3-cinema-2.jpg,Article réservé aux abonnés,,https://www.lemonde.fr/culture/article/2025/08/23/tahar-rahim-dans-alpha-de-julia-ducournau-j-avais-besoin-de-ressentir-un-manque-comme-les-usagers-de-drogue_6633874_3246.html,,
Guerre en Ukraine : le point sur la situation,,,,https://www.lemonde.fr/international/live/2025/08/23/en-direct-guerre-en-ukraine-le-point-sur-la-situation_6630797_3210.html,,
"Incendies en Espagne : « le pire est passé », selon la protection civile, mais « il faut faire un dernier effort pour mettre fin à cette terrible situation »",,,,https://www.lemonde.fr/international/article/2025/08/23/incendies-en-espagne-le-pire-est-passe-selon-la-protection-civile-mais-il-faut-faire-un-dernier-effort-pour-mettre-fin-a-cette-terrible-situation_6634048_3210.html,,
Les frères Menendez vont rester en prison après le rejet de leur demande de libération conditionnelle,,,,https://www.lemonde.fr/international/article/2025/08/23/les-freres-menendez-vont-rester-en-prison-apres-le-rejet-de-la-demande-de-liberation-du-deuxieme-frere-lyle_6633706_3210.html,,
"En Colombie, le père de Miguel Uribe, assassiné en juin, le remplacera comme candidat à la primaire pour la présidentielle de 2026",,,,https://www.lemonde.fr/international/article/2025/08/23/en-colombie-le-pere-de-miguel-uribe-assassine-en-juin-le-remplacera-comme-candidat-a-la-primaire-pour-la-presidentielle-de-2026_6633841_3210.html,,
"« Il est temps de lever le voile sur la question démographique, non pour céder au catastrophisme, mais pour bâtir des réponses adaptées »",,Article réservé aux abonnés,,https://www.lemonde.fr/idees/article/2025/08/22/il-est-temps-de-lever-le-voile-sur-la-question-demographique-non-pour-ceder-au-catastrophisme-mais-pour-batir-des-reponses-adaptees_6633449_3232.html,,Tribune
Coupe du monde féminine de rugby : le XV de France entre en lice avec une « ambition de titre »,,Article réservé aux abonnés,,https://www.lemonde.fr/sport/article/2025/08/23/coupe-du-monde-feminine-de-rugby-le-xv-de-france-entre-en-lice-en-angleterre-avec-une-ambition-de-titre_6633909_3242.html,,
"A Cherbourg, les mondes oniriques et inquiétants de l’auteur de bande dessinée Brecht Evens",,Article réservé aux abonnés,,https://www.lemonde.fr/culture/article/2025/08/23/a-cherbourg-les-mondes-oniriques-et-inquietants-de-l-auteur-de-bande-dessinee-brecht-evens_6633975_3246.html,,
"Que faire, que voir, où aller ? L’agenda culturel et art de vivre en France à partir du 23 août",,Article réservé aux abonnés,,https://www.lemonde.fr/m-styles/article/2025/08/22/que-faire-que-voir-ou-aller-l-agenda-culturel-et-art-de-vivre-en-france-a-partir-du-23-aout_6633541_4497319.html,,
"Gaza : alors que l’ONU déclare l’état de famine, Israël dénonce l’orchestration d’une campagne antisémite",https://img.lemde.fr/2025/08/22/0/0/6000/4000/664/442/75/0/dd90634_upload-1-ysbo3iw1codg-572889.jpg,Article réservé aux abonnés,"Rendu public vendredi, un rapport confirme une crise alimentaire majeure avec plus de 500 000 Gazaouis déjà confrontés à la famine. Cette situation découle de longues périodes de blocus. Le gouvernement israélien conteste ces accusations, que Benyamin Nétanyahou renvoie à des préjugés antisémites.",https://www.lemonde.fr/international/article/2025/08/23/une-legende-de-sang-comment-benyamin-netanyahou-utilise-l-histoire-de-l-antisemitisme-pour-contrer-les-accusations-de-famine-a-gaza_6633704_3210.html, Luc Bronner,Décryptage
"Les nuits avec mon ennemie insomnie : « J’ai juste la sensation d’être allongée, mais je ne pars pas »",https://img.lemde.fr/2025/08/13/0/6/2469/1646/664/442/75/0/8782083_upload-1-gvcwiijoyu4j-lemonde-seriesommeil-obsession-jules-le-barazer-def.jpg,Article réservé aux abonnés,"« Comment dormez-vous ? » (5/6). Alors que quatre Français sur dix assurent mal dormir, certains ont le sentiment de ne jamais tomber dans les bras de Morphée, malgré tous les artifices qu’ils utilisent.",https://www.lemonde.fr/series-d-ete/article/2025/08/22/les-nuits-avec-mon-ennemie-insomnie-j-ai-juste-la-sensation-d-etre-allongee-mais-je-ne-pars-pas_6633456_3451060.html, Maroussia Dubreuil,Enquête
"La carrière déconcertante d’Isabelle Adjani, entre coups d’éclat et éclipses",https://img.lemde.fr/2025/08/20/96/179/4010/2673/664/442/75/0/8d97354_upload-1-xrcunwx6l841-journee-de-la-jupe-2008-01.jpg,Article réservé aux abonnés,"« Isabelle Adjani, célèbre inconnue » (6/6). Depuis le succès de « L’Eté meurtrier », en 1983, l’actrice ne cesse d’alterner entre activité intense et pauses. Sa carrière s’en trouve peu lisible, mais son génie du jeu est porté par une palette très riche.",https://www.lemonde.fr/series-d-ete/article/2025/08/22/la-carriere-deconcertante-d-isabelle-adjani-entre-coups-d-eclat-et-eclipses_6633531_3451060.html, Samuel Blumenfeld,Récit
Sud global : Trump fait le jeu de la Chine,,,,https://www.lemonde.fr/idees/article/2025/08/23/sud-global-trump-fait-le-jeu-de-la-chine_6634045_3232.html,,Éditorial
Tous ces livres qu’on accumule et qu’on ne lira jamais : « J’ai fini par comprendre que c’est moins un fardeau qu’une forme de richesse »,,S’abonner,,https://www.lemonde.fr/series-d-ete/article/2025/08/22/tous-ces-livres-qu-on-accumule-et-qu-on-ne-lira-jamais-j-ai-fini-par-comprendre-que-c-est-moins-un-fardeau-qu-une-forme-de-richesse_6633307_3451060.html,,Récit
"Pierre Dardot et Christian Laval, trente ans de pensée en commun",,S’abonner,,https://www.lemonde.fr/idees/article/2025/08/22/pierre-dardot-et-christian-laval-trente-ans-de-pensee-en-commun_6633450_3232.html,,Portrait
