title,subhead,URL,premium,image URL,byline,article type
 How investigators track the causes of wildfires: 'A snail shell and a stone are valuable clues'  ,"Firefighters, police and forest agents are searching for the ignition point of the major fire in southwestern France, much as they would at a crime scene.",https://www.lemonde.fr/en/environment/article/2026/07/13/how-investigators-track-the-cause-of-wildfires-a-snail-shell-and-a-stone-are-valuable-clues_6755430_114.html,Subscribers only,,,
Major fire rages in Fontainebleau forest near Paris,,https://www.lemonde.fr/en/environment/article/2026/07/13/major-fire-rages-in-fontainebleau-forest-near-paris_6755419_114.html,,,,
"Macron and the military: 10 years made of mistrust, hope, and budget hikes",,https://www.lemonde.fr/en/politics/article/2026/07/13/macron-and-the-military-10-years-made-of-mistrust-hope-and-budget-hikes_6755429_5.html,Subscribers only,,,
France sanctions Russian elite cyberespionage unit 'Turla',France accused Russia's Federal Security Service (FSB) of a series of cyberattacks targeting French ministries and a research institute working on sensitive subjects. The Russian ambassador to France will be summoned in the coming days.,https://www.lemonde.fr/en/pixels/article/2026/07/13/france-sanctions-russian-elite-cyberespionage-unit-turla_6755432_13.html,Subscribers only,,,
'It would have been enough to learn the terrible lessons from Gaza to anticipate the current impasse over Iran',The deals that US President Donald Trump so readily boasts about seemed destined to get bogged down in the Middle East right from the start.,https://www.lemonde.fr/en/international/article/2026/07/12/it-would-have-been-enough-to-learn-the-terrible-lessons-from-gaza-to-anticipate-the-current-impasse-over-iran_6755416_4.html,Subscribers only,,,
"'I would do a line before service, hidden in the bathroom': How cocaine is flooding the restaurant industry","Cocaine at work (2/3). From fast-food joints to Michelin-starred restaurants, drug use has become as commonplace as it is alarming in an industry driven by the pursuit of performance, a toxic party culture and grueling working conditions.",https://www.lemonde.fr/en/campus/article/2026/07/12/i-would-do-a-line-before-service-hidden-in-the-bathroom-how-cocaine-is-flooding-the-restaurant-industry_6755405_11.html,Subscribers only,,,
"'Thank you, dear Hungary, for proving that anything is always possible'","Jean-Baptiste Chastand, Le Monde's Central Europe correspondent, writes a letter to this 'hostile and surprising' country he has covered for more than 10 years.",https://www.lemonde.fr/en/international/article/2026/07/13/thank-you-dear-hungary-for-proving-that-anything-is-always-possible_6755431_4.html,Subscribers only,, Jean-Baptiste Chastand,Letter from...
"Ukraine's allies gather in Paris to rally support, pile pressure on Russia",,https://www.lemonde.fr/en/international/article/2026/07/13/ukraine-s-allies-gather-in-paris-to-rally-support-pile-pressure-on-russia_6755424_4.html,,,,
"Emmanuel Grégoire, an omnipresent Paris mayor with a centralized governance",,https://www.lemonde.fr/en/politics/article/2026/07/13/emmanuel-gregoire-an-omnipresent-paris-mayor-with-a-centralized-governance_6755421_5.html,Subscribers only,,,
US and Iran continue strikes as Gulf states targeted in flare-up over Hormuz,,https://www.lemonde.fr/en/international/article/2026/07/12/iran-announces-closure-of-the-strait-of-hormuz-until-further-notice_6755387_4.html,,,,
"French heatwave drives up water consumption, puts supply networks under severe strain",,https://www.lemonde.fr/en/environment/article/2026/07/13/french-heatwave-drives-up-water-consumption-puts-supply-networks-under-severe-strain_6755418_114.html,Subscribers only,,,
Alfred Dreyfus statue finally finds place in heart of Paris,,https://www.lemonde.fr/en/politics/article/2026/07/12/alfred-dreyfus-statue-finally-finds-place-in-heart-of-paris_6755409_5.html,Subscribers only,,,
South Korea's Yoon sentenced to two years over illegal opinion polls scheme,,https://www.lemonde.fr/en/international/article/2026/07/13/south-korea-s-yoon-sentenced-to-two-years-over-illegal-opinion-polls-scheme_6755428_4.html,,,,
UK announces £250 million in funding to protect Jewish community after spate of anti-semitic attacks,,https://www.lemonde.fr/en/international/article/2026/07/13/uk-announces-250-million-in-funding-to-protect-jewish-community-after-spate-of-anti-semitic-attacks_6755422_4.html,,,,
Why heatwaves disrupt our sleep – and how we can protect it,,https://www.lemonde.fr/en/science/article/2026/07/11/why-heatwaves-disrupt-our-sleep-and-how-we-can-protect-it_6755384_10.html,Subscribers only,,,
"Lindsey Graham, Republican hawk who became staunch Trump loyalist, has died",,https://www.lemonde.fr/en/obituaries/article/2026/07/12/lindsey-graham-republican-hawk-who-became-staunch-trump-loyalist-has-died_6755397_15.html,Subscribers only,,,
French women's baseballers 'not going to give up' after national team is shut down,,https://www.lemonde.fr/en/france/article/2026/07/12/french-women-s-baseballers-not-going-to-give-up-after-national-team-is-shut-down_6755410_7.html,Subscribers only,,,
Record-breaking heat wave hits western US,,https://www.lemonde.fr/en/international/article/2026/07/13/record-breaking-heat-wave-hits-western-us_6755423_4.html,,,,
Spanish PM Sanchez condemns predecessor's racist remarks on French football team,,https://www.lemonde.fr/en/international/article/2026/07/12/spanish-pm-sanchez-condemns-predecessor-s-racist-remarks-on-french-football-team_6755407_4.html,,,,
'We were meant to take as many jewels as we could': The confessions of two Louvre burglars,"After months of silence, two men suspected of stealing the royal jewels described their involvement in detail during new interrogations in June. According to their statements, they were hired to carry out the heist for '€15,000 to €25,000.'",https://www.lemonde.fr/en/france/article/2026/07/12/we-were-meant-to-take-as-many-jewels-as-we-could-the-confessions-of-two-louvre-burglars_6755398_7.html,Subscribers only,, Jérémie Pham-Lê and  Lucie Soullier,In Depth
Is air conditioning good or bad? Join this (fake) group chat for (real) analysis,"Each time a new heatwave hits, the question of air conditioning and its environmental impacts crops up in the public debate. Here are the key points to help you understand what is at stake.",https://www.lemonde.fr/en/les-decodeurs/article/2026/07/10/is-air-conditioning-good-or-bad-join-this-fake-group-chat-for-real-analysis_6755351_8.html,Subscribers only,, Lara Pino Lerro and  Romain Imbach,Explainer
"'If they catch me, it's over for me': Senegal's LGBTQ+ community lives in daily fear of repression","In March, Senegal passed a law increasing penalties for same-sex relations, leaving LGBTQ+ people living in fear. Several described their deeply uncertain daily lives, gripped by the constant anxiety of being arrested.",https://www.lemonde.fr/en/international/article/2026/07/12/if-they-catch-me-it-s-over-for-me-senegal-s-lgbtq-community-lives-in-daily-fear-of-repression_6755411_4.html,Subscribers only,, Coumba Kane,Long Read
French MPs' vote to establish presumption of legitimate defense for police sets dangerous precedent,,https://www.lemonde.fr/en/opinion/article/2026/07/12/french-mps-vote-to-establish-presumption-of-legitimate-defense-for-police-sets-dangerous-precedent_6755413_23.html,,,,Editorial
Le Pen's presidential bid 'is the ultimate symbol of the erosion of public ethics',,https://www.lemonde.fr/en/opinion/article/2026/07/09/le-pen-s-presidential-bid-is-the-ultimate-symbol-of-the-erosion-of-public-ethics_6755311_23.html,Subscribe,,,Op-Ed
"'Diverse France, that of Kylian Mbappé and the national team, is too promising a reality to be used as an electoral punching bag'",,https://www.lemonde.fr/en/opinion/article/2026/07/05/diverse-france-that-of-kylian-mbappe-and-the-national-team-is-too-promising-a-reality-to-be-used-as-an-electoral-punching-bag_6755175_23.html,Subscribe,,,Column
