title,premium,image URL,subhead,URL,article type,byline
"Industrie : face aux difficultés d’ArcelorMittal, la nationalisation fait son retour dans le débat", Article réservé aux abonnés ,,,,,
"Larry Ellison, le retour du flambeur de la Silicon Valley", Article réservé aux abonnés ,,,,,
Matières premières : « La RDC bloque le cobalt », Article réservé aux abonnés ,,,,,
"ZFE : « Limiter l’accès aux centres-villes sans solutions alternatives, c’était méconnaître l’histoire de nos banlieues »", Article réservé aux abonnés ,,,,,
Des témoins racontent l’enfer des camps secrets du Groupe Wagner au Mali, Article réservé aux abonnés ,,,,,
L’attaque d’Israël en Iran pose les bases d’une ère d’incertitude au Moyen-Orient, Article réservé aux abonnés ,,,,,
Gaza : enquête sur une distribution alimentaire qui a tourné à la fusillade contre des civils, Article réservé aux abonnés ,,,,,
Tour de France : le responsable du parcours vous explique comment l’édition 2025 a été tracée pour créer du suspense, Article réservé aux abonnés ,,,,,
"En Iran, l’ignoble diplomatie des otages",,,,,,
"Aux racines de la liberté académique, rempart contre l’arbitraire et fragile pilier des démocraties libérales", Article réservé aux abonnés ,,,,,
« Les compagnies aériennes en ont assez de rejouer chaque été “vols au-dessus d’un nid de grévistes” », Article réservé aux abonnés ,,,,,
"ZFE : « Limiter l’accès aux centres-villes sans solutions alternatives, c’était méconnaître l’histoire de nos banlieues »", Article réservé aux abonnés ,,,,,
Scènes de la vie culinaire : tour de table de la grande et de la petite bouffe au cinéma, Article réservé aux abonnés ,,,,,
"Trois livres de poche à emporter en vacances : Maurice Pons, Mark Twain, Arthur Conan Doyle", Article réservé aux abonnés ,,,,,
A voir ce soir : le documentaire « En route ! » sur france.tv, Article réservé aux abonnés ,,,,,
Thomas Jolly : « On est toujours renvoyé à d’où on vient », Article réservé aux abonnés ,,,,,
"Michael Pollan, essayiste : « Ce qui a changé, c’est que les personnes se posent la question de la provenance de la nourriture »", Article réservé aux abonnés ,,,,,
Scènes de la vie culinaire : tour de table de la grande et de la petite bouffe au cinéma, Article réservé aux abonnés ,,,,,
"Michel Chapoutier, vigneron : « Il faut arrêter avec le snobisme »",,,,,,
"Claire Touzard : « Dans la “folie”, il y a aussi une résistance aux normes »", Article réservé aux abonnés ,,,,,
" Tour de France 2025 : Jasper Philipsen, premier maillot jaune d’une Grande Boucle déjà sous tension  ",Article réservé aux abonnés,,"Le sprinteur belge s’est imposé, samedi à Lille, endossant le maillot jaune pour la première fois de sa carrière. Le champion olympique Remco Evenepoel, piégé dans le final, a perdu 39 secondes sur ses rivaux Tadej Pogacar et Jonas Vingegaard.",https://www.lemonde.fr/sport/article/2025/07/05/tour-de-france-2025-jasper-philipsen-premier-maillot-jaune-d-une-grande-boucle-deja-sous-tension_6618974_3242.html,,
"« C’est réel, on se baigne enfin dans la Seine » : les premiers plongeons des Parisiens",Article réservé aux abonnés,https://img.lemde.fr/2025/07/05/0/3/3000/2000/398/265/75/0/5d1c5f1_upload-1-tucleurrflok-baignade-dans-la-seine-219-dsc0169.jpg,,https://www.lemonde.fr/planete/article/2025/07/05/c-est-reel-on-se-baigne-enfin-dans-la-seine-les-premiers-plongeons-des-parisiens_6618863_3244.html,,
"Autoroute A69 : dans le Tarn, opposants et forces de l’ordre échangent jets de pierres et grenades lacrymogènes",,https://img.lemde.fr/2025/07/05/0/0/4528/3019/398/265/75/0/825ecb2_ftp-import-images-1-cmk182usvo2v-5334496-01-06.jpg,,https://www.lemonde.fr/planete/article/2025/07/05/a69-entre-toulouse-et-castres-malgre-l-interdiction-environ-800-personnes-rassemblees-dans-le-tarn_6618708_3244.html,,
Alger en quête du moment favorable pour la grâce de Boualem Sansal,Article réservé aux abonnés,https://img.lemde.fr/2025/07/05/0/0/6895/4596/398/265/75/0/c1794a3_upload-1-3t2zxx3dtdkw-000-46gm6a6.jpg,"Le calendrier de politique intérieure, plus que la relation avec Paris, a pesé dans l’exclusion de l’écrivain franco-algérien de la clémence collective décidée par le président Tebboune lors de la Fête de l’indépendance du 5 juillet, décrypte notre journaliste Frédéric Bobin.",https://www.lemonde.fr/afrique/article/2025/07/05/alger-en-quete-du-moment-favorable-pour-la-grace-de-boualem-sansal_6618866_3212.html,Analyse,
Gabriel Attal annonce vouloir « proposer un chemin » aux Français pour l’élection présidentielle de 2027,,https://img.lemde.fr/2025/04/06/1/0/5500/3666/398/265/75/0/339cac0_sirius-fs-upload-1-gb5wr90wpqsj-1743960048978-617170.jpg,"« Je fais devant vous le serment de tout faire pour vous conduire dans deux ans sur le chemin de la victoire », a déclaré le secrétaire général du parti Renaissance lors d’un meeting à Paris réunissant des figures de la Macronie. Invité surprise de ce rassemblement, Emmanuel Macron a de son côté appelé son camp à rester « uni » et ne pas être obnubilé par 2027.",https://www.lemonde.fr/politique/article/2025/07/05/gabriel-attal-annonce-vouloir-proposer-un-chemin-aux-francais-pour-l-election-presidentielle-de-2027_6618673_823449.html,,
EN DIRECT | France-Angleterre : les Bleues mènent et dominent les championnes d’Europe,,https://img.lemde.fr/2025/07/05/0/0/6000/4000/398/265/75/0/e26f245_ftp-import-images-1-p3nsmdx3ya6t-d760cfa6d67b4d7da51add03adb8f23b-0-2aaaf39eb86f4017b7b212eb60cc9153.jpg,"Marie-Antoinette Katoto, Selma Bacha et le reste des troupes bleues affrontent les Lionesses samedi, à Zurich, pour leur premier match de la phase de groupes. Toujours à la recherche d’un titre, les Françaises auront fort à faire face aux tenantes du titre.",https://www.lemonde.fr/sport/live/2025/07/05/en-direct-france-angleterre-suivez-l-euro-2025-feminin-de-football_6618872_3242.html,,
Thomas Jolly : « On est toujours renvoyé à d’où on vient »,Article réservé aux abonnés,https://img.lemde.fr/2025/07/02/992/0/3984/2656/664/442/75/0/43859fc_upload-1-f74vfdpbpkhv-abacaportraits-936572-020.jpg,"« Je ne serais pas arrivé là si… » Chaque semaine, « Le Monde » interroge une personnalité sur un moment décisif de son existence. Le metteur en scène revient sur le soutien inconditionnel de sa famille.",https://www.lemonde.fr/culture/article/2025/07/05/thomas-jolly-on-est-toujours-renvoye-a-d-ou-on-vient_6618869_3246.html,Entretien, Sandrine Blanchard
"Incendies : dans l’Hérault, l’autoroute A9 rouverte mais le feu est « toujours en cours » ; 400 hectares de végétation parcourus par le feu dans l’Aude",,https://img.lemde.fr/2025/07/05/0/306/873/582/198/132/95/0/3efd3eb_upload-1-ts5cyu1wilhb-capture-da-ei-cran-2025-07-05-ai-17-28-17.png,,https://www.lemonde.fr/planete/article/2025/07/05/dans-les-bouches-du-rhone-le-premier-incendie-d-ampleur-de-la-saison-a-parcouru-100-hectares-avant-d-etre-stabilise_6618619_3245.html,,
"PSG-Bayern Munich : malmené par le Bayern Munich, Paris s’en remet à Dembélé et Doué et se hisse dans le dernier carré de la Coupe du monde des clubs",,https://img.lemde.fr/2025/07/05/0/48/4462/2975/198/132/95/0/e1801d2_ftp-import-images-1-uxjwkhyizrwl-5337968-01-06.jpg,,https://www.lemonde.fr/sport/live/2025/07/05/en-direct-psg-bayern-munich-suivez-le-quart-de-finale-de-la-coupe-du-monde-des-clubs_6618824_3242.html,,
"Sous l’influence du porno, la strangulation érotique se banalise, malgré ses dangers",Article réservé aux abonnés,https://img.lemde.fr/2025/06/03/683/0/2202/1468/198/132/95/0/9215934_sirius-fs-upload-1-sagq1bt53elj-1748956616305-tom-de-pekin-strangulation-ei-rotique.jpg,,https://www.lemonde.fr/m-perso/article/2025/07/05/sous-l-influence-du-porno-la-strangulation-erotique-se-banalise-malgre-ses-dangers-ce-qui-rend-cette-pratique-si-excitante-c-est-son-caractere-transgressif_6618459_4497916.html,Enquête,
Pierre et Gilles électrisent la communauté gay de Mexico avec leur exposition,Article réservé aux abonnés,https://img.lemde.fr/2025/07/01/0/0/4160/2773/198/132/95/0/dfa95fc_upload-1-km3bnuf4qhpf-13-inauguracioi-n9.jpeg,,https://www.lemonde.fr/culture/article/2025/07/05/pierre-et-gilles-electrisent-la-communaute-gay-de-mexico-avec-leur-exposition_6618822_3246.html,,
L’archevêque français Thibault Verny nommé à la tête de la Commission pontificale pour la protection des mineurs par le pape Léon XIV,,,,https://www.lemonde.fr/religions/article/2025/07/05/l-archeveque-francais-thibault-verny-nomme-a-la-tete-de-la-commission-pontificale-pour-la-protection-des-mineurs-par-le-pape-leon-xiv_6618941_1653130.html,,
"« Qu’est-ce qui explique la haine de l’écologie, qui sert de ciment en Europe et ailleurs ? »",Article réservé aux abonnés,,,https://www.lemonde.fr/idees/article/2025/07/05/dominique-meda-qu-est-ce-qui-explique-la-haine-de-l-ecologie-qui-sert-de-ciment-en-europe-et-ailleurs_6618468_3232.html,Chronique,
"En direct : l’armée ukrainienne fait état de nouvelles offensives russes en direction de Kharkiv, dans le nord-est du pays",,,,https://www.lemonde.fr/international/live/2025/07/05/en-direct-guerre-en-ukraine-l-armee-ukrainienne-fait-etat-de-nouvelles-offensives-russes-en-direction-de-kharkiv-dans-le-nord-est-du-pays_6616331_3210.html,,
Marche des fiertés à Londres : des centaines de milliers de personnes se mobilisent pour défendre les droits des personnes transgenres,,,,https://www.lemonde.fr/international/article/2025/07/05/a-londres-des-centaines-de-milliers-de-personnes-se-mobilisent-pour-les-droits-des-personnes-transgenres-a-l-occasion-de-la-gay-pride_6618975_3210.html,,
"Au moins 27 morts dans des inondations au Texas, où de nouvelles précipitations sont attendues",,,,https://www.lemonde.fr/planete/article/2025/07/05/etats-unis-au-moins-27-morts-dans-des-inondations-au-texas-ou-de-nouvelles-precipitations-sont-attendues_6618288_3245.html,,
"Au salon Japan Expo, le manga de romance selon Oreco Tachibana",Article réservé aux abonnés,,,https://www.lemonde.fr/culture/article/2025/07/05/au-salon-japan-expo-le-manga-de-romance-selon-oreco-tachibana_6618871_3246.html,,
"Julian McMahon, star des séries « Nip/Tuck » et « Charmed », est mort",,,,https://www.lemonde.fr/disparitions/article/2025/07/05/julian-mcmahon-star-des-series-nip-tuck-et-charmed-est-mort_6618820_3382.html,,
Gaza : la défense civile fait état de 35 morts dans des raids et tirs israéliens ; le Hamas se dit prêt à « engager immédiatement » des négociations,,,,https://www.lemonde.fr/international/article/2025/07/05/gaza-la-defense-civile-fait-etat-de-20-morts-dans-des-operations-israeliennes-le-hamas-se-dit-pret-a-engager-immediatement-des-negociations_6618742_3210.html,,
« Le Monde » et la photographie : l’essor décisif de l’image,Article réservé aux abonnés,https://img.lemde.fr/2025/06/28/0/110/5229/3486/664/442/75/0/5f89669_upload-1-aa62ij60cwxg-48-49.jpg,"Longtemps marginalisée, la photographie a mis plusieurs décennies à s’imposer comme un média à part entière dans les colonnes du « Monde ». Une lente conquête marquée par des résistances internes et de profondes mutations, notamment liées au développement d’Internet.",https://www.lemonde.fr/actualite-medias/article/2025/07/05/le-monde-et-la-photographie-l-essor-decisif-de-l-image_6618476_3236.html,Histoire, Michel Guerrin
"Johanna Barasz : « La crise de recrutement des enseignants est désormais structurelle, et on n’entrevoit pas de perspective de résolution mécanique »",Article réservé aux abonnés,https://img.lemde.fr/2025/07/05/0/338/1430/953/664/442/75/0/5d6379f_upload-1-namiim1fytmb-capture-da-ei-cran-2025-07-04-ai-17-13-01.png,"Alors que les concours sont une fois encore déficitaires, Johanna Barasz, autrice d’une enquête sur l’attractivité du métier d’enseignant pour le Haut-Commissariat à la stratégie et au plan, décrypte les ressorts d’une crise du recrutement, mais aussi de la fidélisation des enseignants.",https://www.lemonde.fr/societe/article/2025/07/05/johanna-barasz-la-crise-de-recrutement-des-enseignants-est-desormais-structurelle-et-on-n-entrevoit-pas-de-perspective-de-resolution-mecanique_6618467_3224.html,Entretien, Eléa Pommiers
"« Non, grand-mère n’était pas folle » : la quête de vérité sur les aïeules internées de force en psychiatrie",Article réservé aux abonnés,https://img.lemde.fr/2025/07/02/57/0/3543/2362/664/442/75/0/7585f45_upload-1-bodjrflbppu0-p-235-ori.jpg,"Plus dérangeantes que dérangées, souvent polytraumatisées, des milliers de femmes ont été internées au sein des « asiles d’aliénés » dans les années 1940, 1950 et 1960. Aujourd’hui, certains de leurs descendants entament un travail de réhabilitation de leur mémoire et mettent au jour le caractère abusif et misogyne de l’enfermement.",https://www.lemonde.fr/m-perso/article/2025/07/05/non-grand-mere-n-etait-pas-folle-la-quete-de-verite-sur-les-aieules-internees-de-force-en-psychiatrie_6618462_4497916.html,Enquête, Victoire Radenne
"En Iran, l’ignoble diplomatie des otages",,,,https://www.lemonde.fr/idees/article/2025/07/05/en-iran-l-ignoble-diplomatie-des-otages_6618666_3232.html,Éditorial,
"Francis Dupuis-Déri, politiste : « Les “incels” forment l’une des communautés très actives du mouvement masculiniste aujourd’hui »",S’abonner,,,https://www.lemonde.fr/idees/article/2025/07/05/francis-dupuis-deri-politiste-les-incels-forment-l-une-des-communautes-tres-actives-du-mouvement-masculiniste-aujourd-hui_6618471_3232.html,Entretien,
« Le projet de réforme de l’audiovisuel public cache une bataille culturelle dont France Inter est la principale cible »,S’abonner,https://img.lemde.fr/2017/09/22/0/0/0/0/100/100/60/0/ae2f702_132.jpg,,https://www.lemonde.fr/idees/article/2025/07/04/le-projet-de-reforme-de-l-audiovisuel-public-cache-une-bataille-culturelle-dont-france-inter-est-la-principale-cible_6617860_3232.html,Chronique,
