title,premium,image URL,subhead,URL,byline,article type
Le patron de BlackRock prend la tête du Forum de Davos, Article réservé aux abonnés ,,,,,
Les nombreuses analogies entre les Etats-Unis de Trump et ceux des « barons voleurs » de 1890, Article réservé aux abonnés ,,,,,
Fonctionnement « aléatoire » de l’alarme d’une piscine privée : quelle indemnisation de l’accident ?, Article réservé aux abonnés ,,,,,
Budget 2026 : « La vraie question n’est pas “combien de dette ?” mais “pour quoi faire ?” », Article réservé aux abonnés ,,,,,
"En Russie, des jeunes femmes africaines contraintes de fabriquer des drones de combat", Article réservé aux abonnés ,,,,,
Pourquoi la Russie utilise tellement de drones iraniens Shahed pour attaquer l’Ukraine, Article réservé aux abonnés ,,,,,
Pourquoi tout le monde s’arrache l’Arctique ? Comprendre en trois minutes,,,,,,
Hiroshima : comment s’est déroulé le bombardement atomique le plus dévastateur de l’histoire, Article réservé aux abonnés ,,,,,
"France-Cameroun, une opération vérité nécessaire",,,,,,
"L’IA, mes étudiants et moi : « Le semestre passé constitue la pire expérience de ma vie d’enseignant »", Article réservé aux abonnés ,,,,,
Du costume beige d’Obama aux outrances de Trump : « Je donnerais tout pour revenir au temps où la plus grave offense était un écart de conduite vestimentaire », Article réservé aux abonnés ,,,,,
"« En Syrie, il est essentiel d’endiguer la prolifération illicite des armes légères et de petit calibre »", Article réservé aux abonnés ,,,,,
"Dans « Valeur sentimentale », Joachim Trier filme des blessures familiales qui ne se cicatrisent pas", Article réservé aux abonnés ,,,,,
"Dans « Kolkhoze », Emmanuel Carrère devient le fils de sa mère", Article réservé aux abonnés ,,,,,
"« Fille de la nation », sur Canal+ : Zdenka Havlickova, une figure oubliée de l’histoire tchèque", Article réservé aux abonnés ,,,,,
"Les films à l’affiche : « Alpha », « Valeur sentimentale », « Last Shadow at First Light »…", Article réservé aux abonnés ,,,,,
"Le Mexique en trois recettes, pour un été relevé", Article réservé aux abonnés ,,,,,
"Quatre objets à la seconde jeunesse : mazagran, transistor, chaîne de lunettes et chaise Mullca 510", Article réservé aux abonnés ,,,,,
"La nature, un terreau fertile pour Christian Dior", Article réservé aux abonnés ,,,,,
"« Mon plus long affût a duré presque neuf heures » : Nicolas Groffal, médecin et photographe animalier", Article réservé aux abonnés ,,,,,
" Guerre en Ukraine : les troupes russes menacent la région de Donetsk, malgré l’arrêt de leur récente percée  ",Article réservé aux abonnés,,"L’armée ukrainienne a su déployer des réserves pour arrêter les soldats de Moscou au nord de Pokrovsk, mais elle peine à trouver une parade à la nouvelle tactique d’infiltration russe.",https://www.lemonde.fr/international/article/2025/08/20/guerre-en-ukraine-la-percee-russe-est-bloquee-dans-la-region-de-donetsk_6632164_3210.html,,
Gaza : l’armée israélienne a envoyé un ordre de mobilisation de 60 000 réservistes supplémentaires,,https://img.lemde.fr/2025/08/19/0/0/5641/3760/398/265/75/0/14f2a35_ftp-import-images-1-pd36g7tqrdmi-5669699-01-06.jpg,,https://www.lemonde.fr/international/live/2025/08/20/en-direct-gaza-l-armee-israelienne-a-envoye-un-ordre-de-mobilisation-de-60-000-reservistes-supplementaires_6632172_3210.html,,
"En Russie, les autorités verrouillent toujours plus les communications",Article réservé aux abonnés,https://img.lemde.fr/2025/08/19/0/151/4282/2855/398/265/75/0/ef14cd4_upload-1-hrnm3nhrhb3d-000-36ag3z6.jpg,,https://www.lemonde.fr/international/article/2025/08/20/en-russie-les-autorites-verrouillent-toujours-plus-les-communications_6632280_3210.html,,
"Au Canada, le tourisme des icebergs condamné par le réchauffement : « En 2024, on n’a pas pu en voir du tout »",Article réservé aux abonnés,https://img.lemde.fr/2025/08/19/0/0/4200/2800/398/265/75/0/24d2b89_upload-1-o5hjfdkk7jg6-2025-05-16t171020z-443024084-rc2yiead72im-rtrmadp-3-canada-weather.JPG,"A Terre-Neuve-et-Labrador, la fonte accélérée des icebergs menace une tradition touristique et culturelle chère aux habitants de la province la plus orientale du Canada : la contemplation de la dérive vers le sud des géants de glace.",https://www.lemonde.fr/planete/article/2025/08/20/au-canada-le-tourisme-des-icebergs-condamne-par-le-rechauffement-en-2024-on-n-a-pas-pu-en-voir-du-tout_6632176_3244.html,,
Ligue 1 + promet d’« immerger » les téléspectateurs pour mieux les séduire,,https://img.lemde.fr/2025/08/15/0/19/5356/3571/398/265/75/0/6aee129_ftp-import-images-1-qeogvqk9zyeu-2025-08-15t171040z-1837975830-up1el8f1bpqhe-rtrmadp-3-soccer-france-ren-om.JPG,La nouvelle chaîne du championnat de France veut plonger ses abonnés dans le spectacle. Une révolution très relative.,https://www.lemonde.fr/une-balle-dans-le-pied/article/2025/08/20/pour-seduire-le-telespectateur-ligue-1-promet-de-l-immerger_6632452_6606027.html,,
"Dans « Alpha », la cinéaste Julia Ducournau met en scène un long flirt avec la mort",Article réservé aux abonnés,https://img.lemde.fr/2025/08/18/0/761/2574/1716/398/265/75/0/7b382db_upload-1-l2lri19fpmb4-alpha-photo-3-mandarin-compagnie-kallouche-cinema-frakas-productions-france-3-cinema.jpg,"Au cœur du troisième long-métrage de la réalisatrice de « Grave » et de « Titane », un mystérieux virus qui rappelle le sida transforme ses victimes en statues de marbre.",https://www.lemonde.fr/culture/article/2025/08/20/dans-alpha-la-cineaste-julia-ducournau-met-en-scene-un-long-flirt-avec-la-mort_6632381_3246.html,,
"Aleksandra, étudiante russe à Paris : « J’aime la façon de penser des Français, leur humour sarcastique, ou cette culture rebelle pour manifester »",Article réservé aux abonnés,https://img.lemde.fr/2025/07/25/0/0/2125/1417/664/442/75/0/d609a91_upload-1-xs5e9fn8yqoh-8-aleksandra-250722-v2-1.jpg,"« Mon année en France » (8/8). Chaque semaine cet été, « Le Monde » rencontre des étudiants étrangers. Quel regard portent-ils sur notre pays ? S’y sentent-ils bien accueillis ? Agée de 25 ans, Aleksandra a vu ses études d’astrophysique bousculées par la guerre en Ukraine. Depuis son arrivée à Paris, à l’été 2023, elle jongle entre ses cours et ses nombreux engagements militants.",https://www.lemonde.fr/series-d-ete/article/2025/08/20/aleksandra-etudiante-russe-a-paris-j-aime-la-facon-de-penser-des-francais-leur-humour-sarcastique-ou-cette-culture-rebelle-pour-manifester_6632175_3451060.html, Elisabeth Pineau,Rencontre
"En Nouvelle-Calédonie, Manuel Valls appelle à saisir l’« opportunité historique » de l’accord de Bougival",,https://img.lemde.fr/2025/08/20/0/0/5752/3835/198/132/95/0/b3866b9_ftp-import-images-1-d5kazpwowfku-5672484-01-06.jpg,,https://www.lemonde.fr/politique/article/2025/08/20/en-nouvelle-caledonie-manuel-valls-appelle-a-saisir-l-opportunite-historique-de-l-accord-de-bougival_6632520_823448.html,,
Nétanyahou accuse Macron de nourrir l’antisémitisme en appelant à la reconnaissance internationale de l’Etat palestinien,Article réservé aux abonnés,https://img.lemde.fr/2025/08/19/0/47/5806/3871/198/132/95/0/e834442_ftp-import-images-1-qq9m2sg6sgb6-2025-08-19t110900z-959185792-rc2imeahed4k-rtrmadp-3-israel-australia.JPG,,https://www.lemonde.fr/international/article/2025/08/20/reconnaissance-de-l-etat-palestinien-netanyahou-accuse-macron-de-nourrir-l-antisemitisme_6632416_3210.html,,
"Dans « Kolkhoze », Emmanuel Carrère devient le fils de sa mère",Article réservé aux abonnés,https://img.lemde.fr/2025/08/19/771/225/3935/2623/198/132/95/0/999976d_upload-1-6is0eph9h1np-carrei-re-tbilissi3.jpg,,https://www.lemonde.fr/livres/article/2025/08/20/emmanuel-carrere-fils-de-sa-mere_6632179_3260.html,,
"La Piscine, à Roubaix, invite à un bain de culture",Article réservé aux abonnés,https://img.lemde.fr/2025/07/16/0/189/6963/4642/198/132/95/0/29257fc_upload-1-ptgxankltusf-000-1a52zg.jpg,,https://www.lemonde.fr/series-d-ete/article/2025/08/20/la-piscine-a-roubaix-invite-a-un-bain-de-culture_6632163_3451060.html,,
"Qu’est-ce que Kick, la plateforme sur laquelle est mort le streameur Jean Pormanove ?",,,,https://www.lemonde.fr/pixels/article/2025/08/19/qu-est-ce-que-kick-la-plateforme-sur-laquelle-est-mort-le-streameur-jean-pormanove_6631932_4408996.html,,
Polémique aux Etats-Unis après la libération d’un responsable israélien arrêté pour sollicitation de mineure,,,,https://www.lemonde.fr/international/article/2025/08/20/polemique-aux-etats-unis-apres-la-liberation-d-un-responsable-israelien-arrete-pour-sollicitation-de-mineure_6632449_3210.html,,
"En Afghanistan, 78 morts dans un accident de la route",,,,https://www.lemonde.fr/international/article/2025/08/20/en-afghanistan-78-morts-dans-un-accident-de-la-route_6632519_3210.html,,
"En RDC, le groupe antigouvernemental M23 a commis viols et exécutions sommaires, selon Amnesty International",,,,https://www.lemonde.fr/afrique/article/2025/08/20/en-rdc-le-groupe-antigouvernemental-m23-a-commis-viols-et-executions-sommaires-selon-amnesty-international_6632383_3212.html,,
Donald Trump demande une enquête sur des musées du pays qu’il accuse de « wokisme »,,,,https://www.lemonde.fr/international/article/2025/08/20/etats-unis-donald-trump-demande-une-enquete-sur-les-musees-du-pays-accuses-de-wokisme_6632096_3210.html,,
"« La première fois, je n’ai pas fermé l’œil, j’avais peur » : en hébergement d’urgence, le sommeil sans repos",Article réservé aux abonnés,,,https://www.lemonde.fr/series-d-ete/article/2025/08/20/en-hebergement-d-urgence-le-sommeil-sans-repos-la-premiere-fois-je-n-ai-pas-ferme-l-il-j-avais-peur_6632166_3451060.html,,
Afrique du Sud : l’ancien plus grand éleveur de rhinocéros au monde arrêté pour trafic de cornes,,,,https://www.lemonde.fr/afrique/article/2025/08/20/afrique-du-sud-l-ancien-plus-grand-eleveur-de-rhinoceros-au-monde-arrete-pour-trafic-de-cornes_6632348_3212.html,,
"Le concours de l’Eurovision 2026 aura lieu à Vienne, capitale « cosmopolite » aux « énormes capacités d’hébergement »",,,,https://www.lemonde.fr/culture/article/2025/08/20/le-concours-de-l-eurovision-2026-aura-lieu-a-vienne_6632382_3246.html,,
"Guerre en Ukraine : après les réunions de Washington, le débat sur les garanties de sécurité s’accélère",Article réservé aux abonnés,https://img.lemde.fr/2025/08/19/0/0/8256/5504/664/442/75/0/3c32b38_ftp-import-images-1-7pkks2xl31ek-4483de94954f4864a3d5bb083c9725e6-0-cf8bb9906d824ceb8123a578cec69556.jpg,"La question a été abordée, mardi, par les membres de la « coalition des volontaires », la plupart européens, et devait être à nouveau au menu d’une réunion des chefs d’état-major de l’OTAN, mercredi. En jeu, le rôle des Etats-Unis et une éventuelle clause d’assistance mutuelle.",https://www.lemonde.fr/international/article/2025/08/20/guerre-en-ukraine-apres-les-reunions-de-washington-le-debat-sur-les-garanties-de-securite-s-accelere_6632167_3210.html, Cédric Vallet et  Philippe Ricard,Décryptage
"La mort en direct du streameur Jean Pormanove, humilié et maltraité pendant des mois",Article réservé aux abonnés,https://img.lemde.fr/2025/08/19/472/0/1536/1024/664/442/75/0/bc416d3_upload-1-90dmqvbx0hml-fwwxc0xwiaezw12.jpeg,"Figure française de la plateforme de diffusion Kick, le quadragénaire et ancien militaire était régulièrement frappé et malmené lors de ses lives par deux autres influenceurs.",https://www.lemonde.fr/societe/article/2025/08/19/la-mort-en-direct-du-streameur-jean-pormanove-humilie-et-maltraite-pendant-des-mois_6631954_3224.html, Jérôme Lefilliâtre,Décryptage
« Adjani a le sida » : quand l’actrice est victime d’une rumeur monstre,Article réservé aux abonnés,https://img.lemde.fr/2025/07/23/157/0/2500/1666/664/442/75/0/2137cf9_upload-1-vqelqtdbkgau-000-app2001041435956.jpg,"« Isabelle Adjani, célèbre inconnue » (3/6).  En 1986, une partie des Français est persuadée que la comédienne, qui tourne peu après le triomphe de « L’Eté meurtrier », cache une maladie. Il lui faudra plusieurs mois et une intervention spectaculaire au journal télévisé de TF1 pour dissiper les soupçons.",https://www.lemonde.fr/series-d-ete/article/2025/08/19/adjani-a-le-sida-quand-l-actrice-est-victime-d-une-rumeur-monstre_6631943_3451060.html, Samuel Blumenfeld,Récit
"France-Cameroun, une opération vérité nécessaire",,,,https://www.lemonde.fr/idees/article/2025/08/20/france-cameroun-une-operation-verite-necessaire_6632451_3232.html,,Éditorial
"Face à Donald Trump, « les anciens présidents américains ne veulent pas risquer de compromettre la fonction en parlant de façon irréfléchie »",S’abonner,,,https://www.lemonde.fr/idees/article/2025/08/19/face-a-trump-les-anciens-presidents-americains-ne-veulent-pas-risquer-de-compromettre-la-fonction-en-parlant-de-facon-irreflechie_6631791_3232.html,,Entretien
Du costume beige d’Obama aux outrances de Trump : « Je donnerais tout pour revenir au temps où la plus grave offense était un écart de conduite vestimentaire »,S’abonner,,,https://www.lemonde.fr/series-d-ete/article/2025/08/19/du-costume-beige-d-obama-aux-outrances-de-trump-je-donnerais-tout-pour-revenir-au-temps-ou-la-plus-grave-offense-etait-un-ecart-de-conduite-vestimentaire_6631790_3451060.html,,Récit
