title,premium,image URL,subhead,URL,byline,article type
German daycare centers face a shortage of babies, Subscribers only ,,,,,
Heroes' Memorial in Kyiv carries the pain of all Ukraine, Subscribers only ,,,,,
Syrian authorities struggle with foreign jihadists, Subscribers only ,,,,,
The endless purges of Xi Jinping's China, Subscribers only ,,,,,
"After Charlie Kirk's murder, Europe's far right swears allegiance to Trump's politics", Subscribers only ,,,,,
Sanctions against Russia spark rift between US and Europe over China, Subscribers only ,,,,,
France's political instability puts Franco-German alliance to the test,,,,,,
France faces prospect of paying higher borrowing costs than Italy, Subscribers only ,,,,,
"Emilie König, IS jihadist and propagandist, will go before French criminal court", Subscribers only ,,,,,
Cédric Jubillar trial: What led to the 30-year prison sentence for the murder of his wife, Subscribers only ,,,,,
France's Assemblée Nationale backs bill adding consent to rape law, Subscribers only ,,,,,
Sarkozy imprisonment: Protection of ex-president by armed officers angers prison guards, Subscribers only ,,,,,
Afghanistan: Relentless repression continues over four years into Taliban's rule,,,,,,
Watch: Hundreds of thousands march in France against budget cuts,,,,,,
Emmys 2025: 'Adolescence' star Owen Cooper becomes youngest winner for best supporting actor,,,,,,
"From 'influence peddling' to 'corruption,' what is French Culture Minister Rachida Dati accused of?",,,,,,
"'Contrary to the claims of the far-right populists, people are convinced of the reality of climate change'", Subscribers only ,,,,,
Malian junta is powerless against jihadist threat,,,,,,
'The Thiaroye massacre in Senegal in 1944 marked the reestablishment of colonial order', Subscribers only ,,,,,
"'The Louvre's stolen jewels, valuable only for their gemstones, are above all outdated and cumbersome'", Subscribers only ,,,,,
Brigitte Macron's never-ending fake news nightmare, Subscribers only ,,,,,
A new Israeli-Palestinian restaurant promotes peace through food in Paris, Subscribers only ,,,,,
The wild Albanian island where the Trumps want to build a luxury hotel, Subscribers only ,,,,,
"France's last military pigeons, custodians of a fading tradition", Subscribers only ,,,,,
Twelve artistic happenings to catch outside Art Basel Paris, Subscribers only ,,,,,
A new Israeli-Palestinian restaurant promotes peace through food in Paris, Subscribers only ,,,,,
"'The spirit of the new Fondation Cartier is not that of a cathedral where one must always do more, always bigger'", Subscribers only ,,,,,
"Jean-François Piège, guardian of Paris's bistro heritage", Subscribers only ,,,,,
 Syrian authorities struggle with foreign jihadists  ,Subscribers only,,Clashes between Syrian authorities and French jihadists entrenched in the Harem camp demonstrate the challenges the new regime faces in integrating these foreign groups into society.,https://www.lemonde.fr/en/international/article/2025/10/25/syrian-authorities-struggle-with-foreign-jihadists_6746772_4.html,,
Trump says increasing tariffs on Canada by 10%,,https://img.lemde.fr/2025/10/24/0/0/1339/893/398/265/75/0/2ec851b_ftp-import-images-1-s7tj385sumqu-2025-10-24t224622z-1211579069-rc2ujga27f6e-rtrmadp-3-usa-trump-reagan.JPG,,https://www.lemonde.fr/en/economy/article/2025/10/25/trump-says-increasing-tariffs-on-canada-by-10_6746777_19.html,,
French government under pressure over wealth tax proposal,,https://img.lemde.fr/2025/10/24/0/0/4054/2703/398/265/75/0/448200e_ftp-import-images-1-azhgytwwvger-2025-10-24t085604z-2038268566-rc2wchasbq40-rtrmadp-3-france-politics.JPG,,https://www.lemonde.fr/en/france/article/2025/10/26/french-government-under-pressure-over-wealth-tax-proposal_6746778_7.html,,
Israel army says targeted Islamic Jihad militant in Gaza strike,,https://img.lemde.fr/2025/10/21/0/0/4981/3321/398/265/75/0/d150462_ftp-import-images-1-9ewpfqeaj2jp-5223186-01-06.jpg,"For the past two weeks, there has been a fragile truce, brokered by US President Donald Trump, between Hamas, an ally of Islamic Jihad, and Israel. US Secretary of State Marco Rubio, speaking to journalists as he left Israel on Saturday, did not address the strike directly but noted that incidents are common in the immediate aftermath of ceasefires.",https://www.lemonde.fr/en/international/article/2025/10/25/israel-army-says-targeted-islamic-jihad-militant-in-gaza-strike_6746776_4.html,,
"Japan is still in love with bears, despite increasingly frequent and deadly attacks",Subscribers only,https://img.lemde.fr/2025/10/20/20/0/5455/3636/398/265/75/0/217f962_upload-1-zmfhqbpw7lsd-2024-12-03t085902z-143949713-rc2dmaawufan-rtrmadp-3-japan-bears.JPG,The rise in bear attacks has caused concern in a country deeply attached to the animal. Climate change and the declining rural population have driven bears to venture more often into residential areas.,https://www.lemonde.fr/en/environment/article/2025/10/26/japan-still-in-love-with-bears-despite-increasingly-frequent-and-deadly-attacks_6746779_114.html,,
The Fondation Cartier unveils its new landmark in central Paris,Subscribers only,https://img.lemde.fr/2025/10/21/0/0/1200/800/398/265/75/0/d8026b8_ftp-import-images-1-9rcwqnkoupls-402098-3442806.jpg,"The Fondation Cartier for Contemporary Art has moved to Place du Palais-Royal in Paris. Like its previous location on Boulevard Raspail, the new building was designed by architect Jean Nouvel, conceived as an innovative, flexible space that can be configured in countless ways.",https://www.lemonde.fr/en/culture/article/2025/10/25/the-fondation-cartier-unveils-its-new-landmark-in-central-paris_6746758_30.html,,
Heroes' Memorial in Kyiv carries the pain of all Ukraine,Subscribers only,https://img.lemde.fr/2025/10/24/0/0/4300/2866/664/442/75/0/fde8543_upload-1-nooo4tbshwaq-natalia-maidankiev-21.jpg,"Spontaneously created after the Russian invasion, this self-managed memorial honoring fallen soldiers has become a central site for civilians and military personnel alike.",https://www.lemonde.fr/en/international/article/2025/10/25/heroes-memorial-in-kyiv-carries-the-pain-of-all-ukraine_6746774_4.html, Faustine Vincent,Feature
Left-winger Catherine Connolly wins Ireland's presidential election,,https://img.lemde.fr/2025/10/25/110/0/4208/2805/198/132/95/0/3049a11_ftp-import-images-1-us8xwtukmchy-501d77912770445d9d2c26d35411f2fa-0-43f39c55dd244ddcb209b11a4cece0dd.jpg,,https://www.lemonde.fr/en/international/article/2025/10/25/catherine-connolly-is-the-favorite-to-succeed-michael-higgins-as-president-in-irish-election_6746765_4.html,,
Protesters gather one year after Spain's deadly floods,,https://img.lemde.fr/2025/10/25/0/0/5500/3666/198/132/95/0/e6f73b8_ftp-import-images-1-irmmbagpe120-2025-10-25t155313z-1580358009-rc23jha05i0p-rtrmadp-3-europe-weather-spain-protest.JPG,,https://www.lemonde.fr/en/environment/article/2025/10/25/protesters-gather-one-year-after-spain-s-deadly-floods_6746775_114.html,,
Thailand's former queen Sirikit has died at 93,,https://img.lemde.fr/2025/10/24/80/0/2486/1657/198/132/95/0/ed11231_ftp-import-images-1-dv05t5vnsi1e-7bbc8d4fe2c04b308f03aa534f5a5954-0-1a0e9c88c87c4c6d90d6f6e8c1e6493a.jpg,,https://www.lemonde.fr/en/obituaries/article/2025/10/25/thailand-s-former-queen-sirikit-has-died-at-93_6746766_15.html,,
Louvre heist turns into a flashpoint in Paris municipal elections,Subscribers only,https://img.lemde.fr/2025/10/21/0/1/5782/3855/198/132/95/0/70b664d_ftp-import-images-1-mokqcnyvuci2-2025-10-21t131448z-675605938-rc2dgha2mb14-rtrmadp-3-france-politics.JPG,,https://www.lemonde.fr/en/politics/article/2025/10/25/louvre-heist-turns-into-a-flashpoint-in-paris-municipal-elections_6746770_5.html,,
Montmartre property dispute pits Moulin Rouge against poet Jacques Prévert's estate,Subscribers only,,,https://www.lemonde.fr/en/culture/article/2025/10/25/montmartre-property-dispute-pits-moulin-rouge-against-poet-jacques-prevert-s-estate_6746773_30.html,,
Alassane Ouattara tightens control in Côte d'Ivoire as he seeks fourth term,Subscribers only,,,https://www.lemonde.fr/en/le-monde-africa/article/2025/10/25/alassane-ouattara-tightens-control-in-cote-d-ivoire-as-he-seeks-fourth-term_6746768_124.html,,
Rubio seeks quick deployment of international force to police ceasefire in Gaza,,,,https://www.lemonde.fr/en/international/article/2025/10/25/rubio-seeks-quick-deployment-of-international-force-to-police-ceasefire-in-gaza_6746759_4.html,,
Canada becomes embroiled in new conflict with Donald Trump,Subscribers only,,,https://www.lemonde.fr/en/economy/article/2025/10/25/canada-becomes-embroiled-in-new-conflict-with-donald-trump_6746767_19.html,,
"First loves: '20 years later, our bodies recognize each other, it's crazy'",Subscribers only,,,https://www.lemonde.fr/en/intimacy/article/2025/10/25/first-loves-20-years-later-our-bodies-recognize-each-other-it-s-crazy_6746762_310.html,,
Moody's keeps France's credit rating but places it on negative outlook,Subscribers only,,,https://www.lemonde.fr/en/economy/article/2025/10/25/moody-s-keeps-france-s-credit-rating-but-places-it-on-negative-outlook_6746760_19.html,,
'The Thiaroye massacre in Senegal in 1944 marked the reestablishment of colonial order',Subscribers only,,,https://www.lemonde.fr/en/opinion/article/2025/10/25/the-thiaroye-massacre-in-senegal-in-1944-marked-the-reestablishment-of-colonial-order_6746761_23.html,,
"After nine months of Trump's presidency, US inflation returns but does not derail economic policy",Subscribers only,,,https://www.lemonde.fr/en/economy/article/2025/10/25/after-nine-months-of-trump-s-presidency-us-inflation-returns-but-does-not-derail-economic-policy_6746757_19.html,,
"'The Louvre's stolen jewels, valuable only for their gemstones, are above all outdated and cumbersome'",Subscribers only,https://img.lemde.fr/2025/10/22/0/0/3923/2615/664/442/75/0/c83b47b_ftp-import-images-1-v3uvn3m8fu9q-2025-10-22t113325z-1959701680-rc2xghawv6ic-rtrmadp-3-france-crime-louvre.JPG,"Reactions to the Louvre heist ignore the complex equation museums face: offering generous public access while securing cumbersome objects better suited for a bank vault, explains Le Monde columnist Michel Guerrin.",https://www.lemonde.fr/en/opinion/article/2025/10/24/the-louvre-s-stolen-jewels-valuable-only-for-their-gemstones-are-above-all-outdated-and-cumbersome_6746751_23.html, Michel Guerrin,Column
Brigitte Macron's never-ending fake news nightmare,Subscribers only,https://img.lemde.fr/2025/10/22/212/0/1571/1047/664/442/75/0/dbe52f8_upload-1-zlomphzpzsmh-2018-10-17t000000z-1559596828-rc1d2ea1d230-rtrmadp-3-france-jap.jpeg,"For four years, the absurd rumor that the French first lady is a man has continually spread. The Macrons have taken legal action, both in France and in the US.",https://www.lemonde.fr/en/m-le-mag/article/2025/10/25/brigitte-macron-s-never-ending-fake-news-nightmare_6746763_117.html, Olivier Faye,Investigation
A former mining city in northern China has become a budget tourist destination,Subscribers only,https://img.lemde.fr/2025/10/22/0/0/6694/4462/664/442/75/0/11b10b4_upload-1-mhmsiskhzpuo-gettyimages-2176095999.jpg,"Driven by the reconstruction of its downtown area and the redevelopment of disused mining sites, China's northern city of Datong, located 350 kilometers west of Beijing, has been experiencing a boost in tourism.",https://www.lemonde.fr/en/economy/article/2025/10/24/a-former-mining-city-in-northern-china-has-become-a-budget-tourist-destination_6746726_19.html, Jordan Pouille,Feature
Malian junta is powerless against jihadist threat,,,,https://www.lemonde.fr/en/opinion/article/2025/10/25/malian-junta-is-powerless-against-jihadist-threat_6746769_23.html,,Editorial
'France has lost all budgetary credibility',Subscribe,,,https://www.lemonde.fr/en/opinion/article/2025/10/21/france-has-lost-all-budgetary-credibility_6746627_23.html,,Column
Fragile Middle East ceasefire is tested by renewed violence in Gaza,,,,https://www.lemonde.fr/en/opinion/article/2025/10/21/fragile-middle-east-ceasefire-is-tested-by-renewed-violence-in-gaza_6746637_23.html,,Editorial
