title,premium,image URL,subhead,URL,byline,article type
"US Democrats, defeated by Trump a year ago, grapple with a grassroots rebellion", Subscribers only ,,,,,
"China welcomes back the NBA, America's softpower heavyweight", Subscribers only ,,,,,
Russia aims to cripple Ukraine's power grid to weaken Kyiv, Subscribers only ,,,,,
Iran: Rape allegations against famous actor spark rare debate in deeply patriarchal society, Subscribers only ,,,,,
"After Charlie Kirk's murder, Europe's far right swears allegiance to Trump's politics", Subscribers only ,,,,,
Sanctions against Russia spark rift between US and Europe over China, Subscribers only ,,,,,
France's political instability puts Franco-German alliance to the test,,,,,,
France faces prospect of paying higher borrowing costs than Italy, Subscribers only ,,,,,
French police recover €28 million in precious metals after gold lab heist,,,,,,
"Louvre heist: Man and woman charged, but jewels still missing", Subscribers only ,,,,,
All-you-can-eat buffets attract gourmet and value-conscious diners in France's city centers, Subscribers only ,,,,,
Sentences over red hand graffiti on Paris Shoah Memorial handed down in 'unprecedented' trial, Subscribers only ,,,,,
Afghanistan: Relentless repression continues over four years into Taliban's rule,,,,,,
Watch: Hundreds of thousands march in France against budget cuts,,,,,,
Emmys 2025: 'Adolescence' star Owen Cooper becomes youngest winner for best supporting actor,,,,,,
"From 'influence peddling' to 'corruption,' what is French Culture Minister Rachida Dati accused of?",,,,,,
"In Poland, Donald Tusk's anti-populist 'revolution' fails", Subscribers only ,,,,,
US-China trade truce shows Beijing has upper hand,,,,,,
Why peace in the Middle East depends on the release of Marwan Barghouti, Subscribers only ,,,,,
"'The Louvre theft marks a turning point between a hampered public cultural scene and wealthy, private players'", Subscribers only ,,,,,
"Rosalía returns with mystical album: 'God has given me so much, the least I could do is make an album for him'", Subscribers only ,,,,,
French lesbian literature steps into the spotlight with new prize, Subscribers only ,,,,,
A dizzying dive into Bob Wilson's Long Island theater of objects, Subscribers only ,,,,,
Brigitte Macron's never-ending fake news nightmare, Subscribers only ,,,,,
The Orient Express pulls up in Paris: An opulent journey into the 1920s, Subscribers only ,,,,,
Twelve artistic happenings to catch outside Art Basel Paris, Subscribers only ,,,,,
A new Israeli-Palestinian restaurant promotes peace through food in Paris, Subscribers only ,,,,,
"'The spirit of the new Fondation Cartier is not that of a cathedral where one must always do more, always bigger'", Subscribers only ,,,,,
" US Democrats, defeated by Trump a year ago, grapple with a grassroots rebellion  ",Subscribers only,,"As Tuesday's special elections approach, the party is fractured, with no clear leader or unified message, as activists push for new priorities and a shake-up of its entrenched establishment.",https://www.lemonde.fr/en/international/article/2025/11/03/us-democrats-defeated-by-trump-a-year-ago-grapple-with-a-grassroots-rebellion_6747062_4.html,,
Israel hands over bodies of 45 Palestinians after Hamas returns remains of 3 soldiers,,https://img.lemde.fr/2025/11/03/0/0/8640/5760/398/265/75/0/b177536_ftp-import-images-1-cvtf31wf4hbq-f90e3e25004e4b6d8d92f24f43ec5b87-0-9ce552a42561484d89f873650aedb059.jpg,,https://www.lemonde.fr/en/international/article/2025/11/02/israel-receives-the-remains-of-three-hostages-from-gaza-as-fragile-ceasefire-holds_6747028_4.html,,
"Brazil records biggest annual fall in emissions in 15 years, notably thanks to fight against deforestation",,https://img.lemde.fr/2025/11/03/0/22/2911/1941/398/265/75/0/533af5d_ftp-import-images-1-qzvouluzgpmz-5345918-01-06.jpg,,https://www.lemonde.fr/en/environment/article/2025/11/04/brazil-records-biggest-annual-fall-in-emissions-in-15-years-notably-thanks-to-fight-against-deforestation_6747070_114.html,,
Shein bans all sex dolls after France's outrage over 'childlike' figures,,https://img.lemde.fr/2025/11/03/0/0/7060/4707/398/265/75/0/077c3c3_ftp-import-images-1-yssj8jx2fuav-5343557-01-06.jpg,"Earlier on Monday, France's finance minister had threatened to ban the retailer from the country if it resumed selling the childlike dolls, just days before it opens its first physical store in Paris.",https://www.lemonde.fr/en/economy/article/2025/11/03/shein-bans-all-sex-dolls-after-france-s-outrage-over-childlike-ones_6747064_19.html,,
Tanzania president sworn in as opposition says hundreds killed in protests,,https://img.lemde.fr/2025/11/03/0/0/5472/3648/398/265/75/0/57011e2_ftp-import-images-1-qtvzzlklsuv0-2025-11-03t155643z-883894306-rc21phakz97b-rtrmadp-3-tanzania-election.JPG,"Hassan, who was inaugurated for a second term on Monday, was elevated from vice president after the sudden death of her predecessor John Magufuli in 2021. Election day, despite a heavy security presence, descended into chaos, with Hassan calling for 'unity and solidarity' in her speech, promising a return to normality.",https://www.lemonde.fr/en/international/article/2025/11/03/tanzania-president-sworn-in-as-opposition-says-hundreds-killed-in-protests_6747065_4.html,,
"Benny Safdie, director of 'The Smashing Machine,' and the equation of cinema",Subscribers only,https://img.lemde.fr/2025/10/27/0/0/4999/3333/398/265/75/0/bd9751a_upload-1-ci2lzed0rpri-063-2234411630.jpg,"The filmmaker, who long hesitated between physics and making movies, has not lost his enthusiasm for the magic of the screen.",https://www.lemonde.fr/en/culture/article/2025/11/04/benny-safdie-director-of-the-smashing-machine-and-the-equation-of-cinema_6747068_30.html,,
"Rosalía returns with mystical album: 'God has given me so much, the least I could do is make an album for him'",Subscribers only,https://img.lemde.fr/2025/10/30/0/0/1197/798/664/442/75/0/273ddb6_upload-1-gx08qsft4o0w-web-img-737.jpg,"Three albums and a string of hit singles have propelled her to the ranks of global pop divas. After a three-year hiatus, the 33-year-old Catalan artist returns with 'Lux,' a musical fresco in praise of the divine and major female saints.",https://www.lemonde.fr/en/m-le-mag/article/2025/11/03/rosal-a-returns-with-mystical-album-god-has-given-me-so-much-the-least-i-could-do-is-make-an-album-for-him_6747063_117.html, Aureliano Tonet,Profile
"In France, immigrants earn 28% less than native-born workers when entering the labor market, OECD finds",Subscribers only,https://img.lemde.fr/2025/06/13/0/0/3000/2000/198/132/95/0/64cee37_upload-1-pjm3nuwgorb0-frame-844.jpg,,https://www.lemonde.fr/en/economy/article/2025/11/04/in-france-immigrants-earn-28-less-than-native-born-workers-when-entering-the-labor-market-oecd-finds_6747069_19.html,,
"In Poland, Donald Tusk's anti-populist 'revolution' fails",Subscribers only,https://img.lemde.fr/2025/10/21/0/0/2412/1608/198/132/95/0/21048cc_ftp-import-images-1-8akc8pjajrdl-d0ef7758a39d4b07a44ad0e5b1fda62f-0-c8cd266c6ecc4c35af26f98997978176.jpg,,https://www.lemonde.fr/en/opinion/article/2025/11/03/in-poland-donald-tusk-s-anti-populist-revolution-fails_6747039_23.html,,
Peru severes diplomatic relations with Mexico over former prime minister's asylum,,https://img.lemde.fr/2025/11/04/0/0/5442/3628/198/132/95/0/55563a7_ftp-import-images-1-zxzhkqxvkwfr-141696817676484eb479ae47a7d3bce9-1-49eba658741a44f3ac8e77f64d09f974.jpg,,https://www.lemonde.fr/en/international/article/2025/11/04/peru-severes-diplomatic-relations-with-mexico-over-former-prime-minister-s-asylum_6747071_4.html,,
3-time Oscar-nominated actress Diane Ladd dies at 89,,https://img.lemde.fr/2025/11/03/203/0/2013/1342/198/132/95/0/c98489c_ftp-import-images-1-onnlecpe7j50-2025-11-03t221833z-1917150848-rc2aphav7w56-rtrmadp-3-people-diane-ladd.JPG,,https://www.lemonde.fr/en/obituaries/article/2025/11/03/3-time-oscar-nominated-actress-diane-ladd-dies-at-89_6747067_15.html,,
"Charles Coste, world's oldest living Olympic champion, dies at 101",Subscribers only,,,https://www.lemonde.fr/en/obituaries/article/2025/11/03/charles-coste-world-s-oldest-living-olympic-champion-dies-at-101_6747056_15.html,,
Sudan: The UAE's shady role and Western nations' 'culpable indifference',Subscribers only,,,https://www.lemonde.fr/en/le-monde-africa/article/2025/11/03/the-uae-s-shady-role-in-sudan-and-western-nations-culpable-indifference_6747044_124.html,,
Russia aims to cripple Ukraine's power grid to weaken Kyiv,Subscribers only,,,https://www.lemonde.fr/en/international/article/2025/11/03/russia-aims-to-cripple-ukraine-s-power-grid-to-weaken-kyiv_6747041_4.html,,
Grateful Dead singer Donna Jean Godchaux-MacKay dies at 78,,,,https://www.lemonde.fr/en/obituaries/article/2025/11/03/grateful-dead-singer-donna-jean-godchaux-mackay-dies-at-78_6747066_15.html,,
UK police charge man with 10 counts of attempted murder following train mass stabbing,,,,https://www.lemonde.fr/en/international/article/2025/11/03/uk-police-charge-man-with-10-counts-of-attempted-murder-following-train-mass-stabbing_6747061_4.html,,
"China welcomes back the NBA, America's softpower heavyweight",Subscribers only,,,https://www.lemonde.fr/en/international/article/2025/11/03/china-welcomes-back-the-nba-america-s-softpower-heavyweight_6747049_4.html,,
OpenAI signs $38 billion deal with Amazon's cloud giant AWS,,,,https://www.lemonde.fr/en/pixels/article/2025/11/03/openai-signs-38-billion-deal-with-amazon-s-cloud-giant-aws_6747059_13.html,,
"'I never eat alone anymore': La Cop1ne, a Parisian community canteen offering a cure for loneliness",Subscribers only,,,https://www.lemonde.fr/en/campus/article/2025/11/03/i-never-eat-alone-anymore-la-cop1ne-a-parisian-community-canteen-offering-a-cure-for-loneliness_6747030_11.html,,
The Orient Express pulls up in Paris: An opulent journey into the 1920s,Subscribers only,https://img.lemde.fr/2025/10/21/188/0/1207/804/664/442/75/0/ae7e14b_ftp-import-images-1-6w2ydiyy6mvc-402014-3442546.jpg,"The legendary luxury train is making a stop at Paris's Musée des Arts Décoratifs until spring. As part of the major exhibition dedicated to the centenary of Art Deco, three life-size mock-ups of the new Orient Express, set to return to service soon, are on display.",https://www.lemonde.fr/en/lifestyle/article/2025/11/02/the-orient-express-pulls-up-in-paris-an-opulent-journey-into-the-1920s_6747014_37.html, Valentin Pérez,News
France's new 'unproductive wealth' tax reflects a limited adjustment,Subscribers only,https://img.lemde.fr/2025/11/01/0/0/5899/3933/664/442/75/0/bb5eb46_upload-1-ondiy5mj5rys-jmug251031025.jpg,"MPs approved on Friday a modification of the real estate wealth tax. Its base was broadened, but the tax rate was reduced by a third for the very wealthy. Its yield remains unclear.",https://www.lemonde.fr/en/politics/article/2025/11/02/france-s-new-unproductive-wealth-tax-reflects-a-limited-adjustment_6747019_5.html, Denis Cosnard,News
JD Vance positions himself as heir of the MAGA movement,Subscribers only,https://img.lemde.fr/2025/10/30/1/0/4000/2666/664/442/75/0/aae3d64_ftp-import-images-1-8kpxxg8fxmpv-5303829-01-06.jpg,"The US vice president has made his mark in what is often a thankless role, railing against immigration, placing faith at the heart of his message and playing his part in diplomacy. He is seeking to make his candidacy for 2028 unavoidable – without upsetting Donald Trump.",https://www.lemonde.fr/en/international/article/2025/11/02/jd-vance-positions-himself-as-heir-of-the-maga-movement_6747025_4.html, Piotr Smolar,News
US-China trade truce shows Beijing has upper hand,,,,https://www.lemonde.fr/en/opinion/article/2025/11/03/us-china-trade-truce-shows-beijing-has-upper-hand_6747045_23.html,,Editorial
The far right's strength lies only in its opponents' weakness,,,,https://www.lemonde.fr/en/opinion/article/2025/10/31/the-far-right-s-strength-lies-only-in-its-opponents-weakness_6746956_23.html,,Editorial
'BHV has muddled its own narrative by associating with Shein',Subscribe,,,https://www.lemonde.fr/en/opinion/article/2025/10/30/by-partnering-with-shein-a-symbol-of-globalized-fast-fashion-the-bhv-department-store-has-muddled-its-own-narrative_6746909_23.html,,Op-Ed
