title,premium,image URL,subhead,URL,byline,article type
"Hadrien, 25 ans, chargé de plaidoyer dans une ONG, 2 100 euros par mois : « A quoi sert de gagner 50 K si c’est pour contribuer à un système qui s’autodétruit ? »  ", Article réservé à nos abonnés ,,,https://www.lemonde.fr/campus/article/2025/06/09/hadrien-25-ans-charge-de-plaidoyer-dans-une-ong-2-100-euros-par-mois-a-quoi-sert-de-gagner-50-k-si-c-est-pour-contribuer-a-un-systeme-qui-s-autodetruit_6611573_4401467.html,,
"Hadrien, 25 ans, chargé de plaidoyer dans une ONG, 2 100 euros par mois : « A quoi sert de gagner 50 K si c’est pour contribuer à un système qui s’autodétruit ? »  ", Article réservé à nos abonnés ,,,,,
"Jill Pilet, 31 ans, une chercheuse créative dans le milieu « aride » et masculin de la recherche sur le cancer  ", Article réservé à nos abonnés ,,,,,
"Revyze, l’application éducative au marketing acharné à l’approche du baccalauréat et du brevet  ", Article réservé à nos abonnés ,,,,,
Quiz culture générale : auriez-vous le niveau bac en philosophie ?  , Article réservé à nos abonnés ,,,https://www.lemonde.fr/campus/article/2025/06/14/quiz-culture-generale-auriez-vous-le-niveau-bac-en-philosophie_5466138_4401468.html,,
Quiz culture générale : auriez-vous le niveau bac en philosophie ?  ,,,,,,
"« Pour protéger les plus jeunes sur les réseaux, établissons en Europe l’âge de la majorité numérique à 15 ans »  ", Article réservé à nos abonnés ,,,,,
"Bac de français 2025 : le corrigé du commentaire sur « L’Ensorcelée », de Jules Barbey d’Aurevilly  ", Article réservé à nos abonnés ,,,,,
Porno interdit aux mineurs : tout comprendre à la fermeture des principaux sites Internet   podcast  ,,,,https://www.lemonde.fr/podcasts/article/2025/06/13/porno-interdit-aux-mineurs-tout-comprendre-a-la-fermeture-des-principaux-sites-internet_6612644_5463015.html,,
Porno interdit aux mineurs : tout comprendre à la fermeture des principaux sites Internet   podcast  ,,,,,,
Guerre à Gaza : qu’en pense la société israélienne ?   podcast  ,,,,,,
La rupture spectaculaire entre Donald Trump et Elon Musk   podcast  ,,,,,,
" Yoa, chanteuse : « On s’inspire de ce qui est plus radical que soi. Pour moi, ces figures plus radicales s’avèrent soit queer, soit noires » ",,https://img.lemde.fr/2025/06/11/0/0/3543/2362/664/442/75/0/535a134_upload-1-oq2dhhwgdq47-4-podcast-web-yoa.jpg,,https://www.lemonde.fr/podcasts/article/2025/06/13/yoa-chanteuse-sur-dix-ans-de-castings-je-n-ai-eu-que-des-roles-pour-des-filles-qui-s-appelaient-lila-ou-leila-des-filles-qui-viennent-de-banlieue-et-veulent-se-reapproprier-leur-corps-par-leur-sexualite_6612643_5463015.html,,
"De DG à DJ, de startupeur à investisseur : le retour de Pierre Kosciusko-Morizet  ", Article réservé à nos abonnés ,,,https://www.lemonde.fr/m-le-mag/article/2025/06/13/de-dg-a-dj-de-startupeur-a-investisseur-le-retour-de-pierre-kosciusko-morizet_6612752_4500055.html,,
"De DG à DJ, de startupeur à investisseur : le retour de Pierre Kosciusko-Morizet  ", Article réservé à nos abonnés ,,,,,
"Au Mexique, la machination infernale d’une « mère courage »  ", Article réservé à nos abonnés ,,,,,
Plongée dans l’enfer de la prison de Fresnes : « On est encore dans les années 1800 »  , Article réservé à nos abonnés ,,,,,
" Les cafés kids friendly, ces lieux où les enfants sont les bienvenus ", Article réservé à nos abonnés ,https://img.lemde.fr/2025/06/05/0/0/3543/2362/664/442/75/0/3fe6489_sirius-fs-upload-1-awbbfbue4pw7-1749115458573-bambin-23.jpg,,https://www.lemonde.fr/intimites/article/2025/06/14/les-cafes-kids-friendly-ces-lieux-ou-les-enfants-sont-les-bienvenus_6612964_6190330.html,,
Huit cafés où les petits (et les grands) seront bien accueillis  , Article réservé à nos abonnés ,,,https://www.lemonde.fr/intimites/article/2025/06/13/huit-cafes-ou-les-petits-et-les-grands-seront-bien-accueillis_6612750_6190330.html,,
Huit cafés où les petits (et les grands) seront bien accueillis  , Article réservé à nos abonnés ,,,,,
Que sait-on vraiment de nos parents ?  , Article réservé à nos abonnés ,,,,,
« Le dilemme » : laisser des avis négatifs en ligne est-il une pratique morale ?  , Article réservé à nos abonnés ,,,,,
"Esther Perel, la psy qui réinvente les rapports amoureux  ", Article réservé à nos abonnés ,,,https://www.lemonde.fr/m-le-mag/article/2025/06/11/la-psychologue-esther-perel-autrice-de-je-t-aime-je-te-trompe-en-tournee-en-france_6612220_4500055.html,,
"Esther Perel, la psy qui réinvente les rapports amoureux  ", Article réservé à nos abonnés ,,,,,
Comment des jeunes ont construit leur rapport au travail en fonction de celui des parents : « Mon père a tout donné à sa carrière. Il a fini par faire un gros burn-out et une dépression »  , Article réservé à nos abonnés ,,,,,
Le prénom : « Il y a autant de garagistes que d’architectes qui s’appellent Sébastien »  , Article réservé à nos abonnés ,,,,,
" Michaël Stora, psychanalyste : « La fixette permet de faire une pause dans notre monde d’éternel renouvellement » ", Article réservé à nos abonnés ,https://img.lemde.fr/2025/06/12/841/0/4016/2677/664/442/75/0/53654b6_upload-1-ypnqxl8tktfu-rea7910615.jpg,,https://www.lemonde.fr/m-perso/article/2025/06/14/michael-stora-psychanalyste-la-fixette-permet-de-faire-une-pause-dans-notre-monde-d-eternel-renouvellement_6613032_4497916.html,,
"Ces « fixettes » qui prennent une importance démesurée : « J’ai vécu ce délire tout seul, sans que personne s’en aperçoive »  ", Article réservé à nos abonnés ,,,https://www.lemonde.fr/m-perso/article/2025/06/14/extension-du-domaine-de-la-fixette-j-etais-devenu-monomaniaque-de-louis-xvii_6612963_4497916.html,,
"Ces « fixettes » qui prennent une importance démesurée : « J’ai vécu ce délire tout seul, sans que personne s’en aperçoive »  ", Article réservé à nos abonnés ,,,,,
Un apéro avec Christophe Bourseiller : « Je ne crois pas être réac »  , Article réservé à nos abonnés ,,,,,
Des éléments de langage en boucle sur les chaînes d’info après le « drame de Nogent »  , Article réservé à nos abonnés ,,,,,
"Si le PSG gagne, j’arrête TikTok, je me tatoue la Tour Eiffel sur le bras… et autres paris fous  ", Article réservé à nos abonnés ,,,https://www.lemonde.fr/m-perso/article/2025/06/08/si-le-psg-gagne-j-arrete-tiktok-je-me-tatoue-la-tour-eiffel-sur-le-bras-et-autres-paris-fous_6611158_4497916.html,,
"Si le PSG gagne, j’arrête TikTok, je me tatoue la Tour Eiffel sur le bras… et autres paris fous  ", Article réservé à nos abonnés ,,,,,
"Ils ont moins de 35 ans et, le samedi après-midi, ils jouent au bridge  ", Article réservé à nos abonnés ,,,,,
"Ils sont de plus en plus nombreux à creuser leur mare : « C’est un acte citoyen, pour les générations futures »  ", Article réservé à nos abonnés ,,,,,
 Est-ce bien raisonnable de… porter le smoking canadien ? ,,https://img.lemde.fr/2025/06/02/0/0/1500/1000/664/442/75/0/3cf1f6d_ftp-import-images-1-vjrbt7vvmjh1-384299-3424671.jpg,,https://www.lemonde.fr/m-styles/article/2025/06/08/est-ce-bien-raisonnable-de-porter-le-smoking-canadien_6611263_4497319.html,,
"Willie Morlon, l’orfèvre du plâtre  ", Article réservé à nos abonnés ,,,https://www.lemonde.fr/m-styles/article/2025/06/06/willie-morlon-l-orfevre-du-platre_6610758_4497319.html,,
"Willie Morlon, l’orfèvre du plâtre  ", Article réservé à nos abonnés ,,,,,
De l’abbaye de Grimbergen à l’arboretum de Tervuren : les alentours de Bruxelles à vélo  , Article réservé à nos abonnés ,,,,,
"Que faire, que voir, où aller ? L’agenda culturel et art de vivre du 8 au 14 juin  ", Article réservé à nos abonnés ,,,,,
La première Slow Fashion Week défend une mode sobre et recyclée  , Article réservé à nos abonnés ,,,https://www.lemonde.fr/planete/article/2025/06/14/a-marseille-la-premiere-slow-fashion-week-promeut-une-mode-sobre-et-recyclee_6613022_3244.html,,
La première Slow Fashion Week défend une mode sobre et recyclée  , Article réservé à nos abonnés ,,,,,
"A Paris, Sur Mer met l’iode à la bouche  ", Article réservé à nos abonnés ,,,,,
Quand la mode part en tournée : « Le costume d’une star sur scène est comme un habit de cour »  , Article réservé à nos abonnés ,,,,,
" Dans l’Arctique, un coffre-fort mondial de graines pour pouvoir « recommencer de zéro » en cas de catastrophe planétaire ", Article réservé à nos abonnés ,https://img.lemde.fr/2025/06/06/0/0/4500/3000/664/442/75/0/2b6f75a_sirius-fs-upload-1-cl2ea0x559yk-1749228995163-lm-asurp-globalseedvault-svalbard-109850.jpg,,https://www.lemonde.fr/planete/article/2025/06/14/au-c-ur-de-l-arctique-l-arche-de-noe-du-vegetal-accueille-de-nouvelles-semences_6613047_3244.html,,
"Lenine, chanteur et guitariste brésilien : « Le frevo, j’ai baigné dedans »  ", Article réservé à nos abonnés ,,,https://www.lemonde.fr/culture/article/2025/06/14/lenine-chanteur-et-guitariste-bresilien-le-frevo-j-ai-baigne-dedans_6613029_3246.html,,
"Lenine, chanteur et guitariste brésilien : « Le frevo, j’ai baigné dedans »  ", Article réservé à nos abonnés ,,,,,
La première Slow Fashion Week défend une mode sobre et recyclée  , Article réservé à nos abonnés ,,,,,
"Bedri Baykam, artiste kitsch et engagé, à la galerie S/Beaubourg  ", Article réservé à nos abonnés ,,,,,
Quiz culture générale : auriez-vous le niveau bac en philosophie ?  , Article réservé à nos abonnés ,,,https://www.lemonde.fr/campus/article/2025/06/14/quiz-culture-generale-auriez-vous-le-niveau-bac-en-philosophie_5466138_4401468.html,,
Quiz culture générale : auriez-vous le niveau bac en philosophie ?  ,,,,,,
"A Paris, Sur Mer met l’iode à la bouche  ", Article réservé à nos abonnés ,,,,,
"Associativité, l’énigme maths du « Monde » n° 62  ", Article réservé à nos abonnés ,,,,,
" Bourse : après un semestre agité, les épargnants doivent-ils se replier vers l’Europe ? ", Article réservé à nos abonnés ,https://img.lemde.fr/2025/06/12/116/0/2114/1409/664/442/75/0/02e7660_upload-1-zegwgabiox3g-lemonde-18juin2025.jpg,,https://www.lemonde.fr/argent/article/2025/06/13/bourse-apres-un-semestre-agite-les-epargnants-doivent-ils-se-replier-vers-l-europe_6612665_1657007.html,,
"Epargne : face à un besoin urgent d’argent, où puiser en priorité ?  ", Article réservé à nos abonnés ,,,https://www.lemonde.fr/argent/article/2025/06/13/epargne-face-a-un-besoin-urgent-d-argent-ou-puiser-en-priorite_6612656_1657007.html,,
"Epargne : face à un besoin urgent d’argent, où puiser en priorité ?  ", Article réservé à nos abonnés ,,,,,
Pourquoi l’électricité est-elle rachetée si peu cher aux propriétaires de panneaux photovoltaïques ?  , Article réservé à nos abonnés ,,,,,
Comment sensibiliser les adolescents à la gestion de l’argent  , Article réservé à nos abonnés ,,,,,
 Beaumanoir et Celio reprennent 33 magasins Jennyfer , Article réservé à nos abonnés ,https://img.lemde.fr/2025/06/12/0/6/6036/4024/664/442/75/0/7436862_upload-1-ioejck2vchsq-maxnewsworldsix232390.jpg,,https://www.lemonde.fr/economie/article/2025/06/12/beaumanoir-et-celio-reprennent-33-magasins-jennyfer_6612565_3234.html,,
Les prévisions pour la croissance française rabotées pour la deuxième fois en trois mois par la Banque de France  , Article réservé à nos abonnés ,,,https://www.lemonde.fr/economie/article/2025/06/12/les-previsions-pour-la-croissance-francaise-rabotees-pour-la-deuxieme-fois-en-trois-mois-par-la-banque-de-france_6612472_3234.html,,
Les prévisions pour la croissance française rabotées pour la deuxième fois en trois mois par la Banque de France  ,,,,,,
Négociations sur les retraites : les syndicats prêts à mettre de côté la revendication phare des 64 ans  , Article réservé à nos abonnés ,,,,,
Pourquoi les entreprises soutiennent leurs salariés réservistes dans l’armée  , Article réservé à nos abonnés ,,,,,
"Le sexisme et l’âgisme font perdre plus de 157 000 euros aux femmes sur vingt ans, selon la Fondation des femmes  ", Article réservé à nos abonnés ,,,https://www.lemonde.fr/societe/article/2025/06/12/le-sexisme-et-l-agisme-font-perdre-plus-de-157-000-euros-aux-femmes-sur-vingt-ans-selon-la-fondation-des-femmes_6612495_3224.html,,
"Le sexisme et l’âgisme font perdre plus de 157 000 euros aux femmes sur vingt ans, selon la Fondation des femmes  ",,,,,,
"Hubert Guillaud : « Dans le monde du travail, les algorithmes favorisent une discrimination automatisée »  ", Article réservé à nos abonnés ,,,,,
"Casa France, nouvelle victime de la baisse du marché de l’ameublement, pourrait être placée en liquidation judiciaire  ", Article réservé à nos abonnés ,,,,,
" Immobilier : à Reims, le marché reste calme ", Article réservé à nos abonnés ,https://img.lemde.fr/2025/06/11/0/0/1023/682/664/442/75/0/aeef215_sirius-fs-upload-1-tij9mgvhe3zc-1749630214809-000-34fr96k.jpg,,https://www.lemonde.fr/argent/article/2025/06/14/immobilier-a-reims-le-marche-reste-calme_6612976_1657007.html,,
Municipales à Paris : Rémi Féraud veut débaptiser l’avenue Lamoricière et poursuivre le « travail de mémoire »  , Article réservé à nos abonnés ,,,https://www.lemonde.fr/politique/article/2025/06/13/municipales-2026-a-paris-remi-feraud-veut-debaptiser-l-avenue-lamoriciere-et-poursuivre-le-travail-de-memoire_6612772_823448.html,,
Municipales à Paris : Rémi Féraud veut débaptiser l’avenue Lamoricière et poursuivre le « travail de mémoire »  , Article réservé à nos abonnés ,,,,,
"A Paris, près de la porte de Bagnolet, l’une des dernières imprimeries de la ville reconvertie en vaste hôtel  ", Article réservé à nos abonnés ,,,,,
Au Grand Palais se rejoue la genèse du Centre Pompidou  , Article réservé à nos abonnés ,,,,,
Vers un troisième acte de la rénovation urbaine des quartiers prioritaires  , Article réservé à nos abonnés ,,,https://www.lemonde.fr/societe/article/2025/06/13/vers-un-troisieme-acte-de-la-renovation-urbaine-des-quartiers-populaires_6612684_3224.html,,
Vers un troisième acte de la rénovation urbaine des quartiers prioritaires  , Article réservé à nos abonnés ,,,,,
« Plume de chaleur » : Vérargues a tiré les leçons du coup de chaud record de 2019  , Article réservé à nos abonnés ,,,,,
"Municipales 2026 : à Paris, Pierre-Yves Bournazel croit en son « moment »  ", Article réservé à nos abonnés ,,,,,
 « La rhétorique messianique de Donald Trump risque de se retourner contre lui si l’âge d’or tarde trop à advenir » , Article réservé à nos abonnés ,https://img.lemde.fr/2025/05/30/0/0/6385/4256/664/442/75/0/bdf4027_ftp-import-images-1-r9rqvvsfi5e9-b551515a7cc940eea7615ada2f5c6394-0-a3717ff107fb44c4bad920518d172a44.jpg,,https://www.lemonde.fr/le-monde-des-religions/article/2025/06/08/la-rhetorique-messianique-de-donald-trump-risque-de-se-retourner-contre-lui-si-l-age-d-or-tarde-trop-a-advenir_6611151_6038514.html,,
"« Sous tes pierres, Jérusalem », de Marius Schattner et Frédérique Schillo : heurts en sous-sol dans la Ville sainte  ", Article réservé à nos abonnés ,,,https://www.lemonde.fr/livres/article/2025/06/07/sous-tes-pierres-jerusalem-de-marius-schattner-et-frederique-schillo-heurts-en-sous-sol-dans-la-ville-sainte_6611100_3260.html,,
"« Sous tes pierres, Jérusalem », de Marius Schattner et Frédérique Schillo : heurts en sous-sol dans la Ville sainte  ", Article réservé à nos abonnés ,,,,,
« Le constat d’entrisme témoigne du fait que l’intégration des musulmans a marché »  , Article réservé à nos abonnés ,,,,,
Quelle est la signification de la Pentecôte pour (tous) les chrétiens ?  , Article réservé à nos abonnés ,,,,,
Quatre essais pour découvrir le taoïsme et la spiritualité chinoise  , Article réservé à nos abonnés ,,,https://www.lemonde.fr/le-monde-des-religions/article/2025/06/13/quatre-essais-pour-decouvrir-le-taoisme-et-la-spiritualite-chinoise_6612662_6038514.html,,
Quatre essais pour découvrir le taoïsme et la spiritualité chinoise  , Article réservé à nos abonnés ,,,,,
"« En Israël, la menace mortelle vient aussi de l’intérieur »  ", Article réservé à nos abonnés ,,,,,
"Pèlerinage à La Mecque : qu’est-ce que la Kaaba, cet intrigant cube noir autour duquel tournent des millions de musulmans ?  ", Article réservé à nos abonnés ,,,,,
" Nos choix de podcasts : « cancel culture », balades, bandes-son… ", Article réservé à nos abonnés ,https://img.lemde.fr/2025/06/12/0/81/1038/692/664/442/75/0/119389e_upload-1-ffbswtooqslx-144365-20102017-20171020-5570-mk-mk.jpg,,https://www.lemonde.fr/culture/article/2025/06/14/nos-choix-de-podcasts-cancel-culture-balades-bandes-son_6612926_3246.html,,
Quatre essais pour découvrir le taoïsme et la spiritualité chinoise  , Article réservé à nos abonnés ,,,https://www.lemonde.fr/le-monde-des-religions/article/2025/06/13/quatre-essais-pour-decouvrir-le-taoisme-et-la-spiritualite-chinoise_6612662_6038514.html,,
Quatre essais pour découvrir le taoïsme et la spiritualité chinoise  , Article réservé à nos abonnés ,,,,,
"Cinq expositions scientifiques à ne pas manquer : « Les Maîtres du feu », « Méditerranée 2050 », « Chiens et chats »…  ", Article réservé à nos abonnés ,,,,,
"Nos choix de livres cette semaine : « La Correspondante », « L’Epopée des passeurs », « La Route qui mène au pays »…  ", Article réservé à nos abonnés ,,,,,
"Les films à l’affiche : « Indomptables », « Life of Chuck », « Sister Midnight », « Crasse »…  ", Article réservé à nos abonnés ,,,https://www.lemonde.fr/cinema/article/2025/06/11/les-films-a-l-affiche-indomptables-life-of-chuck-sister-midnight-crasse_6612109_3476.html,,
"Les films à l’affiche : « Indomptables », « Life of Chuck », « Sister Midnight », « Crasse »…  ", Article réservé à nos abonnés ,,,,,
"Les séries de la semaine : « A Life’s Worth », « Les Survivants » et « Une amitié dangereuse »  ", Article réservé à nos abonnés ,,,,,
"Nos idées de concerts et festivals : James Loup, Salif Keita, Kim Deal…  ", Article réservé à nos abonnés ,,,,,
 Israël-Hamas : « Le Monde » face à la guerre des images , Article réservé à nos abonnés ,https://img.lemde.fr/2023/11/28/0/0/7972/5315/664/442/75/0/8b494b3_1701178780683-ap23281394186613.jpg,,https://www.lemonde.fr/le-monde-et-vous/article/2023/11/28/israel-hamas-le-monde-face-a-la-guerre-des-images_6202800_6065879.html,,
Mille et une manières de profiter du « Monde »  ,,,,https://www.lemonde.fr/le-monde-et-vous/article/2023/10/29/mille-et-une-manieres-de-profiter-du-monde_6197214_6065879.html,,
Mille et une manières de profiter du « Monde »  ,,,,,,
La Matinale du Monde fête ses 10 ans : ses lecteurs racontent pourquoi ils ne « peuvent plus s’en passer »  ,,,,,,
La Matinale du Monde a 10 ans : les coulisses de la fabrication d’une édition  ,,,,,,
"A Couthures-sur-Garonne, un festival de journalisme dominé par l’actualité internationale  ",,,,https://www.lemonde.fr/actualite-medias/article/2025/06/14/a-couthures-sur-garonne-un-festival-de-journalisme-domine-par-l-actualite-internationale_6612993_3236.html,,
"A Couthures-sur-Garonne, un festival de journalisme dominé par l’actualité internationale  ",,,,,,
A la Fête de l’écrit : « Cela faisait bien longtemps que je ne m’étais pas servi d’un stylo »  ,,,,,,
"« Ecrire, c’est cheminer avec soi-même, avec le risque de se déplaire et l’espoir de se découvrir »  ",,,,,,
 Les meilleurs mixeurs plongeants ,,https://img.lemde.fr/2024/11/26/0/0/3543/2362/664/442/75/0/02f8fbe_1732629443305-mixeurs-vue-generale-a-ml-frei-chet.jpg,,https://www.lemonde.fr/guides-d-achat/article/2024/11/28/en-relecture-les-meilleurs-mixeurs-plongeants_6418762_5306571.html,,
Les meilleurs aspirateurs balais sans fil  ,,,,https://www.lemonde.fr/guides-d-achat/article/2024/04/25/les-meilleurs-aspirateurs-balais-sans-fil_6229835_5306571.html,,
Les meilleurs aspirateurs balais sans fil  ,,,,,,
Les meilleurs grille-pains  ,,,,,,
Les meilleures lunch box pour la pause déjeuner  ,,,,,,
