title,subhead,URL,premium,image URL,byline,article type
" In Virginia, the world's data center capital faces mounting opposition from local residents  ","This East Coast US state is home to 12% of the world's capacity for the massive data centers essential to AI, which it has attracted largely through tax breaks. Local residents are especially concerned about their environmental impact.",https://www.lemonde.fr/en/economy/article/2026/05/10/in-virginia-the-world-s-data-center-capital-faces-mounting-opposition-from-local-residents_6753298_19.html,Subscribers only,,,
"In Hungary, jubilation marks Péter Magyar's inauguration as prime minister",,https://www.lemonde.fr/en/international/article/2026/05/10/in-hungary-jubilation-marks-peter-magyar-s-inauguration-as-prime-minister_6753299_4.html,Subscribers only,,,
39 in custody in Paris over banned far-right and anti-fascist marches,,https://www.lemonde.fr/en/france/article/2026/05/09/39-in-custody-in-paris-over-banned-far-right-and-anti-fascist-marches_6753293_7.html,,,,
Spanish island braces for arrival of Hantavirus cruise ship,"The MV Hondius, hit by a hantavirus outbreak, is set to anchor off Tenerife, in the Canary Islands, on Sunday. About 80 passengers will be evacuated by Zodiac boats and immediately repatriated by plane. The operation is being overseen by the World Health Organization's director general.",https://www.lemonde.fr/en/international/article/2026/05/09/spanish-island-braces-for-arrival-of-hantavirus-cruise-ship_6753289_4.html,Subscribers only,,,
"Mali: Dozens killed in fresh attacks, say local and security sources",One official said the latest attacks by armed factions like the Al-Qaeda-linked Group for the Support of Islam and Muslims had brought the death toll to over 70 in recent days.,https://www.lemonde.fr/en/international/article/2026/05/10/mali-dozens-killed-in-fresh-attacks-say-local-and-security-sources_6753294_4.html,,,,
Is it really possible to tax oil companies' windfall profits?,"As fuel prices soar, the idea of taxing multinational oil companies' windfall profits has resurfaced. Yet there's heated debate over whether such a tax is actually possible.",https://www.lemonde.fr/en/les-decodeurs/article/2026/05/10/is-it-really-possible-to-tax-oil-companies-windfall-profits_6753295_8.html,Subscribers only,,,
A race to photograph vanishing cinemas,A Swiss cinematographer and filmmaker has traveled the world to document old cinemas and preserve the memory of endangered heritage and striking architecture. Simon Edelstein's latest book focuses on India.,https://www.lemonde.fr/en/m-le-mag/article/2026/05/10/simon-edelstein-s-race-to-photograph-vanishing-cinemas_6753297_117.html,Subscribers only,, Samuel Blumenfeld,Conversation
Israeli strikes in Lebanon kill at least 8 despite ceasefire,,https://www.lemonde.fr/en/middle-east-crisis/article/2026/05/09/israeli-strikes-south-of-beirut-kill-at-least-one-despite-ceasefire_6753290_368.html,,,,
Is it ever a good idea to... coordinate outfits (when you're a couple)?,,https://www.lemonde.fr/en/lifestyle/article/2026/05/10/is-it-ever-a-good-idea-to-coordinate-outfits-when-you-re-a-couple_6753296_37.html,,,,
Russia celebrates Victory Day with lackluster parade,,https://www.lemonde.fr/en/international/article/2026/05/09/putin-celebrates-victory-day-with-lackluster-parade_6753286_4.html,Subscribers only,,,
UK sends warship to Middle East,,https://www.lemonde.fr/en/international/article/2026/05/09/uk-sends-warship-to-middle-east_6753287_4.html,,,,
French Socialists fracture over presidential primary,,https://www.lemonde.fr/en/politics/article/2026/05/09/french-socialists-fracture-over-presidential-primary_6753284_5.html,Subscribers only,,,
US economy persists through trade uncertainty,,https://www.lemonde.fr/en/economy/article/2026/05/09/us-economy-persists-through-trade-uncertainty_6753282_19.html,Subscribers only,,,
First French prototypes that extract CO₂ from the air offer promise and uncertainty,,https://www.lemonde.fr/en/environment/article/2026/05/09/first-french-prototypes-that-extract-co-from-the-air-offer-promise-and-uncertainty_6753279_114.html,Subscribers only,,,
Palestinian President Mahmoud Abbas's maneuvers to  lock in the Fatah congress,,https://www.lemonde.fr/en/international/article/2026/05/09/palestinian-president-mahmoud-abbas-s-maneuvers-to-lock-in-the-fatah-congress_6753272_4.html,Subscribers only,,,
"Bulgaria's new PM unveils roadmap, balancing pro-European and pro-Russian interests",,https://www.lemonde.fr/en/international/article/2026/05/09/bulgaria-s-new-prime-minister-unveils-roadmap-balancing-pro-european-and-pro-russian-interests_6753274_4.html,Subscribers only,,,
Musk lashes out at French judges investigating X,,https://www.lemonde.fr/en/international/article/2026/05/09/musk-lashes-out-at-french-judges-investigating-x_6753281_4.html,Subscribers only,,,
Military deterrence has fully entered 'third nuclear age',,https://www.lemonde.fr/en/international/article/2026/05/08/military-deterrence-has-fully-entered-third-nuclear-age_6753265_4.html,Subscribers only,,,
Annette Messager's exhibition brings her menagerie to life at the Musée de la Chasse et de la Nature,,https://www.lemonde.fr/en/culture/article/2026/05/08/annette-messager-s-a-swallow-does-not-make-spring-exhibition-brings-her-menagerie-to-life-at-the-musee-de-la-chasse-et-de-la-nature_6753254_30.html,Subscribers only,,,
Pedro Almodóvar still burns with desire for cinema,"Born during Madrid's cultural awakening, his work is celebrated around the world. But, despite several appearances at the Cannes Film Festival, Pedro Almodóvar has never won the Palme d'Or. Now 76 years old, the pioneer of Spanish auteur cinema is back in competition with 'Bitter Christmas,' in which he delves into the labyrinth of creation.",https://www.lemonde.fr/en/m-le-mag/article/2026/05/09/cannes-film-festival-2026-spanish-filmmaker-pedro-almodovar-still-burns-with-desire-for-cinema_6753291_117.html,Subscribers only,, Aureliano Tonet,Profile
Leo XIV's return to realism and formalism at the Vatican,"One year after his election as head of the Catholic Church, Pope Leo, Francis's successor, stands out from the Argentine pontiff in his approach, yet maintains a through line on substance.",https://www.lemonde.fr/en/international/article/2026/05/08/leo-xiv-s-return-to-realism-and-formalism-at-the-vatican_6753241_4.html,Subscribers only,, Sarah Belouezzane,In Depth
Six star Japanese products for umami recipes,"These emblematic ingredients of Japanese cuisine are on the menu in these six French-Japanese recipes, accompanied by tips on how to use them easily on a daily basis.",https://www.lemonde.fr/en/lifestyle/article/2026/05/09/six-star-japanese-products-for-umami-recipes_6753292_37.html,Subscribers only,, Camille Labro,Selection
The UK is threatened by the far right,,https://www.lemonde.fr/en/opinion/article/2026/05/09/the-uk-is-under-threat-by-the-far-right_6753288_23.html,Subscribe,,,Editorial
'Germany lacks breakthrough innovation',,https://www.lemonde.fr/en/international/article/2026/05/09/philippa-sigl-glockner-economist-germany-lacks-breakthrough-innovation_6753275_4.html,Subscribe,,,Interview
'Trump is now portrayed by some of his opponents as the Antichrist',,https://www.lemonde.fr/en/religions/article/2026/05/08/trump-is-now-portrayed-by-some-of-his-opponents-as-the-antichrist_6753264_63.html,Subscribe,,,Op-Ed
