title,subhead,URL,premium,image URL,byline,article type
 Climate scientists aren't surprised by summer's record heat: 'We've entered a dangerous zone'  ,"Record heat, historic drought and sweeping wildfires have marked France's 2026 summer. Yet climate scientists mostly see global warming's expected effects playing out. Only the rapid succession of heatwaves has caught them off guard.",https://www.lemonde.fr/en/environment/article/2026/07/21/climate-scientists-aren-t-surprised-by-summer-s-record-heat-we-ve-entered-a-dangerous-zone_6755684_114.html,Subscribers only,,,
"France set to ban social media for under-15s, a first in the EU",,https://www.lemonde.fr/en/france/article/2026/07/21/france-set-to-pass-eu-first-ban-on-social-media-for-under-15s_6755681_7.html,,,,
Iran bets on war of attrition against the US,,https://www.lemonde.fr/en/international/article/2026/07/21/iran-bets-on-war-of-attrition-against-the-us_6755680_4.html,Subscribers only,,,
Burnham enters Downing Street and appoints former defense minister John Healey as chancellor of the Exchequer,"The former mayor of Greater Manchester, who succeeds Keir Starmer, has become the seventh British prime minister in 10 years. Ed Miliband, who had aspired to the chancellorship, was named foreign secretary.",https://www.lemonde.fr/en/international/article/2026/07/21/andy-burnham-enters-downing-street-and-appoints-former-defense-minister-john-healey-as-chancellor-of-the-exchequer_6755671_4.html,Subscribers only,,,
"Two months before Russian parliamentary elections, antiwar voices still struggle for traction","The Kremlin continues to stifle the few parliamentary candidates opposed to the war in Ukraine, even as the public and some industrialists begin to imagine peace.",https://www.lemonde.fr/en/international/article/2026/07/21/two-months-before-russian-parliamentary-elections-antiwar-voices-still-struggle-for-traction_6755677_4.html,Subscribers only,,,
"Between China and the US, a new diplomacy of detainees emerges","Alongside the major issues discussed between the world's two leading powers, the fate of American citizens imprisoned in China on espionage charges has also become a bargaining chip.",https://www.lemonde.fr/en/international/article/2026/07/21/between-china-and-the-us-a-new-diplomacy-of-detainees-emerges_6755667_4.html,Subscribers only,,,
"Bernard Arnault, a 'free-marketeer' who whispers in the ear of every president","'Bernard Arnault's Empire' (2/6). LVMH's boss has never hidden his allegiance to France's pro-business, establishment right. He's close to fellow billionaire Vincent Bolloré and, above all, pragmatic. Now he's preparing for the far right's rise to power.",https://www.lemonde.fr/en/summer-reads/article/2026/07/21/bernard-arnault-a-free-marketeer-who-whispers-in-the-ear-of-every-president_6755675_183.html,Subscribers only,, Raphaëlle Bacqué and  Vanessa Schneider,Investigation
"Laurent Nuñez, French interior minister: 'Trusting police officers and gendarmes never means shielding them from judicial oversight'",,https://www.lemonde.fr/en/opinion/article/2026/07/21/laurent-nunez-french-interior-minister-trusting-police-officers-and-gendarmes-never-means-shielding-them-from-judicial-oversight_6755679_23.html,Subscribers only,,,
Repeated heatwaves fuel eco-anxiety and anger among youth: 'It feels like we're living in a dystopia',,https://www.lemonde.fr/en/campus/article/2026/07/21/repeated-heatwaves-fuel-eco-anxiety-and-anger-among-youth-it-feels-like-we-re-living-in-a-dystopia_6755674_11.html,Subscribers only,,,
Climate change: Why the ECB refuses to create a lower interest rate for green investments,,https://www.lemonde.fr/en/economy/article/2026/07/21/climate-change-why-the-ecb-refuses-to-create-a-lower-interest-rate-for-green-investments_6755672_19.html,Subscribers only,,,
Is air conditioning good or bad? Join this (fake) group chat for (real) analysis,,https://www.lemonde.fr/en/les-decodeurs/article/2026/07/10/is-air-conditioning-good-or-bad-join-this-fake-group-chat-for-real-analysis_6755351_8.html,Subscribers only,,,
France's must-see art exhibitions this summer,,https://www.lemonde.fr/en/culture/article/2026/07/19/france-s-must-see-art-exhibitions-this-summer_6755615_30.html,Subscribers only,,,
Far-right mayor cancels show dedicated to Queen in Southern France,,https://www.lemonde.fr/en/culture/article/2026/07/21/far-right-mayor-cancels-show-dedicated-to-queen-in-southern-france_6755683_30.html,Subscribers only,,,
"In southern Lebanon hospital, caregivers strive to overcome traumas of war",,https://www.lemonde.fr/en/international/article/2026/07/21/in-southern-lebanon-at-the-secours-populaire-hospital-in-nabatieh-caregivers-strive-to-overcome-the-traumas-of-war_6755669_4.html,Subscribers only,,,
"Cleanliness in Paris: Study reveals 1,412 spots left systematically unclean",,https://www.lemonde.fr/en/politics/article/2026/07/20/cleanliness-in-paris-study-reveals-1-412-spots-left-systematically-unclean_6755662_5.html,Subscribers only,,,
Spain stars celebrate with adoring fans at World Cup parade of around two million in Madrid,,https://www.lemonde.fr/en/sports/article/2026/07/21/spain-stars-celebrate-with-adoring-fans-at-world-cup-parade-of-around-two-million-in-madrid_6755673_9.html,,,,
Two tourists stabbed near Acropolis in rare Athens knife attack,,https://www.lemonde.fr/en/international/article/2026/07/21/two-tourists-stabbed-near-acropolis-in-rare-athens-knife-attack_6755682_4.html,,,,
Guinea asks France to return colonization-era looted manuscripts,,https://www.lemonde.fr/en/international/article/2026/07/20/guinea-asks-france-to-return-colonization-era-looted-manuscripts_6755654_4.html,Subscribers only,,,
Seafood and veggie tide inundates dining tables on the Basque coast,,https://www.lemonde.fr/en/lifestyle/article/2026/05/01/seafood-and-veggie-tide-inundates-dining-tables-on-the-basque-coast_6753036_37.html,Subscribers only,,,
Didier Deschamps bids farewell to French team after spectacular World Cup defeat,"The coach stepped down after a dramatic 6-4 loss in the World Cup third-place match against England on Saturday. Over his 14 years in the role, he nonetheless managed to restore France to the pinnacle of world football.",https://www.lemonde.fr/en/sports/article/2026/07/19/didier-deschamps-bids-farewell-to-france-after-spectacular-world-cup-defeat_6755623_9.html,Subscribers only,, Denis Ménétrier,News
"French 'libertines' rapes case: From livestreams to camp sites, where the sexual crimes took place","Christophe B. and many other men he recruited are accused of raping women, with these sexual assaults broadcast online and in public. Responsibility is now being called into question. This is the final part of our investigation into the French 'libertines' rapes case.",https://www.lemonde.fr/en/france/article/2026/07/20/french-libertines-rapes-case-from-livestreams-to-camp-sites-where-the-sexual-crimes-took-place_6755660_7.html,Subscribers only,," Jérôme Lefilliâtre,  Lorraine de Foucher  and  Morgane Tual",Investigation
"Inside the court of France's richest man, Bernard Arnault",'Bernard Arnault's Empire' (1/6). The billionaire at the head of LVMH is as secretive as he is powerful. He relies on a devoted entourage in which a mix of fear and admiration prevails.,https://www.lemonde.fr/en/summer-reads/article/2026/07/19/bernard-arnault-inside-the-court-of-france-s-richest-man_6755617_183.html,Subscribers only,, Raphaëlle Bacqué and  Vanessa Schneider,Investigation
'Can we continue to entrust global sport to organizations more concerned with their financial interests than with the public good?',,https://www.lemonde.fr/en/opinion/article/2026/07/19/can-we-continue-to-entrust-global-sport-to-organizations-more-concerned-with-their-financial-interests-than-with-the-public-good_6755619_23.html,Subscribe,,,Op-Ed
"In a world in turmoil, 'Hamlet' has never been more relevant",,https://www.lemonde.fr/en/opinion/article/2026/07/19/in-a-world-in-turmoil-hamlet-has-never-been-more-relevant_6755613_23.html,Subscribe,,,News analysis
"'We are trapped in a climate dystopia, a black comedy scenario, where the grotesque rivals the Orwellian farce'",,https://www.lemonde.fr/en/opinion/article/2026/07/18/we-are-trapped-in-a-climate-dystopia-a-black-comedy-scenario-where-the-grotesque-rivals-the-orwellian-farce_6755609_23.html,Subscribe,,,Column
