title,subhead,URL,premium,image URL,byline,article type
 Oil market gripped by record volatility and speculation since start of Middle East war  ,"Brent crude and diesel prices have surged since the start of the US-Israeli military intervention in Iran. Behind the scenes, major trading firms and oil giants have monitored every move of oil tankers and watched closely for any drone attack.",https://www.lemonde.fr/en/economy/article/2026/03/26/oil-market-gripped-by-record-volatility-and-speculation-since-start-of-middle-east-war_6751843_19.html,Subscribers only,,,
"War in Iran: At the G7, Canada and its partners want clarification from Washington",,https://www.lemonde.fr/en/international/article/2026/03/26/war-in-iran-at-the-g7-canada-and-its-partners-want-clarification-from-washington_6751848_4.html,Subscribers only,https://img.lemde.fr/2026/03/12/88/0/3000/2000/398/265/75/0/637e312_ftp-1-mzosvz3pslhj-ae31aa7b9f7d491da757498f2dbf7068-1-769b875233564c2b8f8927023ed81e46.jpg,,
United States and Israel are facing the same Iranian foe but are fighting different wars,,https://www.lemonde.fr/en/international/article/2026/03/27/united-states-and-israel-are-facing-the-same-iranian-foe-but-are-fighting-different-wars_6751849_4.html,Subscribers only,https://img.lemde.fr/2026/03/23/0/0/6000/4000/398/265/75/0/229139f_ftp-1-3blbcrwhuh70-2026-03-23t143832z-1631909401-rc2bakahfmj6-rtrmadp-3-iran-crisis-aftermath.JPG,,
Baltic states fear Ukraine war could spill over onto their territory,"Two Ukrainian drones launched against Russia accidentally landed in Estonia and Latvia. This incident comes as the scenario of a fictional pro-Russian republic, orchestrated by Moscow to justify a military intervention, spreads in the Baltic states.",https://www.lemonde.fr/en/international/article/2026/03/26/baltic-states-fear-ukraine-war-could-spill-over-onto-their-territory_6751846_4.html,Subscribers only,https://img.lemde.fr/2026/03/26/0/0/5976/3984/398/265/75/0/9278fae_upload-1-9p85nbwjmudv-000-93zd2zw.jpg,,
French spirits giant Pernod Ricard in merger talks with Jack Daniel's owner,"The discussions come as the alcohol sector faces a difficult global environment, with consumption falling among younger drinkers and new tariffs – particularly in the United States – hurting major producers. Pernod Ricard has been especially affected by US duties.",https://www.lemonde.fr/en/economy/article/2026/03/27/french-spirits-giant-pernod-ricard-in-merger-talks-with-jack-daniel-s-owner_6751850_19.html,,https://img.lemde.fr/2026/03/26/0/0/5569/3713/398/265/75/0/edf10f5_ftp-1-w1elnafoct7q-2026-03-26t172315z-647049850-rc2xcba3yr1h-rtrmadp-3-brown-forman-m-a-pernod.JPG,,
Napoleon's long-lost hat to go on display,"Made by Poupard, Napoleon's official hatmaker, the headpiece displays all the hallmark features of an authentic imperial bicorne, including its distinctive proportions, a small tricolor cockade and a silk-taffeta lining. It will be exhibited at the Chateau de Chantilly, north of Paris, later in the year.",https://www.lemonde.fr/en/france/article/2026/03/26/napoleon-s-long-lost-hat-to-go-on-display_6751842_7.html,,https://img.lemde.fr/2026/03/26/0/0/4999/3333/398/265/75/0/ac70bba_ftp-1-skaf3edmqq6u-5593835-01-06.jpg,,
They were adopted and raised middle-class. France saw them as Black and Arab,"Youssef Dridi and Eyob Bressy, both adopted and raised by families with significant cultural capital in the Paris region, share how, from adolescence, they experienced discrimination due to their skin color.",https://www.lemonde.fr/en/france/article/2026/03/26/they-were-adopted-and-raised-middle-class-france-saw-them-as-black-and-arab_6751844_7.html,Subscribers only,https://img.lemde.fr/2026/03/25/0/0/6720/4480/664/442/75/0/14ce766_upload-1-cpuvuf8nqqe1-eyob-et-toussef-alcock-019.JPG, Louise Couvelaire,Your stories
Trump pushes back deadline for strikes on Iran's energy assets,,https://www.lemonde.fr/en/international/article/2026/03/26/israel-strikes-iran-as-tehran-denies-trump-s-alleged-us-iran-talks_6751825_4.html,,https://img.lemde.fr/2026/03/24/0/0/6000/4000/198/132/95/0/62fde2d_ftp-1-vjmkt5skll6n-3d310a4db2ef4307971ddf0124eb6f6e-0-c92ae7e4d22845d0b9a1c3b3803e4363.jpg,,
"Israeli army calls for more troops on Lebanese front, opposition warns shortage could trigger 'security disaster'",,https://www.lemonde.fr/en/international/article/2026/03/26/israeli-army-calls-for-more-troops-on-lebanese-front-opposition-warns-shortage-could-trigger-security-disaster_6751845_4.html,,https://img.lemde.fr/2026/03/26/0/0/3991/2661/198/132/95/0/9fb570d_ftp-1-70dbqnh3ojys-2026-03-26t190556z-731533931-rc2dcka9l3pu-rtrmadp-3-iran-crisis-lebanon.JPG,,
US currency to bear Trump's signature in first for sitting president,,https://www.lemonde.fr/en/international/article/2026/03/26/us-currency-to-bear-trump-s-signature-in-first-for-sitting-president_6751847_4.html,,https://img.lemde.fr/2026/03/20/0/112/5737/3825/198/132/95/0/13cfba7_ftp-1-fiqp50eeswaa-5533280-01-06.jpg,,
"Volodymyr Zelensky: 'The pressure on Russia is insufficient. Not only from the US, but also from Europe'",,https://www.lemonde.fr/en/international/article/2026/03/26/volodymyr-zelensky-the-pressure-on-russia-is-insufficient-not-only-from-the-us-but-also-from-europe_6751827_4.html,Subscribers only,https://img.lemde.fr/2026/03/25/665/0/4430/2953/198/132/95/0/9a72c14_upload-1-avvyukeajdzv-zelensky-rajh-30.jpg,,
Islamic scholar Ramadan sentenced to 18 years in prison for raping three women in 'campaign of psychological destruction',,https://www.lemonde.fr/en/france/article/2026/03/26/islamic-scholar-ramadan-sentenced-to-18-years-in-prison-for-raping-three-women-in-campaign-of-psychological-destruction_6751838_7.html,Subscribers only,,,
Night train service resumes between Paris and Berlin,,https://www.lemonde.fr/en/economy/article/2026/03/26/night-train-service-resumes-between-paris-and-berlin_6751818_19.html,Subscribers only,,,
Sarkozy minister's defense unsettled by memo in Libyan campaign funding appeal,,https://www.lemonde.fr/en/france/article/2026/03/26/sarkozy-minister-s-defense-unsettled-by-memo-in-libyan-campaign-funding-appeal_6751834_7.html,Subscribers only,,,
Thierry Breton: 'A golden rule limiting the public deficit to 1% of GDP must be enshrined in the French Constitution by 2032',,https://www.lemonde.fr/en/opinion/article/2026/03/26/thierry-breton-a-golden-rule-limiting-the-public-deficit-to-1-of-gdp-by-2032-must-be-enshrined-in-the-french-constitution_6751823_23.html,Subscribers only,,,
South Africa says disinvited from G7 summit after US pressured France,,https://www.lemonde.fr/en/international/article/2026/03/26/south-africa-says-disinvited-from-g7-summit-after-us-pressured-france_6751835_4.html,,,,
Why the Greens lost several major cities in France's municipal elections,,https://www.lemonde.fr/en/politics/article/2026/03/26/why-the-greens-lost-several-major-cities-in-france-s-municipal-elections_6751828_5.html,Subscribers only,,,
IOC brings back gender testing for 2028 Summer Olympics,,https://www.lemonde.fr/en/sports/article/2026/03/26/ioc-brings-back-gender-testing-for-2028-summer-olympics_6751833_9.html,,,,
EU accuses four porn sites of allowing children access adult content,,https://www.lemonde.fr/en/international/article/2026/03/26/eu-accuses-four-porn-sites-of-allowing-children-access-adult-content_6751841_4.html,,,,
Regular exchanges between Hungarian and Russian foreign ministers spark scandal in Brussels,"According to several media outlets, Péter Szijjarto was providing real-time updates to Sergey Lavrov on the content of discussions within the European Union's Foreign Affairs Council.",https://www.lemonde.fr/en/international/article/2026/03/26/regular-exchanges-between-hungarian-and-russian-foreign-ministers-spark-scandal-in-brussels_6751820_4.html,Subscribers only,https://img.lemde.fr/2026/03/23/0/0/5500/3666/664/442/75/0/d60e9be_ftp-1-gwqji9rauhrb-2026-03-23t112156z-875605723-rc205kaucp5f-rtrmadp-3-hungary-election-minister.JPG, Philippe Jacqué,News
The serial-poisoning mother and daughter inspired by 'Breaking Bad',"Castor beans, wolfsbane, antifreeze, rat poison: Carole D. and Amélie D. considered every possible method to poison the former's partner, Enrique B. The two women are set to stand trial before a criminal court in western France starting March 25.",https://www.lemonde.fr/en/france/article/2026/03/25/the-serial-poisoning-mother-and-daughter-inspired-by-breaking-bad_6751792_7.html,Subscribers only,https://img.lemde.fr/2026/03/17/1074/211/1574/1049/664/442/75/0/bbd766e_upload-1-t0z7hf5d0jzd-media-a.jpg, Pascale Robert-Diard,Investigation
Emmanuel Grégoire's long run to Paris City Hall,"The next mayor of Paris, who will be officially elected by the city council on Sunday, will now step into the spotlight after years in the shadow of his political mentors.",https://www.lemonde.fr/en/politics/article/2026/03/24/emmanuel-gregoire-s-long-run-to-paris-city-hall_6751761_5.html,Subscribers only,https://img.lemde.fr/2026/03/23/0/0/5500/3666/664/442/75/0/96afcad_upload-1-8sihgq6hw7iq-ad082-municipales-ii-dsc06390.jpg, Hélène Bekmezian,Profile
Trump faces the trap of escalation in Iran,,https://www.lemonde.fr/en/opinion/article/2026/03/26/trump-faces-the-trap-of-escalation-in-iran_6751840_23.html,,,,Editorial
"Pierre Buhler, former diplomat: We are witnessing 'a worrying crack in the European edifice'",,https://www.lemonde.fr/en/opinion/article/2026/03/26/pierre-buhler-former-diplomat-we-are-witnessing-a-worrying-crack-in-the-european-edifice_6751816_23.html,Subscribe,,,Op-Ed
France's traditional parties dream of a return to the classic left-right contest,,https://www.lemonde.fr/en/opinion/article/2026/03/24/france-s-traditional-parties-dream-of-a-return-to-the-classic-left-right-contest_6751757_23.html,Subscribe,https://img.lemde.fr/2023/07/06/0/0/0/0/100/100/60/0/bee4e6c_1688634540522-73f3cca-40.jpg,,Column
