title,subhead,URL,premium,image URL,byline,article type
         Liveblog  Article in live   French municipal elections: Socialist Emmanuel Grégoire leads Paris mayor race  ,"Voters headed back to the polls in Paris, Lyon, Marseille and cities across France to elect their municipal councils and mayors for the next six years. Follow live coverage of the results here.",https://www.lemonde.fr/en/france/live/2026/03/22/french-municipal-elections-follow-results-live_6751701_7.html, Subscribers only ,,,
Italy's Meloni seeks new momentum with a referendum on judiciary,Italian voters will head to the polls Sunday and Monday to decide on a reform of the judiciary. The vote has all the trappings of a plebiscite for the Italian prime minister. The campaign has been marked by intense polarization and a heavy political climate.,https://www.lemonde.fr/en/international/article/2026/03/22/italy-s-seeks-new-momentum-with-a-referendum-on-judiciary_6751700_4.html,Subscribers only,https://img.lemde.fr/2026/03/20/0/0/8256/5504/398/265/75/0/aeed01f_ftp-1-4856i4vlm28i-5536724-01-06.jpg,,
"Dnipro, the 'heart of Ukraine' where residents, refugees and military live side by side","This industrial city, considered a stronghold of the Jewish community, embodies the country's history and a certain idea of resistance to the advances of the Russian army, four years after the start of the war.",https://www.lemonde.fr/en/international/article/2026/03/22/dnipro-the-heart-of-ukraine-where-residents-refugees-and-military-live-side-by-side_6751695_4.html,Subscribers only,https://img.lemde.fr/2026/03/02/1/0/4300/2866/398/265/75/0/e600c2c_upload-1-rsfscddoc65z-portrait-ville-de-dnipro-13.jpg,,
"Abou Sangare, from film awards to construction sites and back","The former undocumented immigrant, crowned most promising male newcomer at the 2025 César awards for his role in 'Souleymane's Story,' was rumored to have been abandoned by the film industry. But Sangare continues to audition and refuses to be cast as a 'victim.'",https://www.lemonde.fr/en/culture/article/2026/03/22/abou-sangare-from-film-awards-to-construction-sites-and-back_6751703_30.html,Subscribers only,https://img.lemde.fr/2026/03/16/633/0/3698/2465/398/265/75/0/1afc401_upload-1-vsa4cmukuuqf-csharrock-abousangare-17.jpg,,
Charif Majdalani: Lebanon is 'truly being dragged against its will into new calamities',"'Writers on the War in the Middle East' 2/4. Le Monde asked writers Taleb Alrefai, Charif Majdalani and Lila Azam Zanganeh for their perspectives on the war.",https://www.lemonde.fr/en/books/article/2026/03/22/charif-majdalani-lebanon-is-truly-being-dragged-against-its-will-into-new-calamities_6751698_33.html,Subscribers only,https://img.lemde.fr/2026/03/18/0/0/3004/2003/664/442/75/0/764ed2e_upload-1-qjkravs05zgo-iran-jour2.jpg," Charif Majdalani,  Lila Azam Zanganeh and  Taleb Alrefai",Series
US and Iran trade threats of expanding war after strikes near sites tied to nuclear programs,,https://www.lemonde.fr/en/international/article/2026/03/22/us-and-iran-trade-threats-of-expanding-war-after-strikes-near-sites-tied-to-nuclear-programs_6751697_4.html,,https://img.lemde.fr/2026/03/22/1/0/5900/3933/198/132/95/0/9e8fd7b_ftp-1-7y38g5gklxn0-2026-03-22t124703z-1825701970-rc2m9kalac93-rtrmadp-3-iran-crisis-israel.JPG,,
India faces major gas shortage as Middle East conflict disrupts supply,,https://www.lemonde.fr/en/economy/article/2026/03/22/india-faces-major-gas-shortage-as-middle-east-conflict-disrupts-supply_6751694_19.html,Subscribers only,https://img.lemde.fr/2026/03/18/50/0/3000/2000/198/132/95/0/cf0d9c1_upload-1-2chnihlnrkz5-075-rout-notitle260316-npvz5.jpg,,
Cuba restores power after second blackout in a week,,https://www.lemonde.fr/en/international/article/2026/03/22/cuba-hit-by-second-nationwide-blackout-in-a-week_6751687_4.html,,https://img.lemde.fr/2026/03/22/0/1/5115/3410/198/132/95/0/f61fde7_ftp-1-fwvucce7vrfl-5553851-01-06.jpg,,
El Niño's likely return sparks fears of worsening climate crisis,,https://www.lemonde.fr/en/environment/article/2026/03/22/el-nino-s-likely-return-sparks-fears-of-worsening-climate-crisis_6751693_114.html,Subscribers only,https://img.lemde.fr/2026/03/20/0/0/4000/2666/198/132/95/0/7f65073_upload-1-dcll8yaofmbb-000-34px8nz.jpg,,
Russia resumes use of space launch site damaged in accident,,https://www.lemonde.fr/en/international/article/2026/03/22/russia-resumes-use-of-space-launch-site-damaged-in-accident_6751699_4.html,,https://img.lemde.fr/2026/03/22/0/281/3037/2025/198/132/95/0/5f1cbd4_ftp-1-ciphu8nj1ofy-2026-03-22t124821z-699806283-rc2o9ka6mzam-rtrmadp-3-space-iss-launch.JPG,,
"Slovenia votes in tight polls, with conservatives eyeing comeback",,https://www.lemonde.fr/en/international/article/2026/03/22/slovenia-votes-in-tight-polls-with-conservatives-eyeing-comeback_6751692_4.html,,https://img.lemde.fr/2026/03/22/0/0/8256/5504/198/132/95/0/7837a02_ftp-1-4niol23vqg1b-ed8855599ea24240a240dc1a7a4409f0-0-c8b9c86a64e94a22bc1d0ac2c133ef88.jpg,,
Polluted drinking water takes center stage in Denmark's election campaign,,https://www.lemonde.fr/en/environment/article/2026/03/22/polluted-drinking-water-takes-center-stage-in-denmark-s-election-campaign_6751690_114.html,Subscribers only,,,
Trump settles scores with former prosecutor Robert Mueller following news of his death,,https://www.lemonde.fr/en/obituaries/article/2026/03/22/trump-settles-scores-with-former-prosecutor-robert-mueller-following-news-of-his-death_6751689_15.html,Subscribers only,,,
Is anti-scooter sentiment fueled by class contempt?,,https://www.lemonde.fr/en/france/article/2026/03/22/is-anti-scooter-sentiment-fueled-by-class-contempt_6751683_7.html,Subscribers only,,,
London exhibit highlights a meeting between two major suffragettes,,https://www.lemonde.fr/en/international/article/2026/03/22/london-exhibit-highlights-a-meeting-between-two-major-suffragettes_6751684_4.html,Subscribers only,,,
"Pesticides, pharmaceuticals and industrial chemicals found everywhere in seawater",,https://www.lemonde.fr/en/environment/article/2026/03/22/pesticides-pharmaceuticals-and-industrial-chemicals-found-everywhere-in-seawater_6751696_114.html,Subscribers only,,,
The truffle epidemic: 'I'm worried we'll soon have truffle shampoo',,https://www.lemonde.fr/en/m-le-mag/article/2026/03/22/the-truffle-epidemic-i-m-worried-we-ll-soon-have-truffle-shampoo_6751681_117.html,Subscribers only,,,
The UAE reorganizes its arms supply network for Sudanese paramilitaries,,https://www.lemonde.fr/en/le-monde-africa/article/2026/03/22/the-uae-is-reorganizing-its-arms-supply-network-for-sudanese-paramilitaries_6751682_124.html,Subscribers only,,,
Why the municipal vote matters for the senatorial elections later this year,,https://www.lemonde.fr/en/les-decodeurs/article/2026/03/22/why-france-s-local-elections-matter-for-the-senatorial-elections-later-this-year_6751685_8.html,,,,
Soaring ammunition cost turns Iran conflict into 'war of stockpiles',"The daily interception of thousands of missiles and drones launched by Tehran over the past three weeks has put severe strain on already limited reserves. The situation is particularly critical for France, which is bound by defense agreements with several Middle Eastern countries.",https://www.lemonde.fr/en/international/article/2026/03/21/soaring-ammunition-cost-turns-iran-conflict-into-war-of-stockpiles_6751667_4.html,Subscribers only,https://img.lemde.fr/2026/03/07/0/0/3600/2400/664/442/75/0/b9b1e3b_ftp-1-whhk0qpk7y5z-2026-03-07t091059z-1534388852-rc25zjarb712-rtrmadp-3-iran-crisis-britain.JPG, Chloé Hoorman and  Elise Vincent,In Depth
"Despite exhaustion and fear of Iranian strikes, Israelis continue to support warring government","Nearly 80% of the population continues to support Benjamin Netanyahu's government after three weeks of conflict with Iran, fueled by the authorities' repeated announcements of victory.",https://www.lemonde.fr/en/international/article/2026/03/21/despite-exhaustion-and-fear-of-iranian-strikes-israelis-continue-to-support-warring-government_6751670_4.html,Subscribers only,https://img.lemde.fr/2026/03/20/0/0/4999/3333/664/442/75/0/9cb6f13_upload-1-lgf00uiha65r-jo-ramat-gan-009-20260318.jpg, Luc Bronner,Feature
French bitcoin evangelical Eric Larchevêque wants his right-wing voice to be part of public debate,"Known to the public as a judge on a television show, the French bitcoin pioneer wants to win over the masses to the cryptocurrencies that made him wealthy. With the 2027 presidential election approaching, this libertarian has embraced increasingly radical ideas.",https://www.lemonde.fr/en/m-le-mag/article/2026/03/21/french-bitcoin-evangelical-eric-larcheveque-wants-his-right-wing-voice-to-be-part-of-public-debate_6751676_117.html,Subscribers only,https://img.lemde.fr/2026/03/06/417/0/1000/666/664/442/75/0/619a567_ftp-1-af2xcwbnvulj-419148-3462095.jpg, Gaspard Dhellemmes,Profile
Energy crises must accelerate the fight against climate change,,https://www.lemonde.fr/en/opinion/article/2026/03/21/energy-crises-must-accelerate-the-fight-against-climate-change_6751671_23.html,,,,Editorial
"'With Operation Epic Fury, the US turns pop culture into the language of Pentagon violence'",,https://www.lemonde.fr/en/opinion/article/2026/03/21/with-operation-epic-fury-the-us-turns-pop-culture-into-the-language-of-pentagon-violence_6751660_23.html,Subscribe,,,Op-Ed
'The war scripted by Trump is being tested by an Iranian regime determined to survive at any cost',,https://www.lemonde.fr/en/opinion/article/2026/03/18/the-war-as-scripted-by-donald-trump-is-now-being-tested-by-an-iranian-regime-that-is-determine-to-survive-at-any-cost_6751555_23.html,Subscribe,https://img.lemde.fr/2022/03/18/0/0/0/0/100/100/60/0/bfe4dc9_1647595527633-f2df5fa-237.jpeg,,Column
