title,subhead,URL,premium,image URL,byline,article type
" Iran's neighbors, under drone attacks, confront their vulnerability  ","Lacking experience in countering kamikaze drones, especially the infamous Shahed models, the Gulf countries have shown how unprepared they were for the threat posed by Iran, which is determined to exploit their vulnerability.",https://www.lemonde.fr/en/international/article/2026/03/04/iran-s-neighbors-under-drone-attacks-confront-their-vulnerability_6751084_4.html,Subscribers only,,,
US says it is nearing 'complete control' of Iran airspace,"Defense Secretary Pete Hegseth said the US and Israel 'will have complete control of Iranian skies, uncontested airspace.' Trump, meanwhile, rated the US performance in the war with Iran as a '15' on 'a scale of 10,' saying the Islamic Republic's leaders were rapidly being killed and that Tehran's arsenal of ballistic missiles was also being 'wiped out.'",https://www.lemonde.fr/en/international/article/2026/03/04/us-says-it-is-nearing-complete-control-of-iran-airspace_6751107_4.html,,https://img.lemde.fr/2026/03/04/0/205/2209/1473/398/265/75/0/5f5f9a4_ftp-1-65f8lcwjtab3-e551706ac18c4583bb22326b6bb0f9c9-0-f42f5747f9db49d5b901394f8542397d.jpg,,
Macron says he urged Netanyahu to 'refrain from a ground offensive' in Lebanon,"The French president said he also spoke with Lebanon's president and prime minister, stressing the need for the Iran-backed militant group Hezbollah to 'immediately cease its attacks against Israel and beyond.'  Meanwhile, the leader of Hezbollah vowed to keep up its fight against Israel, whose forces advanced in Lebanon for a third day.",https://www.lemonde.fr/en/international/article/2026/03/04/macron-urges-netanyahu-to-refrain-from-a-ground-offensive-in-lebanon_6751105_4.html,,https://img.lemde.fr/2026/03/04/333/0/5000/3333/398/265/75/0/d3d06fa_upload-1-r2yv8u2jrlrt-d3d06fa-upload-1-o0b2wmq9fofw-kzihnioglu-pol-macron-vo-brest-ile-longue-02032026-141.JPG,,
"For Lebanon's displaced, a bitter sense of déjà vu","The government reports that more than 58,000 people have fled their homes since the outbreak of the latest war between Israel and Hezbollah.",https://www.lemonde.fr/en/international/article/2026/03/05/for-lebanon-s-displaced-a-bitter-sense-of-deja-vu_6751111_4.html,Subscribers only,https://img.lemde.fr/2026/03/02/0/0/6000/4000/398/265/75/0/948e08a_ftp-1-uoim66s5huq4-76dacc3e2dda46f5bfdc0485126fd114-0-66410c1527b64d059b1ee2da99d2cd65.jpg,,
'A war justified once again by a lie turns into a race against the clock for Donald Trump',"The third American war waged in the Middle East by a president of the United States bears little resemblance to the previous ones, observes Le Monde's columnist Gilles Paris.",https://www.lemonde.fr/en/opinion/article/2026/03/04/a-war-justified-once-again-by-a-lie-turns-into-a-race-against-the-clock-for-donald-trump_6751104_23.html,Subscribers only,https://img.lemde.fr/2026/03/01/0/0/4476/2984/664/442/75/0/da22a39_ftp-1-97t2cx5azvkq-5337126-01-06.jpg, Gilles Paris,Column
Trump and Venezuela's Rodriguez exchange lavish praise amid oil partnership,,https://www.lemonde.fr/en/international/article/2026/03/05/trump-and-venezuela-s-rodriguez-exchange-lavish-praise-amid-oil-partnership_6751110_4.html,,https://img.lemde.fr/2026/03/04/26/0/5630/3753/198/132/95/0/d609537_ftp-1-phukbieno36m-5368090-01-06.jpg,,
"Iran's participation in the 2026 World Cup threatened by Middle East war, less than 100 days before kick-off",,https://www.lemonde.fr/en/sports/article/2026/03/05/iran-s-participation-in-the-2026-world-cup-threatened-by-middle-east-war-less-than-100-days-before-kick-off_6751109_9.html,Subscribers only,https://img.lemde.fr/2026/03/04/0/0/3640/2427/198/132/95/0/6de65c0_ftp-1-a9aluhd7lbhj-5358840-01-06.jpg,,
"Two-thirds of Cuba, including Havana, hit by blackout",,https://www.lemonde.fr/en/international/article/2026/03/04/two-thirds-of-cuba-including-havana-hit-by-blackout_6751106_4.html,,https://img.lemde.fr/2026/03/03/0/0/4514/3009/198/132/95/0/64d9e32_ftp-1-tkhmmntcxop6-5357807-01-06.jpg,,
'DTF St. Louis' on HBO Max: Jason Bateman and David Harbour star in a deadly 'bromance',,https://www.lemonde.fr/en/culture/article/2026/03/05/dtf-st-louis-on-hbo-max-jason-bateman-and-david-harbour-star-in-a-deadly-bromance_6751112_30.html,Subscribers only,https://img.lemde.fr/2026/03/03/0/0/6000/4000/198/132/95/0/7387009_upload-1-kug2zp99tszv-dtf-st-louisa-1.jpg,,
"In rural France, a grisly death and a lingering question: Which of the dogs killed her?",,https://www.lemonde.fr/en/france/article/2026/03/04/in-rural-france-a-grisly-death-and-a-lingering-question-which-of-the-dogs-killed-her_6751108_7.html,Subscribers only,https://img.lemde.fr/2026/03/03/0/0/4293/2862/198/132/95/0/7b3b3ee_ftp-1-riqdnrbfaunu-5353892-01-06.jpg,,
European Commission banks on 'Made in Europe' to save local industries,,https://www.lemonde.fr/en/economy/article/2026/03/04/european-commission-banks-on-made-in-europe-to-save-local-industries_6751103_19.html,Subscribers only,https://img.lemde.fr/2026/03/04/0/0/7386/4924/198/132/95/0/c49dd96_upload-1-1skiwrtijdkg-000-97284wf.jpg,,
"In the West Bank's Qaryout, a Palestinian village is besieged by settlers",,https://www.lemonde.fr/en/international/article/2026/03/04/in-the-west-bank-s-qaryout-a-palestinian-village-is-besieged-by-settlers_6751100_4.html,Subscribers only,,,
"In Dubai, French influencers experience new reality under Iranian strikes",,https://www.lemonde.fr/en/m-le-mag/article/2026/03/04/in-dubai-french-influencers-experience-new-reality-under-iranian-strikes_6751096_117.html,Subscribers only,,,
How Iran secretly acquired facial recognition technology through a Russian company,,https://www.lemonde.fr/en/investigations/article/2026/03/04/how-iran-secretly-acquired-facial-recognition-technology-through-a-russian-company_6751079_231.html,Subscribers only,,,
"Beirut hotel hit, six killed as Israel launches 'broad wave of strikes'",,https://www.lemonde.fr/en/international/article/2026/03/04/israeli-strike-hits-beirut-hotel_6751078_4.html,,,,
James Talarico wins Democratic US Senate primary in Texas,,https://www.lemonde.fr/en/international/article/2026/03/04/james-talarico-wins-democratic-us-senate-primary-in-texas_6751098_4.html,,,,
EU and France rethink their approach to combat Russian disinformation surge,,https://www.lemonde.fr/en/les-decodeurs/article/2026/03/04/eu-and-france-rethink-their-approach-to-combat-russian-disinformation-surge_6751095_8.html,Subscribers only,,,
US consulate in Dubai targeted by drone strike,,https://www.lemonde.fr/en/videos/video/2026/03/04/us-consulate-in-dubai-targeted-by-drone-strike_6751097_108.html,,,,
Paris's Bourse de Commerce explores the interplay of shadows and light,,https://www.lemonde.fr/en/m-le-mag/article/2026/03/04/a-paris-exhibition-explores-the-interplay-of-shadows-and-light_6751077_117.html,Subscribers only,,,
Russia powerless to help ally Iran under US-Israel strikes,"After the fall of Bashar al-Assad in Syria and Nicolas Maduro in Venezuela, verbal support is all Vladimir Putin can offer the Iranian government after Supreme Leader Ali Khamenei's death. However, Moscow could benefit from rising hydrocarbon prices.",https://www.lemonde.fr/en/international/article/2026/03/03/russia-powerless-to-help-ally-iran-under-us-israel-strikes_6751058_4.html,Subscribers only,https://img.lemde.fr/2026/03/03/0/28/5184/3456/664/442/75/0/e6a8275_upload-1-umabya3vdf1z-000-73396yt.jpg, Marie Jégo,In Depth
Israel unleashes unlimited firepower in Iran and Lebanon,"The country launched an operation against Hezbollah in Lebanon on Monday, after the Iranian-allied armed group fired rockets at it. The Israeli military is now seriously engaged in a two-front war.",https://www.lemonde.fr/en/international/article/2026/03/03/israel-unleashes-unlimited-firepower-in-iran-and-lebanon_6751048_4.html,Subscribers only,https://img.lemde.fr/2026/03/03/0/5/5635/3757/664/442/75/0/52ce5cb_ftp-1-zff8tv8utgkt-5349511-01-06.jpg, Luc Bronner,In Depth
What does international law say about the Israeli-American attack on Iran and Tehran's retaliation?,"Aggression, self-defense, preemptive strikes: The United States, Israel and Iran each justified their military actions, but legal experts question their legality.",https://www.lemonde.fr/en/international/article/2026/03/03/what-does-international-law-say-about-the-israeli-american-attack-on-iran-and-tehran-s-retaliation_6751025_4.html,Subscribers only,https://img.lemde.fr/2026/02/28/0/0/4756/3170/664/442/75/0/b42f071_ftp-1-fyg3oaq4x5iy-5326058-01-06.jpg, Stéphanie Maupas,In Depth
Trump faces the risk of an unpopular war in Iran,,https://www.lemonde.fr/en/opinion/article/2026/03/04/in-iran-trump-faces-the-risk-of-an-unpopular-war_6751094_23.html,,,,Editorial
Mélenchon's deadly race to the bottom,,https://www.lemonde.fr/en/opinion/article/2026/02/28/melenchon-s-deadly-race-to-the-bottom_6750961_23.html,Subscribe,,,Editorial
France's revised nuclear doctrine marks positive shift for European security,,https://www.lemonde.fr/en/opinion/article/2026/03/03/france-s-revised-nuclear-doctrine-marks-positive-shift-for-european-security_6751053_23.html,,,,Editorial
