title,premium,image URL,subhead,URL,byline,article type
 Vidéo. Les premières images des attaques d’Israël contre l’Iran ,,https://img.lemde.fr/2025/06/13/0/0/8640/5760/129/86/60/0/37aa129_ftp-import-images-1-tewb731wr3uj-3f256a1693df46f3a454d4e9ada63966-0-7fdd283c703c4083994f538052c83fe0.jpg,,,,
 Trump tiraillé entre son soutien à Israël et son rejet des aventures militaires à l’étranger , Article réservé à nos abonnés ,https://img.lemde.fr/2025/06/13/0/0/6000/4000/664/442/75/0/bd91a83_upload-1-4sfxycwhrskf-420155.jpg,,https://www.lemonde.fr/international/article/2025/06/14/trump-tiraille-entre-son-alliance-avec-israel-et-son-rejet-des-aventures-militaires-a-l-etranger_6612995_3210.html,,
La position paradoxale des Européens en soutien d’Israël après l’attaque contre l’Iran  , Article réservé à nos abonnés ,,,https://www.lemonde.fr/international/article/2025/06/14/attaque-contre-l-iran-la-position-paradoxale-des-europeens-en-soutien-d-israel_6612971_3210.html,,
La position paradoxale des Européens en soutien d’Israël après l’attaque contre l’Iran  , Article réservé à nos abonnés ,,,,,
Le régime iranien ébranlé par la violence de l’attaque israélienne  , Article réservé à nos abonnés ,,,,,
L’attaque en Iran percute la reconnaissance de l’Etat de Palestine par la France  , Article réservé à nos abonnés ,,,,,
Le récit de l’attaque fulgurante et massive d’Israël contre l’Iran  , Article réservé à nos abonnés ,,,https://www.lemonde.fr/international/article/2025/06/13/israel-lance-une-attaque-fulgurante-et-massive-contre-l-iran_6612685_3210.html,,
Le récit de l’attaque fulgurante et massive d’Israël contre l’Iran  , Article réservé à nos abonnés ,,,,,
"Downey, la « Beverly Hills mexicaine » à l’heure de la chasse aux sans-papiers  ", Article réservé à nos abonnés ,,,,,
"En Espagne, l’étau judiciaire se referme autour du noyau dur qui a permis l’accession au pouvoir de Pedro Sanchez  ", Article réservé à nos abonnés ,,,,,
 La Chine entend supprimer les droits de douane pour la quasi-totalité des pays africains , Article réservé à nos abonnés ,https://img.lemde.fr/2015/07/06/0/0/4633/3089/664/442/75/0/08b72aa_19499-gjbekh.jpg,,https://www.lemonde.fr/international/article/2025/06/14/la-chine-entend-supprimer-les-droits-de-douane-pour-la-quasi-totalite-des-pays-africains_6612984_3210.html,,
La « fermeture sauvage » d’une entreprise détenue par un Français au Maroc plonge des dizaines de salariés dans la précarité  , Article réservé à nos abonnés ,,,https://www.lemonde.fr/afrique/article/2025/06/14/au-maroc-la-fermeture-sauvage-d-une-entreprise-detenue-par-un-francais-plonge-des-dizaines-de-salaries-dans-la-precarite_6612991_3212.html,,
La « fermeture sauvage » d’une entreprise détenue par un Français au Maroc plonge des dizaines de salariés dans la précarité  , Article réservé à nos abonnés ,,,,,
"Au Mali, les paramilitaires russes d’Africa Corps se déploient et subissent leur première défaite  ", Article réservé à nos abonnés ,,,,,
"Au Togo, l’arrestation du rappeur Aamron remobilise l’opposition à Faure Gnassingbé  ", Article réservé à nos abonnés ,,,,,
"En Afrique du Sud, le bilan des inondations atteint 86 morts  ", Article réservé à nos abonnés ,,,https://www.lemonde.fr/afrique/article/2025/06/14/en-afrique-du-sud-le-bilan-des-inondations-atteint-86-morts_6613027_3212.html,,
"En Afrique du Sud, le bilan des inondations atteint 86 morts  ",,,,,,
"La salle de classe, tableau noir de la société marocaine par Hicham Benohoud  ", Article réservé à nos abonnés ,,,,,
"Saxophone, flûte pygmée et harmonium : la sélection musicale du « Monde Afrique » #234  ",,,,,,
 La plus vaste étude animale conduite à ce jour confirme des risques accrus de cancers à cause du glyphosate , Article réservé à nos abonnés ,https://img.lemde.fr/2025/06/11/0/0/2161/1440/664/442/75/0/50ed50c_upload-1-dgbk8r914eqf-severin-millet-glyphosate.jpg,,https://www.lemonde.fr/planete/article/2025/06/12/glyphosate-la-plus-vaste-etude-animale-conduite-a-ce-jour-met-en-evidence-des-risques-accrus-de-diverses-tumeurs_6612420_3244.html,,
Transition écologique : les deux visages d’Emmanuel Macron  , Article réservé à nos abonnés ,,,https://www.lemonde.fr/planete/article/2025/06/11/unoc-emmanuel-macron-l-ocean-et-la-derive-de-la-planification-ecologique_6612123_3244.html,,
Transition écologique : les deux visages d’Emmanuel Macron  , Article réservé à nos abonnés ,,,,,
« Plume de chaleur » : Vérargues a tiré les leçons du coup de chaud record de 2019  , Article réservé à nos abonnés ,,,,,
"UNOC : loin de Donald Trump, les dirigeants de la planète font avancer plusieurs dossiers cruciaux sur l’océan  ", Article réservé à nos abonnés ,,,,,
Conférence des Nations unies sur l’océan : « Les effets du multilatéralisme environnemental sont déjà là »  , Article réservé à nos abonnés ,,,https://www.lemonde.fr/planete/article/2025/06/13/unoc-les-effets-du-multilateralisme-environnemental-sont-deja-la_6612779_3244.html,,
Conférence des Nations unies sur l’océan : « Les effets du multilatéralisme environnemental sont déjà là »  , Article réservé à nos abonnés ,,,,,
"UNOC : à Nice, des Etats appellent à un « traité ambitieux » pour mettre fin à la pollution plastique  ", Article réservé à nos abonnés ,,,,,
"Découverte exceptionnelle d’une épave du XVIᵉ siècle au large de Ramatuelle, à une profondeur encore jamais référencée en France  ", Article réservé à nos abonnés ,,,,,
" Dans l’Arctique, un coffre-fort mondial de graines pour pouvoir « recommencer de zéro » en cas de catastrophe planétaire ", Article réservé à nos abonnés ,https://img.lemde.fr/2025/06/06/0/0/4500/3000/664/442/75/0/2b6f75a_sirius-fs-upload-1-cl2ea0x559yk-1749228995163-lm-asurp-globalseedvault-svalbard-109850.jpg,,https://www.lemonde.fr/planete/article/2025/06/14/au-c-ur-de-l-arctique-l-arche-de-noe-du-vegetal-accueille-de-nouvelles-semences_6613047_3244.html,,
"Chenonceau, l’Acropole  ou le château d’If : le patrimoine malmené et défié par le dérèglement climatique  ", Article réservé à nos abonnés ,,,https://www.lemonde.fr/culture/article/2025/06/14/chenonceau-l-acropole-ou-le-chateau-d-if-le-patrimoine-malmene-et-defie-par-le-dereglement-climatique_6613045_3246.html,,
"Chenonceau, l’Acropole  ou le château d’If : le patrimoine malmené et défié par le dérèglement climatique  ", Article réservé à nos abonnés ,,,,,
Orages : vigilance orange pour dix-huit départements  ,,,,,,
"En Afrique du Sud, le bilan des inondations atteint 86 morts  ",,,,,,
La première Slow Fashion Week défend une mode sobre et recyclée  , Article réservé à nos abonnés ,,,https://www.lemonde.fr/planete/article/2025/06/14/a-marseille-la-premiere-slow-fashion-week-promeut-une-mode-sobre-et-recyclee_6613022_3244.html,,
La première Slow Fashion Week défend une mode sobre et recyclée  , Article réservé à nos abonnés ,,,,,
"Après les violents orages qui ont traversé la France, un homme tué dans les Yvelines, une femme grièvement blessée à Paris  ",,,,,,
"Pollution de l’air : des départements du Sud-Est et l’Alsace en alerte, circulation différenciée dans les Bouches-du-Rhône  ",,,,,,
 Le RN débordé par la parole raciste de ses sympathisants sur Facebook , Article réservé à nos abonnés ,https://img.lemde.fr/2025/06/13/0/0/6000/4000/664/442/75/0/90ebbef_upload-1-q1e1yydtacam-cbi1260091.jpg,,https://www.lemonde.fr/politique/article/2025/06/14/sur-facebook-le-rn-deborde-par-la-parole-raciste-de-ses-sympathisants_6613016_823448.html,,
L’examen de la loi « simplification » s’achève sur un nouveau recul écologique  , Article réservé à nos abonnés ,,,https://www.lemonde.fr/politique/article/2025/06/14/l-examen-de-la-loi-simplification-s-acheve-sur-un-nouveau-detricotage-ecologique_6613015_823448.html,,
L’examen de la loi « simplification » s’achève sur un nouveau recul écologique  , Article réservé à nos abonnés ,,,,,
"En Guyane, les élus attendent des engagements de Manuel Valls pour relancer le processus d’autonomie  ", Article réservé à nos abonnés ,,,,,
"Chido : six mois après le cyclone, le système de santé à Mayotte plus que jamais sous tension  ", Article réservé à nos abonnés ,,,,,
"Thomas Piketty : « Ce qui frappe parmi les opposants à l’impôt sur les ultrariches, c’est leur absence totale de perspective historique »  ", Article réservé à nos abonnés ,,,https://www.lemonde.fr/idees/article/2025/06/14/thomas-piketty-ce-qui-frappe-parmi-les-opposants-a-l-impot-sur-les-ultrariches-c-est-leur-absence-totale-de-perspective-historique_6612972_3232.html,,
"Thomas Piketty : « Ce qui frappe parmi les opposants à l’impôt sur les ultrariches, c’est leur absence totale de perspective historique »  ", Article réservé à nos abonnés ,,,,,
A quoi servent les commissions d’enquête parlementaires ? Comprendre en trois minutes    03:44  ,,,,,,
"La réélection d’Olivier Faure à la tête du PS ratifiée, les négociations commencent pour un texte commun  ", Article réservé à nos abonnés ,,,,,
" Loi « narcotrafic » : le régime carcéral validé par le Conseil constitutionnel, mais des articles importants censurés ", Article réservé à nos abonnés ,https://img.lemde.fr/2023/04/17/0/0/3000/2000/664/442/75/0/79fbb78_1681734866772-art-02.jpg,,https://www.lemonde.fr/societe/article/2025/06/13/loi-narcotrafic-le-regime-carceral-valide-par-le-conseil-constitutionnel-mais-des-articles-importants-censures_6612682_3224.html,,
L’ampleur des difficultés pour remplacer les enseignants détaillée dans un rapport sénatorial  , Article réservé à nos abonnés ,,,https://www.lemonde.fr/societe/article/2025/06/12/un-rapport-senatorial-leve-le-voile-sur-l-ampleur-des-difficultes-de-remplacement-des-enseignants_6612567_3224.html,,
L’ampleur des difficultés pour remplacer les enseignants détaillée dans un rapport sénatorial  , Article réservé à nos abonnés ,,,,,
Bac de français 2025 : ces élèves qui doivent passer l’épreuve alors qu’ils n’ont pas eu de professeur  , Article réservé à nos abonnés ,,,,,
L’encadrement des loyers a fait gagner 1 700 euros par an aux locataires parisiens  , Article réservé à nos abonnés ,,,,,
Plus de 10 000 lycéens ont déjà quitté Parcoursup sans avoir eu de proposition d’affectation  , Article réservé à nos abonnés ,,,https://www.lemonde.fr/campus/article/2025/06/12/parcoursup-plus-de-10-000-lyceens-ont-deja-quitte-la-plateforme_6612582_4401467.html,,
Plus de 10 000 lycéens ont déjà quitté Parcoursup sans avoir eu de proposition d’affectation  , Article réservé à nos abonnés ,,,,,
"A Bobigny, le procès de policiers de la BRAV-M : « Je ferai en sorte de redorer le blason que j’ai sali ce soir-là », assure un prévenu  ", Article réservé à nos abonnés ,,,,,
"Aux Antilles, une vague d’homicides sur fond d’explosion des trafics  ", Article réservé à nos abonnés ,,,,,
 Agriculture bio : le grand décrochage des soutiens publics sous l’ère Macron , Article réservé à nos abonnés ,https://img.lemde.fr/2025/06/13/0/0/5498/3665/664/442/75/0/ebb423b_upload-1-qkjbal2l0z7b-000-47q84br.jpg,,https://www.lemonde.fr/economie/article/2025/06/13/agriculture-bio-le-grand-decrochage-des-soutiens-publics-sous-l-ere-macron_6612658_3234.html,,
"En Italie, l’homme d’affaires Antonio Angelucci et le dessein d’un empire médiatique conservateur  ", Article réservé à nos abonnés ,,,https://www.lemonde.fr/economie/article/2025/06/13/en-italie-l-homme-d-affaires-antonio-angelucci-et-le-dessein-d-un-empire-mediatique-conservateur_6612659_3234.html,,
"En Italie, l’homme d’affaires Antonio Angelucci et le dessein d’un empire médiatique conservateur  ", Article réservé à nos abonnés ,,,,,
L’offensive des pays du Golfe dans l’intelligence artificielle  , Article réservé à nos abonnés ,,,,,
Catastrophe aérienne en Inde dans un marché en pleine expansion  , Article réservé à nos abonnés ,,,,,
"Après le crash du 787 Dreamliner d’Air India, Boeing à nouveau en plein doute  ", Article réservé à nos abonnés ,,,https://www.lemonde.fr/economie/article/2025/06/12/le-crash-du-787-d-air-india-en-inde-un-nouveau-coup-dur-pour-boeing_6612578_3234.html,,
"Après le crash du 787 Dreamliner d’Air India, Boeing à nouveau en plein doute  ", Article réservé à nos abonnés ,,,,,
Beaumanoir et Celio reprennent 33 magasins Jennyfer  , Article réservé à nos abonnés ,,,,,
Mariage en vue pour les deux pionniers allemands de l’ARN messager  , Article réservé à nos abonnés ,,,,,
 Proportionnelle : les enjeux du changement de mode de scrutin , Article réservé à nos abonnés ,https://img.lemde.fr/2025/06/04/61/0/951/634/664/442/75/0/18f02fc_sirius-fs-upload-1-smf2wvq8me5s-1749023031384-capture-da-ei-cran-2025-06-04-ai-09-36-52.png,,https://www.lemonde.fr/les-decodeurs/article/2025/06/04/proportionnelle-les-enjeux-du-changement-de-mode-de-scrutin_6610504_4355770.html,,
Fin de l’ADSL : comment le très haut débit a changé nos vies  , Article réservé à nos abonnés ,,,https://www.lemonde.fr/les-decodeurs/article/2025/04/19/fin-de-l-adsl-comment-le-tres-haut-debit-a-change-nos-vies_6597827_4355770.html,,
Fin de l’ADSL : comment le très haut débit a changé nos vies  , Article réservé à nos abonnés ,,,,,
125 destinations pour faire le tour du monde sans quitter la France (ou l’Europe)    Grand format  ,,,,,,
Pourquoi notre utilisation de l’intelligence artificielle est un gouffre énergétique  , Article réservé à nos abonnés ,,,,,
Pourquoi le style de Wes Anderson est-il si unique ?  , Article réservé à nos abonnés ,,,https://www.lemonde.fr/les-decodeurs/article/2025/05/28/pourquoi-le-style-de-wes-anderson-est-il-si-unique_6592007_4355771.html,,
Pourquoi le style de Wes Anderson est-il si unique ?  , Article réservé à nos abonnés ,,,,,
Vendredi 13 : pourquoi nous sommes toujours perdants aux jeux d’argent et de hasard    Grand format  ,,,,,,
"La chronologie de l’affaire Harvey Weinstein, des révélations aux procès en Californie et à New York  ",,,,,,
 Technologia imperatores : aux racines de la fascination des « tech bros » pour l’Empire romain , Article réservé à nos abonnés ,https://img.lemde.fr/2025/05/20/16/86/1910/1273/664/442/75/0/f524f03_sirius-fs-upload-1-zhaxjfhplaph-1747728083289-mz-rome.jpg,,https://www.lemonde.fr/pixels/article/2025/06/09/technologia-imperatores-aux-racines-de-la-fascination-des-tech-bros-pour-l-empire-romain_6611570_4408996.html,,
Supprimer le hashtag #SkinnyTok ne fera pas disparaître les incitations à la maigreur sur TikTok  , Article réservé à nos abonnés ,,,https://www.lemonde.fr/pixels/article/2025/06/12/skinnytok-pourquoi-les-incitations-a-la-maigreur-sur-tiktok-ne-disparaitront-pas-en-supprimant-un-hashtag_6612502_4408996.html,,
Supprimer le hashtag #SkinnyTok ne fera pas disparaître les incitations à la maigreur sur TikTok  , Article réservé à nos abonnés ,,,,,
"On a testé… « Mario Kart World » : un road trip divertissant, entre virée bucolique et tohu-bohu infernal  ",,,,,,
"De la calculatrice à ChatGPT, l’épopée bringuebalante de l’IA, technologie aux contours flous  ", Article réservé à nos abonnés ,,,,,
Wikipédia suspend un test lié à l’intelligence artificielle après la colère de certains contributeurs  , Article réservé à nos abonnés ,,,https://www.lemonde.fr/pixels/article/2025/06/14/wikipedia-met-en-pause-le-test-de-fonctionnalites-utilisant-l-ia-apres-la-fronde-de-ses-contributeurs_6612985_4408996.html,,
Wikipédia suspend un test lié à l’intelligence artificielle après la colère de certains contributeurs  , Article réservé à nos abonnés ,,,,,
"« Pour protéger les plus jeunes sur les réseaux, établissons en Europe l’âge de la majorité numérique à 15 ans »  ", Article réservé à nos abonnés ,,,,,
De la Magnavox Odyssey à la Nintendo Switch 2 : où sont passés les manuels de jeux vidéo et de consoles ?  , Article réservé à nos abonnés ,,,,,
 Wikipédia suspend un test lié à l’intelligence artificielle après la colère de certains contributeurs , Article réservé à nos abonnés ,https://img.lemde.fr/2025/02/06/0/0/3000/2000/664/442/75/0/adc6308_sirius-fs-upload-1-fapna5ff75xx-1738848306085-papier-345.jpg,,https://www.lemonde.fr/pixels/article/2025/06/14/wikipedia-met-en-pause-le-test-de-fonctionnalites-utilisant-l-ia-apres-la-fronde-de-ses-contributeurs_6612985_4408996.html,,
La revue « Réseaux » s’intéresse aux pouvoirs des algorithmes en matière de sécurité  , Article réservé à nos abonnés ,,,https://www.lemonde.fr/idees/article/2025/06/13/la-revue-reseaux-s-interesse-aux-pouvoirs-des-algorithmes-en-matiere-de-securite_6612718_3232.html,,
La revue « Réseaux » s’intéresse aux pouvoirs des algorithmes en matière de sécurité  , Article réservé à nos abonnés ,,,,,
IA : « Les robots peuvent-ils battre les loups de Wall Street ? »  , Article réservé à nos abonnés ,,,,,
L’offensive des pays du Golfe dans l’intelligence artificielle  , Article réservé à nos abonnés ,,,,,
Meta investit 14 milliards de dollars dans Scale AI pour se renforcer dans l’intelligence artificielle  , Article réservé à nos abonnés ,,,https://www.lemonde.fr/economie/article/2025/06/13/meta-investit-14-milliards-de-dollars-dans-scale-ai-pour-se-renforcer-dans-l-intelligence-artificielle_6612674_3234.html,,
Meta investit 14 milliards de dollars dans Scale AI pour se renforcer dans l’intelligence artificielle  , Article réservé à nos abonnés ,,,,,
Disney et NBC Universal attaquent le générateur d’images par IA Midjourney  ,,,,,,
"IA : à Vivatech, Emmanuel Macron célèbre le partenariat « historique » entre Mistral IA et Nvidia  ", Article réservé à nos abonnés ,,,,,
"« Retarder de quelques années l’avancée du nucléaire iranien est un succès, mais cela ne peut être l’objectif final d’une politique de sécurité durable »",Article réservé à nos abonnés,,,https://www.lemonde.fr/idees/article/2025/06/14/israel-iran-retarder-de-quelques-annees-l-avancee-du-nucleaire-iranien-est-un-succes-mais-cela-ne-peut-etre-l-objectif-final-d-une-politique-de-securite-durable_6613019_3232.html,,Tribune
"« Avec Donald Trump, le show est devenu dangereusement réel »",Article réservé à nos abonnés,,,https://www.lemonde.fr/idees/article/2025/06/14/david-a-bell-avec-donald-trump-le-show-est-devenu-dangereusement-reel_6612990_3232.html,,Tribune
« Les crises écologiques nourries par nos systèmes économiques insoutenables vont déstabiliser nos protections sociales »,Article réservé à nos abonnés,,,https://www.lemonde.fr/idees/article/2025/06/14/les-crises-ecologiques-nourries-par-nos-systemes-economiques-insoutenables-vont-destabiliser-nos-protections-sociales_6612973_3232.html,,Tribune
" La Coupe du monde des clubs, symbole de la course aux profits du football ", Article réservé à nos abonnés ,https://img.lemde.fr/2025/06/10/197/0/6366/4244/664/442/75/0/b1f764a_sirius-fs-upload-1-e45gzdgaekth-1749549429401-000-36pm7ga.jpg,,https://www.lemonde.fr/sport/article/2025/06/14/la-coupe-du-monde-des-clubs-pactole-pour-les-participants-et-symbole-de-la-course-aux-profits-du-football_6612975_3242.html,,
Les prochains lives sport du « Monde »  , Article réservé à nos abonnés ,,,https://www.lemonde.fr/football/article/2024/06/15/les-prochains-lives-sport-du-monde_6157620_1616939.html,,
Les prochains lives sport du « Monde »  ,,,,,,
"Perpignan arrache son maintien en Top 14 en venant à bout de Grenoble, finaliste maudit des barrages  ",,,,,,
"La Coupe du monde des clubs, un tournoi aux allures de test pour Donald Trump  ", Article réservé à nos abonnés ,,,,,
" A Paris, le logement social investit un garage en silo ", Article réservé à nos abonnés ,https://img.lemde.fr/2025/06/09/1/0/5500/3666/664/442/75/0/16ff44e_sirius-fs-upload-1-qiloj3b7bktk-1749458831335-parmentier-a-11h45-florent-michel-6.jpg,,https://www.lemonde.fr/culture/article/2025/06/12/a-paris-le-logement-social-investit-un-garage-en-silo_6612550_3246.html,,
"Un « Elixir d’amour » spécialement infusé pour les enfants au Théâtre des Champs-Elysées, à Paris  ", Article réservé à nos abonnés ,,,https://www.lemonde.fr/culture/article/2025/06/12/un-elixir-d-amour-specialement-infuse-pour-les-enfants-au-theatre-des-champs-elysees-a-paris_6612462_3246.html,,
"Un « Elixir d’amour » spécialement infusé pour les enfants au Théâtre des Champs-Elysées, à Paris  ", Article réservé à nos abonnés ,,,,,
"Günther Uecker, artiste allemand qui avait le clou pour marque de fabrique, est mort  ", Article réservé à nos abonnés ,,,,,
"Sélection albums : Kévin Amiel, Alexandre de Villeneuve, Caroline, Neil Young and The Chrome Hearts, Isha  ", Article réservé à nos abonnés ,,,,,
La Villa Noailles s’engage dans un plan drastique de désendettement  , Article réservé à nos abonnés ,,,https://www.lemonde.fr/culture/article/2025/06/13/la-villa-noailles-s-engage-dans-un-plan-drastique-de-desendettement_6612730_3246.html,,
La Villa Noailles s’engage dans un plan drastique de désendettement  , Article réservé à nos abonnés ,,,,,
Au Grand Palais se rejoue la genèse du Centre Pompidou  , Article réservé à nos abonnés ,,,,,
"Après le limogeage surprise de Bruno Maquart, le Palais de la découverte sur les charbons ardents  ", Article réservé à nos abonnés ,,,,,
 Le Mexique sans fard de Fernanda Melchor , Article réservé à nos abonnés ,https://img.lemde.fr/2025/06/03/509/0/5906/3937/664/442/75/0/4729525_sirius-fs-upload-1-pz6jrcfayp0y-1748975860259-013289-006.jpg,,https://www.lemonde.fr/livres/article/2025/06/07/le-mexique-sans-fard-de-fernanda-melchor_6611073_3260.html,,
"« L’Art d’en sortir » et « Délire de fuite » : Marc’O, toujours d’avant-garde  ", Article réservé à nos abonnés ,,,https://www.lemonde.fr/livres/article/2025/06/08/l-art-d-en-sortir-et-delire-de-fuite-marc-o-toujours-d-avant-garde_6611261_3260.html,,
"« L’Art d’en sortir » et « Délire de fuite » : Marc’O, toujours d’avant-garde  ", Article réservé à nos abonnés ,,,,,
La « Correspondance » de François Truffaut avec ses maîtres et ses pairs  , Article réservé à nos abonnés ,,,,,
"« Le Monde par les hiéroglyphes », de Christophe Barbotin : une leçon d’égyptologie appliquée  ", Article réservé à nos abonnés ,,,,,
« La Correspondante » : les âmes meurtries d’Adelheid Duvanel  , Article réservé à nos abonnés ,,,https://www.lemonde.fr/livres/article/2025/06/11/la-correspondante-les-ames-meurtries-d-adelheid-duvanel_6612233_3260.html,,
« La Correspondante » : les âmes meurtries d’Adelheid Duvanel  , Article réservé à nos abonnés ,,,,,
"Léonid Guirchovitch, écrivain russe : « Nous serrons les rangs derrière notre Zelensky commun »  ", Article réservé à nos abonnés ,,,,,
"La chronique « poches nourrissants » de François Angelier : Pierre Singaravélou et Sylvain Venayre, Lauren Malka, les champignons  ", Article réservé à nos abonnés ,,,,,
" Cinq expositions scientifiques à ne pas manquer : « Les Maîtres du feu », « Méditerranée 2050 », « Chiens et chats »… ", Article réservé à nos abonnés ,https://img.lemde.fr/2025/06/09/38/432/4343/2895/664/442/75/0/9ef0032_sirius-fs-upload-1-p3jikhq4t71z-1749458222130-17.jpg,,https://www.lemonde.fr/sciences/article/2025/06/13/cinq-expositions-scientifiques-a-ne-pas-manquer-les-maitres-du-feu-mediterranee-2050-chiens-et-chats_6612647_1650684.html,,
Un projet pour « nettoyer » la littérature médicale des études douteuses  , Article réservé à nos abonnés ,,,https://www.lemonde.fr/sciences/article/2025/06/12/un-projet-pour-nettoyer-la-litterature-medicale-des-etudes-douteuses_6612453_1650684.html,,
Un projet pour « nettoyer » la littérature médicale des études douteuses  , Article réservé à nos abonnés ,,,,,
"Découverte exceptionnelle d’une épave du XVIᵉ siècle au large de Ramatuelle, à une profondeur encore jamais référencée en France  ", Article réservé à nos abonnés ,,,,,
"Après le limogeage surprise de Bruno Maquart, le Palais de la découverte sur les charbons ardents  ", Article réservé à nos abonnés ,,,,,
La découverte d’un caoutchouc inusable ou presque  , Article réservé à nos abonnés ,,,https://www.lemonde.fr/sciences/article/2025/06/13/la-decouverte-d-un-caoutchouc-inusable-ou-presque_6612726_1650684.html,,
La découverte d’un caoutchouc inusable ou presque  , Article réservé à nos abonnés ,,,,,
La lèpre était présente sur le continent américain avant l’arrivée des colons européens  ,,,,,,
Comment le maïs alerte les épis voisins de l’attaque d’une chenille ravageuse  , Article réservé à nos abonnés ,,,,,
 L’accompagnement à l’orientation des jeunes : une affaire de mères , Article réservé à nos abonnés ,https://img.lemde.fr/2024/09/13/4/0/1801/1200/664/442/75/0/31eef2a_1726227306539-mei-dia-33.png,,https://www.lemonde.fr/campus/article/2025/06/11/l-accompagnement-a-l-orientation-des-jeunes-une-affaire-de-meres_6612135_4401467.html,,
