title,subhead,URL,premium,image URL,byline,article type
" Ship signal jamming, a global threat made worse by Strait of Hormuz crisis  ","Electronic interference with cargo ships' navigation and positioning signal systems has surged since the Middle East conflict started. This comes together with cases of identity spoofing, which is used to evade sanctions.",https://www.lemonde.fr/en/economy/article/2026/05/25/ship-signal-jamming-a-global-threat-made-worse-by-strait-of-hormuz-crisis_6753807_19.html,Subscribers only,,,
Pope Leo XIV calls for 'disarming AI',,https://www.lemonde.fr/en/international/article/2026/05/25/pope-leo-xiv-calls-for-disarming-ai_6753803_4.html,Subscribers only,,,
"Heatwave in France: 'This is an unprecedented event, with about a one-in-1,000 chance of occurring in a given year'",,https://www.lemonde.fr/en/environment/article/2026/05/25/climatologist-christophe-cassou-this-heatwave-is-an-unprecedented-event-with-about-a-one-in-1-000-chance-of-occurring-in-a-given-year_6753812_114.html,Subscribers only,,,
Russia threatens more strikes on Kyiv,Moscow said Monday it planned to target the city's 'decision-making centers' and repeated a call for foreign citizens and diplomats to leave the city. Western diplomatic missions in the city have rebuffed the warning.,https://www.lemonde.fr/en/international/article/2026/05/25/russia-threatens-more-strikes-on-kyiv_6753811_4.html,,,,
France's film funding agency targeted by the far right,"Without the National Center for Cinema and the Moving Image, many French films could never be made. But the CNC is now under attack, which could spell the end of this nearly 80-year-old institution if the far-right Rassemblement National comes to power.",https://www.lemonde.fr/en/m-le-mag/article/2026/05/25/france-s-film-funding-agency-targeted-by-the-far-right_6753790_117.html,Subscribers only,,,
France and Mali's pro-independence rebels: A history shaped by alliances and mutual interests,"Bamako's military junta has accused Paris of supporting the Azawad Liberation Front (ALF), which launched an offensive in northern Mali at the end of April. These claims are based on the French authorities' historical ties with the pro-independence rebel groups, though those connections have since weakened.",https://www.lemonde.fr/en/le-monde-africa/article/2026/05/25/france-and-mali-s-pro-independence-rebels-a-history-shaped-by-alliances-and-mutual-interests_6753805_124.html,Subscribers only,,,
"Caen's former prison goes on sale: 'It's strange, but it really has character'","Residents living near the former prison in Normandy, which has stood empty since 2023 and is now being put up for sale by the French state, have rallied to ensure it is not completely demolished. Buyers, who have until the end of May to submit their bids, will be required to prioritize the preservation of the historic building.",https://www.lemonde.fr/en/m-le-mag/article/2026/05/25/caen-s-former-prison-goes-on-sale-it-s-strange-but-it-really-has-character_6753808_117.html,Subscribers only,, Henri Seckel,Feature
"Heat dome over Europe scorches UK, France, Spain",,https://www.lemonde.fr/en/environment/article/2026/05/25/heat-dome-over-europe-scorches-uk-france-spain_6753809_114.html,,,,
Eleven-year-old boy found dead on riverbank in northwest France,,https://www.lemonde.fr/en/france/article/2026/05/25/eleven-year-old-boy-found-dead-on-riverbank-in-northwest-france_6753806_7.html,,,,
"US says Iran deal still possible, as Trump tempers expectations",,https://www.lemonde.fr/en/international/article/2026/05/25/trump-tempers-expectations-of-a-middle-east-deal-with-iran_6753789_4.html,,,,
Kyiv attacks: The complex logistics network behind Russia's war machine,,https://www.lemonde.fr/en/international/article/2026/05/25/kyiv-attacks-the-complex-logistics-network-behind-russia-s-war-machine_6753798_4.html,Subscribers only,,,
"A €100,000 contract and possible mistaken identity: New clues emerge in murder of anti-drug activist's brother",,https://www.lemonde.fr/en/france/article/2026/05/25/a-100-000-contract-and-possible-mistaken-identity-new-clues-emerge-in-murder-of-anti-drug-activist-s-brother_6753791_7.html,Subscribers only,,,
"In Cuba, an unprecedented health crisis is deepening under US oil blockade",,https://www.lemonde.fr/en/international/article/2026/05/25/in-cuba-an-unprecedented-health-crisis-is-deepening-under-us-oil-blockade_6753797_4.html,Subscribers only,,,
'There is a growing political will to change the status quo',,https://www.lemonde.fr/en/opinion/article/2026/05/25/there-is-a-genuine-political-will-to-restitute-cultural-heritage_6753786_23.html,Subscribers only,,,
Djokovic fights through tough Roland Garros opener,,https://www.lemonde.fr/en/sports/article/2026/05/25/djokovic-fights-through-tough-roland-garros-opener_6753787_9.html,,,,
"New wave of Serbia protests draws nearly 200,000 people",,https://www.lemonde.fr/en/international/article/2026/05/24/new-wave-of-serbia-protests-draws-nearly-200-000-people_6753778_4.html,,,,
The post-May '68 Christian philosophy now being embraced by the American far right,,https://www.lemonde.fr/en/opinion/article/2026/05/24/the-post-may-68-christian-philosophy-now-being-embraced-by-the-american-far-right_6753781_23.html,Subscribers only,,,
Authorities investigate safety lapses after China coal mine blast kills at least 82,,https://www.lemonde.fr/en/international/article/2026/05/24/authorities-investigate-safety-lapses-after-china-coal-mine-blast-kills-at-least-82_6753783_4.html,,,,
Roland-Garros 2026: New crop of French tennis talents emerges,,https://www.lemonde.fr/en/sports/article/2026/05/24/roland-garros-2026-new-crop-of-french-tennis-talents-emerges_6753776_9.html,Subscribers only,,,
Why dropping the worst-case climate scenario does not undermine the reality of global warming,"A new generation of climate scenarios has set aside RCP8.5, which projected a nearly 5°C rise in global temperatures by 2100. Donald Trump presents this as proof of 'alarmism' among climate scientists, but the new projections remain highly concerning.",https://www.lemonde.fr/en/environment/article/2026/05/24/why-dropping-the-worst-case-climate-scenario-does-not-undermine-the-reality-of-global-warming_6753768_114.html,Subscribers only,, Audrey Garric,In Depth
Five arrested over smuggling of Californian cannabis to France,A former influencer known as 'PA7' and a counterfeiter known as 'the Prince of Fake Luxury Watches' are suspected of having illegally imported hundreds of kilograms of 'Cali' marijuana.,https://www.lemonde.fr/en/france/article/2026/05/23/five-arrested-over-smuggling-of-californian-cannabis-to-france_6753759_7.html,Subscribers only,, Jérémie Pham-Lê and  Thomas Saintourens,News
The alleged murder plot casting a new shadow over French-Algerian ties,"Four suspects in the attempted murder of Algerian opposition figure Hichem Aboud in Roubaix, northern France, in May 2025 were indicted. This threatens to complicate the resumed dialogue between Paris and Algiers.",https://www.lemonde.fr/en/le-monde-africa/article/2026/05/25/the-alleged-murder-plot-casting-a-new-shadow-over-french-algerian-ties_6753801_124.html,Subscribers only,, Frédéric Bobin,News
'The most popular Palestinian leader has been imprisoned by Israel since 2002',,https://www.lemonde.fr/en/international/article/2026/05/24/the-most-popular-palestinian-leader-has-been-imprisoned-by-israel-since-2002_6753775_4.html,Subscribe,,,Column
'Which jobs have the most openings? The least valued ones',,https://www.lemonde.fr/en/opinion/article/2026/05/22/which-jobs-have-the-most-openings-the-least-valued-ones_6753714_23.html,Subscribe,,,Column
"Essayist Paul Klotz: With the Enhanced Games, 'we are witnessing the return of the circus'",,https://www.lemonde.fr/en/opinion/article/2026/05/25/essayist-paul-klotz-with-the-enhanced-games-we-are-witnessing-the-return-of-the-circus_6753788_23.html,Subscribe,,,Op-Ed
