title,subhead,URL,premium,image URL,byline,article type
 The gold medal for deception: How a professor created an international award out of thin air  ,"In 2016, Florent Montaclair stepped into the spotlight when he received the Gold Medal of Philology, a sort of Nobel Prize for the discipline. In fact, the award was created by Montaclair himself. It took an investigation by Romanian journalists to uncover this hoax, which is now the subject of a judicial inquiry in France.",https://www.lemonde.fr/en/m-le-mag/article/2026/04/19/the-gold-medal-for-deception-how-a-professor-created-an-international-award-out-of-thin-air_6752586_117.html,Subscribers only,,,
Instability deepens in southern Lebanon after French peacekeeper killed in Hezbollah-blamed attack,,https://www.lemonde.fr/en/international/article/2026/04/19/instability-deepens-in-southern-lebanon-after-french-peacekeeper-killed-in-hezbollah-blamed-attack_6752582_4.html,Subscribers only,,,
Elon Musk summoned by French prosecutors after 15-month probe,,https://www.lemonde.fr/en/pixels/article/2026/04/19/elon-musk-summoned-by-french-prosecutors-after-15-month-probe_6752590_13.html,Subscribers only,,,
"In Milan, Europe's far right gathers amid shifting era and enduring identity politics","Just days after Viktor Orban's defeat in Hungary, Matteo Salvini, Italy's deputy prime minister, hosted a far-right rally under the banner 'Without Fear: In Europe We Are Masters in Our Own House.'",https://www.lemonde.fr/en/international/article/2026/04/19/in-milan-europe-s-far-right-gathers-amid-shifting-era-and-enduring-identity-politics_6752592_4.html,Subscribers only,,,
Bulgarian legislative elections: Corruption and ties to Russia at the heart of the campaign,"Leading in the polls, former president Rumen Radev, known for his ambiguous stance on Russia, has made headlines for his anti-corruption platform and promises to 'topple the oligarchy.' Sunday's vote marks the eighth election in five years.",https://www.lemonde.fr/en/international/article/2026/04/19/bulgarian-legislative-elections-corruption-and-ties-to-russia-at-the-heart-of-the-campaign_6752578_4.html,Subscribers only,,,
"Ireland, the weak link in Europe's defense","Irish neutrality, long seen as a guarantee of independence from its former British colonizer, has been eroding under European and Atlantic pressures. After decades of naval weakness, Dublin has committed to strengthening its navy.",https://www.lemonde.fr/en/international/article/2026/04/19/ireland-the-weak-link-in-europe-s-defense_6752596_4.html,Subscribers only,,,
From a South American frog to a Russian penal colony: How the poison epibatidine killed Navalny,"This extremely powerful neurotoxin is secreted by a frog native to Ecuador. Although Western scientists discovered it in the 19th century, it wasn't synthesized until the 1990s. The neurotoxin appears to have particularly interested the Russian research institute responsible for synthesizing Novichok agents, used in poisonings.",https://www.lemonde.fr/en/science/article/2026/04/19/from-a-south-american-frog-to-a-russian-penal-colony-how-the-poison-epibatidine-killed-navalny_6752595_10.html,Subscribers only,," Audrey Lagadec,  Eric Dedier and  Rémi Ducasse",Investigation
"Libya: 15 years after Gaddafi's fall, Marshal Haftar's authoritarian model spreads",,https://www.lemonde.fr/en/le-monde-africa/article/2026/04/19/libya-15-years-after-gaddafi-s-fall-marshal-haftar-s-authoritarian-model-spreads_6752591_124.html,Subscribers only,,,
Starmer vows to find arsonists of London Jewish sites,,https://www.lemonde.fr/en/international/article/2026/04/19/starmer-vows-to-find-arsonists-of-london-jewish-sites_6752593_4.html,,,,
Stuffed Cabbage World Championship brings together top culinary talent,,https://www.lemonde.fr/en/lifestyle/article/2026/04/19/stuffed-cabbage-world-championship-brings-together-top-culinary-talent_6752584_37.html,Subscribers only,,,
Terrorism investigation opened after at least six killed in Kyiv shooting,,https://www.lemonde.fr/en/international/article/2026/04/19/at-least-6-killed-after-gunman-opens-fire-in-ukrainian-capital_6752574_4.html,,,,
Conservative billionaire Bolloré says he will seek new authors after mass exodus at publisher Grasset,,https://www.lemonde.fr/en/books/article/2026/04/19/conservative-billionaire-bollore-says-he-will-seek-new-authors-after-mass-exodus-at-publisher-grasset_6752580_33.html,,,,
German Chancellor Merz's coalition is fractured by intense internal conflict,,https://www.lemonde.fr/en/international/article/2026/04/19/german-chancellor-merz-s-coalition-is-fractured-by-intense-internal-conflict_6752581_4.html,Subscribers only,,,
When dashes give away ChatGPT usage,,https://www.lemonde.fr/en/m-le-mag/article/2026/04/19/when-dashes-give-away-chatgpt-usage_6752585_117.html,Subscribers only,,,
"DR Congo, M23 armed group agree to ease aid, free prisoners",,https://www.lemonde.fr/en/international/article/2026/04/19/dr-congo-m23-armed-group-agree-to-ease-aid-free-prisoners_6752588_4.html,,,,
Legendary Pigalle nightclub Bus Palladium reclaims its rock-and-roll spirit,,https://www.lemonde.fr/en/lifestyle/article/2026/04/19/legendary-pigalle-nightclub-bus-palladium-reclaims-its-rock-and-roll-spirit_6752583_37.html,Subscribers only,,,
Obsession with primaries takes hold in French politics a year out from presidential race,,https://www.lemonde.fr/en/politics/article/2026/04/19/obsession-with-primaries-takes-hold-in-french-politics-a-year-out-from-presidential-race_6752576_5.html,Subscribers only,,,
Zelensky says oil sanctions relief provides billions for Russian military,,https://www.lemonde.fr/en/energies/article/2026/04/19/zelensky-says-oil-sanctions-relief-provides-billions-for-russian-military_6752579_98.html,,,,
A photographic journey into the daily lives of home care aides,,https://www.lemonde.fr/en/france/article/2026/04/19/i-witnessed-bathing-care-moments-of-silence-and-tears-a-photographic-journey-into-the-daily-lives-of-home-health-aides_6752575_7.html,Subscribers only,,,
France opens the sensitive issue of slavery reparations,"Following a visit by President John Dramani Mahama to the Elysée, Ghana's foreign affairs minister announced on April 8 that Paris would be willing to 'collaborate' on 'restorative justice.' Those close to Emmanuel Macron confirmed that the French president supported the initiative.",https://www.lemonde.fr/en/le-monde-africa/article/2026/04/18/france-opens-the-sensitive-issue-of-slavery-reparations_6752562_124.html,Subscribers only,, Coumba Kane,News
'Viktor Orban's defeat in Hungary is truly a defeat for the reactionary international',"In an interview, Italian historian Steven Forti, a specialist in far-right movements, says that while Péter Magyar's victory is good news for the European Union, it remains unclear what alternative this conservative figure represents for the right – a question that resonates elsewhere.",https://www.lemonde.fr/en/opinion/article/2026/04/18/viktor-orban-s-defeat-in-hungary-is-truly-a-defeat-for-the-reactionary-international_6752555_23.html,Subscribers only,, Anne Dujin,Interview
"Saint-Denis Mayor Bally Bagayoko: 'When you win Paris's largest suburb, it gives you a different standing'","In an interview with Le Monde, Bally Bagayoko says he can play a role in uniting the left around La France Insoumise leader Jean-Luc Mélenchon for the 2027 French presidential election.",https://www.lemonde.fr/en/politics/article/2026/04/17/bally-bagayoko-new-mayor-of-saint-denis-when-you-win-paris-s-largest-suburb-it-gives-you-a-different-standing_6752540_5.html,Subscribers only,, Louise Couvelaire and  Sandrine Cassini,Interview
Hachette Group employees: 'We see our editors' freedom is seriously threatened',,https://www.lemonde.fr/en/opinion/article/2026/04/19/hachette-group-employees-we-see-our-editors-freedom-is-seriously-threatened_6752589_23.html,,,,Op-Ed
'Senegal's anti-homosexuality law relies on historical and health claims that are false',,https://www.lemonde.fr/en/opinion/article/2026/04/17/senegal-s-anti-homosexuality-law-relies-on-historical-and-health-claims-that-are-false_6752525_23.html,Subscribe,,,Op-Ed
Vincent Bolloré's troubling grip on French publishing,,https://www.lemonde.fr/en/opinion/article/2026/04/17/vincent-bollore-s-troubling-grip-on-french-publishing_6752536_23.html,,,,Editorial
