title,premium,image URL,subhead,URL,article type,byline
"Le succès controversé des écoles privées de science politique, « avec des stratégies qui vont de la confusion organisée à la publicité mensongère »  ", Article réservé à nos abonnés ,,,,,
Sexualité et prostitution adolescente : une pièce de théâtre pour ouvrir la discussion avec les élèves  , Article réservé à nos abonnés ,,,,,
Nos recommandations culturelles de l’été   podcast  ,,,,https://www.lemonde.fr/podcasts/article/2025/07/04/nos-recommandations-culturelles-de-l-ete_6617861_5463015.html,,
Nos recommandations culturelles de l’été   podcast  ,,,,,,
Six cents jours à couvrir la guerre à Gaza : le récit de notre journaliste Samuel Forey   podcast  ,,,,,,
Le grand renoncement écologique mondial   podcast  ,,,,,,
" En Espagne, les paysages déprimés de la Costa Blanca ", Article réservé à nos abonnés ,https://img.lemde.fr/2025/06/25/0/0/1500/1000/664/442/75/0/867621f_ftp-import-images-1-ec2mgo9oum9m-388184-3428002.jpg,,https://www.lemonde.fr/m-le-mag/article/2025/07/06/en-espagne-les-paysages-deprimes-de-la-costa-blanca_6619188_4500055.html,,
"Le retour opportun de Reza Pahlavi, prince héritier d’Iran, au lendemain des frappes américaines  ", Article réservé à nos abonnés ,,,https://www.lemonde.fr/m-le-mag/article/2025/07/05/le-retour-opportun-de-reza-pahlavi-prince-heritier-d-iran-au-lendemain-des-frappes-americaines_6618542_4500055.html,,
"Le retour opportun de Reza Pahlavi, prince héritier d’Iran, au lendemain des frappes américaines  ", Article réservé à nos abonnés ,,,,,
"Edouard Herbo, gestionnaire de fortune et empêcheur d’hériter en rond  ", Article réservé à nos abonnés ,,,,,
"En Chine, l’échappée nocturne des cyclistes pékinois  ", Article réservé à nos abonnés ,,,,,
"Itinéraire de Baptiste C., néonazi (presque) repenti  ", Article réservé à nos abonnés ,,,https://www.lemonde.fr/m-le-mag/article/2025/07/06/itineraire-de-baptiste-c-neonazi-presque-repenti_6619194_4500055.html,,
"Itinéraire de Baptiste C., néonazi (presque) repenti  ", Article réservé à nos abonnés ,,,,,
"Dans l’Essonne, une expérience animale afin de transformer un jour le corps humain en compost  ", Article réservé à nos abonnés ,,,,,
« J’ai un début de vacanxiété rien que de penser à la semaine en tête à tête avec mon ado » : l’angoisse inavouable qui précède les vacances  , Article réservé à nos abonnés ,,,,,
" « A ce moment-là de ma vie, j’aurais bien aimé m’appeler Emilie et non An-Xuân. Je voulais m’effacer plutôt qu’attirer les regards » ", Article réservé à nos abonnés ,https://img.lemde.fr/2025/07/04/0/115/4513/3009/664/442/75/0/94af636_upload-1-zpjlvgjpdkid-1-an-xuan-np-lemonde-hq.jpg,,https://www.lemonde.fr/intimites/article/2025/07/07/le-prenom-a-ce-moment-la-de-ma-vie-j-aurais-bien-aime-m-appeler-emilie-et-non-an-xuan_6619516_6190330.html,,
Cinq livres sur la parentalité pour votre été  , Article réservé à nos abonnés ,,,https://www.lemonde.fr/intimites/article/2025/07/06/cinq-livres-sur-la-parentalite-pour-votre-ete_6619244_6190330.html,,
Cinq livres sur la parentalité pour votre été  , Article réservé à nos abonnés ,,,,,
Le postcoït est-il forcément un moment triste ?  , Article réservé à nos abonnés ,,,,,
Sexualité et prostitution adolescente : une pièce de théâtre pour ouvrir la discussion avec les élèves  , Article réservé à nos abonnés ,,,,,
"Moins de voitures, plus de verdure : et si les enfants pouvaient aider à imaginer une ville qui résiste à la canicule ?  ", Article réservé à nos abonnés ,,,https://www.lemonde.fr/intimites/article/2025/07/04/et-si-les-enfants-pouvaient-aider-a-construire-une-ville-durable-qui-resiste-a-la-canicule_6618119_6190330.html,,
"Moins de voitures, plus de verdure : et si les enfants pouvaient aider à imaginer une ville qui résiste à la canicule ?  ", Article réservé à nos abonnés ,,,,,
Cinq ressources pour parler de la canicule avec vos enfants  ,,,,,,
"Amours de jeunesse : « Je tombe éperdument amoureux d’elle et puis, comme un lâche salaud, je détruis tout et je lui brise le cœur »  ", Article réservé à nos abonnés ,,,,,
" Vous aimez Agnès Varda, vous aimerez le 14ᵉ arrondissement de Paris ", Article réservé à nos abonnés ,https://img.lemde.fr/2025/06/30/0/0/3543/2362/664/442/75/0/3673e47_upload-1-vimhjmznkz7h-hl-mcohen-1451147.jpg,,https://www.lemonde.fr/m-perso/article/2025/07/06/vous-aimez-agnes-varda-vous-aimerez-le-14-arrondissement-de-paris_6619252_4497916.html,,
"Claire Touzard : « Dans la “folie”, il y a aussi une résistance aux normes »  ", Article réservé à nos abonnés ,,,https://www.lemonde.fr/m-perso/article/2025/07/05/claire-touzard-dans-la-folie-il-y-a-aussi-une-resistance-aux-normes_6618610_4497916.html,,
"Claire Touzard : « Dans la “folie”, il y a aussi une résistance aux normes »  ", Article réservé à nos abonnés ,,,,,
"Les fléchettes, un sport convivial en plein essor : « C’est vraiment l’activité pour faire autre chose en même temps, parler, boire un coup »  ", Article réservé à nos abonnés ,,,,,
"« Non, grand-mère n’était pas folle » : la quête de vérité sur les aïeules internées de force en psychiatrie  ", Article réservé à nos abonnés ,,,,,
"Sous l’influence du porno, la strangulation érotique se banalise, malgré ses dangers  ", Article réservé à nos abonnés ,,,https://www.lemonde.fr/m-perso/article/2025/07/05/sous-l-influence-du-porno-la-strangulation-erotique-se-banalise-malgre-ses-dangers-ce-qui-rend-cette-pratique-si-excitante-c-est-son-caractere-transgressif_6618459_4497916.html,,
"Sous l’influence du porno, la strangulation érotique se banalise, malgré ses dangers  ", Article réservé à nos abonnés ,,,,,
Travail le 1ᵉʳ-Mai : la crainte d’une « brèche » appelée à s’élargir  , Article réservé à nos abonnés ,,,,,
"Hugo, l’épicier chanteur de TikTok : « Ce n’est pas parce que je suis médiatisé que je vais m’en sortir. Mais, si je ne faisais rien, ce serait encore pire »  ", Article réservé à nos abonnés ,,,,,
 Aux petits soins pour la forêt de Soignes , Article réservé à nos abonnés ,https://img.lemde.fr/2025/07/01/0/0/3543/2362/664/442/75/0/8c5a66f_upload-1-o3bqnzayw8ob-zoniei-nwoud-28a-bart-heirweg.jpg,,https://www.lemonde.fr/m-styles/article/2025/07/05/aux-petits-soins-pour-la-foret-de-soignes_6618614_4497319.html,,
"Au Musée des arts décoratifs, le couturier Paul Poiret consacré roi de l’image  ", Article réservé à nos abonnés ,,,https://www.lemonde.fr/m-styles/article/2025/07/05/au-musee-des-arts-decoratifs-le-couturier-paul-poiret-consacre-roi-de-l-image_6618475_4497319.html,,
"Au Musée des arts décoratifs, le couturier Paul Poiret consacré roi de l’image  ", Article réservé à nos abonnés ,,,,,
"« Il suffit qu’une femme entre dans son champ de vision et que, par malheur, elle pose son attention sur lui, pour que ses mâchoires se serrent »  ", Article réservé à nos abonnés ,,,,,
"A Rome, les jardins réenchantés de la Villa Médicis  ", Article réservé à nos abonnés ,,,,,
"Le CAP cuisine, un diplôme en décalage avec les tendances gastronomiques et les enjeux environnementaux  ", Article réservé à nos abonnés ,,,https://www.lemonde.fr/m-styles/article/2025/07/08/le-cap-cuisine-un-diplome-en-decalage-avec-les-tendances-gastronomiques-et-les-enjeux-environnementaux_6619898_4497319.html,,
"Le CAP cuisine, un diplôme en décalage avec les tendances gastronomiques et les enjeux environnementaux  ", Article réservé à nos abonnés ,,,,,
"Cinq objets écoresponsables : cuiseur à riz kamadosan, germoir bocal, veilleuse française…  ", Article réservé à nos abonnés ,,,,,
Michael Rider chez Celine : un premier défilé au passé composé  ,,,,,,
" Le CAP cuisine, un diplôme en décalage avec les tendances gastronomiques et les enjeux environnementaux ", Article réservé à nos abonnés ,https://img.lemde.fr/2025/07/04/1945/0/2333/1555/664/442/75/0/e49c5ab_upload-1-shrl5dtqosrr-pns-731016523.jpg,,https://www.lemonde.fr/m-styles/article/2025/07/08/le-cap-cuisine-un-diplome-en-decalage-avec-les-tendances-gastronomiques-et-les-enjeux-environnementaux_6619898_4497319.html,,
Les expositions scientifiques à ne pas rater cet été dans toute la France  , Article réservé à nos abonnés ,,,https://www.lemonde.fr/sciences/article/2025/07/08/les-expositions-scientifiques-a-voir-sur-le-chemin-des-vacances_6619832_1650684.html,,
Les expositions scientifiques à ne pas rater cet été dans toute la France  , Article réservé à nos abonnés ,,,,,
"« Histoires de voix », sur France Inter : une série qui donne envie de chanter  ", Article réservé à nos abonnés ,,,,,
Festival d’Avignon : la langue arabe s’invite timidement sur scène  , Article réservé à nos abonnés ,,,,,
"« Obscure et céleste », de Marco Malvaldi : Galilée en danger !  ", Article réservé à nos abonnés ,,,https://www.lemonde.fr/livres/article/2025/07/07/obscure-et-celeste-de-marco-malvaldi-galilee-en-danger_6619641_3260.html,,
"« Obscure et céleste », de Marco Malvaldi : Galilée en danger !  ", Article réservé à nos abonnés ,,,,,
"« A ce moment-là de ma vie, j’aurais bien aimé m’appeler Emilie et non An-Xuân. Je voulais m’effacer plutôt qu’attirer les regards »  ", Article réservé à nos abonnés ,,,,,
"Cinq objets écoresponsables : cuiseur à riz kamadosan, germoir bocal, veilleuse française…  ", Article réservé à nos abonnés ,,,,,
 Santé : quelle mutuelle pour quel profil ? , Article réservé à nos abonnés ,https://img.lemde.fr/2023/05/03/0/0/3000/2000/664/442/75/0/780fea1_1683120136830-lmargent1.jpg,,https://www.lemonde.fr/argent/article/2025/07/08/sante-quelle-mutuelle-pour-quel-profil_6619825_1657007.html,,
Faute d’un avocat : quelle réparation pour le client ?  , Article réservé à nos abonnés ,,,https://www.lemonde.fr/argent/article/2025/07/07/faute-d-un-avocat-quelle-reparation-pour-le-client_6619518_1657007.html,,
Faute d’un avocat : quelle réparation pour le client ?  , Article réservé à nos abonnés ,,,,,
Mon assurance habitation me couvre-t-elle durant les vacances ?  ,,,,,,
Le diamant ne vaut-il plus un clou ?  , Article réservé à nos abonnés ,,,,,
"Chevaux, supercars, châteaux, whiskys… Les pièges de l’investissement fractionné  ", Article réservé à nos abonnés ,,,https://www.lemonde.fr/argent/article/2025/07/04/chevaux-supercars-chateaux-whiskys-les-pieges-de-l-investissement-fractionne_6617879_1657007.html,,
"Chevaux, supercars, châteaux, whiskys… Les pièges de l’investissement fractionné  ", Article réservé à nos abonnés ,,,,,
Investissement durable : les questions climatiques et sociales deviennent-elles taboues dans les grands groupes français ?  , Article réservé à nos abonnés ,,,,,
Prêts étudiants : quelles banques proposent les meilleurs taux ?  , Article réservé à nos abonnés ,,,,,
 Une vague de suicides secoue la direction générale des finances publiques , Article réservé à nos abonnés ,https://img.lemde.fr/2025/07/07/980/56/1878/1252/664/442/75/0/7aace2f_upload-1-kl4avqiyv4xv-image0-3.jpeg,,https://www.lemonde.fr/politique/article/2025/07/08/une-vague-de-suicides-secoue-la-direction-generale-des-finances-publiques_6619817_823448.html,,
Devoir de vigilance : la justice rappelle la « bonne gestion » des risques  , Article réservé à nos abonnés ,,,https://www.lemonde.fr/emploi/article/2025/07/08/devoir-de-vigilance-la-justice-rappelle-la-bonne-gestion-des-risques_6619824_1698637.html,,
Devoir de vigilance : la justice rappelle la « bonne gestion » des risques  , Article réservé à nos abonnés ,,,,,
"Industrie : face aux difficultés d’ArcelorMittal, la nationalisation fait son retour dans le débat  ", Article réservé à nos abonnés ,,,,,
"A Pau, l’expérimentation du « management en équipes autonomes » a changé le quotidien des aides à domicile  ", Article réservé à nos abonnés ,,,,,
"« Plus le management a gagné du terrain, moins il est compris et même toléré »  ", Article réservé à nos abonnés ,,,https://www.lemonde.fr/idees/article/2025/07/08/plus-le-management-a-gagne-du-terrain-moins-il-est-compris-et-meme-tolere_6619869_3232.html,,
"« Plus le management a gagné du terrain, moins il est compris et même toléré »  ", Article réservé à nos abonnés ,,,,,
"A Thouars, l’ancienne école a été transformée en tiers-lieu pour réveiller la ville : « Les énergies existaient, on en a démultiplié les effets »  ", Article réservé à nos abonnés ,,,,,
Travail le 1ᵉʳ-Mai : la crainte d’une « brèche » appelée à s’élargir  , Article réservé à nos abonnés ,,,,,
" Frédéric Hocquard, adjoint au tourisme à la Mairie de Paris : « Plusieurs signes laissent penser que nous allons vers une saturation, une embolie » ", Article réservé à nos abonnés ,https://img.lemde.fr/2025/07/07/0/0/4999/3333/664/442/75/0/123cde2_upload-1-1614mfzo7vaq-maxnewsspecialtwo275084.jpg,,https://www.lemonde.fr/politique/article/2025/07/07/frederic-hocquard-adjoint-au-tourisme-a-la-mairie-de-paris-on-risque-l-embolie-touristique_6619617_823448.html,,
"A Paris, les trois sites de baignade dans la Seine sont restés fermés dimanche en raison des pluies  ", Article réservé à nos abonnés ,,,https://www.lemonde.fr/planete/article/2025/07/06/a-paris-les-trois-sites-de-baignade-dans-la-seine-sont-restes-fermes-dimanche-en-raison-des-pluies_6619291_3244.html,,
"A Paris, les trois sites de baignade dans la Seine sont restés fermés dimanche en raison des pluies  ",,,,,,
"La place de la voiture, un sujet qui divise aussi autour des sites naturels  ", Article réservé à nos abonnés ,,,,,
Maroc : la métamorphose accélérée de Casablanca qui se rêve en « smart city » d’Afrique  ,,,,,,
Police municipale : François-Noël Buffet annonce un projet de loi pour « accroître les compétences » des agents sous la responsabilité des maires  , Article réservé à nos abonnés ,,,https://www.lemonde.fr/societe/article/2025/07/06/police-municipale-francois-noel-buffet-annonce-un-projet-de-loi-pour-accroitre-les-competences-des-agents-sous-la-responsabilite-des-maires_6619249_3224.html,,
Police municipale : François-Noël Buffet annonce un projet de loi pour « accroître les compétences » des agents sous la responsabilité des maires  ,,,,,,
Paris touché par plusieurs coupures de courant en raison de la chaleur  ,,,,,,
"« C’est réel, on se baigne enfin dans la Seine » : les premiers plongeons des Parisiens  ", Article réservé à nos abonnés ,,,,,
 Ce que les mythologies du monde disent du corps humain , Article réservé à nos abonnés ,https://img.lemde.fr/2025/04/16/0/176/4947/3298/664/442/75/0/1627999_sirius-fs-upload-1-uqd4rlwv818p-1744821451524-g724044314.jpg,,https://www.lemonde.fr/le-monde-des-religions/article/2025/07/06/ce-que-les-mythologies-du-monde-disent-du-corps-humain_6619196_6038514.html,,
"Claude Arpi, spécialiste du Tibet : « La succession du dalaï-lama n’est pas qu’une question spirituelle, c’est un levier géopolitique »  ", Article réservé à nos abonnés ,,,https://www.lemonde.fr/le-monde-des-religions/article/2025/07/01/claude-arpi-specialiste-du-tibet-la-succession-du-dalai-lama-n-est-pas-qu-une-question-spirituelle-c-est-un-levier-geopolitique_6617279_6038514.html,,
"Claude Arpi, spécialiste du Tibet : « La succession du dalaï-lama n’est pas qu’une question spirituelle, c’est un levier géopolitique »  ", Article réservé à nos abonnés ,,,,,
"Franck Frégosi, politiste : « En France, l’Etat est en quête du “musulman idéal” et mène une politique de domestication de l’islam »  ", Article réservé à nos abonnés ,,,,,
"A Gaza, avec le père Gabriel Romanelli : « La population est à bout de forces »  ", Article réservé à nos abonnés ,,,,,
Notre-Dame de Paris : les maquettes des futurs vitraux contemporains bientôt exposées au Grand Palais  , Article réservé à nos abonnés ,,,https://www.lemonde.fr/religions/article/2025/06/30/notre-dame-de-paris-les-maquettes-des-futurs-vitraux-contemporains-bientot-exposees-au-grand-palais_6616521_1653130.html,,
Notre-Dame de Paris : les maquettes des futurs vitraux contemporains bientôt exposées au Grand Palais  ,,,,,,
"« Les pratiques cherchant à faire des sens, de la chair et du sexe le théâtre d’une expérience spirituelle se démocratisent »  ", Article réservé à nos abonnés ,,,,,
"Foucauld Giuliani, philosophe : « Trump substitue à Dieu “son” propre dieu, un dieu qui appelle à la guerre et la soutient »  ", Article réservé à nos abonnés ,,,,,
 Les expositions scientifiques à ne pas rater cet été dans toute la France , Article réservé à nos abonnés ,https://img.lemde.fr/2025/07/03/0/0/4032/2688/664/442/75/0/e675e2d_upload-1-v5q0gfcqpbyx-img-3164-a-musei-e-de-la-romanitei-a-nii-mes.jpg,,https://www.lemonde.fr/sciences/article/2025/07/08/les-expositions-scientifiques-a-voir-sur-le-chemin-des-vacances_6619832_1650684.html,,
"Cinq objets écoresponsables : cuiseur à riz kamadosan, germoir bocal, veilleuse française…  ", Article réservé à nos abonnés ,,,https://www.lemonde.fr/m-styles/article/2025/07/07/cinq-objets-ecoresponsables-cuiseur-a-riz-kamadosan-germoir-bocal-veilleuse-francaise_6619510_4497319.html,,
"Cinq objets écoresponsables : cuiseur à riz kamadosan, germoir bocal, veilleuse française…  ", Article réservé à nos abonnés ,,,,,
Sept jeux vidéo sortis cette année à rattraper pendant l’été  , Article réservé à nos abonnés ,,,,,
"Les replays du week-end : paroles d’enfants, rugby, liaisons dangereuses…  ", Article réservé à nos abonnés ,,,,,
"Fouet à matcha, cezve et makisu : comment manier ces ustensiles de cuisine pas toujours faciles à utiliser  ", Article réservé à nos abonnés ,,,https://www.lemonde.fr/le-fil-good/article/2025/07/04/en-cuisine-les-ustensiles-sont-rois-fouet-a-matcha-cezve-makisu-et-moule-a-pastels_6617859_6058795.html,,
"Fouet à matcha, cezve et makisu : comment manier ces ustensiles de cuisine pas toujours faciles à utiliser  ", Article réservé à nos abonnés ,,,,,
Nos vingt-sept livres coups de cœur pour l’été 2025  , Article réservé à nos abonnés ,,,,,
"Les films à l’affiche cette semaine : « L’Accident de piano », « L’Aventura », « Rêves », « Materialists »…  ", Article réservé à nos abonnés ,,,,,
 Mille et une manières de profiter du « Monde » ,,https://img.lemde.fr/2023/09/08/0/0/3000/2000/664/442/75/0/2c254b1_1694180451815-visuel-article-lmev-v3-b.png,,https://www.lemonde.fr/le-monde-et-vous/article/2023/10/29/mille-et-une-manieres-de-profiter-du-monde_6197214_6065879.html,,
Israël-Hamas : « Le Monde » face à la guerre des images  , Article réservé à nos abonnés ,,,https://www.lemonde.fr/le-monde-et-vous/article/2023/11/28/israel-hamas-le-monde-face-a-la-guerre-des-images_6202800_6065879.html,,
Israël-Hamas : « Le Monde » face à la guerre des images  , Article réservé à nos abonnés ,,,,,
La Matinale du Monde a 10 ans : les coulisses de la fabrication d’une édition  ,,,,,,
La Matinale du Monde fête ses 10 ans : ses lecteurs racontent pourquoi ils ne « peuvent plus s’en passer »  ,,,,,,
« Le Monde » et la photographie : l’essor décisif de l’image  , Article réservé à nos abonnés ,,,https://www.lemonde.fr/actualite-medias/article/2025/07/05/le-monde-et-la-photographie-l-essor-decisif-de-l-image_6618476_3236.html,,
« Le Monde » et la photographie : l’essor décisif de l’image  , Article réservé à nos abonnés ,,,,,
"Pour sa 11ᵉ édition, le Festival du Monde se projette vers l’avenir  ",,,,,,
"« Le Monde » répond à vos questions sur sa ligne éditoriale, sa gouvernance et la vie de sa rédaction  ",,,,,,
 Les meilleurs pianos numériques pas chers pour débutants ,,https://img.lemde.fr/2021/12/20/0/0/6376/4251/664/442/75/0/f780226_869169268-1k2a8627.JPG,,https://www.lemonde.fr/guides-d-achat/article/2022/01/17/les-meilleurs-pianos-numeriques-pas-chers-pour-debutants_6109833_5306571.html,,
Les meilleurs sextoys pour le clitoris : comparatif  ,,,,https://www.lemonde.fr/guides-d-achat/article/2024/05/13/sextoys-les-meilleurs-vibromasseurs-pour-le-clitoris_6232927_5306571.html,,
Les meilleurs sextoys pour le clitoris : comparatif  ,,,,,,
Les meilleurs grille-pains  ,,,,,,
Les meilleurs mixeurs plongeants  ,,,,,,
Les meilleures lunch box pour la pause déjeuner  ,,,,https://www.lemonde.fr/guides-d-achat/article/2022/09/01/les-meilleures-lunch-box-pour-la-pause-dejeuner_6139786_5306571.html,,
Les meilleures lunch box pour la pause déjeuner  ,,,,,,
Les meilleures friteuses sans huile  ,,,,,,
Les meilleures gourdes pour remplacer les bouteilles jetables  ,,,,,,
