title,subhead,URL,premium,image URL,byline,article type
" Elon Musk, SpaceX and the illusion of wealth  ","The upcoming stock market listing of SpaceX values the company, of which the billionaire owns less than 50%, at nearly $2 trillion. This figure relies on the success of projects that are unrealistic within any reasonable financial timeframe, such as establishing a colony on Mars or building data centers in space.",https://www.lemonde.fr/en/economy/article/2026/06/01/elon-musk-spacex-and-the-illusion-of-wealth_6754028_19.html,Subscribers only,,,
US-Israel ceasefire with Iran jeopardized by Israeli push into Lebanon,,https://www.lemonde.fr/en/international/article/2026/06/01/us-israel-ceasefire-with-iran-jeopardized-by-israeli-push-into-lebanon_6754027_4.html,,,,
Residence permit for Russian propagandist Xenia Fedorova sparks embarrassment at highest levels of French government,,https://www.lemonde.fr/en/politics/article/2026/06/01/residence-permit-for-russian-propagandist-xenia-fedorova-sparks-embarrassment-at-highest-levels-of-french-government_6754016_5.html,Subscribers only,,,
'It is urgent to heed the warning raised by Pope Leo XIV's encyclical on AI',"The fact that it took a spiritual authority to launch the debate on protecting humanity says a lot about the weakening of political power, which is struggling to rise to the civilizational challenges posed by artificial intelligence, writes Le Monde columnist Stéphane Lauer.",https://www.lemonde.fr/en/opinion/article/2026/06/01/it-is-urgent-to-heed-the-warning-raised-by-pope-leo-xiv-s-encyclical-on-ai_6754021_23.html,Subscribers only,,,
Far-right leaders Bardella and Le Pen diverge on pension reform: 'It's the party's explosive issue',"Rassemblement National leader Jordan Bardella, who may end up being the party's presidential candidate, has shifted to advocating for scrapping the pension system's fixed legal retirement age and possibly adding a share of capitalization.",https://www.lemonde.fr/en/politics/article/2026/06/01/far-right-leaders-bardella-and-le-pen-diverge-on-pension-reform-it-s-the-party-s-explosive-issue_6754025_5.html,Subscribers only,,,
Upcoming G7 in Evian puts serious strain on France-Switzerland relations,"The summit, scheduled to take place on the French shore of Lake Geneva from June 15 to 17, has required the involvement of Swiss authorities due to delegations transiting through Geneva Airport and a planned demonstration in the city.",https://www.lemonde.fr/en/international/article/2026/06/01/upcoming-g7-puts-serious-strain-on-relations-between-switzerland-and-france_6754005_4.html,Subscribers only,,,
Sexting scandal involving Graham Platner threatens Democratic hopes for US midterm elections,"The sexually explicit messages revealed by 'The Wall Street Journal' are undermining the likely Democratic candidate for the Senate race in Maine, a key state in the Northeast.",https://www.lemonde.fr/en/international/article/2026/06/01/sexting-scandal-involving-graham-platner-threatens-democratic-hopes-for-us-midterm-elections_6754029_4.html,Subscribers only,, Nicolas Chapuis,In Depth
Capture of Beaufort Castle in southern Lebanon is both a strategic asset and a historical burden for Israel,,https://www.lemonde.fr/en/international/article/2026/06/01/capture-of-beaufort-castle-in-southern-lebanon-is-both-a-strategic-asset-and-a-historical-burden-for-israel_6754018_4.html,Subscribers only,,,
France's last French Opend hope dashed after Diane Parry defeated by Maja Chwalinska,,https://www.lemonde.fr/en/tennis/article/2026/06/01/french-open-2026-france-s-last-hope-dashed-after-diane-parry-defeated-by-maja-chwalinska_6754024_94.html,,,,
Serena Williams announces her return to tennis,,https://www.lemonde.fr/en/sports/article/2026/06/01/serena-williams-announces-her-return-to-tennis_6754026_9.html,,,,
Far-right candidate Abelardo de la Espriella leads in first round of Colombian presidential election,,https://www.lemonde.fr/en/international/article/2026/06/01/far-right-candidate-abelardo-de-la-espriella-leads-in-first-round-of-colombian-presidential-election_6754019_4.html,Subscribers only,,,
"After cadmium, French doctors warn of drinking water pollution",,https://www.lemonde.fr/en/environment/article/2026/06/01/after-cadmium-french-doctors-warn-of-drinking-water-pollution-another-major-public-health-issue_6754014_114.html,Subscribers only,,,
Resignation of environmental figure Steven Guilbeault weakens Canada PM Carney,,https://www.lemonde.fr/en/international/article/2026/06/01/canada-resignation-of-environmental-figure-steven-guilbeault-weakens-prime-minister-carney_6754007_4.html,Subscribers only,,,
'We'll be back next year for the third!': PSG celebrates second Champions League title with victory party and eye on more trophies,,https://www.lemonde.fr/en/sports/article/2026/06/01/we-ll-be-back-next-year-for-the-third-psg-celebrates-second-champions-league-title-with-victory-party-and-eye-on-more-trophies_6754010_9.html,Subscribers only,,,
"French museum reports theft of arty banana, part of a multimillion-dollar piece",,https://www.lemonde.fr/en/culture/article/2026/06/01/french-museum-reports-theft-of-arty-banana-part-of-a-multimillion-dollar-piece_6754001_30.html,,,,
Cannes rolls out the red carpet for season 4 of 'White Lotus',,https://www.lemonde.fr/en/m-le-mag/article/2026/06/01/white-lotus-cannes-rolls-out-the-red-carpet-for-season-4_6754008_117.html,Subscribers only,,,
Macron hosts his last Choose France summit against a backdrop of stalled reindustrialization,,https://www.lemonde.fr/en/economy/article/2026/05/31/macron-hosts-his-final-choose-france-event-against-a-backdrop-of-stalled-reindustrialization_6753985_19.html,Subscribers only,,,
Mutual mistrust persists between football and the French far right,,https://www.lemonde.fr/en/opinion/article/2026/06/01/mutual-mistrust-persists-between-football-and-the-french-far-right_6754011_23.html,Subscribers only,,,
Nearly 900 arrested in France after PSG's Champions League win,,https://www.lemonde.fr/en/police-and-justice/article/2026/06/01/nearly-900-arrested-in-france-after-psg-wins-champions-league-final_6754009_105.html,,,,
The Bolloré protégée spreading Russian propaganda in France,"Xenia Fedorova, the former director of the now-banned Russian channel RT France, has free rein to advance the Kremlin's version of events without contradiction across the media empire of far-right billionaire Vincent Bolloré.",https://www.lemonde.fr/en/politics/article/2026/05/29/the-bollore-protegee-spreading-russian-propaganda-in-france_6753949_5.html,Subscribers only,, Ariane Chemin and  Ivanne Trippenbach,Investigation
"Sheikha Al-Mayassa Al Thani, the princess spearheading Qatar's artistic ambitions","A central figure in the country's cultural policy, the emir's sister has skillfully used the acquisition of prestigious works of art, the hosting of fairs and the creation of museums to build valuable diplomatic ties.",https://www.lemonde.fr/en/international/article/2026/05/31/sheikha-al-mayassa-al-thani-the-princess-spearheading-qatar-s-artistic-ambitions_6753997_4.html,Subscribers only,, Raphaëlle Bacqué and  Roxana Azimi,Profile
The oil crisis suits TotalEnergies' CEO perfectly,"Between price caps at the pump and controversies over windfall profits, Patrick Pouyané is once again at the center of public debate. Despite the tensions, he dreams of proving that the multinational company serves the French people's interest.",https://www.lemonde.fr/en/economy/article/2026/05/30/the-oil-crisis-suits-totalenergies-ceo-perfectly_6753962_19.html,Subscribers only,, Isabelle Chaperon and  Marie de Vergès,Profile
PSG's sporting triumph in a football world driven by financial power,,https://www.lemonde.fr/en/opinion/article/2026/06/01/psg-s-sporting-triumph-in-a-football-world-driven-by-financial-power_6754017_23.html,,,,Editorial
'Trump and Netanyahu have turned their own blindness into a weapon of mass destruction',,https://www.lemonde.fr/en/international/article/2026/05/31/trump-and-netanyahu-have-turned-their-own-blindness-into-a-weapon-of-mass-destruction_6753993_4.html,Subscribe,,,Column
"By backtracking on environmental progress, Macron is 'betraying' the French, former members of the Climate Convention write",,https://www.lemonde.fr/en/opinion/article/2026/05/28/by-backtracking-on-environmental-progress-macron-is-betraying-the-french-former-members-of-the-climate-convention-write_6753898_23.html,Subscribe,,,Op-Ed
