title,premium,image URL,subhead,URL,byline,article type
"Notre-Dame de Paris connaît une affluence record, neuf mois après sa réouverture", Article réservé aux abonnés ,,,,,
Google échappe au démantèlement aux Etats-Unis, Article réservé aux abonnés ,,,,,
"« Wall Street, porte d’entrée royale pour valoriser les start-up de la “tech” »", Article réservé aux abonnés ,,,,,
"Mouvement du 10 septembre : « Le but n’est plus de renverser le capitalisme, mais de le rendre moins cruel pour les plus démunis »", Article réservé aux abonnés ,,,,,
Pourquoi la Russie utilise tellement de drones iraniens Shahed pour attaquer l’Ukraine, Article réservé aux abonnés ,,,,,
« Bloquons tout » : les premières images des actions de mobilisation du 10 septembre,,,,,,
Pourquoi les pick-up Toyota sont-ils utilisés dans tous les conflits ?, Article réservé aux abonnés ,,,,,
Comment la dette s’est creusée depuis l’arrivée d’Emmanuel Macron au pouvoir, Article réservé aux abonnés ,,,,,
"Editorial du « Monde » : pour Sébastien Lecornu, la voie étroite du compromis",,,,,,
"L’« accélérationnisme », tout schuss vers la fin du vieux monde", Article réservé aux abonnés ,,,,,
« Le chapitre qui s’ouvre aujourd’hui apparaît plus vertigineux que les autres », Article réservé aux abonnés ,,,,,
"Eric la Blanche, philosophe : « Sans colère, il n’y a jamais eu de progrès social »", Article réservé aux abonnés ,,,,,
"« Premières classes » : une année scolaire en Ukraine, ébranlée par l’offensive russe", Article réservé aux abonnés ,,,,,
"Dan Brown, auteur du « Le Secret des secrets » : « Robert Langdon, c’est l’homme que je voudrais être »", Article réservé aux abonnés ,,,,,
"« Katrina. L’ouragan infernal », sur Netflix : vingt ans après, Spike Lee prend le pouls de La Nouvelle-Orléans", Article réservé aux abonnés ,,,,,
A voir ce soir : la série « The Girlfriend » sur Prime Video, Article réservé aux abonnés ,,,,,
Les dessous prennent le dessus,,,,,,
"Le sandwich, le casse-dalle du siècle",,,,,,
Levure ou levain ? Un débat gastronomique difficile à trancher, Article réservé aux abonnés ,,,,,
La bouquinerie éphémère de Guy et Brigitte Oudenot en Bretagne pour dire stop à la guerre, Article réservé aux abonnés ,,,,,
" L’attaque israélienne au Qatar est « ni plus ni moins que du terrorisme d’Etat », selon la diplomatie de l’émirat  ",Article réservé aux abonnés,,"Le porte-parole du ministère qatari des affaires étrangères affirme que l’émirat du Golfe étudie les moyens d’intenter une action en justice contre le premier ministre de l’Etat hébreu, Benyamin Nétanyahou, qu’il qualifie de « voyou » qui a « perdu la raison ».",https://www.lemonde.fr/international/article/2025/09/11/attaque-d-israel-au-qatar-ni-plus-ni-moins-que-du-terrorisme-d-etat-selon-la-diplomatie-de-l-emirat_6640435_3210.html,,
Nos journalistes racontent les manifestations du 10 septembre : « Il y a vraiment une très forte colère qui monte autour des enjeux d’injustice sociale »,,https://img.lemde.fr/2025/09/11/0/0/6720/4480/398/265/75/0/a0baf34_upload-1-f1lpc6t5fpsu-vn20250910-10-09-bloquons-tout-toulouse041.jpg,,https://www.lemonde.fr/politique/article/2025/09/11/mouvement-du-10-septembre-l-instabilite-politique-laisse-entrevoir-une-crise-plus-profonde-qu-un-ras-le-bol-classique_6640429_823448.html,,
Gabriel Zucman : « Il va être très difficile de demander aux Français de faire des efforts tant que les milliardaires paieront si peu d’impôts »,Article réservé aux abonnés,https://img.lemde.fr/2025/09/10/839/12/2836/1891/398/265/75/0/47082f5_upload-1-x2slzfx7s3dr-csharrock-lm-zucman-16.jpg,,https://www.lemonde.fr/politique/article/2025/09/11/gabriel-zucman-le-nouveau-premier-ministre-va-devoir-se-saisir-du-projet-de-taxe-sur-les-ultrariches_6640375_823448.html,,
"Après l’assassinat de Charlie Kirk, le FBI a retrouvé l’arme du crime et cherche toujours le suspect",,https://img.lemde.fr/2025/09/11/0/0/6000/4000/398/265/75/0/e9900b9_ftp-import-images-1-gy2fpibw7z9p-5857459-01-06.jpg,"Le responsable de la police de l’Utah a par ailleurs dit disposer « de bonnes images » du suspect, et avoir pu reconstituer ses mouvements, de son arrivée sur le campus à sa fuite après le tir contre l’influenceur conservateur.",https://www.lemonde.fr/international/article/2025/09/11/assassinat-de-charlie-kirk-le-fbi-annonce-avoir-retrouve-l-arme-ayant-servi-a-le-tuer_6640433_3210.html,,
"Le point sur l’affaire des drones russes en Pologne : réunion d’urgence à l’ONU vendredi, la Chine appelle au « dialogue »",,https://img.lemde.fr/2025/09/11/0/0/4726/3150/398/265/75/0/007411e_ftp-import-images-1-a15y6n8dow0e-09bc3e89214a42339625cee88f8d8651-0-36133c31fda64eca96eade7bda7d6908.jpg,"Varsovie a annoncé, jeudi, l’établissement d’une zone d’exclusion aérienne à la frontière entre la Biélorussie et l’Ukraine. Cette décision fait suite à l’intrusion d’une vingtaine de drones présumés russes sur son territoire dans la nuit de mardi à mercredi.",https://www.lemonde.fr/international/live/2025/09/11/en-direct-guerre-en-ukraine-l-incursion-de-drones-russes-en-pologne-va-faire-l-objet-de-debats-d-urgence-au-parlement-europeen_6639249_3210.html,,
"La croissance française devrait atteindre 0,8 % en 2025, l’incertitude politique pèse",Article réservé aux abonnés,https://img.lemde.fr/2025/09/10/0/0/7181/4787/398/265/75/0/d97a49d_ftp-import-images-1-ftrhidoj4z8n-5850187-01-06.jpg,"L’économie française demeure anémique dans une Europe qui repart. Un déficit de confiance s’est installé depuis la dissolution en 2024, et conduit les entreprises à investir moins et les ménages à dépenser moins.",https://www.lemonde.fr/economie/article/2025/09/11/la-croissance-francaise-devrait-atteindre-0-8-en-2025-l-incertitude-politique-pese_6640437_3234.html,,
"Malaise, colère et « crises d’angoisse » au « Parisien », qui pourrait être vendu à Vincent Bolloré",Article réservé aux abonnés,https://img.lemde.fr/2025/09/11/0/0/6655/4437/664/442/75/0/a5b08ac_upload-1-udksuzorphep-000-36v33lm.jpg,"Les journalistes implorent le propriétaire, Bernard Arnault, de répondre à leur inquiétude et de renoncer, s’il l’envisage, à une vente. Si la crainte terrasse les troupes, le malaise interne n’avait pas attendu cette perspective pour grandir.",https://www.lemonde.fr/economie/article/2025/09/11/on-sait-ce-qui-arrive-quand-vincent-bollore-reprend-un-media-au-parisien-la-redaction-se-mobilise-pour-empecher-sa-vente_6640432_3234.html, Aude Dassonville,Synthèse
"Le Qatar dément prendre ses distances avec les Etats-Unis après l’attaque israélienne, et condamne les déclarations « irresponsables » de Nétanyahou",,https://img.lemde.fr/2025/09/11/0/182/1960/1307/198/132/95/0/89fc01f_ftp-import-images-1-sbzhdkjcxpc8-2025-09-11t134844z-159097675-rc2ppga5fk4z-rtrmadp-3-israel-palestinians-qatar-funeral.JPG,,https://www.lemonde.fr/international/live/2025/09/11/en-direct-gaza-des-dizaines-de-milliers-de-personnes-contraintes-de-quitter-la-ville-de-gaza-assiegee-par-l-armee-israelienne_6638986_3210.html,,
Les présidentes de France Télévisions et de Radio France convoquées par l’Arcom après la diffusion de vidéos des journalistes Thomas Legrand et Patrick Cohen,,https://img.lemde.fr/2025/06/30/0/0/8256/5504/198/132/95/0/766070e_ftp-import-images-1-kopdbmuaoy86-5294383-01-06.jpg,,https://www.lemonde.fr/economie/article/2025/09/11/l-arcom-va-auditionner-les-presidentes-de-france-televisions-et-de-radio-france-apres-la-polemique-concernant-thomas-legrand-et-patrick-cohen_6640425_3234.html,,
Le ministère de l’intérieur renonce à une directive sur les violences urbaines contestée par les journalistes,,https://img.lemde.fr/2025/09/10/96/0/2112/1408/198/132/95/0/9093f9c_upload-1-f0bg7uf21twz-image2.jpeg,,https://www.lemonde.fr/societe/article/2025/09/11/violences-urbaines-le-ministere-de-l-interieur-renonce-a-une-directive-contestee-par-les-journalistes_6640430_3224.html,,
Pourquoi la valeur économique de la forêt française est largement sous-estimée,Article réservé aux abonnés,https://img.lemde.fr/2025/09/11/216/0/5184/3456/198/132/95/0/8dbec74_upload-1-yql6v1bl7fou-000-33yf6yw.jpg,,https://www.lemonde.fr/planete/article/2025/09/11/pourquoi-la-valeur-economique-de-la-foret-francaise-est-largement-sous-estimee_6640440_3244.html,,
Quand la Monnaie de Paris frappe des pièces sans autorisation,Article réservé aux abonnés,,,https://www.lemonde.fr/politique/article/2025/09/11/quand-la-monnaie-de-paris-frappe-des-pieces-sans-autorisation_6640420_823448.html,,
A quand remonte le divorce entre plus de la moitié des habitants de la planète et les valeurs occidentales ?,Article réservé aux abonnés,,,https://www.lemonde.fr/idees/article/2025/09/11/a-quand-remonte-le-divorce-entre-plus-de-la-moitie-des-habitants-de-la-planete-et-les-valeurs-occidentales_6640417_3232.html,,
"Florent de Kersauson, conseiller régional RN, condamné pour cinq infractions financières, dont abus de confiance, faux et usages de faux",,,,https://www.lemonde.fr/politique/article/2025/09/11/florent-de-kersauson-conseiller-regional-rn-condamne-pour-cinq-infractions-financieres-dont-abus-de-confiance-faux-et-usages-de-faux_6640421_823448.html,,
"Peter Mandelson, ambassadeur britannique aux Etats-Unis, limogé en raison de ses liens avec Jeffrey Epstein",,,,https://www.lemonde.fr/international/article/2025/09/11/peter-mandelson-ambassadeur-britannique-aux-etats-unis-limoge-en-raison-de-ses-liens-avec-jeffrey-epstein_6640413_3210.html,,
Une centaine de médias internationaux demandent à l’administration Trump de ne pas restreindre les visas des journalistes étrangers : « Cela nuirait à la position mondiale de l’Amérique »,,,,https://www.lemonde.fr/international/article/2025/09/11/une-centaine-de-medias-demandent-a-l-administration-trump-de-ne-pas-restreindre-les-visas-des-journalistes-etrangers-aux-etats-unis_6640415_3210.html,,
La coûteuse politique migratoire australienne,Article réservé aux abonnés,,,https://www.lemonde.fr/international/article/2025/09/11/la-couteuse-politique-migratoire-australienne_6640418_3210.html,,
"Près de 300 morts en excès pendant la canicule d’août 2025, notamment chez les plus âgés, selon Santé publique France",,,,https://www.lemonde.fr/climat/article/2025/09/11/pres-de-300-morts-en-exces-pendant-la-canicule-d-aout-notamment-chez-les-plus-ages-selon-sante-publique-france_6640423_1652612.html,,
"Baptiste Charroing, le nouveau patron du Théâtre des Champs-Elysées, mise sur la jeunesse et la tradition",Article réservé aux abonnés,,,https://www.lemonde.fr/culture/article/2025/09/11/baptiste-charroing-le-nouveau-patron-du-theatre-des-champs-elysees-mise-sur-la-jeunesse-et-la-tradition_6640424_3246.html,,
"L’assassinat de Charlie Kirk, un proche de Trump, replonge les Etats-Unis dans la violence politique",Article réservé aux abonnés,https://img.lemde.fr/2025/09/11/0/0/3000/2000/664/442/75/0/053206b_upload-1-scdwzjywsoeb-627796.jpg,"Figure du monde MAGA, l’influenceur adulé par les jeunes conservateurs a été abattu, mercredi, dans l’Utah. Donald Trump a, sans attendre l’enquête, mis en cause « l’extrême gauche ».",https://www.lemonde.fr/international/article/2025/09/11/l-assassinat-de-charlie-kirk-consterne-l-amerique-et-provoque-un-sursaut-de-haine-politique_6640402_3210.html, Arnaud Leparmentier et  Piotr Smolar,Reportage
TikTok est « un des pires réseaux sociaux à l’assaut de notre jeunesse » : les mots très durs de la commission d’enquête parlementaire,Article réservé aux abonnés,https://img.lemde.fr/2025/09/11/0/0/6240/4160/664/442/75/0/6001e1c_upload-1-bclzbzkzs1z9-080-hl-nguyonnet-1851637.jpg,"A l’issue de six mois de travaux, la commission d’enquête parlementaire relative aux effets psychologiques de TikTok sur les mineurs a remis ses conclusions, et formulé 43 recommandations.",https://www.lemonde.fr/pixels/article/2025/09/11/commission-d-enquete-tiktok-le-rapport-etrille-une-plateforme-hors-de-controle-a-l-assaut-de-la-jeunesse-et-formule-43-recommandations_6640383_4408996.html, Morgane Tual,Les faits
"Alain Juppé : « Le “gouvernement des juges”, ça n’existe pas »",Article réservé aux abonnés,https://img.lemde.fr/2025/09/10/940/0/3677/2451/664/442/75/0/92678f2_upload-1-w2mxdm1ui8rc-ll-alain-juppe-20.jpg,"Dans « L’Heure du choix », un essai publié le 11 septembre, l’ancien premier ministre (1995-1997) défend la vision d’une Europe forte et indépendante. Face aux remises en cause de l’Etat de droit, le membre du Conseil constitutionnel rappelle l’importance de la séparation des pouvoirs.",https://www.lemonde.fr/politique/article/2025/09/11/alain-juppe-le-gouvernement-des-juges-ca-n-existe-pas_6640390_823448.html, Alexandre Pedro et  Nathalie Segaunes,Entretien
"« Pendant que Vladimir Poutine déchaîne le feu sur l’Ukraine, Donald Trump peste et maugrée »",S’abonner,https://img.lemde.fr/2017/09/22/0/0/0/0/100/100/60/0/f2df5fa_237.jpg,,https://www.lemonde.fr/idees/article/2025/09/10/pendant-que-vladimir-poutine-dechaine-le-feu-sur-l-ukraine-donald-trump-peste-et-maugree_6640291_3232.html,,Chronique
« Le chapitre qui s’ouvre aujourd’hui apparaît plus vertigineux que les autres »,S’abonner,https://img.lemde.fr/2017/06/12/0/0/0/0/100/100/60/0/73f3cca_40.jpg,,https://www.lemonde.fr/idees/article/2025/09/09/chute-du-gouvernement-bayrou-le-chapitre-qui-s-ouvre-aujourd-hui-apparait-plus-vertigineux-que-les-autres_6640052_3232.html,,Chronique
« Les entreprises d’IA ne feront pas l’économie des débats sur l’encadrement de leurs outils »,S’abonner,https://img.lemde.fr/2019/06/07/0/0/0/0/100/100/60/0/e459efe_RUkm5WiAD3APomk0zXimPhhS.jpg,,https://www.lemonde.fr/idees/article/2025/09/11/les-entreprises-d-ia-ne-feront-pas-l-economie-des-debats-sur-l-encadrement-de-leurs-outils_6640414_3232.html,,Chronique
