title,subhead,URL,premium,image URL,byline,article type
 Trump says US-Iran peace talks could resume this week  ,Trump said negotiations could be held again in Islamabad as diplomats worked through back channels to arrange them.,https://www.lemonde.fr/en/international/article/2026/04/15/trump-says-iran-peace-talks-could-take-place-over-the-next-two-days_6752429_4.html, Subscribers only ,,,
Israeli envoy says France has no place in peace talks with Lebanon,,https://www.lemonde.fr/en/international/article/2026/04/14/israeli-envoy-says-on-the-same-side-with-lebanon-after-talks-in-us_6752424_4.html,,,,
Jean-Marc Jancovici: 'Rising gas prices are an appetizer for what's ahead if decarbonization fails',,https://www.lemonde.fr/en/environment/article/2026/04/15/jean-marc-jancovici-rising-gas-prices-are-an-appetizer-for-what-s-ahead-if-decarbonization-fails_6752435_114.html,Subscribers only,,,
"Sepideh Farsi, filmmaker: 'We are witnessing the destruction of Iranian heritage, culture and environment'","The Iranian director shares her anguish over the consequences of American airstrikes on her country. Beyond the loss of life and material devastation, she reflects on the wonders of Iranian civilization and culture that have been permanently scarred.",https://www.lemonde.fr/en/opinion/article/2026/04/15/sepideh-farsi-filmmaker-we-are-witnessing-the-destruction-of-iranian-heritage-culture-and-environment_6752432_23.html,Subscribers only,,,
Measuring insect decline by photographing your license plate is a 'simple and brilliant' idea,"On April 13, France's National Museum of Natural History announced the launch of a citizen science project modeled after a similar initiative that was established in 2021 in the United Kingdom.",https://www.lemonde.fr/en/environment/article/2026/04/15/measuring-insect-decline-by-photographing-your-license-plate-is-a-simple-and-brilliant-idea_6752431_114.html,Subscribers only,,,
Kanye West postpones Marseille concert after France considers blocking him from performing,The US rapper postponed his concert in Marseille after he was blocked from entering the UK over antisemitic remarks and voicing admiration for Adolf Hitler.,https://www.lemonde.fr/en/france/article/2026/04/15/kanye-west-postpones-marseille-concert-after-france-considers-blocking-him-from-performing_6752436_7.html,,,,
Trump Organization's Vietnam golf project sparks protests and corruption allegations,"Signed just before the 2024 US presidential election, the project has caused divisions within the government and sparked anger among local residents, who have been offered extremely low compensation for the seizure of their land.",https://www.lemonde.fr/en/international/article/2026/04/15/trump-organization-s-vietnam-golf-project-sparks-protests-and-corruption-allegations-at-that-price-how-can-we-accept_6752430_4.html,Subscribers only,, Brice Pedroletti,Feature
Mahdieh Esfandiari returns to Iran after release of two French hostages,,https://www.lemonde.fr/en/international/article/2026/04/15/mahdieh-esfandiari-returns-to-iran-after-release-of-two-french-hostages_6752437_4.html,,,,
Zelensky says US peace negotiators 'have no time for Ukraine' because of Iran war,,https://www.lemonde.fr/en/international/article/2026/04/14/zelensky-says-us-peace-negotiators-have-no-time-for-ukraine-because-of-iran-war_6752425_4.html,,,,
'The presence of PFAS in my blood is out of my control': Six Europeans on living in 'forever pollution' hotspots,,https://www.lemonde.fr/en/les-decodeurs/visuel/2026/04/14/the-presence-of-pfas-in-my-blood-is-out-of-my-control-six-europeans-on-living-in-forever-pollution-hotspots_6752421_8.html,Subscribers only,,,
PSG reach Champions League semi-finals after Dembélé's double against Liverpool,,https://www.lemonde.fr/en/sports/article/2026/04/14/psg-beat-liverpool-2-0-to-reach-champions-league-semi-finals_6752426_9.html,,,,
"Hungary elections: 'Once the champagne has been popped, European leaders must reassess their expectations for the new government'",,https://www.lemonde.fr/en/opinion/article/2026/04/15/hungary-elections-once-the-champagne-has-been-popped-european-leaders-must-reassess-their-expectations-for-the-new-government_6752427_23.html,Subscribers only,,,
"Behind the war in Iran, Trump's obsession with global energy resources",,https://www.lemonde.fr/en/opinion/article/2026/04/14/behind-the-war-in-iran-trump-s-obsession-with-global-energy-resources_6752423_23.html,Subscribers only,,,
Investigators denied access to Elysée Palace in events contracts probe,,https://www.lemonde.fr/en/les-decodeurs/article/2026/04/14/investigators-denied-access-to-elysee-palace-in-events-contracts-probe_6752415_8.html,Subscribers only,,,
"The devastated residents of Chibab Tower, struck by four Israeli missiles",,https://www.lemonde.fr/en/international/article/2026/04/14/the-devastated-residents-of-chibab-tower-struck-by-four-israeli-missiles_6752419_4.html,Subscribers only,,,
"'The Strait of Hormuz crisis shows that the seas are no longer spaces of freedom, but territories whose control comes at a price'",,https://www.lemonde.fr/en/opinion/article/2026/04/14/the-strait-of-hormuz-crisis-shows-that-the-seas-are-no-longer-spaces-of-freedom-but-territories-whose-control-comes-at-a-price_6752418_23.html,Subscribers only,,,
IMF cuts global growth forecast due to Middle East war,,https://www.lemonde.fr/en/economy/article/2026/04/14/imf-cuts-global-growth-forecast-due-to-middle-east-war_6752413_19.html,,,,
The Calder exhibition at the Fondation Louis Vuitton in Paris offers a festive experience,,https://www.lemonde.fr/en/culture/article/2026/04/15/the-calder-exhibition-at-the-fondation-louis-vuitton-in-paris-offers-a-festive-experience_6752434_30.html,Subscribers only,,,
Low turnout could shape the 2027 French presidential race,,https://www.lemonde.fr/en/politics/article/2026/04/14/low-turnout-could-shape-the-2027-french-presidential-race_6752399_5.html,Subscribers only,,,
New online search tool in Germany reveals if ancestors were Nazi Party members,"In partnership with American and German archives, the weekly 'Die Zeit' has launched a searchable tool granting access to more than 12 million documents, cataloging the bulk of Nazi Party (NSDAP) memberships from 1925 to 1945.",https://www.lemonde.fr/en/international/article/2026/04/14/new-online-search-tool-in-germany-reveals-if-ancestors-were-nazi-party-members_6752420_4.html,Subscribers only,, Cécile Boutelet,In Depth
"French court condemns 'organized, opaque and illegal' terrorist funding system in Lafarge trial","During the ruling, the president of the court drew an explicit connection between the 'commercial partnership' that the French cement company had entered with terrorist groups and the attacks that were then carried out by those groups.",https://www.lemonde.fr/en/france/article/2026/04/14/french-court-condemns-organized-opaque-and-illegal-terrorist-funding-system-in-lafarge-trial_6752386_7.html,Subscribers only,, Soren Seelow,News
American Catholics outraged at Trump's attack of pope and AI-generated image of himself as Christ,"The US president claimed, against all plausibility, that the image he posted on social media showed him as a doctor, but he was forced to take it down. The post, along with his lengthy tirade against Leo XIV, left believers stunned.",https://www.lemonde.fr/en/international/article/2026/04/14/american-catholics-outraged-at-trump-s-attack-of-pope-and-ai-generated-image-of-him-as-christ_6752396_4.html,Subscribers only,, Arnaud Leparmentier,In Depth
The French's desire for change must be heard by future presidential candidates,,https://www.lemonde.fr/en/opinion/article/2026/04/14/the-french-s-desire-for-change-must-be-heard-by-future-presidential-candidates_6752412_23.html,,,,Editorial
"'Natural bread, more digestible and free of toxic substances, could be available to all if we changed the rules'",,https://www.lemonde.fr/en/opinion/article/2026/04/14/cadmium-natural-bread-more-digestible-and-free-of-toxic-substances-could-be-available-to-all-if-we-changed-the-rules_6752410_23.html,Subscribe,,,Op-Ed
"'Steve Witkoff, Trump's favorite negotiator, boosts his business more than peace'",,https://www.lemonde.fr/en/international/article/2026/04/12/steve-witkoff-trump-s-favorite-negotiator-boosts-his-business-more-than-peace_6752340_4.html,Subscribe,,,Column
