title,subhead,URL,premium,image URL,byline,article type
 Kyiv spends sleepless nights underground as Russia intensifies attacks  ,"Since May 24, the Ukrainian capital has been in mourning, hit by Russian strikes involving ballistic missiles and new, ultra-fast jet-powered drones, while the city's air defense faces a severe shortage of anti-missile systems.",https://www.lemonde.fr/en/international/article/2026/07/11/war-in-ukraine-kyiv-spends-sleepless-nights-underground-as-russia-intensifies-attacks_6755371_4.html,Subscribers only,,,
"France's Socialists opt for a presidential primary, but who will run?",,https://www.lemonde.fr/en/politics/article/2026/07/11/france-s-socialists-opt-for-a-presidential-primary-but-who-will-run_6755375_5.html,Subscribers only,,,
Eiffel Tower and Louvre to close early all weekend amid heatwave,,https://www.lemonde.fr/en/france/article/2026/07/11/eiffel-tower-and-louvre-to-close-early-all-weekend-amid-heatwave_6755373_7.html,,,,
Houston killing of Mexican man by ICE reignites debate over US immigration agency,"Lorenzo Salgado Araujo, a 52-year-old contractor awaiting regularization of his status, was shot dead by an agent claiming to have acted in self-defense, a claim disputed by the victim's friends and family.",https://www.lemonde.fr/en/international/article/2026/07/11/houston-killing-of-mexican-man-by-ice-reignites-debate-over-us-immigration-agency_6755370_4.html,Subscribers only,,,
"'Behind the suffering there are people who love life, art and peace': Words of hope from a poetry contest in Gaza","About 60 students from Gaza, aged 18 to 25, responded to a call from the French Institute of Gaza and the NGO Academic Solidarity with Palestine by submitting poems or videos in which they shared, in French, their feelings and hopes in the face of the war that has affected them for almost three years.",https://www.lemonde.fr/en/international/article/2026/07/11/behind-the-suffering-there-are-people-who-love-life-art-and-peace-words-of-hope-from-a-poetry-contest-in-gaza_6755362_4.html,Subscribers only,,,
Le Monde's eight favorite exhibitions at Arles Photography Festival,Our culture critic has selected her favorite exhibitions among the 36 offerings at the major photography festival held throughout the southern French city.,https://www.lemonde.fr/en/culture/article/2026/07/11/arles-photography-festival-our-eight-favorite-exhibitions_6755366_30.html,Subscribers only,,,
Silicon Valley's next generation feels the AI blues,"In California, the rise of artificial intelligence no longer generates the unanimous enthusiasm it once did. Anxiety is mounting, especially among students and engineers, as jobs have been cut and democratic risks have grown more threatening.",https://www.lemonde.fr/en/m-le-mag/article/2026/07/11/when-it-comes-to-ai-nothing-s-right-silicon-valley-is-torn_6755365_117.html,Subscribers only,, Arnaud Leparmentier,Long Read
"French stayed put during June heatwave, cutting back movements",,https://www.lemonde.fr/en/economy/article/2026/07/11/french-stayed-put-during-june-heatwave-cutting-back-movements_6755374_19.html,Subscribers only,,,
'The latest chapter in Le Pen's legal saga illustrates the intractable challenge of judging politicians',,https://www.lemonde.fr/en/opinion/article/2026/07/11/the-latest-chapter-in-le-pen-s-legal-saga-illustrates-the-intractable-challenge-of-judging-politicians_6755376_23.html,Subscribers only,,,
Tour de France: Merlier wins second consecutive stage,,https://www.lemonde.fr/en/sports/article/2026/07/11/tour-de-france-merlier-wins-second-consecutive-stage_6755377_9.html,,,,
"Ebola outbreak remains out of control, spreads at record speed in the DRC",,https://www.lemonde.fr/en/le-monde-africa/article/2026/07/10/ebola-outbreak-remains-out-of-control-spreads-at-record-speed-in-the-drc_6755357_124.html,Subscribers only,,,
UK police release man arrested in murder investigation into ex-MP's death,,https://www.lemonde.fr/en/international/article/2026/07/10/uk-police-launch-murder-investigation-into-ex-mp-s-death_6755352_4.html,,,,
Marine Le Pen conviction: 'It's very French to think that preventing one person from running undermines democracy as a whole',,https://www.lemonde.fr/en/opinion/article/2026/07/10/marine-le-pen-conviction-it-s-very-french-to-think-that-preventing-one-person-from-running-undermines-democracy-as-a-whole_6755345_23.html,Subscribers only,,,
Sexual violence in Paris after-school programs: Ex-childcare worker found guilty of sexual assault,,https://www.lemonde.fr/en/france/article/2026/07/10/sexual-violence-in-paris-after-school-programs-ex-childcare-worker-found-guilty-of-sexual-assault_6755348_7.html,,,,
Children at the office during the heatwave: 'They have a meeting room with coloring books',,https://www.lemonde.fr/en/m-le-mag/article/2026/07/10/children-at-the-office-during-the-heatwave-they-have-a-meeting-room-with-coloring-books_6755347_117.html,Subscribers only,,,
Differentiated ticket pricing isn't deterring foreigners from visiting the Louvre or Versailles,,https://www.lemonde.fr/en/culture/article/2026/07/10/differentiated-ticket-pricing-isn-t-deterring-foreigners-from-visiting-the-louvre-or-versailles_6755340_30.html,Subscribers only,,,
"France's third heatwave of the year drags on, less intense than the previous one but still stifling",,https://www.lemonde.fr/en/environment/article/2026/07/10/france-s-third-heatwave-of-the-year-drags-on-less-intense-than-the-previous-one-but-still-stifling_6755350_114.html,Subscribers only,,,
'Foreign Tongues': The Rolling Stones ride a second wave of youth with new album,,https://www.lemonde.fr/en/culture/article/2026/07/11/foreign-tongues-the-rolling-stones-ride-a-second-wave-of-youth-with-their-new-album_6755364_30.html,Subscribers only,,,
Germany records most fatalities from Europe's latest heatwave,,https://www.lemonde.fr/en/environment/article/2026/07/11/germany-records-most-fatalities-from-europe-s-latest-heatwave_6755360_114.html,Subscribers only,,,
Is air conditioning good or bad? Join this (fake) group chat for (real) analysis,"Each time a new heatwave hits, the question of air conditioning and its environmental impacts crops up in the public debate. Here are the key points to help you understand what is at stake.",https://www.lemonde.fr/en/les-decodeurs/article/2026/07/10/is-air-conditioning-good-or-bad-join-this-fake-group-chat-for-real-analysis_6755351_8.html,Subscribers only,, Lara Pino Lerro and  Romain Imbach,Explainer
"After a year eyeing France's presidency, Bardella has to settle for deputy","On Marine Le Pen's first campaign trip after being cleared to run for president despite her conviction, her would-be stand-in Jordan Bardella looked stern at her side.",https://www.lemonde.fr/en/politics/article/2026/07/09/after-a-year-eyeing-france-s-presidency-bardella-has-to-settle-for-deputy_6755303_5.html,Subscribers only,, Clément Guillou and  Corentin Lesueur,News
Strait of Hormuz deadlock could lead Trump into sporadic war with Iran,"The renewed US and Iranian strikes on Wednesday, despite the memorandum of understanding reached between the two countries, jeopardize hopes for a swift end to the crisis unpopular with the American public.",https://www.lemonde.fr/en/international/article/2026/07/10/strait-of-hormuz-deadlock-could-lead-trump-into-sporadic-war-with-iran_6755331_4.html,Subscribers only,, Olivier Faye,News
'Imperial obsession and reckless escalation: Vladimir Putin has never appeared so trapped by his fantasies',,https://www.lemonde.fr/en/opinion/article/2026/07/09/imperial-obsession-and-reckless-escalation-vladimir-putin-has-never-appeared-so-trapped-by-his-fantasies_6755314_23.html,Subscribe,,,Column
Marine Le Pen's shifting principles,,https://www.lemonde.fr/en/opinion/article/2026/07/08/marine-le-pen-s-shifting-principles_6755274_23.html,,,,Editorial
"'A World Cup is not a reflection of international relations, or if it is, it is a particularly distorted one'",,https://www.lemonde.fr/en/opinion/article/2026/07/09/a-world-cup-is-not-a-reflection-of-international-relations-or-if-it-is-it-is-a-particularly-distorted-one_6755293_23.html,Subscribe,,,Column
