title,premium,image URL,subhead,URL,byline,article type
« On n’a jamais vu autant de personnes dans l’eau » : la folie du surf dans les Landes, Article réservé aux abonnés ,,,,,
Les nombreuses analogies entre les Etats-Unis de Trump et ceux des « barons voleurs » de 1890, Article réservé aux abonnés ,,,,,
Expulsion de squatteurs et faute de l’huissier, Article réservé aux abonnés ,,,,,
"« Les racines du mal budgétaire français sont à chercher au-delà de nos frontières, dans l’échec d’un système fiscal international à bout de souffle »", Article réservé aux abonnés ,,,,,
La machine anti-immigration de Donald Trump s’active au cœur de New York, Article réservé aux abonnés ,,,,,
Pourquoi la Russie utilise tellement de drones iraniens Shahed pour attaquer l’Ukraine, Article réservé aux abonnés ,,,,,
Pourquoi tout le monde s’arrache l’Arctique ? Comprendre en trois minutes,,,,,,
Hiroshima : comment s’est déroulé le bombardement atomique le plus dévastateur de l’histoire, Article réservé aux abonnés ,,,,,
"Editorial. Après le sommet Trump-Poutine, aux Européens de jouer leur carte",,,,,,
« Je ne résiste pas à l’envie de demander à André Comte-Sponville : “A quoi penses-tu quand tu fais un pot-au-feu ?” », Article réservé aux abonnés ,,,,,
"David Grossman, écrivain israélien : « Je cherche à me ménager un accès direct au cœur de l’incendie »", Article réservé aux abonnés ,,,,,
"« Est-ce qu’on a fini par avaler ce qu’on veut nous faire croire, qu’il y aurait une culture populaire et une autre qui ne serait pas pour nous tous ? »", Article réservé aux abonnés ,,,,,
"Au festival du film de Locarno, « Two Strangers, Two Seasons », du Japonais Sho Miyake, remporte le Léopard d’or", Article réservé aux abonnés ,,,,,
"A quoi va ressembler la rentrée littéraire 2025 : Emmanuel Carrère, Catherine Millet, Alain Mabanckou, Audur Ava Olafsdottir…", Article réservé aux abonnés ,,,,,
"« Fille de la nation », sur Canal+ : Zdenka Havlickova, une figure oubliée de l’histoire tchèque", Article réservé aux abonnés ,,,,,
"Les replays du week-end : un DJ, des damnés de la Commune, un teckel et un peintre oublié", Article réservé aux abonnés ,,,,,
"La nature, un terreau fertile pour Christian Dior", Article réservé aux abonnés ,,,,,
"Clémentine Chambon, designer en Occitanie : le paysage en héritage", Article réservé aux abonnés ,,,,,
Le distributeur de savon de Piero Lissoni,,,,,,
"« Mon plus long affût a duré presque neuf heures » : Nicolas Groffal, médecin et photographe animalier", Article réservé aux abonnés ,,,,,
" Après le sommet d’Anchorage, les Européens en force derrière Zelensky face à Trump  ",Article réservé aux abonnés,,"Plusieurs dirigeants du Vieux Continent se rendront lundi à Washington en compagnie du président ukrainien pour rencontrer le président américain. La crise ukrainienne met aujourd’hui face à face d’un côté Kiev et les principales capitales européennes, de l’autre Moscou et Washington.",https://www.lemonde.fr/international/article/2025/08/17/apres-le-sommet-d-anchorage-les-europeens-en-force-derriere-zelensky-face-a-trump_6631220_3210.html,,
"Incendies en Espagne : le premier ministre, Pedro Sanchez, veut un « pacte national face à l’urgence climatique »",,https://img.lemde.fr/2025/08/17/0/3/6493/4329/398/265/75/0/89019d3_ftp-import-images-1-ziffcasiruaw-2025-08-17t022151z-1909798433-rc2g8gatswud-rtrmadp-3-europe-weather-spain-wildfire.JPG,"Les récents incendies qui ont brûlé plus de 70 000 hectares à travers le pays sont au cœur du débat politique alors que leur gestion revient en premier lieu aux régions, mais où l’Etat central peut être sollicité et intervenir quand la situation s’aggrave.",https://www.lemonde.fr/planete/article/2025/08/17/incendies-en-espagne-le-premier-ministre-pedro-sanchez-veut-un-pacte-national-face-a-l-urgence-climatique_6631354_3244.html,,
Gaza : de nombreuses routes bloquées en Israël par des manifestants qui réclament la fin de l’offensive dans l’enclave et la libération des otages,,https://img.lemde.fr/2025/08/17/0/0/5500/3666/398/265/75/0/4a5278d_ftp-import-images-1-4sonkwybmz1p-2025-08-17t081145z-270833457-rc2s8ga0gbdg-rtrmadp-3-israel-palestinians-strike.JPG,"Des milliers de membres des forces de sécurité ont été déployés, a déclaré la police, en faisant état de l’arrestation de 32 manifestants.",https://www.lemonde.fr/international/live/2025/08/17/en-direct-l-armee-israelienne-compte-prendre-le-controle-operationnel-de-la-ville-de-gaza-avant-le-7-octobre_6628849_3210.html,,
Le Paris FC débarque en Ligue 1 avec des moyens colossaux mais des ambitions mesurées,Article réservé aux abonnés,https://img.lemde.fr/2025/08/15/25/0/5925/3950/398/265/75/0/a8cc3f2_upload-1-5ywif4y4bqhh-000-36tj7e8.jpg,"Le club parisien se rend à Angers, dimanche, pour son premier match dans l’élite depuis quarante-six ans. Malgré un mercato animé et de grosses attentes liées à sa nouvelle puissance financière, il s’est fixé comme objectif prioritaire le maintien.",https://www.lemonde.fr/sport/article/2025/08/17/le-paris-fc-debarque-en-ligue-1-avec-des-moyens-colossaux-mais-des-ambitions-mesurees_6630981_3242.html,,
"Village People, la MAGA bonne affaire des fils Belolo",Article réservé aux abonnés,https://img.lemde.fr/2025/08/07/0/1/1498/999/664/442/75/0/6f55639_ftp-import-images-1-1yecxs2kvbsv-392726-3433440.jpg,"« Une œuvre en héritage, saison 2 » (6/8). Lancés par les Français Henri Belolo et Jacques Morali, les Village People ont incarné le disco et la culture gay des années 1970. Jonathan et Anthony Belolo, qui gèrent désormais le catalogue du groupe, ont entrepris de l’exploiter tous azimuts. Quitte à accepter sans trop d’états d’âme que le tube « YMCA » devienne l’hymne de l’Amérique trumpiste.",https://www.lemonde.fr/series-d-ete/article/2025/08/17/village-people-la-maga-bonne-affaire-des-fils-belolo_6630844_3451060.html, Gaspard Dhellemmes,Récit
"Alessia, étudiante italienne à Lille : « Je ne trouve rien qui soit réconfortant comme les petits biscuits Mulino Bianco »",Article réservé aux abonnés,https://img.lemde.fr/2025/07/25/0/0/2125/1417/198/132/95/0/ceafcea_upload-1-dgzwmrzw2uvl-7-alessia-250722.jpg,,https://www.lemonde.fr/series-d-ete/article/2025/08/17/alessia-etudiante-italienne-a-lille-je-ne-trouve-rien-qui-soit-reconfortant-comme-les-petits-biscuits-mulino-bianco_6631154_3451060.html,,
"Le lobo-guara, ou loup à crinière du Brésil, une icône nationale en danger",Article réservé aux abonnés,https://img.lemde.fr/2025/06/10/196/0/4707/3138/198/132/95/0/0f4f6af_sirius-fs-upload-1-dao3gk9sse5k-1749563308155-49484312007-774da6b66a-o.jpg,,https://www.lemonde.fr/planete/article/2025/08/17/silhouette-rousse-et-pattes-interminables-le-lobo-guara-ou-loup-a-criniere-du-bresil-une-icone-nationale-en-danger_6630836_3244.html,,
"La vague de chaleur s’atténue en France mais 25 département restent en alerte orange, risque « extrême » d’incendie dans l’Aude",,https://img.lemde.fr/2025/08/11/0/0/7572/5048/198/132/95/0/2de1f5e_ftp-import-images-1-zllgizuot2qd-5612968-01-06.jpg,,https://www.lemonde.fr/planete/article/2025/08/17/canicule-la-vague-de-chaleur-s-attenue-en-france-mais-25-departement-restent-en-alerte-orange-risque-extreme-d-incendie-dans-l-aude_6630842_3245.html,,
"Marc Marquez s’offre un sixième succès de rang, au Grand Prix d’Autriche de MotoGP",,https://img.lemde.fr/2025/08/17/0/57/5167/3445/198/132/95/0/362f4d9_ftp-import-images-1-y6wx4ygoycgt-2025-08-17t124954z-1667588146-up1el8h0zn5bm-rtrmadp-3-motor-motogp-austria.JPG,,https://www.lemonde.fr/sport/article/2025/08/17/marc-marquez-s-offre-un-sixieme-succes-de-rang-au-grand-prix-d-autriche-de-motogp_6631254_3242.html,,
Les universités américaines transigent avec l’administration Trump,Article réservé aux abonnés,https://img.lemde.fr/2025/07/21/0/0/4504/3003/198/132/95/0/eddff1d_ftp-import-images-1-ayk6td8vbnhi-0a8f027ccffd4a1ea606c2fdbbc1d59f-0-91b70e57a0474eb7ac67ff27c05e0a5e.jpg,,https://www.lemonde.fr/international/article/2025/08/16/les-universites-americaines-transigent-avec-l-administration-trump_6630552_3210.html,,
"Louis Aliot empêtré dans un projet de parc d’attractions à Perpignan, après l’abandon de son « Puy du Fou catalan »",Article réservé aux abonnés,https://img.lemde.fr/2025/08/15/0/0/6121/4081/198/132/95/0/9f5dacb_upload-1-yjqyaierbvbe-000-48cq86c.jpg,,https://www.lemonde.fr/politique/article/2025/08/17/louis-aliot-empetre-dans-un-projet-de-parc-d-attractions-a-perpignan-apres-l-abandon-de-son-puy-du-fou-catalan_6630832_823448.html,,
Air Canada annonce la reprise de ses vols après l’intervention du gouvernement pour stopper la grève,,,,https://www.lemonde.fr/economie/article/2025/08/17/air-canada-annonce-la-reprise-de-ses-vols-apres-l-intervention-du-gouvernement-pour-stopper-la-greve_6631119_3234.html,,
"L’ouragan Erin, rétrogradé en catégorie 3, atteint les Caraïbes et entraîne de fortes pluies",,,,https://www.lemonde.fr/planete/article/2025/08/17/l-ouragan-erin-retrograde-en-categorie-3-atteint-les-caraibes-et-entraine-de-fortes-pluies_6631017_3244.html,,
"A l’Euro masculin de basket, une équipe de France sans ses stars mais avec ses jeunes",,,,https://www.lemonde.fr/sport/article/2025/08/17/a-euro-masculin-de-basket-une-equipe-de-france-sans-stars-mais-avec-ses-jeunes_6631118_3242.html,,
"En Serbie, cinquième soirée de heurts entre manifestants anticorruption et police",,,,https://www.lemonde.fr/international/article/2025/08/17/en-serbie-cinquieme-soiree-de-heurts-entre-manifestants-anticorruption-et-police_6630983_3210.html,,
"Rebeka Warrior, une incursion percutante en littérature",Article réservé aux abonnés,,,https://www.lemonde.fr/m-le-mag/article/2025/08/17/rebeka-warrior-une-incursion-percutante-en-litterature_6630834_4500055.html,,
"Mousson au Pakistan : au moins 150 disparus dans le nord du pays, l’espoir de retrouver des survivants s’amenuise",,,,https://www.lemonde.fr/planete/article/2025/08/17/mousson-au-pakistan-au-moins-150-disparus-dans-le-nord-du-pays-l-espoir-s-amenuise-de-retrouver-des-survivants_6630980_3244.html,,
"En Bolivie, la gauche, divisée, pourrait perdre les élections après vingt ans d’hégémonie",Article réservé aux abonnés,,,https://www.lemonde.fr/international/article/2025/08/17/en-bolivie-la-gauche-divisee-pourrait-perdre-les-elections-apres-vingt-ans-d-hegemonie_6630838_3210.html,,
"Richard Tylinski, joueur « de toutes les premières » de l’AS Saint-Etienne, est mort",,,,https://www.lemonde.fr/sport/article/2025/08/17/richard-tylinski-joueur-de-toutes-les-premieres-de-l-as-saint-etienne-est-mort_6631121_3242.html,,
"Pour les prêtres africains détachés en France, le choc culturel : « On nous considère parfois comme des élèves à qui il faut apprendre des choses »",Article réservé aux abonnés,https://img.lemde.fr/2025/08/13/854/0/3901/2600/664/442/75/0/7379717_upload-1-odf0ulpw1bom-csharrock-pretre-africain-20.jpg,"En France, environ 30 % des prêtres catholiques en activité sont étrangers, originaires principalement de pays d’Afrique. Si de nombreux points de friction existent, le processus d’accueil s’est peu à peu amélioré.",https://www.lemonde.fr/societe/article/2025/08/17/pour-les-pretres-africains-detaches-en-france-le-choc-culturel-on-nous-considere-parfois-comme-des-eleves-a-qui-il-faut-apprendre-des-choses_6630764_3224.html, Benoît Vitkine et  Sarah Belouezzane,Témoignages
Donald Trump échoue à arracher un cessez-le-feu en Ukraine à Vladimir Poutine,Article réservé aux abonnés,https://img.lemde.fr/2025/08/15/0/0/3162/2108/664/442/75/0/729b982_ftp-import-images-1-1dso4uho9fuv-5643196-01-06.jpg,"Nul ne sait ce qui s’est négocié en Alaska et aucun accord n’a été détaillé. Incapable de contraindre son homologue russe, le président américain met la pression sur les Ukrainiens et les Européens dans le règlement du conflit.",https://www.lemonde.fr/international/article/2025/08/16/guerre-en-ukraine-donald-trump-echoue-a-arracher-un-cessez-le-feu-a-vladimir-poutine-en-alaska_6630196_3210.html, Arnaud Leparmentier et  Marie Jégo,Décryptage
Trois expériences érotiques inspirées par… des états modifiés de conscience,Article réservé aux abonnés,https://img.lemde.fr/2025/07/19/23/0/1252/834/664/442/75/0/ad05eba_upload-1-k00wgp9ddq3k-mazaurette-erotique-conscience.jpg,"Maïa Mazaurette, chroniqueuse pour « La Matinale », s’est donné pour mission de pimenter vos chaudes nuits d’été. Cette semaine, on se coupe du monde pour intensifier ses sensations, on perd toute notion du temps grâce au flow, on ose l’extase masochiste.",https://www.lemonde.fr/series-d-ete/article/2025/08/17/trois-experiences-erotiques-inspirees-par-des-etats-modifies-de-conscience_6630837_3451060.html, Maïa Mazaurette,Chronique
"Editorial. Après le sommet Trump-Poutine, aux Européens de jouer leur carte",,,,https://www.lemonde.fr/idees/article/2025/08/16/ukraine-apres-le-sommet-trump-poutine-aux-europeens-de-jouer-leur-carte_6630305_3232.html,,Éditorial
"David Grossman, écrivain israélien : « Je cherche à me ménager un accès direct au cœur de l’incendie »",S’abonner,,,https://www.lemonde.fr/series-d-ete/article/2025/08/14/david-grossman-je-cherche-a-me-menager-un-acces-direct-au-c-ur-de-l-incendie_6629221_3451060.html,,Entretien
"« La présence militaire américaine au Japon a toujours été destinée à assurer une ligne de défense face à la Chine et la Russie, plus qu’à protéger l’Archipel »",S’abonner,,,https://www.lemonde.fr/international/article/2025/08/15/la-presence-militaire-americaine-au-japon-a-toujours-ete-destinee-a-assurer-une-ligne-de-defense-face-a-la-chine-et-la-russie-plus-qu-a-proteger-l-archipel_6629914_3210.html,,Entretien
