title,premium,image URL,subhead,URL,article type,byline
A crackdown targets one of China's main 'underground' churches, Subscribers only ,,,,,
French authorities fear mounting 'MAGA sphere' intrusions into domestic politics, Subscribers only ,,,,,
"At Sharm el-Sheikh, nations back Trump's plan for Gaza's future", Subscribers only ,,,,,
Trump and the Gaza war: Eight months of shifting strategy and unconventional diplomacy, Subscribers only ,,,,,
Sanctions against Russia spark rift between US and Europe over China, Subscribers only ,,,,,
France's political instability puts Franco-German alliance to the test,,,,,,
France faces prospect of paying higher borrowing costs than Italy, Subscribers only ,,,,,
French man arrested in Slovenia for crimes committed in Croatia during 1991 war, Subscribers only ,,,,,
France-UK migrant return agreement challenged in French court, Subscribers only ,,,,,
"Cédric Jubillar denies killing wife, alternating between 'I don't know' and 'I don't remember'", Subscribers only ,,,,,
Pelicot rape case closes with forgettable appeal trial, Subscribers only ,,,,,
"Robert Badinter's secret face-to-face with the guillotine, in four unseen pictures", Subscribers only ,,,,,
Afghanistan: Relentless repression continues over four years into Taliban's rule,,,,,,
Watch: Hundreds of thousands march in France against budget cuts,,,,,,
Emmys 2025: 'Adolescence' star Owen Cooper becomes youngest winner for best supporting actor,,,,,,
"From 'influence peddling' to 'corruption,' what is French Culture Minister Rachida Dati accused of?",,,,,,
The French Socialists' impossible choice, Subscribers only ,,,,,
Macron is risking a regime crisis,,,,,,
Alain Dieckhoff: 'Israel's postwar period will put Netanyahu and his government in the hot seat', Subscribers only ,,,,,
Jean-Paul Chagnollaud: 'The outlines of Trump's proposed peace in Gaza remain highly ambiguous', Subscribers only ,,,,,
"Rabbi, drag queen and gay: Amichai Lau-Lavie, a Jewish trailblazer", Subscribers only ,,,,,
Matthieu Blazy: 'Just because Karl was a legend does not mean that everyone who designs for Chanel has to be one too', Subscribers only ,,,,,
Sweden's new list of 'cultural values' sparks controversy, Subscribers only ,,,,,
The making of the Agnès b. cardigan, Subscribers only ,,,,,
"Berthe Weill at the Musée de l'Orangerie, the treasures of an eclectic gallerist", Subscribers only ,,,,,
Five fun ways to discover Paris and its surroundings with your family, Subscribers only ,,,,,
Emma Reyes's still lifes relive in two Paris exhibitions, Subscribers only ,,,,,
Tradition done right: Five Paris restaurants reimagining the classics, Subscribers only ,,,,,
 French authorities fear mounting 'MAGA sphere' intrusions into domestic politics  ,Subscribers only,,"French diplomatic officials said they were prepared to be more 'direct' in their response to predicted acts of interference in favor of the far right, especially during election periods.",https://www.lemonde.fr/en/international/article/2025/10/14/french-authorities-fear-mounting-maga-sphere-intrusions-into-domestic-politics_6746437_4.html,,
Israel says it has received remains of four more Gaza hostages,,https://img.lemde.fr/2025/10/14/0/4/5287/3525/398/265/75/0/d421fd4_ftp-import-images-1-c1h7teoi16cw-2025-10-14t220648z-365159422-rc2xbharuqr9-rtrmadp-3-israel-palestinians-hostages.JPG,,https://www.lemonde.fr/en/international/article/2025/10/14/israel-army-announces-four-returned-hostage-bodies-identified_6746415_4.html,,
Trump and the Gaza war: Eight months of shifting strategy and unconventional diplomacy,Subscribers only,https://img.lemde.fr/2025/10/14/0/0/5106/3404/398/265/75/0/d7a5444_upload-1-qjhabk0lhfl3-001618.jpg,,https://www.lemonde.fr/en/international/article/2025/10/14/trump-and-the-gaza-war-eight-months-of-shifting-strategy-and-unconventional-diplomacy_6746407_4.html,,
California plans on protecting minors and preventing self-destructive content by regulating AI,Subscribers only,https://img.lemde.fr/2025/10/13/0/0/8256/5504/398/265/75/0/5642975_upload-1-astlb0ko57a8-000-33zd88h.jpg,"The legislation, signed on Monday by Democratic Governor Gavin Newsom, requires platforms to remind users that they are interacting with a chatbot − not a human − and to direct users to emergency services if they express suicidal thoughts.",https://www.lemonde.fr/en/economy/article/2025/10/15/california-plans-on-protecting-minors-and-preventing-self-destructive-content-by-regulating-ai_6746443_19.html,,
Trump posthumously honors 'martyr' Charlie Kirk with the Presidential Medal of Freedom,,https://img.lemde.fr/2025/10/14/0/0/8031/5354/398/265/75/0/1e6b02d_ftp-import-images-1-oigdmx17qv70-5168535-01-06.jpg,"Tuesday's ceremony coincided with what would have been Kirk’s 32nd birthday, just over a month after the right-wing activist was fatally shot while speaking to a crowd at Utah Valley University. Meanwhile, the US State Department said it had revoked visas of at least six foreign nationals who had 'celebrated the heinous assassination.'",https://www.lemonde.fr/en/international/article/2025/10/14/trump-to-posthumously-award-charlie-kirk-with-the-presidential-medal-of-freedom_6746439_4.html,,
Maria Grazia Chiuri appointed creative director of Fendi,,https://img.lemde.fr/2025/10/14/203/0/775/516/398/265/75/0/4f461eb_upload-1-e9qgrzvth4mi-maria-grazia-chiuri-a-paola-mattioli.jpeg,The 61-year-old designer succeeds Kim Jones and Silvia Venturini Fendi at the helm of the Roman fashion house.,https://www.lemonde.fr/en/lifestyle/article/2025/10/14/fashion-maria-grazia-chiuri-appointed-creative-director-of-fendi_6746428_37.html,,
"First Wap, a discreet cyber-surveillance firm tracking journalists, public figures and corporate executives",Subscribers only,https://img.lemde.fr/2025/10/13/0/0/3000/2000/664/442/75/0/6e2450f_upload-1-ej75xjyqn5ll-firstwap2.jpg,"Little known to the public, this long-standing player in the surveillance industry has been selling phone-tracking technology for more than 20 years, including to authoritarian regimes. Among its targets: a journalist investigating the Vatican, an Airbus employee, and Hollywood actor Jared Leto.",https://www.lemonde.fr/en/pixels/article/2025/10/14/first-wap-a-discreet-cyber-surveillance-firm-tracking-journalists-public-figures-and-corporate-executives_6746433_13.html,Investigation,
"US launches fifth boat strike, kills 6 on drug-smuggling vessel near Venezuela, Trump says",,https://img.lemde.fr/2025/09/11/0/0/5061/3374/198/132/95/0/863c778_ftp-import-images-1-bpawpnaasy4m-2025-09-11t202657z-1936490321-rc2ppga2r5au-rtrmadp-3-usa-venezuela.JPG,,https://www.lemonde.fr/en/international/article/2025/10/15/us-kills-6-people-in-strike-on-boat-accused-of-carrying-drugs-near-venezuela-trump-says_6746444_4.html,,
Trump warns of Argentina aid cut if Milei loses election,,https://img.lemde.fr/2025/10/14/0/0/2394/1596/198/132/95/0/bfaea1c_ftp-import-images-1-ascty5ktp5ph-2025-10-14t211057z-154780154-rc2ubhahe90z-rtrmadp-3-argentina-economy-inflation.JPG,,https://www.lemonde.fr/en/international/article/2025/10/15/trump-warns-of-argentina-aid-cut-if-milei-loses-election_6746440_4.html,,
Zelensky strips Odesa mayor of Ukrainian citizenship,,https://img.lemde.fr/2025/10/14/0/0/4524/3016/198/132/95/0/7f80535_ftp-import-images-1-jzuxuu7jhf1u-2025-10-14t144451z-663384147-rc2yit9v770j-rtrmadp-3-ukraine-crisis-odesa-mayor.JPG,,https://www.lemonde.fr/en/international/article/2025/10/14/zelensky-strips-odesa-mayor-of-ukrainian-citizenship_6746438_4.html,,
Cameroonian authorities say main opposition candidate 'did not win' the presidential election,Subscribers only,https://img.lemde.fr/2025/10/12/0/0/6000/4000/198/132/95/0/cf68181_ftp-import-images-1-gpzudb3tsvrc-2025-10-12t200222z-353254623-rc2jahawnxxl-rtrmadp-3-cameroon-election.JPG,,https://www.lemonde.fr/en/le-monde-africa/article/2025/10/15/cameroonian-authorities-say-main-opposition-candidate-did-not-win-the-presidential-election_6746441_124.html,,
A crackdown targets one of China's main 'underground' churches,Subscribers only,,,https://www.lemonde.fr/en/international/article/2025/10/15/a-crackdown-targets-one-of-china-s-main-underground-churches_6746442_4.html,,
"Amid Gaza's ruins, Hamas celebrates release of 2,000 Palestinian prisoners",Subscribers only,,,https://www.lemonde.fr/en/international/article/2025/10/14/amid-the-ruins-of-gaza-hamas-celebrates-the-release-of-2-000-palestinian-prisoners_6746396_4.html,,
"At Sharm el-Sheikh, nations back Trump's plan for Gaza's future",Subscribers only,,,https://www.lemonde.fr/en/international/article/2025/10/14/at-sharm-el-sheikh-nations-back-trump-s-plan-for-gaza-s-future_6746419_4.html,,
"Cédric Jubillar denies killing wife, alternating between 'I don't know' and 'I don't remember'",Subscribers only,,,https://www.lemonde.fr/en/france/article/2025/10/14/cedric-jubillar-denies-killing-wife-alternating-between-i-don-t-know-and-i-don-t-remember_6746427_7.html,,
France-UK migrant return agreement challenged in French court,Subscribers only,,,https://www.lemonde.fr/en/france/article/2025/10/14/france-uk-migrant-return-agreement-challenged-in-french-court_6746418_7.html,,
What we know about Sarkozy's detention conditions,Subscribers only,,,https://www.lemonde.fr/en/politics/article/2025/10/14/what-we-know-about-sarkozy-s-detention-conditions_6746410_5.html,,
"Berthe Weill at the Musée de l'Orangerie, the treasures of an eclectic gallerist",Subscribers only,,,https://www.lemonde.fr/en/culture/article/2025/10/14/the-treasures-of-berthe-weill-the-eclectic-gallerist-at-the-paris-musee-de-l-orangerie_6746402_30.html,,
"In Switzerland, US tariffs are leaving industries at a loss",Subscribers only,,,https://www.lemonde.fr/en/economy/article/2025/10/14/in-switzerland-us-tariffs-are-leaving-industries-at-a-loss_6746397_19.html,,
Eight key moments in the frantic week that led to France's new government,Subscribers only,https://img.lemde.fr/2025/10/11/0/0/5899/3933/664/442/75/0/f4a48b6_upload-1-htmbdejbqkqs-jmug251011038.jpg,"The political crisis that has gripped France since the June 2024 snap elections sharply intensified in recent days, leaving political leaders visibly on edge – and, at times, behaving erratically.",https://www.lemonde.fr/en/politics/article/2025/10/14/eight-key-moments-in-the-frantic-week-that-led-to-france-s-new-government_6746400_5.html,Timeline, Nathalie Segaunes and  Sandrine Cassini
France's political crisis weakens French and European growth,Subscribers only,https://img.lemde.fr/2025/10/13/0/134/2555/1703/664/442/75/0/4da70ef_upload-1-0p03fm0kigvt-le-monde.jpg,"Uncertainty stemming from political instability has cost France at least 0.2 percentage points of growth, according to its central bank. With economic stagnation in Germany and budget tensions in the UK, Europe's largest countries are in turmoil.",https://www.lemonde.fr/en/economy/article/2025/10/14/france-s-political-crisis-weakens-french-and-european-growth_6746399_19.html,In Depth, Eric Albert
"Trump's 20-point plan for Gaza, explained and analyzed",Subscribers only,https://img.lemde.fr/2025/09/30/0/0/5500/3666/664/442/75/0/605b2c6_upload-1-uhiif5ugs18p-213707.jpg,"While lacking a precise timeframe, the Gaza peace plan released by the White House, and accepted by Israel under some conditions, leaves several crucial points open to interpretation.",https://www.lemonde.fr/en/international/article/2025/09/30/gaza-trump-s-20-point-plan-explained-and-analyzed_6745944_4.html,Document, Samuel Forey
Macron is risking a regime crisis,,,,https://www.lemonde.fr/en/opinion/article/2025/10/13/macron-is-risking-a-regime-crisis_6746377_23.html,Editorial,
Cancer: France must know why it has higher exposure rates,,,,https://www.lemonde.fr/en/opinion/article/2025/10/11/cancer-france-must-know-why-it-faces-higher-exposure-rates_6746328_23.html,Editorial,
Israel's strikes on Qatar may have jump-started Gaza peace plan,Subscribe,https://img.lemde.fr/2025/02/13/0/0/0/0/100/100/60/0/012c520_sirius-fs-upload-1-siebgildln9p-1739442624103-capture-da-a-cran-2025-02-13-112806.png,,https://www.lemonde.fr/en/opinion/article/2025/10/11/israel-s-strikes-on-qatar-may-have-jump-started-gaza-peace-plan_6746327_23.html,Column,
