title,image URL,premium,subhead,URL,article type,byline
"Anne-Sophie Lapix rejoindra le Groupe M6 à la rentrée, après son éviction du « 20 heures » de France 2",,,,,,
Nucléaire : « Les ogres des données sont partis à la chasse aux électrons »,, Article réservé aux abonnés ,,,,
"En cas de fortes chaleurs, quid du « confort thermique » pour les salariés au bureau ?",, Article réservé aux abonnés ,,,,
"MaPrimeRénov’ : « Le manque, et non les excès, de moyens humains de contrôle est à l’origine de la hausse des délais et des fraudes »",, Article réservé aux abonnés ,,,,
Les images des attaques iraniennes contre Israël dans la nuit du 14 au 15 juin,,,,,,
Attaque d’Israël contre l’Iran : les images analysées par « Le Monde » montrent les sites stratégiques touchés,,,,,,
A quoi servent les commissions d’enquête parlementaires ? Comprendre en trois minutes,,,,,,
Ukraine : ce que l’on sait de l’attaque de drones inédite lancée contre des bases russes,,,,,,
"Au G7, Donald Trump face aux autres dans le chaos du monde",,,,,,
"Arthur Pouliquen, politiste : « Une politique autonome a toujours un sens quand les partis et les syndicats manquent à leur devoir »",, Article réservé aux abonnés ,,,,
"Faire des grandes familles, avec « plus de bébés », le nouveau ciment des droites aux Etats-Unis",, Article réservé aux abonnés ,,,,
"« Pourquoi ne pas passer de vrais contrats avec chaque établissement privé, centrés sur ses objectifs pédagogiques et éducatifs ? »",, Article réservé aux abonnés ,,,,
"Aux cinémas Dulac, un climat délétère",, Article réservé aux abonnés ,,,,
"Quadrature, vingt ans de bonnes nouvelles",, Article réservé aux abonnés ,,,,
"« Télétravail du sexe », sur Tënk : de l’autre côté de l’écran, la vie réelle des « camgirls »",, Article réservé aux abonnés ,,,,
"A voir ce soir : « Pourquoi pas ! », la petite et indestructible utopie de Coline Serreau",, Article réservé aux abonnés ,,,,
Un jardin dans son assiette : trois recettes fleuries,, Article réservé aux abonnés ,,,,
"C’est l’histoire d’une rue : Buffon, du jardin botanique au repaire politique",, Article réservé aux abonnés ,,,,
Est-ce bien raisonnable de… porter ses lunettes de soleil sur le crâne ?,,,,,,
« La France buissonnière » : les échappées numériques du cartographe à vélo,, Article réservé aux abonnés ,,,,
 Guerre Israël-Iran : les ambiguïtés entretenues par Donald Trump face à l’embrasement du Moyen-Orient  ,,Article réservé aux abonnés,"Le président américain a appelé les habitants de Téhéran à « immédiatement évacuer » la ville, lundi soir, alors que les Etats-Unis renforcent leur présence militaire dans la région. Mais il a refusé d’évoquer une participation à l’opération lancée par l’Etat hébreu le 13 juin.",https://www.lemonde.fr/international/article/2025/06/17/guerre-israel-iran-les-ambiguites-entretenues-par-donald-trump-face-a-l-embrasement-du-moyen-orient_6613607_3210.html,,
Guerre en Ukraine : au moins 14 morts dans des frappes russes sur Kiev,https://img.lemde.fr/2025/06/17/0/0/5500/3666/398/265/75/0/9c3351c_ftp-import-images-1-7mebtfmwwrdq-2025-06-17t023355z-937180380-rc224fav5te4-rtrmadp-3-ukraine-crisis-attack-kyiv.JPG,,,https://www.lemonde.fr/international/live/2025/06/17/en-direct-guerre-en-ukraine-kiev-accuse-la-russie-de-poursuivre-sa-guerre-contre-les-civils-apres-des-frappes-sur-la-capitale-qui-ont-tue-un-americain-et-blesse-seize-autres-personnes_6613242_3210.html,,
"Derrière la pause de MaPrimeRénov’, un coup d’arrêt à la rénovation énergétique",https://img.lemde.fr/2025/06/05/1/0/8192/5461/398/265/75/0/f24d656_ftp-import-images-1-ekpflnaztlvn-5106136-01-06.jpg,Article réservé aux abonnés,,https://www.lemonde.fr/idees/article/2025/06/17/derriere-la-pause-de-maprimerenov-un-coup-d-arret-a-la-renovation-energetique_6613625_3232.html,Analyse,
« Un accord lors du conclave sur les retraites remettrait dans le jeu les partenaires sociaux à un moment d’inconsistance politique »,https://img.lemde.fr/2025/01/17/0/0/5724/3816/398/265/75/0/89687c0_ftp-import-images-1-ruia7excua67-2025-01-17t104031z-754042236-rc2lbca1p4fc-rtrmadp-3-france-politics.JPG,Article réservé aux abonnés,"Que l’avenir de la réforme des retraites et celui du gouvernement dépendent de la bonne volonté de quelques partenaires sociaux en dit long sur la crise des responsables politiques, explique, dans sa chronique, Françoise Fressoz, éditorialiste au « Monde ».",https://www.lemonde.fr/idees/article/2025/06/17/un-accord-lors-du-conclave-sur-les-retraites-remettrait-dans-le-jeu-les-partenaires-sociaux-a-un-moment-d-inconsistance-politique_6613617_3232.html,Chronique,
Les airbags Takata à l’origine d’un nouveau décès en France,https://img.lemde.fr/2016/02/02/0/394/2724/1816/398/265/75/0/dc2e0b3_5188493-01-06.jpg,,"La conductrice d’une Citroën C3 est morte le 11 juin à Reims à la suite du déclenchement de son airbag. C’est le quatorzième décès causé dans le pays par ces équipements défectueux, et le deuxième dans l’Hexagone. Les douze autres ont eu lieu en outre-mer, le dispositif étant particulièrement sensible à la chaleur.",https://www.lemonde.fr/societe/article/2025/06/17/les-airbags-takata-a-l-origine-d-un-nouveau-deces-en-france_6613599_3224.html,,
"En cas de fortes chaleurs, quid du « confort thermique » pour les salariés au bureau ?",https://asset.lemde.fr/medias/img/social-network/placeholder-phalcon-lemonde.png,Article réservé aux abonnés,"Même si un décret du 27 mai vise à renforcer les obligations des employeurs lors de températures élevées, il n’existe toujours pas de seuils au-delà desquels il est interdit de travailler, rappelle, dans sa chronique, le juriste Francis Kessler.",https://www.lemonde.fr/emploi/article/2025/06/17/en-cas-de-fortes-chaleurs-quid-du-confort-thermique-pour-les-salaries-au-bureau_6613613_1698637.html,Chronique,
"En Corse, les plages noires de Nonza et d’Albo menacées par la fièvre du nickel",https://img.lemde.fr/2025/05/02/0/0/5292/3528/664/442/75/0/a7ee9b1_sirius-fs-upload-1-lzkp6cbxwrzb-1746194666544-000-42ve2b9.jpg,Article réservé aux abonnés,"Crucial pour le secteur des batteries électriques, du nickel est présent dans le sable des plages artificielles de Nonza et Albo. Un projet d’extraction porté par un industriel suscite un large rejet des habitants, très attachés à ces sites atypiques, vestiges du passé industriel de la région.",https://www.lemonde.fr/planete/article/2025/06/17/en-corse-les-plages-noires-de-nonza-et-d-albo-menacees-par-la-fievre-du-nickel_6613606_3244.html,Reportage, Paul Ortoli
Retraites : François Bayrou dit avoir proposé aux partenaires sociaux « une prime » pour maintenir les seniors en emploi,https://img.lemde.fr/2025/06/13/0/0/7740/5160/198/132/95/0/7f1a199_ftp-import-images-1-ghz1wdzvpvxt-5183447-01-06.jpg,,,https://www.lemonde.fr/politique/article/2025/06/16/retraites-francois-bayrou-dit-avoir-propose-aux-partenaires-sociaux-une-prime-pour-maintenir-les-seniors-en-emploi_6613561_823448.html,,
Inéligibilité des élus : les députés s’opposent en commission à l’interdiction de l’exécution immédiate de peines,https://img.lemde.fr/2025/06/10/0/0/4032/2688/198/132/95/0/706ff10_ftp-import-images-1-phqdwvi7iq1k-2025-06-10t140103z-700884720-rc2qzead2cz4-rtrmadp-3-france-politics.JPG,,,https://www.lemonde.fr/politique/article/2025/06/16/les-deputes-s-opposent-en-commission-a-l-interdiction-de-l-execution-immediate-de-peines-d-ineligibilite_6613595_823448.html,,
Les airbags Takata à l’origine d’un nouveau décès en France,https://img.lemde.fr/2016/02/02/0/394/2724/1816/198/132/95/0/dc2e0b3_5188493-01-06.jpg,,,https://www.lemonde.fr/societe/article/2025/06/17/les-airbags-takata-a-l-origine-d-un-nouveau-deces-en-france_6613599_3224.html,,
"Au Bourget, la fermeture des stands des entreprises israéliennes renforce les tensions entre Paris et l’Etat hébreu",https://img.lemde.fr/2025/06/16/0/0/6000/4000/198/132/95/0/5987164_upload-1-ly0jbpydqswm-870898.jpg,Article réservé aux abonnés,,https://www.lemonde.fr/economie/article/2025/06/16/au-bourget-la-fermeture-des-stands-des-entreprises-israeliennes-renforce-les-tensions-entre-paris-et-l-etat-hebreu_6613587_3234.html,,
"Les séries de la semaine : « El’sardines », « Complicités », « The Gilded Age »…",,Article réservé aux abonnés,,https://www.lemonde.fr/culture/article/2025/06/16/les-series-de-la-semaine-el-sardines-complicites-the-gilded-age_6613596_3246.html,,
Les experts en vaccination congédiés par l’administration Trump « profondément préoccupés » par Robert Kennedy Jr,,,,https://www.lemonde.fr/international/article/2025/06/17/les-experts-en-vaccination-congedies-par-l-administration-trump-profondement-preoccupes-par-robert-kennedy-jr_6613601_3210.html,,
"Au Royaume-Uni, le gouvernement fait volte-face et lance une enquête nationale sur les « grooming gangs »",,Article réservé aux abonnés,,https://www.lemonde.fr/international/article/2025/06/16/au-royaume-uni-le-gouvernement-fait-volte-face-et-lance-une-enquete-nationale-sur-les-grooming-gangs_6613593_3210.html,,
Le Louvre bloqué plusieurs heures après une grève surprise de ses agents d’accueil,,,,https://www.lemonde.fr/culture/article/2025/06/17/le-louvre-bloque-plusieurs-heures-apres-une-greve-surprise-de-ses-agents-d-accueil_6613597_3246.html,,
"Mali : à Bamako, la pollution du fleuve Niger atteint des niveaux critiques",,Article réservé aux abonnés,,https://www.lemonde.fr/afrique/article/2025/06/16/mali-a-bamako-la-pollution-du-fleuve-niger-atteint-des-niveaux-critiques_6613572_3212.html,,
Des enfants français devenus majeurs dans les camps syriens demandent leur rapatriement,,,,https://www.lemonde.fr/international/article/2025/06/16/des-enfants-francais-devenus-majeurs-dans-les-camps-syriens-demandent-leur-rapatriement_6613578_3210.html,,
La police belge met au jour un gigantesque réseau de prostitution,,Article réservé aux abonnés,,https://www.lemonde.fr/international/article/2025/06/16/la-police-belge-met-au-jour-un-gigantesque-reseau-de-prostitution_6613583_3210.html,,
L’Etat français promet 500 millions d’euros pour soutenir la filière musicale d’ici 2030,,,,https://www.lemonde.fr/culture/article/2025/06/17/l-etat-francais-promet-500-millions-d-euros-pour-soutenir-la-filiere-musicale-d-ici-2030_6613600_3246.html,,
Maladie de Parkinson : la recherche pour de meilleurs traitements en effervescence,https://img.lemde.fr/2025/06/13/1619/0/2693/1795/664/442/75/0/241ccf8_upload-1-jmi5fwolog0k-parkinson1.jpg,Article réservé aux abonnés,"En attendant l’arrivée de thérapies qui ralentiraient la progression de cette pathologie neurodégénérative, la prise en charge des symptômes s’améliore. Un espoir pour les quelque 200 000 personnes actuellement traitées en France, alors que le nombre de cas augmente de façon inquiétante.",https://www.lemonde.fr/sciences/article/2025/06/16/maladie-de-parkinson-la-recherche-pour-de-meilleurs-traitements-en-effervescence_6613579_1650684.html,Décryptage, Sylvie Burnouf
Comment les Etats-Unis ont fracturé l’Europe en 2003 pour attaquer l’Irak à tout prix,https://img.lemde.fr/2025/06/12/1/0/594/396/664/442/75/0/3443354_upload-1-qs7ycielig5t-gettyimages-124101029-594x594.jpg,Article réservé aux abonnés,"« Divorce transatlantique » (1/5). Au lendemain des attentats du 11-Septembre, les néoconservateurs américains nourrissent le projet d’attaquer l’Irak, en dépit des oppositions française et allemande. Dès lors, pour arriver à ses fins, la Maison Blanche s’appuiera sur ses alliés d’Europe de l’Est, divisant ainsi pour longtemps la famille européenne.",https://www.lemonde.fr/histoire/article/2025/06/16/comment-les-etats-unis-ont-fracture-l-europe-en-2003-pour-attaquer-l-irak-a-tout-prix_6613493_4655323.html,Enquête, Sylvie Kauffmann
Israël-Iran : « Ce conflit constitue une menace grave pour les fondements mêmes de la civilisation humaine »,https://img.lemde.fr/2025/06/16/0/0/6000/4000/664/442/75/0/57dd138_upload-1-yhqwvsktezad-427921.jpg,Article réservé aux abonnés,"Dans une tribune au « Monde », des personnalités iraniennes, dont les Prix Nobel de la paix Narges Mohammadi et Shirin Ebadi, et les cinéastes Jafar Panahi et Mohammad Rasoulof affirment que la poursuite du programme nucléaire et la guerre entre la République islamique et le régime israélien ne servent pas les intérêts du peuple iranien.",https://www.lemonde.fr/idees/article/2025/06/16/la-seule-voie-credible-pour-preserver-l-iran-et-son-peuple-est-la-demission-du-regime-l-appel-de-personnalites-de-la-societe-civile-iranienne-contre-une-guerre-devastatrice_6613529_3232.html,Tribune, Collectif
"Au G7, Donald Trump face aux autres dans le chaos du monde",,,,https://www.lemonde.fr/idees/article/2025/06/16/au-g7-donald-trump-face-aux-autres-dans-le-chaos-du-monde_6613525_3232.html,Éditorial,
"Arthur Pouliquen, politiste : « Une politique autonome a toujours un sens quand les partis et les syndicats manquent à leur devoir »",,S’abonner,,https://www.lemonde.fr/idees/article/2025/06/16/arthur-pouliquen-politiste-une-politique-autonome-a-toujours-un-sens-quand-les-partis-et-les-syndicats-manquent-a-leur-devoir_6613539_3232.html,Entretien,
"Faire des grandes familles, avec « plus de bébés », le nouveau ciment des droites aux Etats-Unis",,S’abonner,,https://www.lemonde.fr/idees/article/2025/06/15/la-relance-des-naissances-nouveau-ciment-des-droites-aux-etats-unis_6613236_3232.html,Enquête,
