title,subhead,URL,premium,image URL,byline,article type
 'We were meant to take as many jewels as we could': The confessions of two Louvre burglars  ,"After months of silence, two men suspected of stealing the royal jewels described their involvement in detail during new interrogations in June. According to their statements, they were hired to carry out the heist for '€15,000 to €25,000.'",https://www.lemonde.fr/en/france/article/2026/07/12/we-were-meant-to-take-as-many-jewels-as-we-could-the-confessions-of-two-louvre-burglars_6755398_7.html,Subscribers only,,,
Iran strikes Gulf neighbors after new US attacks,,https://www.lemonde.fr/en/international/article/2026/07/12/iran-announces-closure-of-the-strait-of-hormuz-until-further-notice_6755387_4.html,,,,
"'I would do a line before service, hidden in the bathroom': How cocaine is flooding the restaurant industry",,https://www.lemonde.fr/en/campus/article/2026/07/12/i-would-do-a-line-before-service-hidden-in-the-bathroom-how-cocaine-is-flooding-the-restaurant-industry_6755405_11.html,Subscribers only,,,
France powers down several nuclear reactors due to extreme heat,"Three nuclear reactors were temporarily shut down and eight others were operating at reduced power, France's main energy provider said.",https://www.lemonde.fr/en/france/article/2026/07/12/france-powers-down-several-nuclear-reactors-due-to-extreme-heat_6755404_7.html,,,,
"Lindsey Graham, Republican hawk who became staunch Trump loyalist, has died","The senator from South Carolina, who was seeking re-election in November, died suddenly at the age of 71. He embodied, perhaps better than anyone else, the Republican Party's surrender to Trumpism.",https://www.lemonde.fr/en/obituaries/article/2026/07/12/lindsey-graham-republican-hawk-who-became-staunch-trump-loyalist-has-died_6755397_15.html,Subscribers only,,,
"Martine Barrat, a photographer without fear or limits","At 93, the artist has lost none of her vitality or curiosity. She lives at the legendary Hotel Chelsea in New York, where she remains one of the last year-round artist residents. Today, her work is the subject of a retrospective at the Rencontres d'Arles photography festival.",https://www.lemonde.fr/en/m-le-mag/article/2026/07/12/martine-barrat-a-photographer-without-fear-or-limits_6755391_117.html,Subscribers only,,,
Macron's tribute to Alfred Dreyfus: 'Dreyfusism reminds us that antisemitism is the enemy of the Republic',"French President Emmanuel Macron spoke at the first national day commemorating the recognition of Alfred Dreyfus's innocence, 120 years after the army captain wrongfully convicted of treason was exonerated.",https://www.lemonde.fr/en/politics/article/2026/07/12/macron-s-tribute-to-alfred-dreyfus-dreyfusism-reminds-us-that-antisemitism-is-the-enemy-of-the-republic_6755403_5.html,,, Emmanuel Macron,Document
Spanish PM Sanchez condemns predecessor's racist remarks on French football team,,https://www.lemonde.fr/en/international/article/2026/07/12/spanish-pm-sanchez-condemns-predecessor-s-racist-remarks-on-french-football-team_6755407_4.html,,,,
"Zelensky announces Ukrainian government reshuffle, including PM change",,https://www.lemonde.fr/en/international/article/2026/07/12/zelensky-announces-ukrainian-government-reshuffle-including-pm-change_6755402_4.html,,,,
The rush to air-conditioned spaces: 'Full house at the cinema for 2 hours and 40 minutes of AC',,https://www.lemonde.fr/en/m-le-mag/article/2026/07/12/the-rush-to-air-conditioned-spaces-full-house-at-the-cinema-for-2-hours-and-40-minutes-of-ac_6755399_117.html,Subscribers only,,,
Tour de France: Van der Poel wins shortened ninth stage,,https://www.lemonde.fr/en/sports/article/2026/07/12/tour-de-france-van-der-poel-wins-shortened-ninth-stage_6755406_9.html,,,,
"Pauline Vilain-Carlotti, geographer: 'The intensity of wildfires, which seems unprecedented, could become the new norm'",,https://www.lemonde.fr/en/opinion/article/2026/07/12/pauline-vilain-carlotti-geographer-the-intensity-of-wildfires-which-seems-unprecedented-could-become-the-new-norm_6755401_23.html,Subscribers only,,,
Qatar's former ruler Hamad bin Khalifa Al Thani dies at 74,,https://www.lemonde.fr/en/international/article/2026/07/12/qatar-s-former-ruler-hamad-bin-khalifa-al-thani-dies-at-74_6755394_4.html,,,,
Why heatwaves disrupt our sleep – and how we can protect it,,https://www.lemonde.fr/en/science/article/2026/07/11/why-heatwaves-disrupt-our-sleep-and-how-we-can-protect-it_6755384_10.html,Subscribers only,,,
How live screenings of Paris Fashion Week are making fashion more accessible,,https://www.lemonde.fr/en/m-le-mag/article/2026/07/12/how-live-screenings-of-paris-fashion-week-are-making-fashion-more-accessible_6755385_117.html,Subscribers only,,,
Kyiv spends sleepless nights underground as Russia intensifies attacks,,https://www.lemonde.fr/en/international/article/2026/07/11/war-in-ukraine-kyiv-spends-sleepless-nights-underground-as-russia-intensifies-attacks_6755371_4.html,Subscribers only,,,
'No region is safe from climate change: Brittany will not be a climate refuge',,https://www.lemonde.fr/en/opinion/article/2026/07/12/no-region-is-safe-from-climate-change-brittany-will-not-be-a-climate-refuge_6755386_23.html,Subscribers only,,,
"Before Emile Zola, this forgotten writer was the first to defend Alfred Dreyfus",,https://www.lemonde.fr/en/m-le-mag/article/2026/07/12/before-emile-zola-this-forgotten-writer-was-the-first-to-defend-alfred-dreyfus_6755389_117.html,Subscribers only,,,
"Tiago Rodrigues, director of the Avignon Festival: 'Thanks to Europe, thanks to democracy, how lucky I have been!'",,https://www.lemonde.fr/en/culture/article/2026/07/11/tiago-rodrigues-director-of-the-avignon-festival-thanks-to-europe-thanks-to-democracy-how-lucky-i-have-been_6755381_30.html,Subscribers only,,,
"'You're expected to perform, but no one wants to know how you do it': Cocaine, the toxic fuel of young professionals","Cocaine at work (1/3). Among young professionals, the illegal and highly addictive drug is used in a relentless pursuit of performance, often shrouded in taboo and without questioning of working conditions.",https://www.lemonde.fr/en/campus/article/2026/07/11/you-re-expected-to-perform-but-no-one-wants-to-know-how-you-do-it-cocaine-the-toxic-fuel-of-young-professionals_6755382_11.html,Subscribers only,, Marine Miller,Series
Somaliland's high-risk quest for recognition,"The self-proclaimed republic aspires to accede to the international stage. It finds itself at the center of a game of alliances, caught between Israeli, American and Emirati ambitions and threats from Yemen and neighboring Somalia.",https://www.lemonde.fr/en/le-monde-africa/visuel/2026/07/06/somaliland-s-high-risk-quest-for-recognition_6755178_124.html,Subscribers only,, Francesca Fattori and  Noé Hochet-Bodin,Visual Story
"How Ukraine is turning Crimea, the Russians' Riviera, into a battlefield","The annexed Ukrainian peninsula, which Vladimir Putin sees as his crowning jewel, has descended into chaos as Kyiv ramps up attacks on the territory. Shocked tourists and residents express their distress as shortages worsen.",https://www.lemonde.fr/en/international/article/2026/07/09/how-ukrainians-are-turning-crimea-the-russians-riviera-into-a-battlefield_6755294_4.html,Subscribers only,, Faustine Vincent and  Marie Jégo,In Depth
'Imperial obsession and reckless escalation: Vladimir Putin has never appeared so trapped by his fantasies',,https://www.lemonde.fr/en/opinion/article/2026/07/09/imperial-obsession-and-reckless-escalation-vladimir-putin-has-never-appeared-so-trapped-by-his-fantasies_6755314_23.html,Subscribe,,,Column
"'In trying to avoid accusations of exaggerating, the IPCC has instead underestimated the severity of our summers'",,https://www.lemonde.fr/en/opinion/article/2026/07/10/in-trying-to-avoid-accusations-of-exaggerating-the-ipcc-has-instead-underestimated-the-severity-of-our-summers_6755317_23.html,Subscribe,,,Column
'The latest chapter in Le Pen's legal saga illustrates the intractable challenge of judging politicians',,https://www.lemonde.fr/en/opinion/article/2026/07/11/the-latest-chapter-in-le-pen-s-legal-saga-illustrates-the-intractable-challenge-of-judging-politicians_6755376_23.html,Subscribe,,,Op-Ed
