title,premium,image URL,subhead,URL,article type,byline
« Je suis devenue obsolète » : ces seniors contraints de se muer en indépendants, Article réservé aux abonnés ,,,,,
Nucléaire : « Les ogres des données sont partis à la chasse aux électrons », Article réservé aux abonnés ,,,,,
"Devoir de vigilance : « Alors que La Poste est la première entreprise française condamnée, un vent de fronde souffle depuis quelques mois »", Article réservé aux abonnés ,,,,,
« Le gouvernement porte préjudice aux structures de terrain qui œuvrent en faveur d’une rénovation énergétique performante accessible à tous », Article réservé aux abonnés ,,,,,
Comment « Le Monde » a reconstitué l’appel du 18 juin avec une IA,,,,,,
Israël-Iran : retour en images sur le quatrième jour du conflit,,,,,,
Les images des attaques iraniennes contre Israël dans la nuit du 14 au 15 juin,,,,,,
Ukraine : ce que l’on sait de l’attaque de drones inédite lancée contre des bases russes,,,,,,
Le droit international et les leçons de l’histoire,,,,,,
"L’« adultisme », le « système d’oppression et de domination » des enfants", Article réservé aux abonnés ,,,,,
« Un accord lors du conclave sur les retraites remettrait dans le jeu les partenaires sociaux à un moment d’inconsistance politique », Article réservé aux abonnés ,,,,,
"Itai Ater et Yossi Spiegel, universitaires israéliens : « Nous ne sommes pas notre gouvernement »", Article réservé aux abonnés ,,,,,
"Avec « Elio », Pixar livre une odyssée spatiale qui sonde notre solitude", Article réservé aux abonnés ,,,,,
Ces écrivains et écrivaines russes qui célèbrent le patriotisme et la guerre en Ukraine : « Notre “opération spéciale” permet de souder le pays », Article réservé aux abonnés ,,,,,
« Sommes-nous tous racistes ? » : le poids des stéréotypes mis en lumière par une série d’expériences, Article réservé aux abonnés ,,,,,
Netflix diffusera les chaînes et contenus de TF1 en France dès l’été 2026,,,,,,
Quand la tong prend de la hauteur,,,,,,
La nouvelle vie de la lampe 10445 de Ben Swildens,,,,,,
"Avec « Visage Théâtre », la palette poétique de la peintre Inès Longevial", Article réservé aux abonnés ,,,,,
Plaidoyer pour le short au bureau, Article réservé aux abonnés ,,,,,
" Limiter le réchauffement climatique à 1,5 °C est désormais inatteignable  ",Article réservé aux abonnés,,"Selon un collectif de scientifiques, l’objectif fixé par l’accord de Paris en 2015 ne pourra pas être tenu en raison de l’incapacité des pays à diminuer les émissions de gaz à effet de serre.",https://www.lemonde.fr/planete/article/2025/06/19/limiter-le-rechauffement-climatique-a-1-5-c-est-desormais-inatteignable_6614266_3244.html,,
La police israélienne fait part d’« impacts » après de violentes explosions à Tel-Aviv et Jérusalem,,https://img.lemde.fr/2025/06/19/0/0/8640/5760/398/265/75/0/cfdb638_ftp-import-images-1-mgfekhpsqcte-9f6889f66873418c873c5eec7b37dd90-0-6e98c47dc8814f30976d50359761ef42.jpg,,https://www.lemonde.fr/international/live/2025/06/19/en-direct-israel-iran-l-armee-israelienne-dit-mener-des-frappes-sur-l-iran-notamment-a-teheran-au-septieme-jour-de-son-offensive_6612642_3210.html,,
Définition pénale du viol : le Sénat approuve à son tour la notion de non-consentement de la victime,,https://img.lemde.fr/2025/06/19/1/0/8192/5461/398/265/75/0/9deaa62_upload-1-ov0w21xxdmc4-000-33xb4ag.jpg,,https://www.lemonde.fr/societe/article/2025/06/19/definition-penale-du-viol-le-senat-approuve-a-son-tour-la-notion-de-non-consentement-de-la-victime_6614272_3224.html,,
"Pour les maires, les tensions au sein du conseil municipal, première cause de démission",Article réservé aux abonnés,https://img.lemde.fr/2025/06/18/0/0/5568/3712/398/265/75/0/96461a0_upload-1-qeqvcflyh3nr-000-8x77td.jpg,"Avec 2 189 démissions depuis 2020, soit plus de 400 par an, les édiles ont été quatre fois plus nombreux à quitter leur mandat qu’en 2008-2014, « une ampleur jamais observée » selon une note du chercheur au Cevipof Martial Foucault.",https://www.lemonde.fr/politique/article/2025/06/19/pour-les-maires-les-tensions-au-sein-du-conseil-municipal-premiere-cause-de-demission_6614359_823448.html,,
"Aux Etats-Unis, la Fed maintient ses taux d’intérêt, à rebours des envies de Donald Trump",,https://img.lemde.fr/2025/06/18/0/0/7135/4757/398/265/75/0/6ca2c6b_ftp-import-images-1-6so4hldfc9oe-ef1473a79d8d4284bfb328922508ae30-1-62ba16c5bc304045808136bb18a64fdc.jpg,"Le président américain, qui souhaite une baisse des taux, a qualifié le président de la banque centrale américaine, Jerome Powell, de « personne stupide » et « politisée ». L’institution a revu ses prévisions de croissance à la baisse, mais celles du chômage à la hausse.",https://www.lemonde.fr/international/article/2025/06/19/etats-unis-la-fed-maintient-ses-taux-d-interet-a-rebours-des-envies-de-donald-trump_6614269_3210.html,,
Plaidoyer pour le short au bureau,Article réservé aux abonnés,https://img.lemde.fr/2024/05/22/0/0/780/520/398/265/75/0/4e19664_1716382609145-d34ad89-1705494183336-1c4289c-1704279693589-travail-lucas-burtin-1-1.jpg,"« Work in progress ». Si aucune loi ne l’interdit, porter un short ou un bermuda au travail suffit souvent à vous faire passer pour un militant profarniente. Cette décontraction vestimentaire ne serait-elle pas, plutôt, une forme d’avant-gardisme écologique ?, se demande Nicolas Santolaria dans sa chronique.",https://www.lemonde.fr/m-perso/article/2025/06/19/plaidoyer-pour-le-short-au-bureau_6614354_4497916.html,Chronique,
"Anduril, la start-up star de la défense américaine, débarque en Europe",Article réservé aux abonnés,https://img.lemde.fr/2025/06/18/0/0/5499/3666/664/442/75/0/8ea9ed3_upload-1-ffnkqehnbtc9-874818.jpg,"L’entreprise a signé un accord avec le géant allemand Rheinmetall pour produire, sur le sol européen, un drone de combat et un missile de croisière. Ultravalorisée, elle est aussi controversée.",https://www.lemonde.fr/international/article/2025/06/19/anduril-la-start-up-star-de-la-defense-americaine-debarque-en-europe_6614358_3210.html,Décryptage, Olivier Pinaud
Guerre en Ukraine : Vladimir Poutine dit qu’une rencontre avec Volodymyr Zelensky est possible dans la phase finale de négociations de paix,,https://img.lemde.fr/2025/06/18/0/0/3485/2323/198/132/95/0/11d6d3b_ftp-import-images-1-pollhpskukp0-de18451d10ea42098d9e3d225e4b62db-0-2d90d58f7a7744d583189237dd855fcf.jpg,,https://www.lemonde.fr/international/live/2025/06/19/en-direct-guerre-en-ukraine-vladimir-poutine-dit-qu-une-rencontre-avec-volodymyr-zelensky-est-possible-dans-la-phase-finale-de-negociations-de-paix_6613242_3210.html,,
Le député écologiste Pouria Amirshahi interdit d’entrée aux Etats-Unis,Article réservé aux abonnés,https://img.lemde.fr/2025/06/18/0/0/5760/3840/198/132/95/0/5ff9d75_upload-1-d0u5f01wa5w3-000-36273cr.jpg,,https://www.lemonde.fr/international/article/2025/06/18/le-depute-ecologiste-pouria-amirshahi-interdit-d-entrer-aux-etats-unis_6614265_3210.html,,
"RDC-Rwanda : un accord de paix paraphé à Washington, signature prévue le 27 juin",,https://img.lemde.fr/2025/06/18/0/35/5430/3620/198/132/95/0/b106c2b_ftp-import-images-1-cf9xr6ygtkot-2025-06-18t221409z-2090395950-rc295fajwf62-rtrmadp-3-congo-rwanda-diplomacy.JPG,,https://www.lemonde.fr/international/article/2025/06/19/rdc-rwanda-un-accord-de-paix-paraphe-a-washington-signature-prevue-le-27-juin_6614270_3210.html,,
"Plus de 4 000 forces de l’ordre mobilisées mercredi et jeudi pour mener des contrôles dans les gares et les bus à la recherche de « clandestins », annonce Bruno Retailleau",,https://img.lemde.fr/2024/03/19/100/0/4979/3319/198/132/95/0/3f9f550_1710857503629-pns-6498343.jpg,,https://www.lemonde.fr/societe/article/2025/06/18/bruno-retailleau-annonce-le-deploiement-de-4-000-membres-des-forces-de-l-ordre-pour-le-controle-de-migrants-aux-frontieres-dans-les-gares-et-les-bus_6614250_3224.html,,
"Christian Tein, leader indépendantiste kanak : « C’est un beau gâchis ce qui s’est passé »",Article réservé aux abonnés,,,https://www.lemonde.fr/international/article/2025/06/18/christian-tein-leader-independantiste-kanak-c-est-un-beau-gachis-ce-qui-s-est-passe_6614251_3210.html,,
"Le Real Madrid toujours convalescent, Xabi Alonso a du travail pour recréer un vrai collectif triomphant",Article réservé aux abonnés,,,https://www.lemonde.fr/sport/article/2025/06/19/le-real-madrid-toujours-convalescent-xabi-alonso-a-du-travail-pour-recreer-un-vrai-collectif-triomphant_6614271_3242.html,,
"Argentine : forte mobilisation en soutien à Cristina Kirchner, condamnée et assignée à résidence",,,,https://www.lemonde.fr/international/article/2025/06/19/argentine-forte-mobilisation-en-soutien-a-cristina-kirchner-condamnee-et-assignee-a-residence_6614274_3210.html,,
"Les Etats-Unis approuvent un traitement préventif très prometteur contre le VIH, évoquant « un jour historique » dans la lutte contre le sida",,,,https://www.lemonde.fr/societe/article/2025/06/18/les-etats-unis-approuvent-un-traitement-preventif-tres-prometteur-contre-le-vih-evoquant-un-jour-historique-dans-la-lutte-contre-le-sida_6614264_3224.html,,
La grand-tante du petit Grégory Villemin convoquée pour un nouvel interrogatoire en vue d’une possible mise en examen pour « association de malfaiteurs criminelle »,,,,https://www.lemonde.fr/societe/article/2025/06/18/affaire-du-petit-gregory-la-justice-ordonne-un-interrogatoire-de-la-grand-tante-de-l-enfant-en-vue-d-une-possible-mise-en-examen_6614255_3224.html,,
"A Cahors, les responsables d’un parc animalier devant la justice pour un vaste trafic d’oiseaux protégés",Article réservé aux abonnés,,,https://www.lemonde.fr/planete/article/2025/06/18/a-cahors-les-responsables-d-un-parc-animalier-devant-la-justice-pour-un-vaste-trafic-d-oiseaux-proteges_6614262_3244.html,,
"Dans l’Aisne, un enfant meurt d’une intoxication alimentaire, six autres cas recensés",,,,https://www.lemonde.fr/sante/article/2025/06/19/dans-l-aisne-un-enfant-meurt-d-une-intoxication-alimentaire-six-autres-cas-recenses_6614268_1651302.html,,
Comment Donald Trump en est venu à accorder un nouveau sursis à TikTok,Article réservé aux abonnés,,,https://www.lemonde.fr/pixels/article/2025/06/18/comment-donald-trump-en-est-venu-a-accorder-un-nouveau-sursis-a-tiktok_6614257_4408996.html,,
Comment Israël a acquis la supériorité aérienne sur la ville de Téhéran,Article réservé aux abonnés,https://img.lemde.fr/2025/06/18/0/0/1279/853/664/442/75/0/92806f8_upload-1-soosbioq2txw-2025-06-13t064519z-1296547764-mt1eyeim268651-rtrmadp-3-israel-strikes-against-iran.JPG,L’Etat hébreu a mené une longue guerre contre l’Iran et l’« axe de la résistance » pour contrôler le couloir aérien menant à Téhéran.,https://www.lemonde.fr/international/article/2025/06/18/conflit-israel-iran-comment-israel-a-acquis-la-superiorite-aerienne-sur-teheran_6614180_3210.html,Les faits, Samuel Forey
"La bombe américaine GBU-57, seule capable d’atteindre le site nucléaire de Fordo en Iran",Article réservé aux abonnés,https://img.lemde.fr/2025/06/17/0/219/1609/1073/664/442/75/0/d235ab2_upload-1-tpgnkpr18naq-ap23138330231870.jpg,L’armée israélienne ne dispose pas des moyens nécessaires pour détruire les installations d’enrichissement d’uranium du site souterrain. La bombe américaine GBU-57 à fort pouvoir de pénétration a précisément été conçue pour cet usage.,https://www.lemonde.fr/international/article/2025/06/18/la-bombe-americaine-gbu-57-seule-a-meme-d-atteindre-le-site-nucleaire-iranien-de-fordo_6614157_3210.html,Décryptage, Jean-Philippe Lefief
Pourquoi les entreprises françaises ont un problème avec les travailleurs de plus de 50 ans,Article réservé aux abonnés,https://img.lemde.fr/2025/06/17/1225/426/1040/693/664/442/75/0/c12b988_upload-1-cmq07puqiaii-image0-1.jpeg,La discrimination liée à l’âge est largement répandue dans le monde du travail. Avec pour conséquences un taux d’emploi des seniors plus faible que chez les voisins européens et une précarité grandissante. Une hypocrisie à l’heure du report de l’âge de la retraite.,https://www.lemonde.fr/economie/article/2025/06/18/les-plus-de-50-ans-laisses-a-la-porte-des-entreprises_6614126_3234.html,Décryptage, Anne Rodier
« Guerre préventive et changement de régime sont rarement couronnés de succès »,S’abonner,https://img.lemde.fr/2017/09/22/0/0/0/0/100/100/60/0/cd62c21_403.jpg,,https://www.lemonde.fr/idees/article/2025/06/18/iran-israel-guerre-preventive-et-changement-de-regime-sont-rarement-couronnes-de-succes_6614125_3232.html,Chronique,
"L’« adultisme », le « système d’oppression et de domination » des enfants",S’abonner,,,https://www.lemonde.fr/idees/article/2025/06/18/l-adultisme-le-systeme-de-domination-des-enfants_6614155_3232.html,Décryptage,
Le droit international et les leçons de l’histoire,,,,https://www.lemonde.fr/idees/article/2025/06/18/le-droit-international-et-les-lecons-de-l-histoire_6614178_3232.html,Éditorial,
