title,premium,image URL,subhead,URL,byline,article type
"La place de la voiture, un sujet qui divise aussi autour des sites naturels", Article réservé aux abonnés ,,,,,
"Larry Ellison, le retour du flambeur de la Silicon Valley", Article réservé aux abonnés ,,,,,
Faute d’un avocat : quelle réparation pour le client ?, Article réservé aux abonnés ,,,,,
"« Les événements climatiques extrêmes ne sont plus des risques marginaux, et le secteur bancaire tarde à en prendre la mesure »", Article réservé aux abonnés ,,,,,
Gaza : enquête sur une distribution alimentaire qui a tourné à la fusillade contre des civils, Article réservé aux abonnés ,,,,,
Tour de France : le responsable du parcours vous explique comment l’édition 2025 a été tracée pour créer du suspense, Article réservé aux abonnés ,,,,,
Ukraine : la Russie lance la plus grande attaque aérienne depuis le début de la guerre,,,,,,
L’attaque d’Israël en Iran pose les bases d’une ère d’incertitude au Moyen-Orient, Article réservé aux abonnés ,,,,,
"En Iran, l’ignoble diplomatie des otages",,,,,,
"Aux racines de la liberté académique, rempart contre l’arbitraire et fragile pilier des démocraties libérales", Article réservé aux abonnés ,,,,,
"« Des offensives anticlimat aux remises en cause de l’Etat de droit, la montée des mensonges officiels signe le retour d’une logique stalinienne »", Article réservé aux abonnés ,,,,,
"« Préservons l’équilibre, fragile mais indispensable, entre le politique et la justice »", Article réservé aux abonnés ,,,,,
Scènes de la vie culinaire : tour de table de la grande et de la petite bouffe au cinéma, Article réservé aux abonnés ,,,,,
"« Appartements témoins », d’Isabelle Backouche, Sarah Gensburger et Eric Le Bourhis : spoliation des juifs de France, le dossier s’alourdit", Article réservé aux abonnés ,,,,,
"Gérald Darmanin, un roc dans la « Tempête » au ministère de l’intérieur", Article réservé aux abonnés ,,,,,
"Emilien, plus grand gagnant de l’histoire des jeux télévisés, a été éliminé des « 12 coups de midi »",,,,,,
"Cinq objets écoresponsables : cuiseur à riz kamadosan, germoir bocal, veilleuse française…", Article réservé aux abonnés ,,,,,
Michael Rider chez Celine : un premier défilé au passé composé,,,,,,
"De Céline à Celine, quatre-vingts ans de création",,,,,,
"Vous aimez Agnès Varda, vous aimerez le 14ᵉ arrondissement de Paris", Article réservé aux abonnés ,,,,,
" Avec le Parti de l’Amérique, Elon Musk entend séduire les électeurs lassés par la partition de la vie politique en deux camps  ",Article réservé aux abonnés,,"En créant sa propre formation politique, le patron de SpaceX et Tesla entérine sa rupture avec Donald Trump après le vote de la loi budgétaire. Le président américain a jugé « ridicule » l’initiative de son ancien allié.",https://www.lemonde.fr/international/article/2025/07/07/elon-musk-cree-son-propre-parti-dans-une-tentative-de-seduire-les-americains-lasses-par-la-partition-de-la-vie-politique-en-deux-camps-irreconciliables_6619511_3210.html,,
"Dans la Manche, les traversées de migrants ne cessent d’augmenter : « C’est assez inédit qu’il y ait autant de gens »",Article réservé aux abonnés,https://img.lemde.fr/2025/07/06/177/0/4252/2834/398/265/75/0/26baec0_upload-1-wzfqopaq0fyl-09.JPG,,https://www.lemonde.fr/societe/article/2025/07/07/dans-la-manche-les-traversees-de-migrants-ne-cessent-d-augmenter-c-est-assez-inedit-qu-il-y-ait-autant-de-gens_6619520_3224.html,,
"Le point sur la guerre en Ukraine : nouvelles attaques russes dans les régions de Kherson, Odessa et Kharkiv",,https://img.lemde.fr/2025/07/03/0/4/4248/2832/398/265/75/0/5f52a5f_ftp-import-images-1-ldv2ts5dhaeq-2025-07-03t154931z-23580732-rc2psb7vwhob-rtrmadp-3-ukraine-crisis-air-defence.JPG,,https://www.lemonde.fr/international/live/2025/07/07/en-direct-guerre-en-ukraine-au-moins-dix-sept-blesses-dans-une-attaque-de-drones-russes-a-kharkiv_6619192_3210.html,,
La difficile désintoxication de la voiture sur les lieux de vacances,Article réservé aux abonnés,https://img.lemde.fr/2025/07/04/0/0/4108/2739/398/265/75/0/3f6a9d6_upload-1-1p0op55pdzxy-sipa01209913-000015.jpg,Les initiatives visant à proposer des alternatives demeurent limitées et imparfaites.,https://www.lemonde.fr/economie/article/2025/07/06/la-difficile-desintoxication-de-la-voiture-sur-les-lieux-de-vacances_6619285_3234.html,,
"Inondations au Texas : le bilan approche 80 morts, Donald Trump espère se rendre sur place vendredi",,https://img.lemde.fr/2025/07/06/0/0/5534/3689/398/265/75/0/ac30971_ftp-import-images-1-jsl3lcedmcqb-07df09275895460ab6b7b7042186580f-0-ffacb54e11684d96b1e0c0c6909eeaf9.jpg,"Des pluies diluviennes, vendredi, ont fait monter les eaux du Guadalupe de 8 mètres en seulement quarante-cinq minutes. Dix fillettes d’un camp d’été restent portées disparues. Le président américain a dit avoir « signé une déclaration de catastrophe » afin de garantir aux secours tous les moyens nécessaires.",https://www.lemonde.fr/planete/article/2025/07/06/inondations-au-texas-nous-n-abandonnons-pas-les-recherches-pour-retrouver-27-enfants-portees-disparues-declare-le-gouverneur-adjoint_6619283_3244.html,,
"Le pont de l’Oder entre l’Allemagne et la Pologne, déclin d’un symbole européen",Article réservé aux abonnés,https://img.lemde.fr/2025/07/06/119/0/5000/3333/398/265/75/0/0c9a08d_upload-1-txqy4emckm1y-250704-polish-german-border-by-ksenia-ivanova-025.jpg,"Après que Berlin a rétabli les contrôles sur cette frontière, pour barrer la route aux migrants, Varsovie a pris une mesure similaire, bouleversant le quotidien des riverains. L’endroit emblématique de l’élargissement de l’UE à l’Est, atteste désormais de la poussée des sentiments xénophobes dans cette région.",https://www.lemonde.fr/international/article/2025/07/07/le-pont-de-l-oder-entre-l-allemagne-et-la-pologne-declin-d-un-symbole-europeen_6619474_3210.html,,
"Hugo, 26 ans, ingénieur, 2 400 euros par mois : « J’ai un peu honte de gagner autant quand je vois ma mère aide-soignante, au métier si difficile »",Article réservé aux abonnés,https://img.lemde.fr/2025/04/22/0/0/4252/2834/664/442/75/0/f78d87e_sirius-fs-upload-1-albqbid0rlzk-1745313239317-colo-garcon.jpg,"« La bonne paye ». Chaque semaine, « Le Monde » parle d’argent avec les jeunes, de leurs factures, leur loyer, leurs loisirs. Que signifie bien gagner sa vie ? Comment se projettent-ils dans l’avenir ? Bien qu’encouragé par sa famille, Hugo se sent mal à l’aise de gagner, dès sa sortie d’école d’ingénieurs, plus que sa mère en fin de carrière.",https://www.lemonde.fr/campus/article/2025/07/07/hugo-26-ans-ingenieur-2-400-euros-par-mois-j-ai-un-peu-honte-de-gagner-autant-quand-je-vois-ma-mere-aide-soignante-au-metier-si-difficile_6619513_4401467.html, Alice Raybaud,Témoignages
"Itinéraire de Baptiste C., néonazi (presque) repenti",Article réservé aux abonnés,https://img.lemde.fr/2025/07/01/264/0/1126/750/198/132/95/0/cb2d147_ftp-import-images-1-u81dvuo5vjdq-388776-3428173.jpg,,https://www.lemonde.fr/m-le-mag/article/2025/07/06/itineraire-de-baptiste-c-neonazi-presque-repenti_6619194_4500055.html,,
"En Iran, « disparition inquiétante » d’un jeune touriste français",,https://img.lemde.fr/2025/07/06/418/257/464/309/198/132/95/0/1f59998_upload-1-lg7jnkc08n8l-capture-da-ei-cran-2025-07-06-ai-18-51-19.png,,https://www.lemonde.fr/international/article/2025/07/06/en-iran-disparition-inquietante-d-un-jeune-touriste-francais_6619298_3210.html,,
Gaza : Benyamin Nétanyahou reçu lundi par Donald Trump à Washington pour avancer sur une trêve et la libération d’otages israéliens,,https://img.lemde.fr/2025/07/04/0/0/1023/682/198/132/95/0/b1a5099_upload-1-9e7m63tpsqip-000-36zu9zu.jpg,,https://www.lemonde.fr/international/article/2025/07/07/gaza-benyamin-netanyahou-recu-lundi-par-donald-trump-a-washington-pour-avancer-sur-une-treve-et-la-liberation-d-otages-israeliens_6619515_3210.html,,
"Boris Tavernier, député écologiste : « Mieux manger est une question de justice sociale et de solidarité »",Article réservé aux abonnés,https://img.lemde.fr/2024/10/09/0/1/6280/4187/198/132/95/0/501bbe0_1728453361067-000-36gx6rw.jpg,,https://www.lemonde.fr/societe/article/2025/07/06/boris-tavernier-depute-ecologiste-mieux-manger-est-une-question-de-justice-sociale-et-de-solidarite_6619286_3224.html,,
Ce qu’il ne fallait pas manquer de l’actualité du week-end,,,,https://www.lemonde.fr/les-decodeurs/article/2025/07/06/ce-qu-il-ne-fallait-pas-manquer-de-l-actualite-du-week-end_6619290_4355770.html,,
"Diana Ross, 81 ans, toujours suprême",Article réservé aux abonnés,,,https://www.lemonde.fr/culture/article/2025/07/07/diana-ross-81-ans-toujours-supreme_6619507_3246.html,,
Sept jeux vidéo sortis cette année à rattraper pendant l’été,Article réservé aux abonnés,,,https://www.lemonde.fr/pixels/article/2025/07/06/sept-jeux-video-sortis-cette-annee-a-rattraper-pendant-l-ete_6619181_4408996.html,,
"Mathieu van der Poel, nouveau maillot jaune, retarde le retour au pouvoir de Tadej Pogacar dans le Tour de France",Article réservé aux abonnés,,,https://www.lemonde.fr/sport/article/2025/07/06/mathieu-van-der-poel-nouveau-maillot-jaune-retarde-le-retour-au-pouvoir-de-tadej-pogacar-dans-le-tour-de-france-2025_6619307_3242.html,,
"Décors, transports, isolation… L’empreinte carbone du secteur de la création artistique passée au crible",Article réservé aux abonnés,,,https://www.lemonde.fr/culture/article/2025/07/07/decors-transports-isolation-l-empreinte-carbone-du-secteur-de-la-creation-artistique-passee-au-crible_6619508_3246.html,,
"Les Suisses devraient boire plus de vin, parole de ministre",Article réservé aux abonnés,,,https://www.lemonde.fr/international/article/2025/07/07/les-suisses-devraient-boire-plus-de-vin-parole-de-ministre_6619440_3210.html,,
"Les nouveaux droits de douane s’appliqueront au 1ᵉʳ août pour les pays n’ayant pas trouvé d’accord avec les Etats-Unis, prévient le secrétaire au Trésor américain",,,,https://www.lemonde.fr/economie/article/2025/07/06/les-nouveaux-droits-de-douane-s-appliqueront-au-1er-aout-pour-les-pays-n-ayant-pas-trouve-d-accord-avec-les-etats-unis-previent-le-secretaire-du-tresor-americain_6619281_3234.html,,
"La boîte à savon, une alternative aux emballages plastique jetables",,,,https://www.lemonde.fr/m-design-deco/article/2025/07/06/la-boite-a-savon-une-alternative-aux-emballages-plastique-jetables_6619276_4497702.html,,Chronique
"« Non, grand-mère n’était pas folle » : la quête de vérité sur les aïeules internées de force en psychiatrie",Article réservé aux abonnés,https://img.lemde.fr/2025/07/02/57/0/3543/2362/664/442/75/0/7585f45_upload-1-bodjrflbppu0-p-235-ori.jpg,"Plus dérangeantes que dérangées, souvent polytraumatisées, des milliers de femmes ont été internées au sein des « asiles d’aliénés » dans les années 1940, 1950 et 1960. Aujourd’hui, certains de leurs descendants entament un travail de réhabilitation de leur mémoire et mettent au jour le caractère abusif et misogyne de l’enfermement.",https://www.lemonde.fr/m-perso/article/2025/07/05/non-grand-mere-n-etait-pas-folle-la-quete-de-verite-sur-les-aieules-internees-de-force-en-psychiatrie_6618462_4497916.html, Victoire Radenne,Enquête
Le postcoït est-il forcément un moment triste ?,Article réservé aux abonnés,https://img.lemde.fr/2025/07/02/73/0/1252/834/664/442/75/0/23f4421_upload-1-figuuybga2ao-img-4060.jpg,"Des études mettent en lumière la « dysphorie postcoïtale », qui peut toucher femmes et surtout hommes après un rapport sexuel. Elle peut se manifester par de l’anxiété, de la tristesse, voire de l’irritabilité.",https://www.lemonde.fr/intimites/article/2025/07/06/le-postcoit-est-il-forcement-un-moment-triste_6619178_6190330.html, Maïa Mazaurette,Chronique
"Après des images de gendarmes crevant à coups de couteau un canot de migrants dans la Manche, la doctrine de la France en question",Article réservé aux abonnés,https://img.lemde.fr/2025/07/06/0/171/1620/1080/664/442/75/0/93b6b76_upload-1-5rgjsizbrcgy-newspress-collage-s6u2fkpob-1751640101520.jpg,"La vidéo, tournée dans le Pas-de-Calais et diffusée vendredi 4 juillet par la BBC, accrédite l’idée d’un changement en cours du cadre d’intervention, côté français, lors de l’interception de bateaux dans la bande littorale.",https://www.lemonde.fr/societe/article/2025/07/06/apres-des-images-de-gendarmes-crevant-a-coups-de-couteau-un-canot-de-migrants-dans-la-manche-la-doctrine-de-la-france-en-question_6619300_3224.html, Julia Pascual,Décryptage
"« Des offensives anticlimat aux remises en cause de l’Etat de droit, la montée des mensonges officiels signe le retour d’une logique stalinienne »",S’abonner,https://img.lemde.fr/2021/10/04/0/0/0/0/100/100/60/0/a649d65_1633340428935-image-d-ios.jpg,,https://www.lemonde.fr/idees/article/2025/07/06/des-offensives-anticlimat-aux-remises-en-cause-de-l-etat-de-droit-la-montee-des-mensonges-officiels-signe-le-retour-d-une-logique-stalinienne_6619187_3232.html,,Chronique
"En Iran, l’ignoble diplomatie des otages",,,,https://www.lemonde.fr/idees/article/2025/07/05/en-iran-l-ignoble-diplomatie-des-otages_6618666_3232.html,,Éditorial
"Aux racines de la liberté académique, rempart contre l’arbitraire et fragile pilier des démocraties libérales",S’abonner,,,https://www.lemonde.fr/idees/article/2025/07/05/aux-racines-de-la-liberte-academique-rempart-contre-l-arbitraire-et-fragile-pilier-des-democraties-liberales_6618458_3232.html,,Enquête
